id|name|desc|category|thumbnail
762B3EE2-5E164F50-ACE97F84-E4CBB887|The Ultimate Elegant Furniture Bundle|The ultimate bundle of our elegant items, includes the dining tables. * Elegant Dining Table * Elegant Dining Table for 8 * Elegant Dining Table for 12 * Elegant Indoor Bar with Chairs * Elegant Outdoor Bar with Chairs * Elegant Table with Chairs * Elegant Tall Table with Chairs * Elegant Sofa and Canopy * Elegant Canopy * Elegant Sofa * Elegant Chair * Elegant Swing Sofa * Elegant Big Swing Sofa * Magical Leaf Rug|Bundle-Furniture|L
77A06EB8-50B04153-8DB30AE1-8173AF96|Dishware Set|Dishware Set. Serve Up Delicious Food. This Set Includes The Following Items. Chopsticks (decorative) Spoon (decorative) Fork (decorative) Bowl (decorative) Small Dish (decorative) Medium Dish (decorative) Small Bowl (decorative) Long Dish (decorative) Teacup (decorative) Each Item Will Be Added To The Corresponding Category When Purchased.|Bundle-Furniture|L
78AD5B2A-28F4466D-90CEAB45-90014C26|Fossil Collection Plates Set (for footprints)|A 2-piece set of collection plates for displaying footprint fossils. This set contains the following items - Old Fossil Collection Plate (for footprints)(Decoration) - Brand New Fossil Collection Plate (for footprints)(Decoration) * Upon purchase, each item in the applicable category will be added.|Bundle-Furniture|L
794C2D01-BBAA4190-90CA51D9-4F433493|Traffic Cone Set|A 8-piece set of cone-shaped traffic pylons. This set includes the following items - Traffic Cone (Red) (Ornaments) - Pylon (Blue) (Ornaments) - Traffic Cone (Green) (Ornaments) - Traffic Cone (Yellow) (Ornaments) - Mini Traffic Cone (Red) (Ornaments) - Mini Traffic Cone (Blue) (Ornaments) - Mini Traffic Cone (Green) (Ornaments) - Mini Traffic Cone (Yellow) (Ornaments) * Upon purchase, each item will be added to the applicable category.|Bundle-Furniture|L
7B26CD23-764A4C83-8B72A510-D7D38F09|Fossil Collection Plates Set (for shellfish)|A 2-piece set of collection plates for displaying shellfish fossils. This set contains the following items - Old Fossil Collection Plate (for shellfish)(Decoration) - Brand New Fossil Collection Plate (for shellfish)(Decoration) *Upon purchase, each item in the applicable category will be added.|Bundle-Furniture|L
7B29F3DB-F7CB45DA-ADAEC339-F1093329|Fossil Collection Plates Set (for insects)|A 2-piece set of collection plates for displaying insect fossils. This set includes the following items. - Old Fossil Collection Plate (for insects)(Decoration) - Brand New Fossil Collection Plate (for insects)(Decoration) *Upon purchase, each item in the applicable category will be added.|Bundle-Furniture|L
7B395949-B24943AF-95C2BE6A-EEDD0112|Fossil Collection Plates Set (for fish)|A 2-piece set of collection plates for displaying fish fossils. This set includes the following items. - Old Fossil Collection Plate (for fish)(Decoration) - Brand New Fossil Collection Plate (for fish)(Decoration) *Upon purchase, each item in the applicable category will be added.|Bundle-Furniture|L
7C34F246-2C314C06-916722C5-D7827721|Morning Glory Ikebana 2-piece Set|A 2-piece set that includes morning glories arranged in bamboo and ceramic vases. This set includes the following items - Morning Glory Arranged in Bamboo (Ornaments) - Morning Glory Arranged in Ceramics (Ornaments) * Upon purchase, each item will be added to the applicable category.|Bundle-Furniture|L
7CD78FDA-8A824AD3-8B32B482-4A60549F|5-piece System Kitchen Set (Wood)|This 5-piece System Kitchen Set Has The Warmth Of Wood. This Set Includes The Following Items System Kitchen (wood Cupboard) Decoration System Kitchen (wood Utensil Holder) Decoration System Kitchen (wood Stove) Decoration System Kitchen (wood Sink) Decoration System Kitchen (wood Shelf) Decoration Each Item Will Be Added To The Corresponding Category When Purchased.|Bundle-Furniture|L
7D662289-401149E5-A7E874A2-571725AD|Two-piece Morning Glory Ikebana Set|Two Sets Of Morning Glories, One Arranged In A Bamboo Bowl And One In Ceramic. This Set Includes The Following Items Morning Glory In Bamboo Vase Decoration Morning Glory In Pottery Decoration When Purchased, Each Item Will Be Added To The Corresponding Category.|Bundle-Furniture|L
7D687615-F0FB4E87-9764D423-516AEEE0|Cooling Set (Pattern 3)|A Small Item Set For Placement To Make You Feel Summer. This Set Contains The Following Items. Straw Mat (Pattern 3) (rug) Cushion (Pattern 3) (rug) Mosquito Coil (Pattern 3) (decorative Item) Items Are Added To Each Category After Purchase.|Bundle-Furniture|L
7DA563C0-A7C1436E-91B17A7A-CA3033C4|Fringed Pink Ikebana 2-piece Set|A 2-piece set that includes fringed pink arranged in bamboo and ceramic vases. This set includes the following items - Fringed Pink Arranged in Bamboo (Ornaments) - Fringed Pink Arranged in Ceramics (Ornaments) * Upon purchase, each item will be added to the applicable category.|Bundle-Furniture|L
80861A67-703E40F4-A3F464B4-E071A431|Party Animal Bundle|Party Animal Bundle - including Multi-colored Helium Balloons, Disco Rig with moving lights and Animated Flashing Disco Floor.|Bundle-Furniture|L
80BA30AD-80CB415B-8E6A7365-E715D64A|nParty Mini Bash Bundle (Blue)|The perfect bundle for a mini bash at your apartment. This set includes * Party Seat(Blue) * Smoke Machine (Blue) * Balloons (Black and White) * Animated Bulb Show (Blue) * Party Cake (Orange) Upon purchase, all items will be added to their corresponding categories.|Bundle-Furniture|L
80DB738E-AAFA45D8-931C18A7-5BCD65F7|Astrological Statue Collection|Whats your sign? Bundle includes twelve statues of the celestial constellations.|Bundle-Furniture|L
8109050F-379B4640-AB685673-712754E5|Propaganda Poster Pack|Decorate your apartment with this 6-pack of Conspiracy propaganda posters. What better way to fly under the radar than advertise that you are part of the conspiracy?|Bundle-Furniture|L
825359C0-C3C648A7-A149242D-FD489CA2|Idea - Modular Sofa - Bundle - Floral|This bundle is for the complete floral sofa and comes with all six objects. 1. Double Seat 2. Left End Seat 3. Right End Seat 4. Corner Seat 5. Single Seat 6. Footstool|Bundle-Furniture|L
8380E132-B1694A38-BAA8D398-14B33FA6|Fossil Collection Plates Set (for ancient dragonfly)|A 2-piece set of collection plates for displaying ancient dragonfly fossils. This set includes the following items. - Old Fossil Collection Plate (for ancient dragonfly)(Decoration) - Brand New Fossil Collection Plate (for ancient dragonfly)(Decoration) *Upon purchase, each item in the applicable category will be added.|Bundle-Furniture|L
83ABB882-78FB46E3-814C6030-8892345A|Fossil Collecting Plate Set (for Fish)|Two Sets Of Collecting Plates That Can Fit And Display Fish Fossils. This Set Includes The Following Items Old Fossil Collecting Plate (for Fish) (decoration) Brand New Fossil Collecting Plate (for Fish) (decoration) When Purchased, Each Item Will Be Added To The Corresponding Category.|Bundle-Furniture|L
844710AE-42244F7B-A714EDE3-37B4B4D6|Cherry tree 5-piece set|A set that allows you to build a huge cherry tree. This 5-piece set includes 2 types of cherry trees flowers, a trunk, the upper part of a trunk and the lower part of a trunk. This set includes the following items. Cherry tree, Flower (Two branches)(Ornament) Cherry tree, Flower (Full-blown)(Ornament) Cherry tree, Trunk (Upper)(Ornament) Cherry tree, Trunk (Bottom)(Ornament) Cherry tree, Trunk (Upper + Bottom)(Ornament) Upon purchase, the items will be placed into their respective categories.|Bundle-Furniture|L
8478D250-65264616-8507C698-990600A6|Comfort Space Bundle|With the Comfort Space Bundle, you can sit back and relax with both the white and black versions of the Tube and Cube Furniture. (Cube Chair, Cube Couch, Tube Chair, Tube Couch and Tube Loveseat.)|Bundle-Furniture|L
84C587DB-37F54BBA-9603EC5B-D5197D77|Retro Modern Kitchen Pack|Retro Modern Kitchen Pack This pack includes the following items Retro Modern Gas Hob Retro Modern Fridge Freezer Retro Modern Double Oven Retro Modern Sink and Dishwasher Retro Modern Cupboard with Shelves Retro Modern Cupboard Retro Modern Cupboard and Wall Cabinet Retro Modern Corner Cupboards A vintage style kitchen with all the mod cons of the day.|Bundle-Furniture|L
861CAF03-E5B04D66-8F1EB720-2025DA4F|Fossil Collection Plates Set (for Japanese giant salamander)|A 2-piece set of collection plates for displaying Japanese giant salamander fossils. This set includes the following items. - Old Fossil Collection Plate (for Japanese giant salamander)(Decoration) - Brand New Fossil Collection Plate (for Japanese giant salamander)(Decoration) *Upon purchase, each item in the applicable category will be added.|Bundle-Furniture|L
871B03A9-077E4EA0-B2140573-DD5990E6|Comfortable Furniture Pack|Comfy and practical furniture for everyday use. Contains Comfortable Dining Chair Coffee Table Chest of Drawers Grandfather Clock Bookcase Comfortable Armchair Comfortable Chair Comfortable Two Seat Sofa Comfortable Three Seat Sofa Homework Table Comfortable Round Pouffe Comfortable Square Pouffe Square Cushion Rectangular Cushion  PMExtraCommerce |Bundle-Furniture|L
873E64A6-03AF4979-8E8A3A3C-E4AF3B47|Portrait Pack|A selection of framed portraits. Contains Full Length Portrait with Gold Frame Three-Quarter Length Portrait with Gold Frame Posed Portrait with Gold Frame Side-On Portrait with Gold Frame Side-On Portrait with Carved Frame Posed Portrait with Ornate Frame Side-On Portrait with Ornate Frame Three-Quarter Length Portrait with Carved Frame Seated Portrait with Carved Frame  PMExtraCommerce|Bundle-Furniture|L
87C0062F-34D34993-9D872877-EAD2DAEF|Cafe Chair and Table Set|A 5-piece set including a combination of tables (square round), chairs, and table chair combos (square round), all perfectly suited for a cafe. This set includes the following items - Cafe Table, Square (Tables) - Cafe Table, Round (Tables) - Cafe Chair (Chairs) - Cafe Chair and Table, Square (Chairs) - Cafe Chair and Table, Round (Chairs) * Upon purchase, each item will be added to the applicable category.|Bundle-Furniture|L
8881B91F-91EF426C-AF77BD8B-9F85083B|Fossil Collection Plates Set (for anomalocarid)|A 2-piece set of collection plates for displaying anomalocarid fossils. This set includes the following items. - Old Fossil Collection Plate (for anomalocarid)(Decoration) - Brand New Fossil Collection Plate (for anomalocarid)(Decoration) *Upon purchase, each item in the applicable category will be added.|Bundle-Furniture|L
898902B3-AAF34F69-B087494B-937E9237|Summer House Furniture Bundle|Its the Summer House furniture Bundle. Includes the Summer House Foot Stool, Summer House Light, Summer House Ornament, Summer House Table, Summer House Chair, and Summer House Sofa. **IMPORTANT NOTICE** This Summer House Furniture Bundle may contain the items you have already purchased. Only the item which is not yet purchased is added to Redecorete &gt Furniture and same purchased item will not appear in the furniture twice. Purchased Special Bundles are not refundable, transferable or exchangeable, and cannot be redeemed for cash or credit.|Bundle-Furniture|L
8AEE0405-E8744547-9A90A608-06852744|Winter Vacation Villa Furniture Bundle|The Winter Vacation Villa Furniture Bundle. Bundles include a stool, four chairs, five tables, three containers, a lamp, a rug, and a couch.|Bundle-Furniture|L
8B21DFAB-2D8F41A6-B5C0D980-536D0099|5-piece Barbecue Set|Includes Stove, Beef, Onions, Green Bell Pepper, And Corn. This Set Includes The Following Items. Barbecue Stove decoration Barbecued Onions decoration Barbecued Peppers decoration Barbecued Corn decoration Barbecued Beef decoration When Purchased, Each Item Will Be Added To The Appropriate Category.|Bundle-Furniture|L
8B67F181-BB724552-A90D7B9B-BDE6F5C0|Luxury Train Furniture Bundle (Red)|The perfect furniture bundle to go with the Luxury Train Apartment. Includes seven furniture items including * Corner Sofa (Red) * Straight Sofa (Red) * Low Chair (Red) * Low Table (Red) * Large Counter Top (Red) * Small Counter Top (Red) * Bed (Red) Upon purchase, all items will be added to their corresponding categories.|Bundle-Furniture|L
8BE536DB-69AB4874-AA55D47E-72EF8F26|Vigilarium Planter Set|Planters from the Primarchs Vigilarium in FINAL FANTASY XIII. This set contains the following items to customise your personal space Vigilarium Planter A (Ornaments) Vigilarium Planter B (Ornaments) *Items can be found in Redecorate Personal Space &gt Add Furniture after purchase. 2009, 2010 SQUARE ENIX CO., LTD. All Rights Reserved. CHARACTER DESIGN TETSUYA NOMURA|Bundle-Furniture|L
8BECA650-DE2F4847-83027E9B-EC46E647|Sandwich and Coffee 4-piece Set|A 4-piece set including a sandwich, hot coffee, a coffee pot, and a coffee siphon. This set includes the following items - Sandwich and Coleslaw (Ornaments) - Coffee Siphon (Ornaments) - Hot Coffee (Ornaments) - Coffee Pot (Ornaments) * Upon purchase, each item will be added to the applicable category.|Bundle-Furniture|L
8C17BF33-E8554F85-BCC849FF-2281C3D5|Paris Modern Dining Room Set|Its the Modern Dining Room set. Includes the Modern Table, Head Chair, Side Chair, and Modern Buffet Wine Rack.|Bundle-Furniture|L
8CA72F24-CFF345C9-AED90A9E-96763C31|Animated Diamond Furniture Collection|Enjoy the splendor of sparkling diamond furniture. Bundle includes four tables, four chairs, a footstool, two sofas, a bed, and a laptop.|Bundle-Furniture|L
8D1F60AE-BFEE4E9A-8899F288-C7923F04|Japanese Winter Sweets 6-piece Set|A 6-piece Japanese winter sweets set including kimi shigure sweet, usagi manju sweet, tou manju sweet, hanabira mochi sweet, uguisu mochi sweet, and nerikiri sweets. This set includes the following items for private lounge customization. - Kimi Shigure Sweet (Ornaments) - Usagi Manju Sweet (Ornaments) - Tou Manju Sweet (Ornaments) - Hanabira Mochi Sweet (Ornaments) - Uguisu Mochi Sweet (Ornaments) - Nerikiri Sweet, Kantsubaki (Ornaments) * Upon purchase, each item will be added to the applicable category in Private Lounge Customization.|Bundle-Furniture|L
8D431DE9-BBBF4362-B532E696-DE5B8922|Backlit Simple Picture Frame Set|Backlit Simple Picture Frame Set This Set Includes The Following Items. Backlit Simple Frame Large (picture Frame, Wall Hanging Decoration) Backlit Simple Frame Medium (picture Frame, Wall Hanging Decoration) Backlit Simple Frame Small (picture Frame, Wall Hanging Decoration) Each Item Will Be Added To The Corresponding Category When Purchased.|Bundle-Furniture|L
8D56B7B5-E8F2458D-B9DAC709-B20F840E|Daffodil Ikebana 2-piece Set|A 2-piece set that includes daffodils arranged in bamboo and ceramic vases. This set includes the following items for private lounge customization. - Daffodils Arranged in Bamboo (Ornaments) - Daffodils Arranged in Ceramic (Ornaments) * Upon purchase, each item will be added to the applicable category in Private Lounge Customization.|Bundle-Furniture|L
8E88DF92-E16A4AD3-8D81F6B9-F8FB5559|Commercial Kitchen Utensil 7-Item Set|A 7-item set of kitchen utensils used in the kitchen of a restaurant such as a burger shop. This set includes the following items - Large Commercial Refrigerator (Decoration) - Commercial Grill (Decoration) - Commercial Fryer (Decoration) - Commercial Sink (Decoration) - Commercial Cooking Cabinet (Decoration) - Commercial Microwave Oven (Decoration) - Commercial Kitchen Stand (Table) * Upon purchase, each item will be added to the applicable category.|Bundle-Furniture|L
8E8B7BC6-86514926-8B48A0A7-077C376E|MyOffice - Bundle 02 - Mega bundle|Ever fancied yourself a study where you can sit down and work on those reports (overdue or not?). MyOffice allows you to do just that. This bundle contains (1) MyOffice - Desk (2) MyOffice - Filing Unit (3) MyOffice - Single - Storage Unit (4) MyOffice - Single - Countertop Unit (5) MyOffice - Single - Desk Height Cabinet (6) MyOffice - Double - Storage Unit (7) MyOffice - Double - Countertop Unit (8) MyOffice - Double - Desk Height Cabinet (9) MyOffice - Corner - Storage Unit (10) MyOffice - Corner - Desk Height Cabinet (11) MyOffice - Corner - Desk (12) MyOffice - Tall Robe (13) MyOffice - Waste Bin - Chrome (14) MyOffice - Desk Chair - Brown (15) MyOffice - Desk Lamp|Bundle-Furniture|L
8ED01A48-7B804221-A5356FF7-2D0FFFC6|Wakamatsu and Senryo Ikebana 2-piece Set|A 2-piece set that includes wakamatsu and senryo arranged in bamboo and ceramic vases. This set includes the following items for private lounge customization. - Wakamatsu and Senryo Arranged in Bamboo (Ornaments) - Wakamatsu and Senryo Arranged in Ceramic (Ornaments) * Upon purchase, each item will be added to the applicable category in Private Lounge Customization.|Bundle-Furniture|L
8FCC9E7E-116C45CA-B1E974E3-7FC38ADF|Name In Lights Gold Bundle|This bundle has everything you need to spell out your name or create a message for your friends in a gorgeous font style. This bundle includes the following ornaments * Name In Lights A (Gold) * Name In Lights B (Gold) * Name In Lights C (Gold) * Name In Lights D (Gold) * Name In Lights E (Gold) * Name In Lights F (Gold) * Name In Lights G (Gold) * Name In Lights H (Gold) * Name In Lights I (Gold) * Name In Lights J (Gold) * Name In Lights K (Gold) * Name In Lights L (Gold) * Name In Lights M (Gold) * Name In Lights N (Gold) * Name In Lights O (Gold) * Name In Lights P (Gold) * Name In Lights Q (Gold) * Name In Lights R (Gold) * Name In Lights S (Gold) * Name In Lights T (Gold) * Name In Lights U (Gold) * Name In Lights V (Gold) * Name In Lights W (Gold) * Name In Lights X (Gold) * Name In Lights Y (Gold) * Name In Lights Z (Gold) Upon purchase, all items will be added to their corresponding categories.|Bundle-Furniture|L
907556B8-3AE54161-8C1B08D7-C78B522B|Crime scene set.|Turn Your Room Into A Crime Scene. This Set Includes The Following Items Rope In The Shape Of A Person (rug) Keep Out Tape (decoration) When Purchased, Each Item Will Be Added To The Appropriate Category.|Bundle-Furniture|L
9083B3B9-D5B14D93-A6C34132-6541615B|Sofa Set Black|Sofa Set Black This Set Includes The Following Items Double Sofa Black (Sofa) Long Sofa Black (Sofa) Ottoman Black (Footstool) Each Item Will Be Added To The Corresponding Category When Purchased.|Bundle-Furniture|L
91E74BD3-00BA4F9D-B6577747-2DD97E92|Weather Cube Bundle|The full set of three Weather Cube ornaments that allow you to change the weather in areas of your personal space. This bundle contains the following items * Weather Cube Rain * Weather Cube Snow * Weather Cube Falling Leaves All of these items will be placed into their relevant categories once this bundle is purchased.|Bundle-Furniture|L
91F065DE-B6384799-9ABCE6A3-E4CFB820|Black Stone Tile Set|A set of black stone tiles. This set includes the following items for customizing your personal space. Black Stone Tile - Square (Ornaments) Black Stone Tile - Rounded Corners (Ornaments) Black Stone Tile - Round (Ornaments) *Each item will be added to their relevant wardrobe and furniture category.|Bundle-Furniture|L
92E73AFA-473B46F9-9A8EE4D8-A84A59A4|Intellivision Console with Shark. Shark. Cartridge|Its arcade excitment with the INTELLIVISION Shark. Shark. Home INTELLIVISION game console with Shark. Shark. cartridge, in this updated version of the classic game created especially for PlayStation Home. Big fish eat little fish in this fun and challenging under-sea adventure. Watch out for the shark, lobsters and poisonous jelly-fish. Earn the following three exclusive Shark. Shark. themed rewards during gameplay an animating t-shirt, glitzy game poster, and gold-plated trophy. This bundle contains the Shark. Shark. game and a free INTELLIVISION Console.|Bundle-Furniture|L
92F571C7-10FE4060-922B5962-BB05DDC1|Big GZ Burger Assembly Set|Set of paper napkins and and 15 food items to customize the Big GZ Burger that boasts an amazing 30cm diameter, with 4 types of buns, lettuce, tomato, onion and pickles, beef, beef and cheese, fish, fish and cheese, battered shrimp, battered shrimp and cheese, egg, and bacon. This set includes the following items - Big GZ Burger, Bun Top (Decoration) - Big GZ Burger, Bun Top (With Sesame) (Decoration) - Big GZ Burger, Lettuce (Decoration) - Big GZ Burger, Tomato (Decoration) - Big GZ Burger, Onion and Pickles (Decoration) - Big GZ Burger, Beef (Decoration) - Big GZ Burger, Beef and Cheese (Decoration) - Big GZ Burger, Egg (Decoration) - Big GZ Burger, Battered Fish (Decoration) - Big GZ Burger, Battered Fish and Cheese (Decoration) - Big GZ Burger, Bun Middle (Decoration) - Big GZ Burger, Bacon (Decoration) - Big GZ Burger, Battered Shrimp (Decoration) - Big GZ Burger, Battered Shrimp and Cheese (Decoration) - Big GZ Burger, Bun Bottom (Decoration) - Big GZ Burger, Paper Napkins (Decoration) * Upon purchase, each item will be added to the applicable category.|Bundle-Furniture|L
94BBDAAB-AA2D48F8-A67ABCE3-27EF5011|Antique Sofa and Table 3-piece Set|A 3-piece set with antique-style sofas and table. This set includes the following items - Antique Single Sofa (Ivory) (Sofa) - Antique Long Sofa (Ivory) (Sofa) - Antique Glass Table (Brown) (Table) * Upon purchase, each item will be added to the applicable category.|Bundle-Furniture|L
95077DC9-C33B46CD-BC30111B-7123C2E4|Luxurious Sofa and Table 3-piece Set|A 3-piece set with luxurious furniture including 2 sofa types and a table. This set includes the following items - Luxurious Single Sofa (Sofa) - Luxurious Double Sofa (Sofa) - Luxurious Table (Table) * Upon purchase, each item will be added to the applicable category.|Bundle-Furniture|L
95B1FC66-220D46F0-8549DA0D-FECDA0DD|Sandwich And Coffee 4-Piece Set|Includes Sandwich, Hot Coffee, Coffee Pot And Coffee Siphon. This Set Includes The Following Items. Sandwich And Coleslaw|Bundle-Furniture|L
96BD3A6B-95A94020-A11E4779-C9135732|Anime Prepared and Ready Value Pack|Prepared and Ready. Includes 10 items Blaster, Adjustable Lamp, Mech Chair, Mini Blue Mech Suit, Pod, Sub Machine Gun, Tech Pistol, Mech Suit Incomplete, Mech Suit Right Arm, Mech Suit Right Leg.|Bundle-Furniture|L
96D1541C-39934E92-9318E5C8-DD901291|Deluxe Kitchenware Bundle|Outfit your kitchen with any color palette you choose with this deluxe bundle including 20 interactive active items. Bundle includes the following items Chefs Oven BBQ Grill Stockpot Saucepot Stainless Steel Hot Pot Cherry Red Hot Pot Leaf Green Hot Pot Cobalt Blue Hot Pot Stainless Steel Stand Mixer Cherry Red Stand Mixer Leaf Green Stand Mixer Cobalt Blue Stand Mixer Stainless Steel Toaster Cherry Red Toaster Leaf Green Toaster Cobalt Blue Toaster Stainless Steel Blender Cherry Red Blender Leaf Green Blender Cobalt Blue Blender|Bundle-Furniture|L
97096436-C6184973-B50F9717-37942C71|Dreaming Bed 3-Piece Set|This Is A Set Of Three Magical Beds That Make Your Dreams Come True Whether You Sleep Alone Or Together. This Item Is Advanced Furniture With Additional Animations And Features. There Is A Limit To The Number Of Items Of This Type That Can Be Placed. This Set Includes The Following Items Light Colored Wooden Bed sofa Iron Frame Bed sofa Chic Black Bed sofa When Purchased, Each Item Will Be Added To The Appropriate Category.|Bundle-Furniture|L
978D964F-A4B2416A-8AC10A39-9AB05471|Easter Egg Furniture Set (Dot)|Easter Egg Furniture Set (Dot) This Set Includes The Following Items. Easter Egg (Dot No1) (Decoration) Easter Egg (Dot No2) (Decoration) Easter Egg Wall Hanging (Dot) (Picture Wall Hanging Decoration) When Purchased, Each Item Will Be Added To The Appropriate Category.|Bundle-Furniture|L
97B7F8FF-D76E4135-89243A83-237199C0|x7 Bundle Volume 61|Exclusive x7 Value Bundle. Includes -Davy Jones Locker -Piratical Cannon -Treasure Chest -Pirate Barrel -Pirate Bar -Pirate Bar Stool -Captain Crackers|Bundle-Furniture|L
97FEA200-A9764C9F-8E2CC53A-09481C58|Swimming Float, Mat-shaped Set (Blue)|2-piece set of mat-shaped swimming floats for floating in the ocean. This set includes the following items - Swimming Float, Mat-shaped (Single Size, Blue) (Decoration) - Swimming Float, Mat-shaped (Double Size, Blue) (Decoration) * Upon purchase, each item will be added to the applicable category.|Bundle-Furniture|L
988CCA61-2FA64016-B36C3CED-B09BE563|Kitchen Counter 3-piece Set (White Countertop)|A kitchen counter set including 3 types I-shaped, L-shaped, and U-shaped. This set includes the following items - Kitchen Counter, I-Shape (White Countertop) (Table) - Kitchen Counter, L-Shape (White Countertop) (Table) - Kitchen Counter, U-Shape (White Countertop) (Table) * Upon purchase, each item will be added to the applicable category.|Bundle-Furniture|L
99476F3E-7F7D4C37-8FBE4DE4-81543F8F|Kitchen Counter 3-piece Set (Black Countertop)|A kitchen counter set including 3 types I-shaped, L-shaped, and U-shaped. This set includes the following items - Kitchen Counter, I-Shape (Black Countertop) (Table) - Kitchen Counter, L-Shape (Black Countertop) (Table) - Kitchen Counter, U-Shape (Black Countertop) (Table) * Upon purchase, each item will be added to the applicable category.|Bundle-Furniture|L
9A277B2A-FF004651-9EBE8105-743CA8DE|Self-assembly Blackboard 2-piece Set|A slightly large blackboard set that uses two matching pieces. This set includes the following items - Self-assembly Blackboard, Left Side (Wall Hangings) - Self-assembly Blackboard, Right Side (Wall Hangings) * Upon purchase, each item will be added to the applicable category.|Bundle-Furniture|L
9A6E94CD-8A3C4789-B228FF84-511B15F0|Thirlmere - Dining Room Bundle|Including Dresser, Table and 3 Chairs.|Bundle-Furniture|L
9B214125-4964478C-89981B7E-B4374B6F|Floating Bag Mat-type Set (yellow)|Two-piece Mat-type Floating Bag Set For Floating In The Sea. This Set Includes The Following Items Floating Bag Mat-type (yellow For 1 Person) Decoration Floating Bag Mat-type (yellow For 2 People) Decoration When Purchased, Each Item Will Be Added To The Corresponding Category.|Bundle-Furniture|L
