id|name|desc|category|thumbnail
C683A665-ED28432D-99B86CB5-B044DA0E|Instant Classy Date Adventure Pack|Join the adventure with this bundle of 13 romance inspired items. Bundle includes Smoking Jacket, Silk Pajama Pants, Romantic Camisole, Silk Shorts, Adorable Ermine, Romantic Fireplace, Romantic Mood Vase, The Love Tub, Rainy Window, Valentines Gift, Picnic Basket, Valentine Balloon, The Romantisizer .|Bundle-Furniture|L
C68A5653-7E274211-AE19A88B-DED2119C|Fossil Collecting Plate Set (for Coral)|Two Sets Of Collecting Plates That Can Fit And Display Coral Fossils. This Set Includes The Following Items Old Fossil Collecting Plate (for Coral) (decorative Item) Brand New Fossil Collecting Plate (for Coral) (decorative Item) When Purchased, Each Item Will Be Added To The Corresponding Category.|Bundle-Furniture|L
C76F90CC-550240F0-B0AD4BCA-EDCAEC40|Summer House Furniture Bundle|Includes 4 Summer House furniture pieces, bundled together and offered at a discount.|Bundle-Furniture|L
C78B5B8A-2F654FF9-BEB52841-0E0D14FD|Super Lucky Takeout - Meal Deal|This Super Lucky Takeout meal deal contains four of your favourite dishes including, 1. Mongolian Beef, 2. Kung Pao Chicken, 3. Baby Bok Choy and 4. Sweet and Sour Chicken. All in one great deal, cat chef said meow.|Bundle-Furniture|L
C799BF6C-D5C24B3C-A32ADD7A-B3F3DECA|DIYR - Planks and Boards Bundle|Wooden boards and planks in various sizes to make ramps and elevations for the DIY Racer mini-game. This bundle includes DIYR - Wooden Plank Small DIYR - Wooden Plank Medium DIYR - Wooden Plank Large DIYR - Wooden Board Small DIYR - Wooden Board Medium DIYR - Wooden Board Large Go get the DIY Racer mini-game and turn your apartments into a race track.|Bundle-Furniture|L
C7E85358-108D4115-A85F891E-15706F06|Lucky Set 2 (Furniture)|Want to refresh in the silent nature? (Lucky Set 2 contains different 8 items including special New Year Tiger T-shirt.) **IMPORTANT NOTICE** This Lucky Set may contain the items you have already purchased. Only the item which is not yet purchased is added to your wardrobe and same purchased item will not appear in the wardrobe twice . Purchased Lucky Set are not refundable, transferable or exchangeable, and cannot be redeemed for cash or credit.|Bundle-Furniture|S
C825977A-3BA64D60-904C2315-BCA86F41|Five Story Pagoda Set|This Pagoda Is Designated As A National Treasure With High Artistic Value. The Pagoda Is Completed By Stacking All The Parts Of The Pagoda, Top, Middle And Bottom. The Number Of Layers Is Usually Set To An Odd Number. It Is Rumored That A Powerful Enemy Awaits On Each Floor. This Set Includes The Following Items For Furniture. Five-Story Pagoda (Sorin) (decoration) Five-Story Pagoda (Upper) (decoration) Five-Story Pagoda (Middle) (decoration) Five-Story Pagoda (Lower) (decoration) When Purchased, Each Item Will Be Added To The Appropriate Category.|Bundle-Furniture|L
C889FBBF-83FA48CA-926471F2-7EE347A5|Ornamental Doll, Prop Set|A 35-piece set of ornamental dolls and props. * Upon purchase, each item will be added to the applicable category.|Bundle-Furniture|L
C8DF3722-0B6B4C22-AB61D3F9-5236ACCF|Traffic cone set|A circular cone set of 8. This set includes the following items. Traffic cone (Red)(Ornament) Traffic cone (Blue)(Ornament) Traffic cone (Green)(Ornament) Traffic cone (Yellow)(Ornament) Mini traffic cone (Red)(Ornament) Mini traffic cone (Blue)(Ornament) Mini traffic cone (Green)(Ornament) Mini traffic cone (Yellow)(Ornament) Upon purchase, the items will be placed in their respective categories.|Bundle-Furniture|L
C8F68A38-B500475E-A8A84285-F9A623ED|Space Cubes (4) Bundle|Stack em and mismatch em with the Space Cubes (4) Bundle. Each Cube (4) Design (Open, Closed or Glass) comes in 5 great colors White, Black, Red, Pink and Orange.|Bundle-Furniture|L
C912BAC0-15B148F7-905844F4-1A4854B0|Picnic Pack|Picnic Pack This pack includes the following Picnic Basket Picnic Fruit Platter Picnic Blanket Picnic Tray Find a romantic spot and sweep someone off their feet with a wonderful picnic.|Bundle-Furniture|L
C92ED15E-E4364C6E-8FA1C7E9-C66BE548|Halloween Apartment Decorative Pack Bundle|Everything you need to give your apartment that spooky Halloween feeling. This bundle contains (1) Pumpkin Lanterns (2) Haunted Portrait (3) Candle in Skull (4) Bubbling Cauldron (5) Gravestones|Bundle-Furniture|L
C957B603-E0DE4766-A7E10DCC-A2FEF80E|Three-piece Kitchen Counter Set (black Top)|This Kitchen Counter Set Includes I-shape, L-shape And U-shape. This Set Includes The Following Items Kitchen Counter I-shape (black Top) table Kitchen Counter L-shape (black Top) table Kitchen Counter U-shape (black Top) table When Purchased, Each Item Will Be Added To The Corresponding Category.|Bundle-Furniture|L
CAD96180-AD274BDB-88BFF9B2-4DB63858|Elegant Dining Table Bundle|Includes all three sizes of table. * Elegant Dining Table * Elegant Dining Table for 8 * Elegant Dining Table for 12|Bundle-Furniture|L
CB1196F7-59A24CF4-99750666-FA547397|The Jewel of the Skies Treasure Pack|This pack includes the following The Jewel of the Skies Sultans Finery Pack - Sable Jewel Thief Clothing Pack (for Male) Ameerahs Finery Pack - Mystic Jewel Thief Clothing Pack (for Female) Arabian Finery Furniture Pack - Gold Almas the Tiger Arabian Carpet - Ameerah Arabian Carpet - Indigo Arabian Carpet - Mystic Save big with a value pack. Over 70% discount compared to buying the items individually.|Bundle-Furniture|L
CB2BB639-E2784082-A63C1DE4-29543586|Stainless Steel Kitchenware Bundle|Outfit your kitchen in style with this bundle of 8 active items. Bundle includes the following items Chefs Oven BBQ Grill Stockpot Saucepot Stainless Steel Hot Pot Stainless Steel Stand Mixer Stainless Steel Toaster Stainless Steel Blender|Bundle-Furniture|L
CC3A0131-68A447F9-A15E3EB7-E50AABB4|Osechi Cuisine Three-tiered Osechi Dish|Three-tiered Osechi Dish Is Essential For The New Year. This Set Includes The First, Second, And Third Tiers With Lids. This Set Includes The Following Items Osechi-ryori (three-tiered) (lid) (decoration) Osechi-ryori (three-tiered) (first Tier) (decoration) Osechi-ryori (three-tiered) (second Tier) (decoration) Osechi-ryori (three-tiered) (decoration) Each Item Will Be Added To The Corresponding Category When You Purchase It.|Bundle-Furniture|L
CCA91D19-22934EF7-9AC67B7D-99257618|The LED Ticker Bundle|Why say it when you can write it. Choose from a range of great colours in which to display your message. This bundle contains all 3 LED Tickers * The LED Ticker - Standard * The LED Ticker - Free Standing * The LED Ticker - Wall Mounted Upon purchase, all items will be added to their corresponding categories.|Bundle-Furniture|L
CD1CF9F5-50F44615-8BFF81BC-F4EEEEA5|Elegant Furniture Pack|Elegant and refined furniture that adds a special touch to each room. Contains Elegant Sofa Elegant Dining Chair Elegant Chaise Longue Elegant Round Table Elegant Rectangular Table Large Toothed Animal Skull Snouted Animal Skull Occular Animal Skull Long Animal Skull Slender Animal Skull Elegant Rug Elegant Fabric Cushion Elegant Pleated Cushion Elegant Box  PMExtraCommerce |Bundle-Furniture|L
CDDD3D55-70034A45-98408812-7B7008E0|Active Item - Dogs and Cats Set|Relax with your adorable partners in your personal space. This set includes the following items Sleeping Doberman Golden Retriever Chihuahua Sleeping Bulldog Mastiff Boston Terrier Orange Cat Playful Kitten Upon purchase, the items will be added into the respective categories.|Bundle-Furniture|L
CE20E2DF-268042A4-9113B379-C55C4690|nDreams Funiture Lucky Set - 2012 version|nDreams Funiture Lucky Set - 2012 version contains different 2 bundle item sets (Total of 9 items) from nDreams and 2012 Special New Year T-shirt. **IMPORTANT NOTICE** This nDreams Funiture Lucky Set - 2012 version may contain the items you have already purchased. If you purchased already the items which are included, same item will not appear in the inventory twice. Purchased Lucky Set are not refundable, transferable or exchangeable, and cannot be redeemed for cash or credit.|Bundle-Furniture|L
CE37619D-FF4F408E-9D15E94A-1651EFEB|Modern Furniture Brown Bundle|Includes the brown versions of the Modern sofa, corner sofa, ottoman and chair from your friends at Loot .|Bundle-Furniture|L
CE4978FD-69564EFB-9C922728-62B8CE35|Fossil Collecting Plate Set (for Ancient Dragonflies)|Two Sets Of Collecting Plates That Can Fit And Display Ancient Dragonfly Fossils. This Set Includes The Following Items Old Fossil Collecting Plate (for Ancient Dragonflies) (Decoration) Brand New Fossil Collecting Plate (for Ancient Dragonflies) (Decoration) When Purchased, Each Item Will Be Added To The Appropriate Category.|Bundle-Furniture|L
CF13A920-84A24C0A-9CE7B33F-AA1D3DC7|Doctor Who - Dalek Furniture Bundle|All of the Dalek active items in one bundle. EXTERMINATE. 1) Doctor Who - Drone Dalek (Red) Furniture 2) Doctor Who - Scientist Dalek (Orange) Furniture 3) Doctor Who - Strategist Dalek (Blue) Furniture 4) Doctor Who - Eternal Dalek (Yellow) Furniture 5) Doctor Who - Supreme Dalek (White) Furniture 6) Doctor Who - Dalek Emperor Furniture Doctor Who logo 2013 and TM BBC. Dalek image BBC Terry Nation 1963. Licensed by BBC WW Ltd.|Bundle-Furniture|L
CF3FD2B3-BCF6400C-BCE08849-EF35B3D4|Chameleo Glow - Furniture Bundle|A unique range of modern furnishings that automatically cycle through 16 different glowing colours. Including, Neon Blue, Lime Green, Passionate Pink, Deep Purple, Sun kissed Orange, Fiery Red and Sunbeam Yellow. This bundle includes the following items * Chameleo Glow - Chair * Chameleo Glow - Sofa * Chameleo Glow - Carpet * Chameleo Glow - Picture Frame * Chameleo Glow - Table * Chameleo Glow - Bookshelf All of these items will be placed into their relevant categories once this bundle is purchased.|Bundle-Furniture|L
CF8DB3FD-BFD74368-B2782A00-7BE4B518|Magic Carpet Set (Red)|A 4-piece set including 2 Locomotion flying magic carpet items (high and low), an unfurled magic carpet, and a rolled up magic carpet. Locomotion Speed ~ This set includes the following items - Unfurled Magic Carpet (Red) (Flooring) - Rolled Magic Carpet (Red) (Ornaments) - Locomotion - Soaring Magic Carpet, High (Red) (Locomotion items) - Locomotion - Soaring Magic Carpet, Low (Red) (Locomotion items) * Upon purchase, each item will be added to the applicable category.|Bundle-Furniture|L
CFBCA361-457C451D-888419ED-854FE433|Magic Carpet Set (Blue)|A 4-piece set including 2 Locomotion flying magic carpet items (high and low), an unfurled magic carpet, and a rolled up magic carpet. Locomotion Speed ~ This set includes the following items - Unfurled Magic Carpet (Blue) (Flooring) - Rolled Magic Carpet (Blue) (Ornaments) - Locomotion - Soaring Magic Carpet, High (Blue) (Locomotion items) - Locomotion - Soaring Magic Carpet, Low (Blue) (Locomotion items) * Upon purchase, each item will be added to the applicable category.|Bundle-Furniture|L
CFE0EC22-3E9B49EE-AB2FAEB6-4BB33DC6|Magic Carpet Set (Green)|A 4-piece set including 2 Locomotion flying magic carpet items (high and low), an unfurled magic carpet, and a rolled up magic carpet. Locomotion Speed ~ This set includes the following items - Unfurled Magic Carpet (Green) (Flooring) - Rolled Magic Carpet (Green) (Ornaments) - Locomotion - Soaring Magic Carpet, High (Green) (Locomotion items) - Locomotion - Soaring Magic Carpet, Low (Green) (Locomotion items) * Upon purchase, each item will be added to the applicable category.|Bundle-Furniture|L
CFF608EB-5C3E4AAE-810788B4-19133E13|16 Candles Bundle|With this bundle of 16 candles you create the most romantic ambience in your apartment. The candles come in two sizes and there are several colors or scents to choose from.|Bundle-Furniture|L
D008F04B-7B9C4DC2-9E21B9A1-B06B2538|Drey Prop Pack - Feminine|Drey Prop Pack - Feminine This pack includes the following Drey Prop Swing Bench Drey Prop Book Stack Drey Prop Suitcase Stack Drey Prop Parasol Be the star of your very own poster campaign with the actual props used by Dreys photographers.|Bundle-Furniture|L
D04949C3-88194EBA-B377F39E-B0DB1C66|Stack Genius Game|This game consists of 4 levels the Red Chamber, the Green Chamber, the Blue Chamber, and finally the Yellow Chamber. This bundle contains all 4 levels in the form of private spaces, as well as the red Cube furniture item. You can solve the Red Chamber with the Red Cube. Completing the Red Chamber will give you a green block, to unlock the following level the Green Chamber. And so on complete the Green Chamber, in order to obtain the blue block that will solve the Blue Chamber and finally, solving the Blue Chamber will in turn give you the yellow block, to solve the Yellow Chamber, and win the Stack Genius trophy.|Bundle-Furniture|L
D09841A8-281A4A61-AA33CC70-3AA5387F|Model Set Of Mysterious Flying Object (Before Transformation)|Two Different Scale Models Of The Kikai Machine Imperial Mother Ship When It Was Just Standing Quietly. This Set Includes The Following Items Model Of Mysterious Flying Object (before Transformation) 1 80 Scale (decoration) Model Of Mysterious Flying Object (before Transformation) 1 144 Scale (chair) Each Item Will Be Added To The Corresponding Category When Purchased.|Bundle-Furniture|L
D09A4C94-79BA4A54-89CF69ED-6F4D64F7|Magic Carpet Set (Eastern Arabesque)|A 4-piece set including 2 Locomotion flying magic carpet items (high and low), an unfurled magic carpet, and a rolled up magic carpet. Locomotion Speed ~ This set includes the following items - Unfurled Magic Carpet (Eastern Arabesque) (Flooring) - Rolled Magic Carpet (Eastern Arabesque) (Ornaments) - Locomotion - Soaring Magic Carpet, High (Eastern Arabesque) (Locomotion items) - Locomotion - Soaring Magic Carpet, Low (Eastern Arabesque) (Locomotion items) * Upon purchase, each item will be added to the applicable category.|Bundle-Furniture|L
D1077B35-CFC84EB9-A22E567D-0DA18060|LKWD Venue Customization Pack - Figment|Unlocks further customisation options within the LKWD Venue Apartment. Important LKWD Venue Customisation Packs can only be used in conjuction with the LKWD Venue Apartment.|Bundle-Furniture|L
D1A11F43-72EE45CC-9570F683-34E76F17|Paris Classical Room Ornament Set 1 and 2|Its the full classical ornament bundle. This set combines the content from both Ornament bundle  1 and  2.|Bundle-Furniture|L
D23B6992-32834269-8421FAC5-2DE4F2E6|Gray Stone Tile Set|A set of gray stone tiles. This set includes the following items for customizing your personal space. Gray Stone Tile - Square (Ornaments) Gray Stone Tile - Rounded Corners (Ornaments) Gray Stone Tile - Round (Ornaments) *Each item will be added to their relevant wardrobe and furniture category.|Bundle-Furniture|L
D263AF26-A1434941-AF0EF128-E2DDB46E|Modular Kitchen - Bundle - Gold|This bundle contains (1) Modular Kitchen - Single Unit - Gold (2) Modular Kitchen - Double Unit - Gold (3) Modular Kitchen - Corner Unit - Gold (4) Modular Kitchen - End Corner - Gold (5) Modular Kitchen - Breakfast Bar - Gold (6) Modular Kitchen - Bar Stool - Gold (7) Modular Kitchen - Sink - Gold (8) Modular Kitchen - Stove - Gold (9) Modular Kitchen - Refrigerator - Gold|Bundle-Furniture|L
D2B5F08C-553B4DF9-9A535AF0-A44C6C62|Japanese Confectionery 6-piece Set|This Set Includes 2 Pieces Of Nerikiri, Daifuku, Yokan, Kuzu Manju, And Rakugan. This Set Includes The Following Items Nerikiri Flowers Decoration Nerikiri Leaves Decoration Daifuku Decoration Yokan Decoration Kuzu Manju Decoration Rakigans Decoration When Purchased, Each Item Will Be Added To The Appropriate Category.|Bundle-Furniture|L
D4194A85-8B8E4DCD-9C06B049-C8C629A0|Classical Furniture Pack|Classical and sophisticated furniture with a timeless look. Contains Classical Chaise Longue Classical Two Seat Sofa Classical Three Seat Sofa Classical Footstool Classical Chest of Drawers Classical Table Classical Dining Chair Classical Lamp Classical Oval Coffee Table Classical Rectangular Coffee Table  PMExtraCommerce |Bundle-Furniture|L
D41F724B-D9504920-8B700B56-9D98ADC2|Stage Set Flat Collection|With this punch-you-in-the-face-it s-so-awesome bundle you get all 14 LOOT flats, the Ghostbusters Blue Flat and the bundle exclusive Ghostbusters Wood Flat. All flats are designed to fit perfectly in the LOOT Stage Set personal Space.|Bundle-Furniture|L
D4480B60-4FA74D43-AA172365-C6D2BB9C|Magic Carpet Set (Meander)|A 4-piece set including 2 Locomotion flying magic carpet items (high and low), an unfurled magic carpet, and a rolled up magic carpet. Locomotion Speed ~ This set includes the following items - Unfurled Magic Carpet (Meander) (Flooring) - Rolled Magic Carpet (Meander) (Ornaments) - Locomotion - Soaring Magic Carpet, High (Meander) (Locomotion items) - Locomotion - Soaring Magic Carpet, Low (Meander) (Locomotion items) * Upon purchase, each item will be added to the applicable category.|Bundle-Furniture|L
D471CF0F-49484643-9B18AA0F-8721C0C9|Chinese Banquet 9-piece Set|A Chinese banquet set with 7 Chinese dishes(Peking Duck, Roasted Suckling Pig, Mapo Tofu, Xiaolongbao, Dry-braised shelled shrimp, Yangchow fried rice, Fujian fried rice) , table and chair. This set includes the following items. Chinese Table Tables Chinese Chair Chairs Peking Duck Ornament Roasted Suckling Pig Ornament Mapo Tofu Ornament Xiaolongbao Ornament Dry-braised shelled shrimp Ornament Yangchow fried rice Ornament Fujian fried rice Ornament *When purchased, each item is added to its respective category.|Bundle-Furniture|L
D48BAC6B-BE8E4FD4-96754031-F8A6ACBE|Sofa Set Red|Sofa Set Red This Set Includes The Following Items Double Sofa Red (sofa) Long Sofa Red (sofa) Ottoman Red (footstool) Each Item Will Be Added To The Corresponding Category When Purchased.|Bundle-Furniture|L
D4CE7908-C46C45DA-B60FC7BE-C0F5857D|GROW HOME Bundle|This bundle contains (1) GROW HOME Blue Delphinium (2) GROW HOME Poinsettia (3) GROW HOME Cherry Blossom (4) GROW HOME White Jasmine (5) GROW HOME Sunflower Bush|Bundle-Furniture|L
D5E2AF9B-EE344506-B4BAE397-5CA80A0B|Magic Lamp Set|5-piece set including 2 portables (genie and sprite of the lamp), genie figurine, sprite figurine, and lamp. This set includes the following items - Genie of the Lamp Figurine (Ornaments) - Sprite of the Lamp Figurine (Ornaments) - Magic Lamp, Light (Lights) - Genie of the Lamp (Portables) - Sprite of the Lamp (Portables) * Upon purchase, each item will be added to the applicable category.|Bundle-Furniture|L
D5F2744E-2391457D-BF96010C-8DE0B28E|Hina Dolls, Set Of 3 Kanjo (three Courtesans). This Set Includes The Following Items Hina Dolls, Three Courtesans (left Side) (decoration) Hina Dolls, Three Courtesans Without Eyebrows (center) (decoration) Hina Dolls, Three Courtesans (right Side) (decoration) When Purchased, Each Item Will Be Added To The Appropriate Category.|CategoryXX|Bundle-Furniture|L
D69D38E2-EEC74E71-BE52AAD2-CA452196|Light Green Grass Tile Set|A set of light green grass tiles. This set includes the following items for customizing your personal space. Light Green Grass Tile - Square (Ornaments) Light Green Grass Tile - Wedge (Ornaments) Light Green Grass Tile - Heart (Ornaments) Light Green Grass Tile - Star (Ornaments) *Each item will be added to their relevant wardrobe and furniture category.|Bundle-Furniture|L
D6A33A2B-1F2249CB-9D995287-A6B79872|Tailgate Bundle|These eighteen items are the essentials for a great tailgate party. * Backyard Bar With Stools * Backyard Bar * Tall Table with Stools * Table with Stools * Picnic Table * Engine Grill * Tire Cooler * Table with Lamp * Tall Table with Lamp * Bar Stool * Tall Bar Stool * Sports Canopy * Tailgate Chair - Black * Tailgate Chair - Blue * Tailgate Chair - Green * Tailgate Chair - Orange * Tailgate Chair - Red * Tailgate Chair - Yellow|Bundle-Furniture|L
D6B781F4-7C824144-82697330-36287EAF|Character Dolls Bundle|This bundle contains the following items Character Doll Ryu Character Doll Ken Masters Character Doll Guile Character Doll Chun-Li Character Doll Dhalsim Character Doll Zangief Character Doll E. Honda Character Doll Blanka Character Doll Balrog Character Doll Vega Character Doll Sagat Character Doll M. Bison Character Doll C. Viper Character Doll Seth Character Doll Rufus Character Doll Akuma Character Doll Gouken Character Doll Abel Character Doll El Fuerte Character Doll Cammy Character Doll Sakura Character Doll Dan Character Doll Fei Long Character Doll Rose Character Doll Gen Street Fighter IV CAPCOM U.S.A., Inc.|Bundle-Furniture|L
D6BD5142-61FF4B21-9B4F2EBD-DC2D0B69|x7 Bundle Volume 14|Get this exclusive bundle at great value, only available in x7. Includes Active Item - Plasma Ball, Animated LED Lights, Active Item - Monument Etched Crystal, Active Item - Galaxy Etched Crystal, Active Item - Dragon Etched Crystal, Etched Crystal Bundle, Active Item - Victorian Clock, Active Item - Modern Age Clock, Active Item - Golden Orrery, Active Item - Wooden Orrery, Active Item - Earth Orbit Orrery and Orrery Bundle.|Bundle-Furniture|L
D715FA20-1DA349D1-B48114BF-E6506C91|Personal Computer (Black Set)|Personal Computer (Black Set). This Set Contains The Following Items * Keyboard (Black) (Ornament) * Desktop Computer (Black) (Ornament) * Mouse (Black) (Ornament) * Monitor (Black) (Ornament) When Purchased, Each Item Is Added To The Appropriate Category.|Bundle-Furniture|L
DA5D7CB6-5D1B4346-91E081D9-47F31D31|8-piece Dining Set With Ham And Baguette|Including Ham & Cheese, Knife & Fork, Baguette, Potage, 2 Different Bottles, Jam Plus Items That Combine Them Into One, Total 8 8-piece Set. This Set Includes The Following Items Ham & Cheese Decoration Potage Decoration Baguette Decoration White Bottle Decoration Red Bottle Decoration Blueberry Jam Decoration Knife & Fork Decoration Table With Ham And Baguette Decoration When Purchased, Each Item Will Be Added To The Appropriate Category.|Bundle-Furniture|L
DAD2622D-586F4C72-A28729B1-A0FA9F53|Outdoor Barbecue Set|This Set Includes A Garden Parasol, Barbecue Grill, Log Table And 3 Outdoor Chairs, A Summer Outdoor Staple.|Bundle-Furniture|L
DB37565E-4D9A4EEF-8E33755A-5373C335|Large Outdoor Zeus Rocket Multi-Pack|Large Outdoor Zeus Rocket Multi-Pack This pack includes the following Large Outdoor Zeus Rocket - Electric Orchid Large Outdoor Zeus Rocket - Electric Blue Large Outdoor Zeus Rocket - Ruby Large Outdoor Zeus Rocket - Emerald Large Outdoor Zeus Rocket - Silver Impress your guests or just satisfy your creative pyrotechnic desires with these animated fireworks. Place several together to produce a breathtaking spectacle. Only suitable for outdoor use.|Bundle-Furniture|L
DC6B686C-E5D34845-B5C76FA4-BE08A913|Lock-a-doodle Giant Furniture Pack|Lock-a-doodle Giant Furniture Pack This pack includes the following Giant Lock-a-doodle Sketch Pad Giant Lock-a-doodle Paintbrush Pot Giant Lock-a-doodle Crayon Box Giant Lock-a-doodle Paint Tubes Giant Lock-a-doodle Paint Box Giant Lock-a-doodle Palette Giant Lock-a-doodle Drawing Set Giant Lock-a-doodle Pencil Pot Giant Lock-a-doodle Marker Pens Floor Paint Splat - Magenta Floor Paint Splat - Gold Wall Paint Splat - White Wall Paint Splat - Blue Not the most practical art supplies, but very eye-catching.|Bundle-Furniture|L
DCC0418E-6B71444E-9A50572C-5AFC38DC|Cutteridge Estate Furniture Bundle|The abysmal darkness of Cutteridge Estate may imprison your soul for eternity, but at least youll have some nice furnishings. This bundle includes the following 17 pieces of furniture Occult Sideboard, Reading Chair, Horrifyingly Comfortable Ottoman, Antique Armchair, Carved Antiquities Cabinet, Inscribed Cabinet, Gothic Four Poster Bed, Antique Wood-Burning Stove, Suspicious Tomes, Mysterious Grimoires, Curious Chest of Drawers, Grotesque Statue, Intricate Candelabra, Victorian Sofa, Inlaid Wood Table, Victorian Dining Chair and the (probably) authentic Necronomicopedia.|Bundle-Furniture|L
DD536A9E-BF644B61-80F72D41-883132D9|Artsy Seats|A furniture set containing a Twisted sofa and matching chair, along with the Kiss Me chair.|Bundle-Furniture|L
DD8F3F05-AC724851-86638D8F-D9A71B47|AAA - Florence + the Machine Bundle Offer|Florence + the Machine - official item bundle 1) Lungs Artwork, 2) Ceremonial Wreath, 3) Cosmic Love T-Shirt, 4) Fluro Flo Logo T-Shirt and 5) Florence and The Machine Between Two Lungs Poster|Bundle-Furniture|L
DDFDB44A-6F964DCA-8FEA5C87-FCB38DC8|Cookie Rug Set|Cookie Rug Set This Set Includes The Following Items Cookie Rug (Wavy Rectangle) (Rug) Cookie Rug (Round) (Rug) Cookie Rug (Star) (Rug) When Purchased, Each Item Will Be Added To The Appropriate Category.|Bundle-Furniture|L
DEC89C47-D7944005-9B9BCA75-05882EAE|Pirate Flag Bundle|Be ready to shift your allegiances as appropriate with this bundle of 6 pirate flags. Bundle includes the following Pirate Flags Black Death Flag, Bloody Crow Flag, Ghost Skull Flag, Gold Buccaneer Flag, Sea Raider Flag, Striking Serpent Flag.|Bundle-Furniture|L
