id|name|desc|category|thumbnail
40B416B4-A0F94A5F-B93875AE-9A926C3D|Boys May Festival Doll Set|A 8-piece set of dolls used during the Boys Festival a festival in May to bless young boys with good health. This set includes the following items. - Boys May Festival Doll, Helmet (Ornaments) - Boys May Festival Doll, Armour (Ornaments) - Boys May Festival Doll, Armour Chest (Ornaments) - Boys May Festival Doll, Boots (Ornaments) - Boys May Festival Doll, Bow and Arrow (Ornaments) - Boys May Festival Doll, Daikatana (Ornaments) - Boys May Festival Doll, Gold Folding Screen (Ornaments) - Boys May Festival Doll, Base (Chair) *Upon purchase, each item in the applicable category will be added.|Bundle-Furniture|L
40C88521-5FF94E77-980CE8DA-BE4ADB0D|Garden Set (Bamboo)|Set To Create Gravel Garden That Evokes The Pureness Of Bamboo. This Set Includes The Following Items. Garden Bamboo (decorative Item) Stone Lantern (lighting Fixture) Gravel (Middle) (rug) Gravel (Side) (rug) Gravel (Corner) (rug) Items Are Added To Each Category After Purchase.|Bundle-Furniture|L
40E9CF99-73784C8A-AA97E846-FC8C9BEC|The Nightclub Party Equipment Bundle|Everything you will ever need to get the party started. This bundle includes * The Nightclub Confetti Cannon * The Nightclub Laser Display * The Nightclub Bubble Machine * BoxBeats Nightclub Edition * BoxBeats Minis Nightclub Edition * The Nightclub Lounge Seat Active items provide more functionality than normal items. You may only place limited numbers of the active items in your apartment or clubhouse at any time. Upon purchase, all items will be added to their corresponding categories.|Bundle-Furniture|L
4142EA77-2DFE42DC-88484E82-1A089FA0|Chameleo Motifs - Furniture Bundle|A unique range of modern furnishings that automatically cycle through 16 different motifs. Including, Tartan, Floral, Striped, Checkered and Stucco . This bundle includes the following items * Chameleo Motifs - Chair * Chameleo Motifs - Sofa * Chameleo Motifs - Carpet * Chameleo Motifs - Picture Frame * Chameleo Motifs - Table * Chameleo Motifs - Bookshelf All of these items will be placed into their relevant categories once this bundle is purchased.|Bundle-Furniture|L
4195CB85-F65B4777-AC733296-297A00E2|x7 Bundle Volume 90|Exclusive x7 Value Bundle. Includes Yeti Costume (Male) Earth Aura (Male) Fly Kicks (Male) Over-sized Shuriken (Male) Plaid Paperboy Hat (Male) Hockey Arena Table Sweet Treats Furniture - Peppermint Lamp|Bundle-Furniture|L
41B01F97-E79D4BB6-8322B3B0-570CED7E|Gun Case Bundle|Includes the gun displays, bundled together and offered at a discount.|Bundle-Furniture|L
41CBB414-EE764CE1-95AEDFDD-AB8C6FFA|Big GZ Burger Assembly Set|Set of paper napkins and and 15 food items to customize the Big GZ Burger that boasts an amazing 30cm diameter, with 4 types of buns, lettuce, tomato, onion and pickles, beef, beef and cheese, fish, fish and cheese, battered shrimp, battered shrimp and cheese, egg, and bacon. This set includes the following items - Big GZ Burger, Bun Top (Ornament) - Big GZ Burger, Bun Top (With Sesame) (Ornament) - Big GZ Burger, Lettuce (Ornament) - Big GZ Burger, Tomato (Ornament) - Big GZ Burger, Onion and Pickles (Ornament) - Big GZ Burger, Beef (Ornament) - Big GZ Burger, Beef and Cheese (Ornament) - Big GZ Burger, Egg (Ornament) - Big GZ Burger, Battered Fish (Ornament) - Big GZ Burger, Battered Fish and Cheese (Ornament) - Big GZ Burger, Bun Middle (Ornament) - Big GZ Burger, Bacon (Ornament) - Big GZ Burger, Battered Shrimp (Ornament) - Big GZ Burger, Battered Shrimp and Cheese (Ornament) - Big GZ Burger, Bun Bottom (Ornament) - Big GZ Burger, Paper Napkins (Ornament) * Upon purchase, each item will be added to the applicable category.|Bundle-Furniture|L
424137B6-37D94A12-B7C72AB8-D6FB654C|x7 Bundle Volume 77|Exclusive x7 Value Bundle. Includes Human Tech-Bot 1.0 Helmet (Male) Human Tech-Bot 1.0 Torso (Male) Human Tech-Bot 1.0 Legs (Male) Human Tech-Bot 1.0 Hands (Male) Human Tech-Bot 1.0 Feet (Male) Sweet Treats Furniture - Donut Chair LED Bar|Bundle-Furniture|L
4289A7E1-1CAC49F8-B5CF4514-83074012|Traffic Cone Set|A 8-piece set of cone-shaped traffic pylons. This set includes the following items - Traffic Cone (Red) (Decorative Item) - Traffic Cone (Blue) (Decorative Item) - Traffic Cone (Green) (Decorative Item) - Traffic Cone (Yellow) (Decorative Item) - Mini Traffic Cone (Red) (Decorative Item) - Mini Traffic Cone (Blue) (Decorative Item) - Mini Traffic Cone (Green) (Decorative Item) - Mini Traffic Cone (Yellow) (Decorative Item) * Upon purchase, each item will be added to the applicable category.|Bundle-Furniture|L
44252745-48E8449C-A35FA904-BB620DE1|The Wolf House Furniture Pack|A loyal banner-man of House Grimoult should own all of the finely crafted furniture pertaining to that house. Its basic respect. Or you just like the color palette. Includes House Grimoult Throne, House Grimoult Ottoman, House Grimoult Circular Coffee Table, House Grimoult Rectangular Coffee Table, House Grimoult Grand Vase, House Grimoult Daybed, House Grimoult King Bed, House Grimoult Grand Chair, House Grimoult Chair, House Grimoult Loveseat, House Grimoult Grand Dining Chair, House Grimoult Dining Chair, House Grimoult Wardrobe, and House Grimoult Shield.|Bundle-Furniture|S
4575136F-608246FF-9892B5EC-594F8D00|Chessboard Bundle|This classic chessboard bundle will keep you busy as you take on new opponents. Bundle includes a chessboard with a set of white and black pieces.|Bundle-Furniture|L
45A23E90-19C440DB-B1DAB7B1-42985692|Furniture-Tastic|The Animated Furniture Collection including a Sofa, Chair, Table, Footstool, Lamp and Flower in various colours - brighten up your Home|Bundle-Furniture|L
45F45888-42174091-95B32F5F-EB4A60EE|Swimming Float, Mat-shaped Set (Blue)|2-piece set of mat-shaped swimming floats for floating in the ocean. This set includes the following items - Swimming Float, Mat-shaped (Single Size, Blue) (Ornaments) - Swimming Float, Mat-shaped (Double Size, Blue) (Ornaments) * Upon purchase, each item will be added to the applicable category.|Bundle-Furniture|L
462D7B2F-E8234AEE-AADFDE33-BC2019F6|Dining Furniture Set (Green)|A 2-piece set with chairs and a table perfect for a dining room. This set includes the following items - Fabric Dining Chair (Green) Chairs - Square Wooden Dining Table (Brown) Tables * Upon purchase, each item will be added to the applicable category.|Bundle-Furniture|L
46566840-94574848-9270F076-32867816|Swimming Float, Mat-shaped Set (Pink)|2-piece set of mat-shaped swimming floats for floating in the ocean. This set includes the following items - Swimming Float, Mat-shaped (Single Size, Pink) (Ornaments) - Swimming Float, Mat-shaped (Double Size, Pink) (Ornaments) * Upon purchase, each item will be added to the applicable category.|Bundle-Furniture|L
47287156-1F304F9D-B93581A3-D1381808|Name In Lights Cosmic Bundle|This bundle has everything you need to spell out your name or create a message for your friends in a gorgeous font style. This bundle includes the following ornaments * Name In Lights A (Cosmic) * Name In Lights B (Cosmic) * Name In Lights C (Cosmic) * Name In Lights D (Cosmic) * Name In Lights E (Cosmic) * Name In Lights F (Cosmic) * Name In Lights G (Cosmic) * Name In Lights H (Cosmic) * Name In Lights I (Cosmic) * Name In Lights J (Cosmic) * Name In Lights K (Cosmic) * Name In Lights L (Cosmic) * Name In Lights M (Cosmic) * Name In Lights N (Cosmic) * Name In Lights O (Cosmic) * Name In Lights P (Cosmic) * Name In Lights Q (Cosmic) * Name In Lights R (Cosmic) * Name In Lights S (Cosmic) * Name In Lights T (Cosmic) * Name In Lights U (Cosmic) * Name In Lights V (Cosmic) * Name In Lights W (Cosmic) * Name In Lights X (Cosmic) * Name In Lights Y (Cosmic) * Name In Lights Z (Cosmic) Upon purchase, all items will be added to their corresponding categories.|Bundle-Furniture|L
477F80B1-7FE44E4E-88C6E2DF-CDAB81DF|LKWD Venue customization Pack - Medusa|Unlocks further customisation options within the LKWD Venue Apartment. Important LKWD Venue Customisation Packs can only be used in conjuction with the LKWD Venue Apartment.|Bundle-Furniture|L
47CC8A50-9F0D4E94-868ABFEA-31AC21FE|PODI Starter Pack|PODI Starter Pack This pack includes the following Pyrotechnic Overhead Display Interface (PODI) PODI Fuses Divine Display PODI Fireworks This box contains o Bombette Burst - A powerful green explosion o Jet o Gold - A sustained fountain of sparkling gold o Kissin the Sky - A cloud of tiny, delicate crosses o Rising Horizon - Glaringly bright flash dogged by a plume of green smoke o Ready-Steady-Go - Traffic lights in the sky Use fuses to introduce pauses to your display and give fireworks a delay before they are launched. Important PODI Fireworks can only be used in conjuction with the Pyrotechnic Overhead Display Interface Active Object.|Bundle-Furniture|L
47ED9254-9FB04D18-87197A33-147B5BB1|Hazama Receptionist Set|Hazamas Receptionist, Sakuyas Favorite. This Set Includes The Following Items For Furniture Bonbori (large) (lighting Fixture) Gold Folding Screen (large) (decoration) When Purchased, Each Item Will Be Added To The Appropriate Category.|Bundle-Furniture|S
48258392-3DE64A25-96264E9D-70AF8CA6|Cherry Blossom Tree - 5-Piece Set|A set made from large cherry blossom trees. This 5-piece set includes 2 types of blooming cherry blossom trees, a tree trunk, and a tree trunk divided into upper and lower items. This set includes the following items - Cherry Blossom Tree, Blossoming (Forked Branches) (Ornaments) - Cherry Blossom Tree, Blossoming (Full Bloom) (Ornaments) - Cherry Blossoming Tree, Trunk (Upper) (Ornaments) - Cherry Blossoming Tree, Trunk (Lower) (Ornaments) - Cherry Blossoming Tree, Trunk (Upper + Lower) (Ornaments) * Upon purchase, each item will be added to the applicable category.|Bundle-Furniture|L
48BD9248-D02B4B7B-90239EC8-D38607C5|Dining Furniture Set (Red)|A 2-piece set with chairs and a table perfect for a dining room. This set includes the following items - Fabric Dining Chair (Red) Chairs - Square Wooden Dining Table (white) Tables * Upon purchase, each item will be added to the applicable category.|Bundle-Furniture|L
4934DE2B-FC724704-8CF3FE84-01306A38|Gardenia Ikebana 2-Piece Set|Two Sets Of Gardenia Flowers, One In A Bamboo Bowl And The Other In A Ceramic Bowl. This Set Includes The Following Items Gardenia In Bamboo Vase Decorative Gardenia In Pottery Decorative When Purchased, Each Item Will Be Added To The Appropriate Category.|Bundle-Furniture|L
496E529D-D74C44E6-A7776C13-1A2A20B3|Fossil Collection Plates Set (for coral)|A 2-piece set of collection plates for displaying coral fossils. This set contains the following items - Old Fossil Collection Plate (for coral)(Decoration) - Brand New Fossil Collection Plate (for coral)(Decoration) * Upon purchase, each item in the applicable category will be added.|Bundle-Furniture|L
4A2E7327-FF054583-A1823EC3-25554D96|Breakfast 6-piece Set|A 6-piece set including simple dishes, snacks, and drinks. This set includes the following items - Hot Dog Ornament - Eggs Benedict Ornament - Donuts Ornament - Apple Pie Ornament - Cola Ornament - Orange Juice Ornament * Upon purchase, each item will be added to the applicable category.|Bundle-Furniture|L
4A6AFE23-123F412D-B009B5E4-0A1D5E79|Dining Furniture Set (Dark Brown)|A 2-piece set with chairs and a table perfect for a dining room. This set includes the following items - Fabric Dining Chair (Dark brown) Chairs - Square Wooden Dining Table (Dark brown) Tables * Upon purchase, each item will be added to the applicable category.|Bundle-Furniture|L
4A96DE59-B8374C35-8E9D4EBB-FE409E16|Cutteridge Estate Furniture Bundle|The abysmal darkness of Cutteridge Estate may imprison your soul for eternity, but at least youll have some nice furnishings. This bundle includes the following 19 pieces of furniture Occult Sideboard, Reading Chair, Horrifyingly Comfortable Ottoman, Antique Armchair, Carved Antiquities Cabinet, Inscribed Cabinet, Gothic Four Poster Bed, Antique Wood-Burning Stove, Suspicious Tomes, Mysterious Grimoires, Curious Chest of Drawers, Grotesque Statue, Square Picture Frame, Round Picture Frame, Intricate Candelabra, Victorian Sofa, Inlaid Wood Table, Victorian Dining Chair and the (probably) authentic Necronomicopedia.|Bundle-Furniture|L
4B1C1893-96C749CE-8ED3F57F-9D3D308E|Fossil Collection Plates Set (for footprints)|A 2-piece set of collection plates for displaying footprint fossils. This set contains the following items - Old Fossil Collection Plate (for footprints)(Decoration) - Brand New Fossil Collection Plate (for footprints)(Decoration) * Upon purchase, each item in the applicable category will be added.|Bundle-Furniture|L
4B26FE0D-D828475D-98D8A27B-2859F9A0|Dinner 7-piece Set|A 7-piece professional dinner course set with a seafood theme. This set includes the following items - Clam Chowder in Bread Bowl Ornaments - Dungeness Crab Garlic Stir-fry Ornaments - Seafood Salad Ornaments - Beefsteak Ornaments - Shrimp Cocktail Ornaments - Cioppino Ornaments - Crab Cake Ornaments * Upon purchase, each item will be added to the applicable category.|Bundle-Furniture|L
4B72FA58-B7C84D39-A439380A-27F3017F|MyBedroom - Birch Wood - Bundle|The complete Birch Wood MyBedroom set. This bundle contains (1) MyBedroom - Birch Wood - Vanity Table (2) MyBedroom - Birch Wood - Vanity Stool (3) MyBedroom - Birch Wood - Cupboard (4) MyBedroom - Birch Wood - Bedside Cabinet (5) MyBedroom - Birch Wood - Tallboy (6) MyBedroom - Birch Wood - Single Wardrobe (7) MyBedroom - Birch Wood - Double Wardrobe (8) MyBedroom - Birch Wood - Table Lamp (9) MyBedroom - Birch Wood - Wool Rug (10) MyBedroom - Birch Wood - Bed (11) MyBedroom - Birch Wood - Mirror (12) MyBedroom - Birch Wood - Large Glass Unit|Bundle-Furniture|L
4BA2FC54-C5224C92-AF1ED9C1-F2CF206A|Wintersweet and Winter Plum Ikebana 2-piece Set|A 2-piece set that includes wintersweet and winter plum arranged in bamboo and ceramic vases. This set includes the following items for private lounge customization - Wintersweet and Winter Plum Arranged in Bamboo (Ornaments) - Wintersweet and Winter Plum Arranged in Ceramic (Ornaments) * Upon purchase, each item will be added to the applicable category in Private Lounge Customization.|Bundle-Furniture|L
4BB63EE5-F2B4468F-9B36B40A-BE911FF4|Natural interior set|A 3 piece set perfect for the yearlong summer with 2 types of wooden chests and an interior light. This set includes the following items - Wooden chest (Dark brown, 2 drawers) (Decoration) - Wooden chest (Natural, 3 drawers) (Decoration) - Table lamp (Bamboo) (Lighting device) * Upon purchase, each item will be added to the applicable category.|Bundle-Furniture|L
4BE44EBF-BEB646E5-BFFA9680-E5FEC284|Tropical palm tree - 4 piece set|Put the 4 pieces of this set together to make a large palm tree. This set includes the following items - Tropical palm tree - Piece I (Decoration) - Tropical palm tree - Piece II (Decoration) - Tropical palm tree - Piece III (Decoration) - Tropical palm tree - Piece IV (Decoration) * Upon purchase, each item will be added to the applicable category.|Bundle-Furniture|L
4C45377E-C1AF4976-B933302A-62D97A2D|Luxury Train Furniture Bundle (Black)|The perfect furniture bundle to go with the Luxury Train Apartment. Includes seven furniture items including * Corner Sofa (Black) * Straight Sofa (Black) * Low Chair (Black) * Low Table (Black) * Large Counter Top (Black) * Small Counter Top (Black) * Bed (Black) Upon purchase, all items will be added to their corresponding categories.|Bundle-Furniture|L
4D61EBB2-97644B42-8BED1BA4-58787590|x7 Bundle Volume 1|Get this exclusive bundle at great value, only available in x7. Includes Animated Horse, Animated Hamster on Wheel, Animated Snake in Terrarium, Animated Rabbit, Active Item - Animated Cow, and Active Item - Animated Goat.|Bundle-Furniture|L
4DDB709A-514B444A-B14DDA0F-9ADA918F|Dark Green Grass Tile Set|A set of dark green grass tiles. This set includes the following items for customizing your personal space. Dark Green Grass Tile - Square (Ornaments) Dark Green Grass Tile - Wedge (Ornaments) Dark Green Grass Tile - Heart (Ornaments) Dark Green Grass Tile - Star (Ornaments) *Each item will be added to their relevant wardrobe and furniture category.|Bundle-Furniture|L
4DE222D2-0B504E14-8F1FBDCC-C3D0B83A|Dining Furniture Set (white)|A 2-piece set with chairs and a table perfect for a dining room. This set includes the following items - Fabric Dining Chair (white) Chairs - Square Wooden Dining Table (Black) Tables * Upon purchase, each item will be added to the applicable category.|Bundle-Furniture|L
4E8E9433-C6F14ED8-B51BB9D1-57D85044|nDreams Active Furniture Lucky Set - 2012 version|nDreams Active Furniture Lucky Set - 2012 version contains different 2 bundle item sets and 1single item (Total of 13 items) from nDreams and 2012 Special New Year T-shirt **IMPORTANT NOTICE** This nDreams Active Furniture Lucky Set - 2012 version may contain the items you have already purchased. If you purchased already the items which are included, same item will not appear in the inventory twice. Purchased Lucky Set are not refundable, transferable or exchangeable, and cannot be redeemed for cash or credit.|Bundle-Furniture|L
4EBEB72A-27C84834-AB533356-5C6A0B4A|100 Vacation-Themed Items Super Bundle|Decorate your Home space with a souvenir from all of our popular vacation getaways. This 100 item vacation bundle includes unique items from our Tropical Escape, Santorini Greece, and Yacht Santorini Collections. Valued at over $30, get this pack for only $4.99. As a bonus, get this pack for only $1 by owning any one of the following items PlayStation Home Mansion First Floor, PlayStation Home Mansion Second Floor, PlayStation Home Mansion Infinity Pool, Gold Suit, Diamond Suit, Emerald, Ruby, and Sapphire Suit Bundle, Animated Diamond Furniture Collection, or the Ultimate Diamond Collection Bundle.|Bundle-Furniture|L
4F36566C-2A1046ED-AA844EBA-018BFE01|Living Room Furniture Set (Green)|A 6-piece set of furniture perfect for a living room including a sofa with wooden armrests. This set includes the following items - Wooden Sofa with Armrest, 3-seat (Green) Sofas - Wooden Sofa with Armrest, 2-seat (Green) Sofas - Wooden Chair with Armrest, 1-seat (Green) Chairs - Square Cushion (Green) Ornaments - Oval Wooden Coffee Table (Brown) Tables - Sideboard with Glass Door (Brown) Ornaments * Upon purchase, each item will be added to the applicable category.|Bundle-Furniture|L
50D73D70-3BB64281-932F1140-B7E610EF|Cookware Set|Cookware Set. Cook Delicious Meals. This Set Includes The Following Items. Bowl (decorative) Frying Pan (decorative) One-handed Pot (decorative) Kettle (decorative) Cutting Board (decorative) Each Item Will Be Added To The Appropriate Category When Purchased.|Bundle-Furniture|L
50FFC3C6-88C046E9-A7D1C335-B5FBB672|The Japanese Shelf Accumulated Scarlet Set|A Simple But Good Quality Shelf. It Seems To Be Suitable For Displaying Figures. This Set Includes The Following Items For Furniture Stackable Scarlet Japanese Shelf Large (decorative) Stackable Scarlet Japanese Shelf Small (decorative) When Purchased, Each Item Will Be Added To The Appropriate Category.|Bundle-Furniture|L
518FEC02-E2034B81-B082461C-EA2A9DC1|5-Piece Interrogation Set|This 5-piece Set Includes A Desk, Chair, Desk Lamp, And Two Ashtrays For Use When Interrogating A Suspected Person. This Set Includes The Following Items. Table For Interrogation Chair For Interrogation Light Stand For Interrogation Ashtray (aluminum) (decorative Item) Ashtray With Cigarette Butt (stainless Steel) (decorative Item) When Purchased, Each Item Will Be Added To The Corresponding Category.|Bundle-Furniture|L
52589BC9-BF62405E-B3B2DD7A-DF8D2CE6|Living Room Furniture Set (Brown)|A 6-piece set of furniture perfect for a living room including a sofa with wooden armrests. This set includes the following items - Wooden Sofa with Armrest, 3-seat (Brown) Sofas - Wooden Sofa with Armrest, 2-seat (Brown) Sofas - Wooden Chair with Armrest, 1-seat (Brown) Chairs - Square Cushion (Brown) Ornaments - Oval Wooden Coffee Table (white) Tables - Sideboard with Glass Door (white) Ornaments * Upon purchase, each item will be added to the applicable category.|Bundle-Furniture|L
5280359F-45564233-8CC4E545-77ADAB91|Swimming Float, Mat-shaped Set (Yellow)|2-piece set of mat-shaped swimming floats for floating in the ocean. This set includes the following items - Swimming Float, Mat-shaped (Single Size, Yellow) (Ornaments) - Swimming Float, Mat-shaped (Double Size, Yellow) (Ornaments) * Upon purchase, each item will be added to the applicable category.|Bundle-Furniture|L
529CC6AD-21CD4241-BAF49581-8FE06CD2|Outdoor Ambient Lamp Set|These lamps are great for lighting up a walkway. Bundle includes 3 outdoor lamps.|Bundle-Furniture|L
52EF2FDF-B77D46A9-B426A6DF-C416A5E0|Living Room Furniture Set (Red)|A 6-piece set of furniture perfect for a living room including a sofa with wooden armrests. This set includes the following items - Wooden Sofa with Armrest, 3-seat (Red) Sofas - Wooden Sofa with Armrest, 2-seat (Red) Sofas - Wooden Chair with Armrest, 1-seat (Red) Chairs - Square Cushion (Red) Ornaments - Oval Wooden Coffee Table (Dark Brown) Tables - Sideboard with Glass Door (Dark Brown) Ornaments * Upon purchase, each item will be added to the applicable category.|Bundle-Furniture|L
52F74572-641B4BF0-BE45BD6C-17098201|PixelJunk Monsters Giant Pack|Giants, towers, trees, oh my. Unleash the Giant within by giving your room that Monsters feel with this 7 item bundle today. PixelJunk Monsters Miniature Character (Giant) PixelJunk Monsters Miniature Tower (Trap Tower) PixelJunk Monsters Floor Rug (Type A) PixelJunk Monsters Floor Rug (Type C) PixelJunk Monsters Miniature Tree (Spring) PixelJunk Monsters Miniature Tree (Summer) PixelJunk Monsters Round Tree (Spring)|Bundle-Furniture|L
53CF3500-AF724290-9BC8FF26-38EB96F9|x7 Bundle Volume 67|Exclusive x7 Value Bundle. Includes -Black Sofa -Racing Dining Table - Dark Wood -White Lounge Sofa -Pink Rug -Black Lamp -Wood Bench with Cushions -Yellow Pot -White and Blue Beach Bag|Bundle-Furniture|L
53DF0C4A-9FAF42F9-9710B337-147E971C|Mega Kitchen Bundle|including Cerkez Kitchen, Avedic Kitchen and Truzzi Kitchen (3 x Corner Unit, 3 x Hob Unit, 3 x Oven Housing, 3 x Sink Unit, 3 x Standard Unit)|Bundle-Furniture|L
53EF71DC-BEF94474-97973B3D-731B35D4|Doctor Who - Wave Two Ultimate Bundle|This bundle comes with the following items 1) Doctor Who - Drone Dalek (Red) companion 2) Doctor Who - Supreme Dalek (White) companion 3) Doctor Who - Eternal Dalek (Yellow) companion 4) Doctor Who - Strategist Dalek (Blue) companion 5) Doctor Who - Scientist Dalek (Orange) companion 6) Doctor Who - Drone Dalek (Red) Furniture 7) Doctor Who - Scientist Dalek (Orange) Furniture 8) Doctor Who - Strategist Dalek (Blue) Furniture 9) Doctor Who - Eternal Dalek (Yellow) Furniture 10) Doctor Who - Supreme Dalek (White) Furniture 11) Doctor Who - Dalek Emperor Furniture 12) Doctor Who - Cyberman companion 13) Doctor Who - Cyberman Furniture 14) Doctor Who - K-9 companion 15) Doctor Who - K-9 Furniture BBC logo BBC 1996. Doctor Who logo BBC 2013. Dalek image BBC Terry Nation 1963. Cyberman image BBC Kit Pedler Gerry Davis 1966. K-9 image BBC Bob Baker Dave Martin 1977. Licensed by BBC Worldwide Limited.|Bundle-Furniture|L
540F9DE4-045B4378-8467F6A5-274ADD67|Two Daffodil Ikebana Set|Two Sets Of Daffodils, One In A Bamboo Bowl And One In A Ceramic Bowl. This Set Includes The Following Items For Customizing Your Private Lounge Daffodils In Bamboo Vase Decoration Daffodils In Pottery Decoration When Purchased, Each Item Will Be Added To The Appropriate Category In The Customize Private Lounge Section.|Bundle-Furniture|L
541FFE4E-1F2246FD-B8C934B3-A0F79565|Living Room Furniture Set (Black)|A 6-piece set of furniture perfect for a living room including a sofa with wooden armrests. This set includes the following items - Wooden Sofa with Armrest, 3-seat (Black) Sofas - Wooden Sofa with Armrest, 2-seat (Black) Sofas - Wooden Chair with Armrest, 1-seat (Black) Chairs - Square Cushion (Black) Ornaments - Oval Wooden Coffee Table (Black) Tables - Sideboard with Glass Door (Black) Ornaments * Upon purchase, each item will be added to the applicable category.|Bundle-Furniture|L
54477667-8EB04FEC-84CC460B-98C3B808|Swimming Float, Mat-shaped Set (Green)|2-piece set of mat-shaped swimming floats for floating in the ocean. This set includes the following items - Swimming Float, Mat-shaped (Single Size, Green) (Ornaments) - Swimming Float, Mat-shaped (Double Size, Green) (Ornaments) * Upon purchase, each item will be added to the applicable category.|Bundle-Furniture|L
5449F841-F3184AEF-BE2E3DA3-5A22844C|Idea - Modular Sofa - Bundle - Pink|This bundle is for the complete pink sofa and comes with all six objects. 1. Double Seat 2. Left End Seat 3. Right End Seat 4. Corner Seat 5. Single Seat 6. Footstool|Bundle-Furniture|L
548DBDF5-0159489A-AF55495D-B1E0A08A|x7 Bundle Volume 39|Get this exclusive bundle at great value, only available in x7. Includes Chimera Statue, Liger Statue, Lion Statue, T-Rex Statue, Black Lamp, Black Sofa, Earth Globe and Wood Bench with Cushions.|Bundle-Furniture|L
549531ED-A2D84ED0-A8BB93AD-8EA49228|Lucky Set 1 - 2011 version (Furniture)|Would you like to have a summer house for your own apartment? (Lucky Set 1 contains different 6 items including 2011 special New Year T-shirt.) **IMPORTANT NOTICE** This Lucky Set may contain the items you have already purchased. Only the item which is not yet purchased is added to the corresponding categories under Redecorateand same purchased item will not appear twice. Purchased Lucky Set are not refundable, transferable or exchangeable, and cannot be redeemed for cash or credit. This Lucky Set 2011 contains different variety of items from Lucky Set 2010.|Bundle-Furniture|L
