id|name|desc|category|thumbnail
AF021720-FCDB4D3C-B55F5257-470B8FB4|Masquerade Ball - Fine Gloves (Female) (Gothic)|Be the belle of the ball with this elegant clothing item. This is part of the Masquerade Ball clothing range.|Female-Hands|L
AF0D1E9F-E58E4728-80EA983B-F7D828D2|Hands_katana_muramasa_00_1 (0)|Hands_katana_muramasa_00_1|Female-Hands|L
AF492548-546E4AF7-BE72A9D9-EB6688C9|Side Spear (female)|Spear With T-shaped Handle And Ear Tip Facing Sideways. (From Semi-Finalist Fantasia) Attack , Defense -, Combo 2, Attribute Laughter The Weapon Is Worn On The Hands During Combat Events. During Normal Times, The Weapon Is Worn On The Back.|Female-Hands|L
AF4C8072-65674562-A490BB6A-9947EF1D|Drey Chic Clutch - Blue|Shes the belle of the ball in the latest party attire from Drey.|Female-Hands|L
AF4D3B1E-F4A747EE-8CC3DB10-D9B51458|Gingerbread Cookie (Female)|A tasty gingerbread cookie in the shape of a tree.|Female-Hands|L
AF63BC2A-B8334FC5-A39EC4B6-A0742045|Spunland Spun Boxing Gloves (female)|Be careful who you strike at with the punches that you throw. Keep your hands safe and cushion your blow. Speak nicely of peace and calmly of love. And spread the word with a Spun Boxing Glove.|Female-Hands|L
AF65C410-E45D45A8-AB65913F-F579AB12|Sea Nymph Rings (Violet)|Become a sea goddess.|Female-Hands|L
AF678C2A-C6414A7B-87DFE25A-3DB69CCA|Metal Wing (Red Women)|Red Mechanical Wing. For Female.|Female-Hands|L
AF7473D2-F0EE43E6-9C5E5685-C7883339|Blue Knit Gloves|The Razor Collection brings you casual style with a cutting edge. We bring you trousers, boots, tops and gloves. Mix it or match it, the choice is yours, cohesion or clash, cut a dash in the Razor Collection.|Female-Hands|L
AF8324ED-833C453F-9D5A2D9A-EE6E20F3|Elvish Fantasy Gauntlets (Female)|Theres enough punch in those gloves to wipe the smirk off any foe you might encounter.|Female-Hands|L
AF8604C3-EA6844F4-96C4052A-AC607F7D|The Staff Of A Kind Old Lady (female)|Wonderful Staff That Heals Wounds With Powerful Healing Magic. It Is Said To Have Belonged To The Kindest Grandmother In The Village. (From Semi-Finalist Fantasia) Resilience , Defense -, Combo 2, Attribute Holy, Magic Healing Bright The Weapon Is Worn On The Hands During Combat Events. During Normal Times, The Weapon Is Worn On The Back.|Female-Hands|L
AF9ACCEF-D41042B7-8582771C-D89AD2D5|Midas Reactive Defense Gloves (Female)|These are the gloves for the Midas Reactive Defense System. Co-developed by Obsidian and Earth Fleet scientists, the Midas Reactive Defense System utilizes the core components from Obsidian armor, forming a metallic substance that is soft and pliable at room temperature. The final compound binds directly to a human pilots skin, instantly absorbing most energy-based attacks when a gentle charge of Nebulon energy is applied. This item passively absorbs Nebulon, effectively increasing your Novus Prime base Nebulon gains by about 5%.|Female-Hands|L
AFCA4A24-38E8409F-BAE68FCC-5566DC57|Swirly Lollipop (for Female)|Yummy multicoloured candy lollipop.|Female-Hands|L
AFCA6438-97F54338-824485DE-CB781C8B|Ultimate Scribble Shooter PlayStation Home Saviour Cape and Sceptre (female)|Lets face it, we cant all be heroes. But dont let that stop you from fooling people into thinking you helped defend the PlayStation Home Universe against the evil Scribble Shooter Aliens. Remember kids, fake it til you make it.|Female-Hands|L
B00B0C17-D50F40A0-88946589-18EA7008|Halberd (Women)|Halberd with its characteristic elegant shape. It can be used in Operation Defend Edo. Attacking Strength - Attacking Strength towards demons - Charge attack available.|Female-Hands|L
B011165B-372340E0-B72A06FD-D4BFB273|Furoshiki-Yoi|Stylish Furoshiki Cape. Wearing It In Peakvox Ninja, Allows You To Glide Freely Through The Air, Known As flying Squirrel Ninjutsu . By Pressing The Jump Button Again During A Double Jump In The Game, You Can Perform Flying Squirrel Ninjutsu. *To Use The Furoshiki In The Game You Must Be Lv. 6 Or Higher.|Female-Hands|L
B0256C1D-4B604A93-AE853BF4-B9F20B8B|Gothic Hands (Female)|Mesh gloves with some razor wire conveniently wrapped around your wrist.|Female-Hands|L
B048FFB3-B0EB4DF8-BDCE7B69-1DCC5E31|Bunny Cuffs (Red Female)|Cuffs For Bunny Suits With Red Buttons.|Female-Hands|L
B067B506-DAD24881-B292A23D-47980BB6|Black and Red Nail Varnish|Salon Nails available in a variety of colors - find the perfect one to match your outfit|Female-Hands|L
B07B1665-8E1C4426-BEEEA8E2-AD91CD9E|Blue balloon on a stick|Blue balloon on a stick|Female-Hands|L
B08F802D-5D444D93-94C32184-01868AB8|Wizard Deflectors (Female)|Flashy and useful, these bracers help deflect anything that might have gotten past the savages and their *shudder* hand-to-hand combat.|Female-Hands|L
B0D662AE-0F584C1B-8BAB42C0-5F12AEEE|Hands_ninja_00_1 (0)|Hands_ninja_00_1|Female-Hands|L
B0E7A41B-355C4003-B2B3FACD-EF1AD99F|Casual Backpack (Red, Women)|A backpack featuring a casual design. The backpack is attached to the hands.|Female-Hands|L
B11945C9-3E8B4E07-B7D61CCD-2E260CDE|Sacred Flame Fishing Rod(female)|A Rod Charged With Flame To Purge Evil. It Has A Moderate Pulling Power. It Can Use Sacred Flame Twice Per Fishing. Sacred Art Of Fire Inflicts Additional Damage.|Female-Hands|L
B131A5D7-9E314297-9B7046BB-162A2829|Fairytale Queen of Hearts Sceptre|A cold-hearted queen, or just a misunderstood monarch? All depends on your perspective. Concept by PlayStation Home user Jennifer Whitbread.|Female-Hands|L
B1377361-FD3B458F-82137B59-4668A41D|Briefcase (Female)|This is a reward from Home Tycoon|Female-Hands|L
B16AB3F7-0B1442E4-B5110F3E-33A45217|Star Trek TNG Tricorder (Female)|Hey Trekkies, Star Trek has come to PlayStation Home. Be equipped for all missions with your very own Star Trek The Next Generation Tricorder. TM and 2013 CBS Studios Inc. Star Trek and all related marks and logos are trademarks of CBS Studios Inc. All Rights Reserved.|Female-Hands|L
B1854D80-097E4F97-A3DD74F5-0E39817C|Taiko Drumstick (Women)|Taiko Drumstick.|Female-Hands|L
B18FAD0C-3B994E77-8BDCCC5D-060A7E83|Wooden Bow (For Battle, Women)|hands_bow_00_1|Female-Hands|L
B1B3E882-4F504E57-AFC3546A-652392EB|Brimstone Skeleton Hand (female)|Prize for getting a Royal Flush.|Female-Hands|L
B220523A-FDCC4023-BBA6C2A7-479AE838|Pirates Cloak White (Female)|Female Hands Pirate2|Female-Hands|L
B22ED42D-B9BF469A-A12AF042-867133A4|Echochrome Costume (Bottom)|Echochrome Costume (Bottom)|Female-Hands|S
B246819F-3E25416A-B38FECD9-F2D0170A|Nico Nico TV-chan Uchiwa (for Women)|The Mascot Character Of Nico Nico Douga, Nico Nico TV-chan With A Cute And Unique Expression Is Printed On This Fan. niwango, Inc.|Female-Hands|S
B2657642-0E604978-84EC36E1-6BFFFB79|Cavewoman Club|Prehistoric Valley from Lockwood a time AND a place.|Female-Hands|L
B267878E-FC5A4DC5-AB6D2DA2-A16D325E|Leather Elbow Gloves - Black|Sharp, understated and timeless. A retro collection from Figment.|Female-Hands|L
B26BF871-CE3D4677-A52BAC6B-A03890B1|Billabong - Water Warz Tote Bag - Black multi (Women)|The Water Warz is a yarn dye woven large beach tote with front sleeve pockets, and retro wave patch detail.|Female-Hands|L
B2B06CE9-4D5F4199-9946F4A3-9B4F5BD1|Drey Orange Bow Clutch Bag with Bangle|Staying home or seeking out a party? This shimmer tone leather ribbon bag will keep you on trend. Make a moment last a lifetime with the glamorous bangle. Composition Pure shimmer and shine Care Use specialist shimmer cleaner|Female-Hands|L
B2B8CE6A-C2794EC8-B66CDB69-26015355|Weathercock halberd (Women)|Halberd with weathercock on it. It can be used in Operation Defend Edo. Attacking Strength - Attacking Strength towards demons - Charge attack available.|Female-Hands|L
B2C8D8EA-18484AF6-ACC45497-0D7D09F3|Pink and Purple Gloves|The Razor Collection brings you casual style with a cutting edge. We bring you trousers, boots, tops and gloves. Mix it or match it, the choice is yours, cohesion or clash, cut a dash in the Razor Collection.|Female-Hands|L
B2E59059-58FC4BB4-BAF33098-C39AD079|Uproar - Outlaws Nimble Finger Gloves (for Female)|Represent your chosen Uproar gang by wearing this clothing item in-game and around PlayStation Home.|Female-Hands|L
B3080897-FA454C21-B126C763-ED012E55|Silverballers (Female)|Equip the ultimate weapons and assume the role of Agent 47 with these dual Silverballers. Nothing is more deadly.|Female-Hands|L
B30A9D2F-4FE14ACA-A664C201-098B8B52|Win Big Tattoo (Female)|Everyone will want to fold when they see these hands on the table.|Female-Hands|L
B3190F14-96854A1A-A851FE68-A4B77083|July 4th - Sparkler - Female|Celebrate the Fourth of July with these commemorative sparklers. Exclusive to Acorn Meadows Park 4th of July.|Female-Hands|L
B32E88EC-63584C4D-8536CCE5-1D0B4D35|Hands_ninja_00_1 (1)|Hands_ninja_00_1|Female-Hands|L
B332944C-CFCA4DD8-B4FE8BA9-126DF170|Excalibur Of Purple Flame (Female)|One Of The Swords Known As Excalibur. Although Its Authenticity Is Not Certain, The Blade Shines A Beautiful Purple Color As Proof That It Is Excalibur. (From Semifinalist Fantasia 2) Attack , Defense -, Combo 3, Attribute Holy The Weapon Is Normally Worn On The Back.|Female-Hands|L
B35063E6-F1114103-9DB1970A-7535820B|Stubborn Grandfathers Staff (Female In Combat)|The Weapon Is In Her Hand For Combat During The Mini-game.|Female-Hands|L
B3659B61-25644472-9F3D8C02-B8873A9C|Blue Balls Prize 2|Blue Balls Prize 2|Female-Hands|L
B37C403A-082947D5-85F0FA84-00E56935|Infernal Revolver (Female)|Let loose your inner demons.|Female-Hands|L
B388D9CB-74FF4571-B0E56921-5528C0F0|Golden Rod (Flame Female)|A Fire-bearing Golden Rod Boasting Overwhelming Destructive Power. Attack Power + Vs. Oni Attack Power +|Female-Hands|L
B3CFEE96-EFCA447B-AE37D4D6-F4A48383|Playground Female Mesh Black Gloves|These will go great with a pair of fishnet stockings.|Female-Hands|L
B3E7B9FF-820E401A-8C47B64D-31088F3E|1940s Gal Gloves (Female)|Elbow long gloves with a corsage.|Female-Hands|L
B4045BE5-CF044558-838B7FC7-9EA4EB1F|Hands_ninja_00_1 (2)|Hands_ninja_00_1|Female-Hands|L
B445430B-F3924652-8898C327-F9CF6B04|AXE Anarchy Bag of Fireworks|Spark some Anarchy around Home with this AXE Bag of Fireworks|Female-Hands|L
B4601142-ABF341C9-A1EC3465-8B750B6E|PlayStation Vita halo|A reward received for signing up to Inside PS Vita.|Female-Hands|S
B4607C4A-FCE14C31-BAE8C072-74684138|Vuvuzela Red (Female)|This Is A Unique African Cheer Horn In The Shape Of A Long, Thin Trumpet.|Female-Hands|S
B46A1D79-7FC4456F-AF0B5F39-6CE0D2F4|Sparkling Diamond Ring (Female) Pink|Awarded for reaching level 37 in MiniBots in Serenity Plaza.|Female-Hands|L
B495996A-68ED42DC-B404C1FC-52995C94|National Flag - Greece (Women)|A hand held national flag. Who will you support? Exclusive to the Football Mania Acorn Meadows Park.|Female-Hands|L
B4A253CC-F6EB42AC-93B749A5-B61F5C49|Skeleton Foam Hand (Women)|What witchcraft is this? A hand made out of Foam?. Exclusive to Acorn Meadows Park Halloween.|Female-Hands|L
B4B00C77-C4EB4715-9EF528D1-83AD28BF|Lightning Costume Set Gloves|Gloves from the Lightning Costume Set from FINAL FANTASY XIII. 2009, 2010 SQUARE ENIX CO., LTD. All Rights Reserved. CHARACTER DESIGN TETSUYA NOMURA|Female-Hands|L
B4F86EBF-C84D4943-856D45F5-A97EB352|Dark Bronze Chunky Beaded Bracelet|Cuff-style bracelet made from three rows of chunky beads.|Female-Hands|L
B4F9D5ED-2884475A-9CCCF6A0-7F60D399|BLoons Air Gun|Arm yourself with this BLoon Air Gun to defend yourself.|Female-Hands|L
B5068679-A8D34FEC-A98D150A-B46A1065|White Short Gloves|Put on these white short gloves to make any daily look a special one.|Female-Hands|L
B50B23B9-ADDC4A40-8B123AF4-78BB9956|Mysterious Lantern (female)|This lantern is handy to carry to dark places.|Female-Hands|L
B52522FD-45BB47FF-81D1071F-57493231|Muginami Suit(Hands)|Muginamis Impersonation Suit Hands In The Anime Rinne No Lagrange. Lagrange Project|Female-Hands|L
B53CC900-DEE949A5-91F51A12-F7E35394|Kinchaku (Yellow)|The Kinchaku Included In Modern Yukata Set (White).|Female-Hands|L
B5615117-746143B6-903C1F83-DE11C67D|Dolphin Flippers (Aqua, Women)|Hands shaped like dolphin flippers. Tropicalness |Female-Hands|L
B57CBBB5-3A6B4127-8C48C9A9-E5C395A1|Tanabata Star Bracelet (Pink, Women)|A bracelet with a Tanabata star design. Magic Power |Female-Hands|L
B59569D1-15194380-8B73BEF5-ACFBBB7D|Alien Glove Red (Women)|Glove Which Resembles A Red Alien. For Female.|Female-Hands|L
B59708AB-9D114316-A405F789-FBF16BF8|Flaming Fists (Female)|You can find this gift at the Giftinator 9000 from Hellfire Games.|Female-Hands|L
B5BE5B3A-B925478F-9437FF37-13965EEA|Pink Heart Sparkler (Female)|A pink, heart shaped sparkler. Only available from Valentines Day Acorn Meadows Park.|Female-Hands|L
B5DBA432-D54E4895-AB266D26-89AC4050|Athelete Torch (female)|Keep the fire burning while you climb to the top of Mount Olympia.|Female-Hands|L
B60B93D1-2D244BA4-B27809D6-1C8A8FDD|Kigu Bunny Gloves (female)|Reinvent the Pyjama Party. Change your boring outfits and add a touch of colour to your nights. Fun and different the Kigurumis suits your personality. Are you daring, curious, agile or strong? No matter who you are. There is always a Kigurumis for you. Become the focus of attention in the most original way, engage your instincts and start your wildest parties.|Female-Hands|L
B6273EAD-786C4F16-B08CBFDB-A951DBE5|JTTW Sun Wukong - Staff (Female)|Become the Monkey King. This clothing item is taken from the Sun Wukong character set.|Female-Hands|L
B62B5D9B-1A464297-A8C645AF-BA7AA175|Wedding Gloves (White, Women)|Pure white gloves to gently cover a brides hands. Happiness |Female-Hands|L
B6668CD8-55AD4825-8B5C0376-1EDAAEED|Obsidian Elf Queen - Hands|The Queen of the Obsidian Elves is known for her power, knowledge and dark temper.|Female-Hands|L
B6901FE4-0BB34A12-B8EE0BAA-B5A8C74F|Hands_woodrod_00_1|Hands_woodrod_00_1|Female-Hands|L
B696EC2F-66B046E4-A301F6D7-4AE8BA19|Dragon Clan Female Ninja Gloves With Reverse Sword - Black|Dragon Clan Female Ninja Gloves With Reverse Sword - Black|Female-Hands|L
B6F0F6E4-C5A0437C-ACBA20A0-E6BC275E|Artists Palette (for Female)|Arty smarty.|Female-Hands|L
B726FB23-7A954034-833FEDDA-6BFD8DFB|Big Red Robot Hand (Women)|Big Mechanical Hand Red. For Female.|Female-Hands|L
B72F1EFC-69E04C8F-809D2A86-58A25253|Japanese Hagoita for New Year 2011 - Type A (Women)|A Japanese hagoita to celebrate the coming of the new year 2011. The number 2 of 2011 is printed on it.|Female-Hands|L
B74C8A8B-873F40C6-BFC22453-20FA7AFD|Anime Futuristic Lab Gloves Female|Science by day, svelte evening wear by night.|Female-Hands|L
B79662E9-55114D85-AE8F3146-ADE9A415|Golden Laser Claw Hands (Women)|Ready yourself for battle with these laser claw hands. Batteries not included. This item is part of the Limited Edition 3D Printer Anniversary Collection.|Female-Hands|L
B79DBE04-44374F9A-A5761B76-10510A7C|Egyptian Goddess Gauntlet Aqua Blue Glow|Enjoy this Egyptian themed attire worthy of a goddess. This special version includes aqua blue glowing elements.|Female-Hands|L
B79F79BD-8AEF4936-A68CE608-A31A9E3E|Halbert Buttons Halbert Buttons Female Hands|Granzella Inc.|Female-Hands|L
B7A5C00D-9B034951-AF712D51-446A3D55|Shuriken Gauntlet (Female)|Quality Replica Based Off Of Gauntlet That Shoots Out Shuriken. Unfortunately, Does Not Shoot Shuriken.|Female-Hands|L
B7BC4E81-681B4E30-9BDBFBB9-E0DA2D09|Kigu Panda Gloves|Reinvent the Pajama Party. Change your boring outfits and add a touch of color to your nights. Fun and different the Kigurumis suits your personality. Are you daring, curious, agile or strong? No matter who you are. There is always a Kigurumis for you. Become the focus of attention in the most original way, engage your instincts and start your wildest parties.|Female-Hands|L
B7C07410-EE07402D-BCF127B4-27BF593B|Sodium Hex Bangle (for Female)|Despite the fact that youre flying around a barren desert landscape, you should always dress to impress.|Female-Hands|L
B7C25DE1-350E416E-B5FF4215-03E5341E|Bangle Of Wind And Earth People (Silver & Brown Female)|Bangle Worn By Wind And Earth People. Wind And Earth Degree |Female-Hands|L
B813F308-6DB445EA-9DFE32DB-FD8D539B|Hands_woodrod_00_1 (0)|Hands_woodrod_00_1|Female-Hands|L
B821BA31-678644CC-BE89CA3F-229C348E|Konami Code Gloves And Tattoo|Show off your love of the Konami code with these tattoos. What effect will these tattoos have in here?|Female-Hands|L
B8284045-F1784963-AA2B8AC1-3817BFCA|Nameless Sword, Sheathed (Women)|A sword by an unknown swordsmith. It cuts reasonably well. (sheathed) Attacking Strength +|Female-Hands|L
B86432D5-0C394EDA-94BEB9ED-AE41D046|Deck of Cards (Female)|For when the power goes out.|Female-Hands|L
B8A75F2C-86D147F1-B8837D7D-0FCD611A|Dolphin Flippers (Pink, Women)|Hands shaped like dolphin flippers. Tropicalness |Female-Hands|L
B8B7E56D-AD9343AF-B80F3ED6-CA43A21F|Bigfoot Prize 8 (female)|Bigfoot Prize 8|Female-Hands|L
B8EFF627-B09643C6-9FEABB8F-EAEFA3DC|Shark Fins (Blue, Women)|Hands shaped like shark fins. Tropicalness |Female-Hands|L
B8FA65D3-D2FC4D77-BC31FF11-FDD02129|Ivory Island Warrior Forearm and Calf Tattoos|Strong designs with an indigenous style. Bring out your inner tribal warrior. Note Not all Torso or Leg items are created equal. When purchasing this Tattoo accessory item it may not work well on all clothing items. Please feel free to pick up our complimentary Bare Canvas torso item for male female to properly display your new ink.|Female-Hands|L
B8FB4D7E-294A4E53-AFFA4E92-CA3A8CC5|Toy Bow And Arrow (female)|Toy Bow And Arrow With Heart-shaped Arrowhead In Hand. Justice |Female-Hands|P
B901D4E9-89754139-9A201030-3EA9B57C|Gloves Of Unidentified Sentai Youman (Youma Red Female)|Gloves Of Unidentified Sentai Youman. Heroism |Female-Hands|L
B9161E0B-AD1948E4-A3228756-910AAE7C|Powerfist (Female)|If they cant pronounce melee, give them a practical example.|Female-Hands|L
B91C0CC1-50C64C60-B3086866-FF378503|Tribal Gloves (Female)|These give you more versatility.|Female-Hands|L
B9388357-9D224284-8C9F39A8-DE2D0825|Drop Science Bling Bracelets - Butter|Represent in the latest street styles from Drop Science.|Female-Hands|L
B93DD344-6B7C41A8-8592FAAF-CEB54B2D|Shanti Bracelet|The spiffy Shanti Bracelet adds the perfect accent to your outfit.|Female-Hands|L
B93FF509-CCC84E4F-8EA63174-E61667F3|Uproar - Swyfts Force Gloves (for Female)|Represent your chosen Uproar gang by wearing this clothing item in-game and around PlayStation Home.|Female-Hands|L
B9543E22-FAB445E6-A622225B-0A8EB84A|The Family Violin|With this collection you will show you mean business, the family business. Ladies can be super sassy and sexy while the gents can be dapper and dashing.|Female-Hands|L
B95A705C-1F0B4430-B0676747-5BA40443|Lanka Lee Wristband (Women)|This Wristband With Lanka Face Patch Will Make Your Macross Super Live More Exciting. 2007 VicWest Macross F Production Committee MBS|Female-Hands|L
B96862BF-78BC42F1-B3E6E500-567297FB|Gloves With Fish Of Brown Cat (for Female)|Female Hands Cat ToraC|Female-Hands|L
B9A70C52-908A487E-A7C52C21-6C400301|Emerald Star Celtic Ring|Celebrate in style with this authentically Irish garment.|Female-Hands|L
B9B79F92-7EFC4260-97CC8451-40A8FED0|Wedding Bouquet of Red Roses (Women)|A bouquet of red and pink roses to be hold by hand.|Female-Hands|L
B9BEF0BC-50304996-B38B90BE-D2A8B730|Fallen Sword Shield (Female In Combat)|The Weapon Is In Her Hands For Combat During The Mini-game.|Female-Hands|L
B9DD3152-EBA1489A-87DE33D5-8976EE25|Halbert Weathercock Beating Swords Women|Halbert Weathercock Beating Swords Women|Female-Hands|L
BA0B1632-EAFA4220-996A64C9-C49579D5|Gaandiva(Female)|Female Hands HighestBow|Female-Hands|P
BA0E37E7-E1B040F4-9A88B89A-78180DA6|Shark Fins (Pink, Women)|Hands shaped like shark fins. Tropicalness |Female-Hands|L
BA198118-3A58459F-8DF939AE-2825636A|Sushi Fold For Souvenir (Female)|Sushi Fold For Souvenir In Hand.|Female-Hands|L
BA538768-4B7745A3-A22346E2-0057F378|Shell Pink Flower Ring and Bracelet (For Female)|A ring and bracelet made of cute and girlish flowers. The ring goes on the right hand, and the bracelet on the left. The shell pink color is very gentle and graceful.|Female-Hands|L
BA6EBDE1-61BF4E9A-8DFD2CE7-DCACCD2D|Rust Remover (Women)|High-powered Spray Which Can Remove Rust. For Female.|Female-Hands|L
BA7543D9-0EA04A56-812E2471-E98C9DFB|Peacock Tail|Peacock tail|Female-Hands|L
BA81CD6B-05284B79-9A4CDBDC-3D9A5977|B Movie Madness - Zombie - Hands - Women|Join the B Movie Madness with this Zombie costume.|Female-Hands|L
BAA23F70-1E304101-B6A104E4-0CD7D6D9|Aquamarine Aura - March (Female)|Show your birth month pride with this birthstone Aura.|Female-Hands|L
BAB25AF0-055A47C2-BD2FF477-FC8E81F0|Magic Sparkles - Bracelet (female, turquoise)|Add a touch of magic wherever you go. By Dani.|Female-Hands|L
BAC27B58-02564C5A-82950E9F-A1F5DF44|National Flag - Switzerland (Women)|A hand held national flag. Who will you support? Exclusive to the Football Mania Acorn Meadows Park.|Female-Hands|L
BAD6E997-ED344EE8-B55D112A-75CB511A|009 RE CYBORG Muffler(female)|Muffler From The Theatrical Anime 009 RE CYBORG Released On October 27, 2012. 2012 009 RE CYBORG Production Committee This Item Is An Avatar Item To Be Worn On The hands.|Female-Hands|L
BAE3073A-59A7421F-9BC223C0-4500D99A|TEKKEN 6 - Dumbbell (Women)||Female-Hands|L
BB2D762B-551F4B98-9BE00806-AE93FD0F|Goldenglove|Goldenglove|Female-Hands|L
BB3C87E3-868F43F2-BC12A27A-EBFF9D2F|Diamond Cell Phone (Female, Right Hand)|Almost everyone has a cell phone these days, but not everyone has diamonds on their cell phone. Lucky you.|Female-Hands|L
BB743D98-8D9F4C10-B3552BC1-9FCB91F9|Beam Swordsman Sword Lv2 (Red) When Drawn (Female)|Beam Swordsman Sword Lv2 (Red) When Drawn (Female)|Female-Hands|L
BB77962A-984E4A31-8F180C3B-E2AC7119|Ice Tiger - Medium Assault Gloves|Medium armour offers good protection and moderate weight penalties.|Female-Hands|L
BB7851A5-5CAA4BDB-A8AFC2CF-F19CA00C|Water Wand (Female)|Wonderful Wand That Attacks Enemies With Water Magic. (From Semi-Finalist Fantasia) Attack , Defense -, Combo 2, Attribute Water, Magic Water Bomb The Weapon Is Worn On The Hands During Combat Events. The Weapon Is Worn On The Hand During Combat Events, And On The Back During Normal Times.|Female-Hands|L
BB7ECF3A-63AB4773-97B0BCBB-CBFF9AD4|Sword Of Vindictiveness And Shield Of Vindictiveness (Female In Combat)|These Are The Weapons For Combat In The Mini-game In Her Hands.|Female-Hands|L
BB8CE98D-5569401E-89513019-EACC76EA|Kigu Cat Gloves|Reinvent the Pajama Party. Change your boring outfits and add a touch of color to your nights. Fun and different the Kigurumis suits your personality. Are you daring, curious, agile or strong? No matter who you are. There is always a Kigurumis for you. Become the focus of attention in the most original way, engage your instincts and start your wildest parties.|Female-Hands|L
BBA5DBC5-6D7C4E57-B3DA165B-BB7C38B0|Human Tech-Bot 1.0 Hands (Female)|A pair of robot hands.|Female-Hands|L
BBD490BB-85DB4E09-A5311071-219B81AB|Red Captains Band Female|An arm band worn by a teams captain.|Female-Hands|L
BBE0705B-EF724F90-9A08861B-5D05F038|Scarlet Border Scarf & Mittens|Warm Border Scarf And Mittens Given To Me At The 2012 White Day Event.|Female-Hands|L
BC15C4B6-ACDD49D3-95FF5552-F2E7D445|Liberty Hand item (Women)|Carry the flame and tablet of lady liberty. Only available from Acorn Meadows Park - 4th July.|Female-Hands|L
BC205BD9-B0ED40E2-B0DE61E9-CBAC8BC2|Large Paper Fan-Miyabi Fireworks (Female)|Yee-haw. Illuminated Paper Fan. It Makes You Feel The Summer Night Sky.|Female-Hands|L
BC22E0B9-8C284045-86227509-2AAB11A2|Hei Zi Shou Rin Ken (Female)|Female Hands Sword Rinken|Female-Hands|S
BC3D492D-2B804F8A-AFB947F7-B423816D|B Movie Madness - Werewolf - Hands - Women|Join the B Movie Madness with this Werewolf costume.|Female-Hands|L
BC402882-A9914A94-ACFEC114-3565F82C|Black Cat Gloves With Fish (for Women)|Female Hands Cat ToraB|Female-Hands|L
BC451AFB-2F074367-ACD3A12A-7ED39AC4|Valentine s Animated Gloves (black, women)|Spread some love with these special Valentine s gloves. Cute little animated hearts that will charm your beloved.|Female-Hands|L
BC9D4FE9-963E4AC2-BB93FDE7-28FBA858|Thiefs Dagger|Good for cutting the noblemens coin purses from their belts.|Female-Hands|L
BCB117F4-EBE44057-A203711F-C58C3D38|Commanders Dress Uniform Gloves|This is a piece of the Novus Prime Commanders Dress Uniform Set. Suit up and command respect from your subordinates at any event or occasion. Earn all five pieces by achieving higher levels in Novus Prime.|Female-Hands|L
BCFF1374-F69C41EF-A862E0C1-19EF0B1A|Tennis Racket and Ball (White, Female)|Tennis racket and ball used by tennis players. Cuteness |Female-Hands|P
BD18F94F-767942BA-9439996C-030C5075|Soft Ox Leather Gloves (for Female)|Accessorize fantasy style.|Female-Hands|L
BD1AFCAC-D08F408E-B6CEC387-8AB972BE|The Card Queen Flower|Your powerful sceptre.|Female-Hands|L
BD1C1EED-93E244F1-81EB6FB3-CB35F090|Uncharted 3 Drakes Deception G-MAL Assault Rifle (Female)|Youre just all about the money, arent you? Good work.|Female-Hands|L
BD1CBD20-D4C64FB6-B269EBF6-DCAF8B05|Green Glow Sticks with Bracelets (Women)|Forget the grim and dingy, celebrate this Halloween with bright colours and dancing. Exclusive to Acorn Meadows Park Halloween.|Female-Hands|L
BDB41AB8-64FD4AC8-AC84878D-AFB1EF46|Twin Flame Sword (Female)|Twin Swords Imbued With The Power Of Water.|Female-Hands|L
BDD3960C-C5E040D8-9C4827C8-EF8A93B4|Christmas Flower Ring (for Women)|This Ring Has A Christmas Color Flower Motif. The Ring Is On The Right Hand And The Bracelet Is On The Left Hand. Why Dont You Start The Christmas Feeling From Your Hand First? Wearing It, You Will Have The Following Effects With A Chatting Farm. Christmas Flower Ring (for Women)...The Effect Is To Slightly Increase The Duration Of Sunshine For Everyone.|Female-Hands|L
BDDA5101-419D4273-ACFE45A8-533E218F|Party Arrows (Female)|Someones been using you for target practice.|Female-Hands|S
