id|name|desc|category|thumbnail
3B5D2016-70F7408F-8E1F81CD-9875C6D0|Dwarf Shoes (Female)|Dwarf Shoes (Female)|Female-Feet|S
3B80184B-B39D4C3D-91748AB3-AAB4BA0E|Gogo Cowgirl Boots - Purple|Get on the dance floor and show off your moves in these hot clothes.|Female-Feet|L
3B8396F4-976E42BA-B09AA480-67BB6101|Loafers with Smashed Heels (Black, Women)|Black loafers whose heels have been crushed on purpose. Defensive Strength Youth Level Sense of Justice |Female-Feet|S
3BA1CE7C-AEB44795-BBE4C981-19275926|Drey Ultra Wedge Heels - Ocean|An ideal gift for any occasion.|Female-Feet|L
3BAB5741-B69E4EF0-BC31C372-4B406989|Backstrap Mules (Blue purple, Women)|Mules strapped on by the ankle. Defensive Strength Cuteness |Female-Feet|L
3BB67BA6-49C84B74-B5921FA9-560B6BDD|Twingate Leather and Lace Thigh Boots (for her) - White|Every story has two sides, every day has its night and every soul has its dark side. What would happen if these two sides were ever parted, if magic entered the roots of your soul and divided it into two? The curse hung in the air filling every corner of the castle. The splitting of a soul in two, one side to hold all that was good, great and beautiful, the other half to be filled with the darkness of evil, bitterness and hatred. Here everything is light, the feeling of hope and happiness is palpable. But this is Twingate Castle...|Female-Feet|L
3BD6398C-BE9E40F4-A5E427D0-4FCF63F3|Animanga 3D Schoolgirl Shoes|Schoolgirl Shoes from Engine Giant Entertainments Animanga 3D comic Anti-Bully. {Color Default}|Female-Feet|L
3BE9AA31-093F476B-AB124C71-B3099001|J-Metal Leather Buckle Boots - Vivid Violet|Move over J-Pop, theres a new musical behemoth in town. Dress like your favourite J-Metal star thanks to Anime.|Female-Feet|L
3BF7F15F-D46F420B-829BDFD9-88683473|Pin Heels and Stockings (Red and Black, Women)|Red pin heels with heels that are thinly pointed, and black stockings. Defensive Strength Sexiness |Female-Feet|L
3BFFA948-EE624DF6-8ECA04A8-A97C7E87|Loafers with Smashed Heels (Camel, Women)|Camel-coloured loafers whose heels have been crushed on purpose. Defensive Strength Youth Level Sense of Justice |Female-Feet|L
3C1ACE99-D6024ABA-8D9510E0-DC324802|Secrets Lilith Boots - Black|Fiendish fun from Secrets this Halloween. Dress seductively as a vampire, witch, cat, or devil.|Female-Feet|L
3C23A394-04D3401A-A10A7E4D-06C5393D|nFashion Cross Strap Sandals (White)|Sensible yet stylish, these sandals will match any kind of outfit or event. These shoes look fantastic when worn with LMO High Heels, transforming them into a pair of chic cross strap high heels.|Female-Feet|L
3C74E798-CA044BCC-9A77AF12-7081D880|A Touch of Spring Sandals (black)|Get a touch of Spring with these floral print sandals. Design by Dani|Female-Feet|L
3CBE9806-B1DC403D-93CA86AD-E0C3AEF9|Neon Blue High-Tops (Female)|High-Top shoes.|Female-Feet|L
3CC5735B-608A4CD6-AC263D2B-85665ACC|Fleeing Samurais Leg Armour (Black, Women)|A set of black armoured boots with cracks and said to be worn by a fleeing samurai. Attacking Strength Defensive Strength +|Female-Feet|L
3CE437A7-65A44516-A0B5B1E6-193CB858|Seductive Witchs High Heels (White, Women)|High-heels with pointy toes. Defensive Strength Magic Power Sexiness |Female-Feet|L
3D5EB002-2791492E-BE82DD69-B6ED883D|Bartender Shoes (Black, Women)|Dress shoes worn by bartenders. Defensive Strength Bartender Skill |Female-Feet|L
3D616536-695448D6-A70CF8FF-A9F60A74|Wind and Earth Boots (Ochre, Women)|Boots worn by the people of the Wind and Earth. Defensive Strength Wind and Earth Level |Female-Feet|L
3D670654-672A4186-B9C6293D-DEEFD0DD|Midas Reactive Defense Shoes (Female)|These are the shoes for the Midas Reactive Defense System. Co-developed by Obsidian and Earth Fleet scientists, the Midas Reactive Defense System utilizes the core components from Obsidian armor, forming a metallic substance that is soft and pliable at room temperature. The final compound binds directly to a human pilots skin, instantly absorbing most energy-based attacks when a gentle charge of Nebulon energy is applied. This item passively absorbs Nebulon, effectively increasing your Novus Prime base Nebulon gains by about 5%.|Female-Feet|L
3D76854E-12EF44F4-BF706270-F71A1C34|Gladiator Sandals (Aqua, Women)|Sandals designed with many thin leather bands covering the feet. Defensive Strength Cuteness |Female-Feet|L
3DCB6397-AB2E4007-A597408D-7CF7FCC5|Wedge Heel Boots - Tiger|Comfortable, fashionable footwear.|Female-Feet|L
3DD1DB21-1A2B42B7-ADE4DAC6-39057291|Beach Sandals (Orange, Women)|Stay cool with these orange beach sandals. Defensive Strength Tropicalness |Female-Feet|L
3DD2B481-DDAA49CA-8BA3845D-77BE7F57|Feminine Pirate Boots|Plush leather with steel toes. Functional yet fabulous.|Female-Feet|L
3DEAF169-67A74E09-857726F2-8D31F2DF|Bomber Girl Boots|The original orange Bomber Girl boots.|Female-Feet|L
3E5EED12-8C004EFF-8DB313C7-F3650FFD|High heels (black, female)|Smart black high heels. Defense Coolness |Female-Feet|P
3E995760-404B491B-97F0D738-A4491930|Witch Boots (Black, Women)|Witch boots perfect for a Halloween costume. Defensive Strength Magic Power |Female-Feet|L
3EA0D17D-73AF4D55-980C82CA-E21AD27D|Cat-style High Heels (White, Women)|Costume high heels with a cat motif. Defensive Strength Sexiness |Female-Feet|L
3EAC929F-10A44FD5-A81385D4-839230A8|Classic Stiletto Heels - Silver Snakeskin (for Female)|There is no such thing as Too Many Shoes.|Female-Feet|L
3EB36A68-21794818-96AF15B1-66E7F35B|Bridesmaids Low Heel Shoe|From our formal wedding footwear collection.|Female-Feet|S
3EB9FBA5-3E074CD3-B72A3CD7-5A76C30B|True Love Heels - Black|Tell a modern day love story.|Female-Feet|L
3EBA2AA4-C7934BA2-904B6948-ACF514CA|Wedge Heel Boots - Tan|Wearable, lightweight leather boots.|Female-Feet|L
3EC27B08-0D9C4E3D-AC285A1B-63C12309|Paintball Shoes - Green Splattered (for Female)|If they didnt run fast enough, send them this. Created by Double Time Play to Win, Play Double Time.|Female-Feet|L
3ED3EB6D-725A4E7E-9093FB50-FEE7348F|Ninja-Snow Ninja Shoes (Female)|Ninja Shoes For Slightly Advanced Ninjas. Shined Every Day Until White.|Female-Feet|L
3EFCE3BA-A65C4D8C-B1736195-3B5E91E1|High Heel Sneakers Pink|Be sporty and elegant at the same time, with these pink high heel sneakers.|Female-Feet|S
3F1351AA-2EB84EA8-97F0CAA7-4E623C45|Venetian Boots White (for Women)|Female Feet Venetian05|Female-Feet|L
3F283079-BE7C4C2F-B14995D5-6CDAAEE3|Multi-strap Mules (Red, Women)|Cool-looking mules worn over bare feet. Defensive Strength Cuteness |Female-Feet|L
3F2F2AA2-19864B25-906D520D-0A790CC6|White biker boots for women|Those timeless classics will fit any casual look.|Female-Feet|L
3F379DBC-F0ED4AF1-B71338BC-8356A945|Strapped High Heel Pumps and Tights (White, Women)|Thick-soled pumps in Gothic Lolita fashion. Defensive Strength Cuteness |Female-Feet|L
3F48A516-5E0C4482-9E81EC95-D2C28B72|Ethnic Boots - Red (For Female)|The length of these red ethnic-style boots is perfect for a skirt, and the purple flower corsages add a cute touch to the feet.|Female-Feet|L
3F4B28F5-A9654B67-A2DF7CD2-3F1D7F4D|Nekomata Feet (Black, Women)|Hairy feet with sharp claws. Defensive Strength Mononoke Level |Female-Feet|L
3F6DA035-89C94ECA-9D6B0498-DABE8106|Frilly Tights and High Heels (Leopard Print, Women)|Leopard print, frilly tights with high heels. Defensive Strength Sexiness |Female-Feet|L
3F75687D-D8B44208-81680436-846B96C6|Shredded. - Black Military Boots (women)|Heavy duty military styled boots.|Female-Feet|L
3F7968E4-DD974DD8-8FF61AD3-D2DEE89D|Futuristic R.E.B.E.L. Boots (Female)|Leather boots.|Female-Feet|L
3F7C7D40-7CCA4E36-B472D989-41CF5D6F|Slippers (Flower Pattern on Pink, Women)|Slippers worn in the bedroom. Defensive Strength Sleepiness |Female-Feet|L
3F94DF54-93E546DD-A77C89A0-85004D09|Fleeing Samurais Leg Armour (Red, Women)|A set of red armoured boots with cracks and said to be worn by a fleeing samurai. Attacking Strength Defensive Strength +|Female-Feet|L
3FA7CA6F-3C0348D3-99D64949-C0024DE1|Rave High Heels|Long live the party. Rave Party is the ideal collection for all those who love to go out to have fun and dance. Dare to combine different designs and create your own style.|Female-Feet|L
3FB220E8-953F40CC-B6685FAA-BB606C1A|Dokuganryu No Gusoku (red Female)|Red Gusoku Said To Have Been Worn By Dokuganryu Masamune. Attack + Defense Chic |Female-Feet|L
3FD2CCB8-EE6144C8-8B9A914B-D3FF20C3|White Japanese Sandals (Women)|A pair of white Japanese sandals with a pair of white socks.|Female-Feet|S
3FD31975-15314572-A5CDDEE9-98348A94|White Heels (Female)|White heels with straps.|Female-Feet|L
3FD90409-42784B5C-B4CDCB3B-B722FA4E|Slippers (Yellow, Women)|Slippers worn in the bedroom. Defensive Strength Sleepiness |Female-Feet|P
3FDA56FA-620E46F1-8C361301-2744EAF0|Slippers (Black, Women)|Slippers worn in the bedroom. Defensive Strength Sleepiness |Female-Feet|L
3FEF6911-986447B1-96A47EF5-87DD5266|Animated Halloween Bat Shoes|Animated Halloween Fancy Dress Costume|Female-Feet|L
3FFEA00E-51014E0E-9AE62B00-CEB4005B|Sodium Neon Stomper Boots - Bees Knees (for Female)|Invited to a rave in the baking hot Sodium desert? Weve got it covered.|Female-Feet|L
40084F45-13D04AD3-B5BC6FDF-0E7C3453|Slippers (Pale Blue Stripe, Women)|Slippers worn in the bedroom. Defensive Strength Sleepiness |Female-Feet|L
40562116-DF334DB9-9453CCC9-6C86B757|Yellow Babydoll Stilettos with Black Satin Details and a Black Bow|Cute stilettos with lace and bow details - available in lots of colors to mix and match with any outfit.|Female-Feet|L
4058C941-632E4E38-984339C1-6B4B0C11|Fleeing Samurais Leg Armour (Silver, Women)|A set of silver armoured boots with cracks and said to be worn by a fleeing samurai. Attacking Strength Defensive Strength +|Female-Feet|L
406C23EB-335D4B19-AEB3A0D1-E994CF5B|Wind and Earth Boots (Black, Women)|Boots worn by the people of the Wind and Earth. Defensive Strength Wind and Earth Level |Female-Feet|L
408D9516-AA8D4E47-809AA43A-CCCC0E0F|Mandarin High Heels (Red with Gold Thread, Women)|Red high heels, embroidered with gold flowers and butterflies. Defensive Strength Sexiness |Female-Feet|L
40AC9CB4-AE3C4148-974AD307-833576FD|Sweetheart Shoes|Heart detailed, candy pink shoes.|Female-Feet|L
40B40898-F1B845D9-8F803609-69187BD2|Slippers (Red Checked, Women)|Slippers worn in the bedroom. Defensive Strength Sleepiness |Female-Feet|L
40D55A03-692544ED-BC0632D1-D9A7B3CD|Glitter Jelly Heels - White|Give a girl the right shoes, and she can conquer the world - Marilyn Monroe.|Female-Feet|L
40D71C55-E7424C72-9E37261E-A2543C60|Outdoor Running Shoes|Tear through the trails.|Female-Feet|S
4109A894-C4504991-B736DDA1-B79A6BC1|Fuzzy Boots (Female)|These fuzzy boots will be on the lips of every fashionista on the scene. Yetis look out because hairy legs are back in style.|Female-Feet|L
412CCF30-79634E32-81FF784A-51071CDB|Silver Anklets (Women)|Subdued silver bracelets worn on the left ankle.|Female-Feet|L
4181C422-5CE34FF0-B9B78C63-272C3054|Stiletto Boots - Brown (for Female)|Over-the-knee leather stiletto heel boots. Need we say more?|Female-Feet|L
41A185CB-817B4E43-844564E0-2A6B3409|Gladiator Sandals (Yellow, Women)|Sandals designed with many thin leather bands covering the feet. Defensive Strength Cuteness |Female-Feet|L
41A330E3-7B324965-8BD401A6-38CCEC00|Monotone Anklet Heels and Tights (Black, Women)|High heels with an elegant hue, giving off an air of nobility. This style sports black tights. Defensive Strength Gorgeousness |Female-Feet|L
41A73729-756E4053-991D737E-2CD0B213|Thorned Boots (Black, Women)|Boots adorned with massive thorns Attacking Strength + Defensive Strength + Cling Resist |Female-Feet|L
41C30166-6DC94913-AE36C3CA-1E4DAE1F|Metallic Peeptoe Heels - Azure|Give a girl the right shoes, and she can conquer the world - Marilyn Monroe.|Female-Feet|L
41C3E426-76874A25-B06DB467-FC26B948|Stilettos with Leg Warmers - Red Glitter (for Female)|Get that 80s pop star look with this heels and leg warmer combo.|Female-Feet|L
41C3E9EA-DE504A2D-BE274D23-6A917E2A|Shooter Survivor Suit (Boots)|Boots from the PixelJunk Shooter Survivor Suit.|Female-Feet|L
41E914DF-8285451D-AD044D29-34F0A523|Heel Boots (Dark Brown, Women)|Dark brown boots with heels that show off beautiful legs. Defensive Strength Cuteness |Female-Feet|L
41E99902-FCC7466F-BCD75D42-F40A9044|Bear Slippers (Pink, Women)|Slippers in the form of a cute bear. Defensive Strength Cuteness |Female-Feet|L
41F7F88E-708F435D-846ED4BF-07CE8F87|Maru Geta (Pink Flower Straps, Women)|Comfortable Maru Geta with pink straps with white flowers. Defensive Strength |Female-Feet|L
42289C44-C3DF40FC-A6BDB6FA-4CFA462B|Bear Slippers (Yellow, Women)|Slippers in the form of a cute bear. Defensive Strength Cuteness |Female-Feet|L
425A35DA-A9BE40D7-83989826-76258E68|Maru Geta (Blue Checks Straps, Women)|Comfortable Maru Geta with blue straps with checks. Defensive Strength |Female-Feet|L
4269B9E0-6B8848C3-81E9DCB5-CC1CF6D1|Thorned Boots (Red, Women)|Boots adorned with massive thorns Attacking Strength + Defensive Strength + Cling Resist |Female-Feet|L
42719CC8-DDD0419B-9190016D-C8D8FA82|Dokuganryus Samurai Boots (Black, Female)|Black samurai boots said to be worn by Dokuganryu Masamune himself. Attacking Strength + Defensive Strength Stylishness |Female-Feet|L
428DDDF4-E88B48D8-AD52D27A-EA57B749|Heel Boots (Brown, Women)|Brown boots with heels that show off beautiful legs. Defensive Strength Cuteness |Female-Feet|L
4296F3BF-5D0A48D9-9EA5986D-8991D9FC|Thorned Boots (Silver, Women)|Boots adorned with massive thorns Attacking Strength + Defensive Strength + Cling Resist |Female-Feet|L
42B4CB68-D6954071-BB499C44-F4B5A0D4|Bear Slippers (Black, Women)|Slippers in the form of a cute bear. Defensive Strength Cuteness |Female-Feet|L
42C02DFD-0B7642F1-AB920ADC-FB92434F|Elf Feet|Elvin style never goes out of fashion.|Female-Feet|S
42D11B6A-D12D4634-A4A6410E-5A9EDFF9|Miss Hiss Flat Shoes|Be bold and proud and stand out from the crowd in our range of body paint effects. Get in touch with your inner artist and show off in unique style.... complete the look with the accessories and show your artistic flair, be Painted Bare.|Female-Feet|L
42DB6FA2-C9B548B7-BD9F4E1F-AF8BA61C|Celestial Shoes and Stockings (Red and Orange, Women)|High heels with sharp tips and star-patterned stockings. Defensive Strength Magic Power |Female-Feet|L
42DBB39F-7E784EAC-9141BD2A-724BBAF3|Little Purple Heels|A no nonsense profile with a wild color will keep them guessing.|Female-Feet|S
430CA4D8-211043AE-AF7C09DE-D6CAA939|Sheepskin Knee Boots - Fawn|Theres no such thing as too many pairs of boots.|Female-Feet|L
4313DCD5-77AE43BB-B76E2990-C919C0A0|Peace - Light Field Boots|Light weight armour with minimal weight penalties but offers low damage protection.|Female-Feet|L
43293613-84004DFB-951E9AA6-49FB3E1B|Engineer Boots (Women)|Female Farm Boots Eng|Female-Feet|L
4333693E-3DE44327-8BAD6CA2-BE328EAF|Bear Slippers (Light Blue, Women)|Slippers in the form of a cute bear. Defensive Strength Cuteness |Female-Feet|P
43660758-4EA94A2F-B30B60A5-AA15E787|Gunfighter Boots (White, Women)|Boots fitted at the ankle for an active lifestyle. Defensive Strength Sniping Ability - Stylishness |Female-Feet|L
436BB561-C4EF4B95-A6BB3846-12C35CB4|Miss Behave - Red and Black Knuckle Duster Shoes (without stockings)|With this collection you will show you mean business, the family business. Ladies can be super sassy and sexy while the gents can be dapper and dashing.|Female-Feet|L
4379ECFA-FD7E49D1-97B89E3E-A83BBB89|Ajagara Phoenix Guardian Sabaton Boots - Golden (for Female)|You have proven yourself a fierce warrior and have been chosen to become a Phoenix Guardian, protecting the creatures and kingdom of Ajagara. This fine armor will serve you well whether you battle on the plains, mountain side, or in the skies.|Female-Feet|L
43874E3B-9A3845DA-ACA77457-F9C87D3B|Beach Sandals (Pink, Women)|Stay cool with these pink beach sandals. Defensive Strength Tropicalness |Female-Feet|L
43955683-B182438A-A817CDA3-3AF23BED|Wedge Heel Boots - Gray|Perfect for the transition from Summer to Autumn - wearable, lightweight leather boots.|Female-Feet|L
4398F892-0B63473B-AF545B5C-87B56A9E|Spark Shoes|Spice it up with the Spark Shoes.|Female-Feet|S
43BCE510-809E4A06-9D6950AD-388C024A|Bear Slippers (Brown, Women)|Slippers in the form of a cute bear. Defensive Strength Cuteness |Female-Feet|L
43BDA86A-2BF546CA-A2BBFB81-DD120472|Soft Ox Leather Boots (for Female)|Take cobbled streets in your stride with these comfortable boots.|Female-Feet|L
43E1124F-BCD04DC0-8BB5E870-5D523B83|Maru Geta (Black Straps, Women)|Comfortable Maru Geta with black straps with yellow stars. Defensive Strength |Female-Feet|L
43F8961D-AE874B0B-B7823B50-69C93544|Noble High Heels (Pink, Women)|High heels with ribbons for a woman of nobility. Defensive Strength Gorgeousness |Female-Feet|L
43F9F6B9-03514350-ABBF0CE1-D674C32A|Dokuganryus Samurai Boots (Red, Female)|Red samurai boots said to be worn by Dokuganryu Masamune himself. Attacking Strength + Defensive Strength Stylishness |Female-Feet|L
441F7E5C-C1CB4818-9230EC6A-E534FE6A|Pandora Shoes|Be just like Pandora and wear these classic, classy colours - red, white and blue.|Female-Feet|L
441FB911-30314167-BEF9FFB5-A462DC8A|Drey Leather Platform Sandals - Gold|She has high fashion and big business on the brain.|Female-Feet|L
442A212C-E6D34541-A1489AC9-3E81E140|Double Time Hi-Tops - Red (for Female)|Double Time is back on track with a new range of sporty tracksuits. Ready, Set, Go.|Female-Feet|L
44332E2F-D9F54C3F-9FF20010-5792B68E|Casual Black Shoes|You enjoy wearing the latest fashion and youre able to mix and match any item and turn it into an original and unique outfit combination. You know how to have fun, live in the moment and most importantly how to dress for any occasion. Dont miss the moment, make the most of it.|Female-Feet|L
44365DB4-B0CE422C-952AFAA1-412D5539|Chunky Wedge Sandals - Candy Pop|Keep it fun and funky.|Female-Feet|L
444ED1A7-3A384B42-A31DE18F-936CFB60|Steampunk Anachropologist Boots - Tan|Whether youre into interplanetary time-travel, solving mysterious crimes, or exploring Victorian London youll look the part with Delirious Squids latest Steampunk offerings.|Female-Feet|L
446633B3-0E1144FE-90A6E36C-6DEF2D2D|Gogo Fur Boots - Blue|Get on the dance floor and show off your moves in these hot clothes.|Female-Feet|L
44753E2C-3170443C-921ED53E-380AE8DA|Mandarin High Heels (Blue with Silver Thread, Women)|Blue high heels, embroidered with silver flowers and butterflies. Defensive Strength Sexiness |Female-Feet|L
44A57EB3-887240C9-8CB5F29B-C7986980|Maru Geta (White Straps, Women)|Comfortable Maru Geta with white straps with purple flowers. Defensive Strength |Female-Feet|L
44A74CA3-810541BF-A34FCC79-101729A3|Sparkly Purple Shoes RaceOn. (Women)|Every pit stop beauty needs stunning stilettoes, these are sparkly purple.|Female-Feet|L
44AA244F-074144D6-B977041D-8B7A80AB|Vertical Belted Long Boots (Brown, Women)|Long boots with a belt attached vertically on the sides. Cuteness Defensive Strength |Female-Feet|L
44AEA2DD-531E45F7-8B21D226-68D059F7|Red Leather Shoes|You know you aren t like them, you follow another set of rules, your rules aren t from this world. Your world is a secret, a mystery for them. They can t see you, you embrace the night, you follow the Raven Culture.|Female-Feet|L
44B4BAAC-919D47D8-898F2896-6EB47D1D|Blue and Yellow Beach Shoes|Simple and versatile. Try these blue and yellow beach shoes.|Female-Feet|S
44D05E75-235C40BA-BE8D4C1E-A0FB2745|Patrol Pumps (Brown Female)|Patrol Pumps For Women, Protecting The Security Of The Town. Defense Justice |Female-Feet|L
44E68D0A-B6D143D9-96F81969-330B77F9|Ruffle Tights And High Heels (white Female)|White Ruffle Tights With High Heels. Defense Sexy |Female-Feet|L
44F58E33-88DF4040-BB9215F9-804B92AC|Tall Geta (Scarlet, Women)|Japanese wooden clogs with higher supports than normal geta. Defensive Strength Luckiness |Female-Feet|L
4510A25E-22354C59-ACB23091-C87404D8|Cheer Shoes and Loose Socks (Blue and White, Women)|Baggy socks and cheerleader shoes. Defensive Strength Cuteness |Female-Feet|L
452D521E-4B104DBA-8DE67C24-9656871A|Bear Slippers (Blue, Women)|Slippers in the form of a cute bear. Defensive Strength Cuteness |Female-Feet|L
452F4E0A-B8864867-8F650C94-110768DA|Noble High Heels (Yellow, Women)|High heels with ribbons for a woman of nobility. Defensive Strength Gorgeousness |Female-Feet|L
453DD2DD-3284404D-AA5963BE-8EA6E88F|Majorette Heels - Gold|Familiar festive fairy tale outfits for a unique holiday look.|Female-Feet|L
4553B60D-AAD64434-A3DB62CC-EF200429|Bunny Shoes (Red Female)|Red High Heels With Net Tights.|Female-Feet|S
455F79E1-5A2D4119-9DF5B4C6-3E21F9C6|Tennis Shoes (Pink, Women)|Shoes worn by tennis athletes. Defensive Strength Cuteness |Female-Feet|L
456C3654-C93C4463-85D27CD0-143A47F8|Dokuganryus Samurai Boots (Silver, Female)|Silver-coloured samurai boots said to be worn by Dokuganryu Masamune himself. Attacking Strength + Defensive Strength Stylishness |Female-Feet|L
4570AABB-04104752-9B6EF8B5-6D69D3EC|Cheer Boots (Blue, Women)|Boots for cheerleaders. Defensive Strength Sexiness |Female-Feet|L
45B60B1C-39D44B34-93711C03-CA118CC5|Bear Slippers (Red, Women)|Slippers in the form of a cute bear. Defensive Strength Cuteness |Female-Feet|L
45C05987-A66E4930-B949A9A4-2600C9F3|Female Hover Boots (Blue)|Female Hover Boots (Blue)|Female-Feet|L
45E20912-21334CF1-8D16F202-AE6233FF|Uproar - Swyfts Tan Boots (for Female)|Represent your chosen Uproar gang by wearing this clothing item in-game and around PlayStation Home.|Female-Feet|L
46007AD2-AB6146F2-B30DB5E3-E954A8F9|Brown Clunky Shoes|Get down with your funky self.|Female-Feet|S
463A20A0-5CCD44BB-A31C29CC-19024F5D|Gunfighter Boots (Blue, Women)|Boots fitted at the ankle for an active lifestyle. Defensive Strength Sniping Ability - Stylishness |Female-Feet|L
4663F43A-261F42FE-BBAC2FAB-B77D7B8F|Hands For Feet - Female|Need a hand? Now you can have a pair to spare. Replace your feet with an extra set of hands with this wacky item. Exclusive to the VEEMEE 3D Printer.|Female-Feet|L
46B84C81-07124CB3-9125E6DB-EC9320AE|Bunny Slippers (Pink, Women)|Slippers in the form of a cute rabbit. Defensive Strength Cuteness |Female-Feet|L
46C6AE76-C3C34DD7-B7712DA8-01D1F03A|Beach Sandals (Royal Blue, Women)|Stay cool with these royal blue beach sandals. Defensive Strength Tropicalness |Female-Feet|L
46CC725D-A13A49F4-9EBDB990-6A09EE97|Multi-strap mule (Red, Women)|A pair of cool mules which is worn without socks. Defensive Strength Cuteness |Female-Feet|S
46EBDBC0-35874396-B88E81F7-9EE26408|Tabi and setta (Black, Women)|Black tabi socks and setta sandals with black straps. Defensive Strength Stylishness |Female-Feet|S
46F48BF6-314F45C2-AB071F1E-7A3C8F07|Beach Sandals (Red, Women)|Stay cool with these red beach sandals. Defensive Strength Tropicalness |Female-Feet|L
46FCDC93-84AB4E85-BB1031D1-54686396|Bunny Slippers (Yellow, Women)|Slippers in the form of a cute rabbit. Defensive Strength Cuteness |Female-Feet|L
471407BA-128C43FA-87B55C88-D13AA469|Female Hover Boots (Red)|Female Hover Boots (Red)|Female-Feet|L
472129E9-05574CC4-92C16325-0CCE5A16|Flower Strap Sandals (Black Women)|Floral Decorated, Heeled Sandals. Defense Sexy |Female-Feet|P
472CBA26-1ED8438A-81323F26-7E29AF15|Tabi and setta (Black Navy Blue, Women)|Black tabi socks and setta sandals with navy blue straps. Defensive Strength Stylishness |Female-Feet|L
473E2B03-B9354F39-9E54635E-34CA7955|Female Hover Boots (green) For Game|Female-Feet|Female-Feet|L
474E2D94-400345F5-AE9B55D5-99F65146|Female Hover Boots (Pink)|Female Hover Boots (Pink) For Game|Female-Feet|L
476D8304-0F3C4CD0-8492FFFF-A10F6BD7|Airmax Trainers|Airmax Trainers|Female-Feet|L
477FEF1D-B81745A1-89505D66-BAF0940A|Heeled Boots (Black Female)|Black Boots With Heels That Show Off Your Legs. Defense Cuteness |Female-Feet|L
47833D4B-457147A7-84C991F5-B21F9BAD|Billabong - Too Good - Black|Brown strapped sandals.|Female-Feet|L
47C728B4-6CEA4627-B51E0C4B-AE46F594|Bunny Slippers (Black, Women)|Slippers in the form of a cute rabbit. Defensive Strength Cuteness |Female-Feet|L
47E36853-EAE5438B-9C9A5CED-F966A814|Female Hover Boots (Purple) For Game|Female-Feet|Female-Feet|L
480BBC70-6AA04621-92DD46A4-921D5720|Tabi and setta (Black Gray, Women)|Black tabi socks and setta sandals with grey straps. Defensive Strength Stylishness |Female-Feet|L
4819A9FB-48A14014-A26E9C43-1FB7F27B|Tall Geta (Pink, Women)|Japanese wooden clogs with higher supports than normal geta. Defensive Strength Luckiness |Female-Feet|L
4822239C-E3464A12-9A76F029-CCE1B6EA|Bunny Slippers (Light Blue, Women)|Slippers in the form of a cute rabbit. Defensive Strength Cuteness |Female-Feet|L
48240814-D8E74C3C-8D2CEB02-DD11F6B0|Bunny Slippers (White, Women)|Slippers in the form of a cute rabbit. Defensive Strength Cuteness |Female-Feet|L
48309C48-E9594A2F-B7EEE1B8-1DFF3F84|Roller Skate Shoes, Rocket Type (White, Women)|Shoes outfitted with Rocket Type Roller Skates. Defensive Strength |Female-Feet|L
4835EB95-C1CB4AC5-A80C9BFC-14A19D64|Ruffle Tights And High Heels (black Female)|Black Ruffle Tights With High Heels. Defense Sexy |Female-Feet|L
4855FC66-800F4AE1-8F20C249-7F54B43D|Mandarin High Heels (Black with Gold Thread, Women)|Black high heels, embroidered with gold flowers and butterflies. Defensive Strength Sexiness |Female-Feet|L
486178F8-2DB74DC0-BD5B4FFD-2FF985B3|Killzone 2 - Helghast Boots Female|Killzone 2 - Helghast Boots Female|Female-Feet|L
4891F675-5AE9479F-98D3A842-70893225|Playground Blue And White Leg Warmers With Ballet Shoes|The leg warmers double as arm sleeves when it s cold out.|Female-Feet|L
4899CDBA-6B5F46F2-896A6DD5-6833A90B|Brides Shoes - Black|Look ravishing and radiant on your big day without the need to pale into the background. Rock down the ailse in black.|Female-Feet|L
