id|name|desc|category|thumbnail
69AFDDD8-9D2A4F14-AF9D3C66-E6E1966E|Retro Star Earrings (Right Ear) - Viper|Relive the eighties, or experience them for the first time with some Retro fashion.|Female-Jewellery|L
6A17E637-CD924A4A-95457C8F-28F34FD3|Glow Spike Earring - Green (for Female Left Ear)|If you have trouble spotting your friends in dark places gift them these dayglow earrings and youll spot them a mile off.|Female-Jewellery|L
6A8AD4A4-E99044E8-B729D465-BF3C9FDB|Drop Pearl Earring, Left Ear (Women)|An earring for the left ear with a hanging pearl. Sexiness |Female-Jewellery|L
6AA3F548-9DCB4FC0-BCD871A5-D03AEF93|Sky Blue Beaded Flower Earrings, Right Ear (for Women)|Flower Earrings Made Of Sky Blue Beads, For Right Ear. The Simple Design Goes With A Variety Of Coordinates.|Female-Jewellery|L
6AEA2474-D19F4341-A3ABF174-841EFF35|Glow Hoop Earring - Pink (for Female Right Ear)|Pick a color, pick a style, or be avant garde and mix em up. How glow will you go?.|Female-Jewellery|L
6BDAF4FB-FBD1435B-91B69155-C08AD315|Rich Harvest Earring (Right Women)|Earring For The Right Ear Which Produces A Rich Harvest. For Female. By Equipping, The Number Of Items Which You Can Obtain At L-Project Of Peakvox Labs Increases.|Female-Jewellery|L
6BF1082B-09CC4782-AF78B0A7-F2D4601F|Sky Blue Beaded Flower Earrings, Left Ear (for Women)|Flower Earrings Made Of Sky Blue Beads, Left Ear. The Simple Design Goes With A Variety Of Coordinates.|Female-Jewellery|L
6D4E15F2-590D48B8-9BC1CB23-487F1A1E|Glow Spiral Earring - Green (for Female Left Ear)|If you have trouble spotting your friends in dark places gift them these dayglow earrings and youll spot them a mile off.|Female-Jewellery|L
6DD4FD5B-A45A4402-90D7DA45-4BE505AB|Delinquent Earring (Right Ear, White and Gold, Women)|A spiked delinquent earring. Coolness |Female-Jewellery|L
6DED796B-DF4A4293-8C7F45F1-131ED640|Star Earrings (right Ear Female)|Big Star Shaped Earrings. Halloween 2012 Limited Item Magic |Female-Jewellery|L
6E690BC3-8B7543DF-B9E86647-59EF963A|Glow Star Galaxy Earrings - Blue and Yellow (Right)|Glow Star Galaxy Earrings - Stars that Glow in the Dark|Female-Jewellery|L
6E75C214-92434189-BB49940A-24270418|Delinquent Earring (Left Ear, White and Gold, Women)|A spiked delinquent earring. Coolness |Female-Jewellery|L
6F616C89-ACBA417E-AD6BE25C-EB756861|Diamond Encrusted Earrings|Shine, in these glamorous diamond encrusted earrings.|Female-Jewellery|S
70760BBF-F9D64F1D-B23DF013-6A014B62|Love Right Earring|The Rockabilly line is inspired by the 1950s and is characterised by its vintage, casual and striking style. The leather, jeans and prints are the stars of this collection. It will be impossible not to triumph on the dance floor.|Female-Jewellery|L
70909A58-25554701-B8CC3826-DF5D4C91|Mermaids Tears (Earrings Female)|Earrings With Small Teardrop-shaped Crystals Made From Hardened Tears Shed By Mermaids (from Semi-finalist Fantasia) Female Jewellery|Female-Jewellery|L
71DFA5D3-E71740E6-899F251D-DA669326|Crystal Teardrop Earrings (Right)|Glamorous, fabulous, beauteous, yours.|Female-Jewellery|L
72066645-8F5548F7-B776C8F0-4813FF65|Treasure Earrings (emerald, Right Ear, Female)|A Type Of Green Pillar Stone, A Gemstone With An Intense Green Color. For The Right Ear. (Mohs Hardness 8)|Female-Jewellery|L
72237AF7-6FDD4BE2-91946B9C-47E3267B|Pink Tri-Flower Earring - Left Ear (For Female)|An earring for the left ear with three pink flowers. The charming and delicate design fits well with any look.|Female-Jewellery|L
726E3B75-5F3344D8-AE50375A-68A808C5|Neon Star Right Earring (Female)|Highlight your earlobes with this neon glowing earring.|Female-Jewellery|L
7274F3F3-83EB41DC-B15B3AD7-C24A613E|Fairytale Ms Muffets Bow Earring (Right Ear)|What you dont know is that after her scare, Ms Muffet went on to culinary fame as an artisan cheesemaker. Whos laughing now spider? Concept by PlayStation Home user Jennifer Whitbread.|Female-Jewellery|L
72CE452F-DD264410-A8E585E8-33EF8100|Punk Earrings (left Ear White And Gold Female)|Punk Earrings With Spikes. Coolness |Female-Jewellery|L
736F8DAD-EE8647A7-9BA4CDC2-E6E735E7|Golden Heart Earrings|Golden heart shaped earrings.|Female-Jewellery|L
73BFBD5C-44544060-86FC90EE-3A17870B|Animated Diamond Earring (Right)|Animated diamond earrings.|Female-Jewellery|L
745CF240-70E644BA-A03C5DE1-A900E3FD|Crystal Teardrop Earrings - Sapphire (Right)|Take sophistication to the max with these bejewelled beauties.|Female-Jewellery|L
74971DB9-D8D74FC5-8A87803F-EF56C5D2|Drop Science Earring (Right Ear) - Ghetto Ghost|Oversized earrings.|Female-Jewellery|L
74F2683F-E96C4B33-A0A5FDEC-8599C999|Glow Spiral Earring - Blue (for Female Left Ear)|If you have trouble spotting your friends in dark places gift them these dayglow earrings and youll spot them a mile off.|Female-Jewellery|L
765B14DF-686544F7-9417E7B0-36FDA94E|Brides Earring (Right Ear)|Lockwood Weddings - everything you need for your special day.|Female-Jewellery|L
7663605E-D8B84F3D-820D58E5-0D5DF4D0|Glow Star Galaxy Earrings - Pink and Green (Right)|Glow Star Galaxy Earrings - Stars that Glow in the Dark|Female-Jewellery|L
766E4382-E61047D3-938A2651-9329CC05|Glow Bunny Earring - Red (for Female Right Ear)|If you have trouble spotting your friends in dark places gift them these dayglow earrings and youll spot them a mile off.|Female-Jewellery|L
767CE77D-38904B35-9D784A23-C891C8C0|Glow Star Galaxy Earrings - Yellow and Black (Right)|Glow Star Galaxy Earrings - Stars that Glow in the Dark|Female-Jewellery|L
76CDD333-D08749A6-B5FA4F7B-39438331|Night Sky Lightning Bolt Earrings (Left)|Give your loved one that magical jolt of electricity.|Female-Jewellery|L
7708EB12-94724635-9D5A327C-EC2B33E7|Snorkel (Black, F)|A black tube that swimmers can breath through to be able to remain underwater for a long time. (Jewelry worn on the left ear)|Female-Jewellery|L
771F5794-18B74311-902A6C27-EA414917|Rich Harvest Earring (Left Women)|Earring For The Left Ear Which Produces A Rich Harvest. For Female. By Equipping, The Number Of Items Which You Can Obtain At L-Project Of Peakvox Labs Increases.|Female-Jewellery|L
78322699-B5B14086-8070FB1A-BC767076|DNA (White) Earring (Right Women)|DNA (White) earring for the right ear. For female.|Female-Jewellery|L
784ACCFD-770544F4-8A0CF24E-F6EA2B6C|White Animated Nebulon Earring - Right Ear (Female)|This glowing Nebulon Earring is the ultimate accessory to complete any true Novus Prime fans outfit.|Female-Jewellery|L
7910F7C9-EA7047AA-986284FC-7900B20F|Glow Spike Earring - Purple (for Female Left Ear)|Pick a color, pick a style, or be avant garde and mix em up. How glow will you go?.|Female-Jewellery|L
79904783-9FC54DEF-B270C2FC-B35D776D|Earrings RaceOn.|Fun and stylish, wear this checkered flag jewellery with pride.|Female-Jewellery|L
7A466750-10044A3A-85F23DDE-14703DB8|Jenny Black - Earrings (Left)|Welcome to the world of the secret agent, where espionage and double dealings are a way of life. Slip undercover oozing charm and sophistication with a deadly appeal, ruthlessly sexy and chillingly alluring. Feel the bonds of love pull tighter just be careful who you fall for.|Female-Jewellery|L
7A84EED1-2A8E4B49-AE6C70AE-9D492A6F|Glow Lion Earring (for Female Left Ear)|Limited Edition Lockwood item exclusive to E3 .|Female-Jewellery|L
7AEAE20D-8C7D4477-A37DF92E-C09854C9|Marginal Medal (Female)|Female JewelRightEar Medal SUComp|Female-Jewellery|L
7C09F39E-9CB64389-882BF0A6-ADCB2C69|Glow Hoop Earring - Yellow (for Female Right Ear)|If you have trouble spotting your friends in dark places gift them these dayglow earrings and youll spot them a mile off.|Female-Jewellery|L
7C8127F3-C3C04C7A-A6A1B96D-7E599A43|Glamourous Animated Hoops Earrings|Sparkling earrings- a girls best friend.|Female-Jewellery|L
7CAAF6B8-47864D6C-B1F8D7FD-93C5B305|C. Viper Earrings|Feel like C. Viper from Street Fighter IV with this set of luxurious earrings. Look good in and out of the ring. Street Fighter IV CAPCOM U.S.A., Inc.|Female-Jewellery|S
7D20EB9F-81944E41-BC73C65D-53ACFE35|They glow. Loco Earring L (Viole womens)|They glow. Loco Earring L (Viole womens)|Female-Jewellery|L
7D74D4F5-01E14791-BCCACB40-CBF24B8B|Glow Alien Earring - Blacklight (for Female Left Ear)|If you have trouble spotting your friends in dark places gift them these dayglow earrings and youll spot them a mile off.|Female-Jewellery|L
7D8E7983-6C5E45C1-98D0B8C0-EA8CBB1F|Glow Alien Earring - Blue (for Female Left Ear)|If you have trouble spotting your friends in dark places gift them these dayglow earrings and youll spot them a mile off.|Female-Jewellery|L
7DB00535-44D447E2-900547D8-71129479|They glow. Loco Earring L (Priffy womens)|They glow. Loco Earring L (Priffy womens)|Female-Jewellery|L
7E29670E-B28F40A6-9D1B82CB-64DF59BA|Asian Earrings (Right)|Asian Earrings Included In Summer Set 2010 (for Women). These Earrings Have A Beautiful Natural Look Of Natural Stones.|Female-Jewellery|L
7E58F336-0B464B3E-A4BCD94A-7107498E|Treasure Earring (Emerald, Right Ear, Women)|This gem is a type of beryl that is tinged with a striking green colour. For the right ear. (Mohs hardness 8)|Female-Jewellery|L
7E700BF0-D1E8468F-A1178CB8-D33468B4|Female - Dummy Object - Jewel Left Ear|JewelLeftEar_DummyObject|Female-Jewellery|L
7E987478-6B9B43B7-97FE7E27-8DF0950E|Drop Science Earring (Left Ear) - Home Girl|Oversized earrings.|Female-Jewellery|L
7FA8D625-6840421E-85D5C4A6-754468CE|Ethnic Beaded Flower Earrings, Left Ear (for Women)|Ethnic Style Beaded Flower Earrings For Left Ear. Perfect For Those Who Want To Enjoy Ethnic Style Fashion. Why Dont You Start With Your Ear First? Wear It With A Chattering Farm, And It Has The Following Effects. Ethnic Beaded Flower Earrings (for Women)...Have The Effect Of Correcting Avatar Conditions, Allowing You To Clear Planta Calls Such As Male Avatar Only And Female Avatar Only. (The Effect Is Only Activated When Worn On Both Ears.)|Female-Jewellery|L
7FC3C7AB-2CF64110-BAD22229-5B62FD31|Diamond and Pearl Drop Earring (Right Ear)|Diamonds (and pearls) are a girls best friend. Iridescent freshwater pearls suspended beneath delicate diamonds set in white gold.|Female-Jewellery|L
8108DDA3-260442E0-A5B4327C-80B8D367|Butterfly Earring (Right)|Butterfly earrings part of the Butterfly Girl costume.|Female-Jewellery|L
8209FE10-F877490C-BB0EFD55-2F655EDF|Silver Hoop Earring (Right)|These Ring Earrings Have A Lot Of Presence But Are Silver, So They Are Very Versatile.|Female-Jewellery|L
824C48FD-C3704BAB-A8AE64B1-9922A972|Treasure Earring (Emerald, Left Ear, Women)|This gem is a type of beryl that is tinged with a striking green colour. For the left ear. (Mohs hardness 8)|Female-Jewellery|L
828820CB-2E9D49A8-8919A80D-671389A6|Drey Tassel Earring (Right Ear) - Gold|Dreys beautifully crafted tassel earrings are an ideal accompaniment to any formal or casual outfit.|Female-Jewellery|L
82F09819-1E234F9A-8BEC96C0-0490BC1A|Female Pirate Earrings|These earrings are meant for the queen of the high seas.|Female-Jewellery|L
833919C7-D413498E-B1CBE3DD-7AC50757|Drop diamond earring, right (Women)|Right earring with a dangling diamond. Sexiness |Female-Jewellery|L
83E65805-6CA84216-955AAA82-5FFDF034|Shamrock Earrings|Be lucky with this Shamrock Earrings.|Female-Jewellery|L
83E777AA-07D24FB3-A40818A3-465875A0|Crest Of The Savior (female)|Female JewelLeftEar Medal DarkComp|Female-Jewellery|L
842E587A-614D4F41-BB1E694C-3142843A|Dolphin Earring (Left Ear, Female)|A tiered earring featuring a dolphin hanging from a heart Cuteness |Female-Jewellery|L
84AA77EA-4B8D492E-92710AD8-25EA2709|Jade Celtic Earring (Left Ear)|Cut jade inlaid in a Celtic design, complete with a pearl teardrop.|Female-Jewellery|L
84B413FD-9EFE4868-99AC55FA-89D9E4CD|Drey Midnight Black Feather Drop Earring (Left Ear)|Glam it up with these feather design earrings. A perfect match for every outfit this season.|Female-Jewellery|L
84DC526B-2E6E443D-A37E5251-D73524E3|Glow Spiral Earring - Pink (for Female Left Ear)|If you have trouble spotting your friends in dark places gift them these dayglow earrings and youll spot them a mile off.|Female-Jewellery|L
85A4093E-BB164200-B5035068-DF06DA0B|Hex Earring Right F |A stylish hexagonal earring awarded for getting a 2x Chain in Hexalon.|Female-Jewellery|L
85B91A07-42844CE4-AF9BE4B5-B790DA66|Gold Cascade Earring (Right Ear)|Faceted burnished gold earrings in an elegant cascading design.|Female-Jewellery|L
85BA8548-6B2A4AB2-A6E7FAF2-7EF6CE77|Drop diamond earring, left (Women)|Left earring with a dangling diamond. Sexiness |Female-Jewellery|L
86123EE4-FF954B46-970C837E-4E7E104F|Drey Dewdrop Earring - Green (Left Ear)|Dreys playful jewellery perfectly complements any bright and cheerful outfit.|Female-Jewellery|L
8676E135-8DED4837-817F5751-3C3947BE|Sodium Parrot Feather Earring (Right Ear)|Fashion earrings with a Sodium twist.|Female-Jewellery|L
86CDB1F7-642D4D26-8B32CF79-9D6BB859|Star Earring (Left Ear, Women)|Large star-shaped earring. Magic Power |Female-Jewellery|L
873E1020-EFDD4479-83C334C2-7CE7A6E6|Star Earring (Right Ear, Women)|Large star-shaped earring. Magic Power |Female-Jewellery|L
8769C70E-36BA49E1-A51C97F0-2140733B|Drey Dewdrop Earring - Green (Right Ear)|Dreys playful jewellery perfectly complements any bright and cheerful outfit.|Female-Jewellery|L
87D158AB-C46B4DEE-8382E9D5-CDE29BE5|Drey Pearl White Feather Drop Earring (Right Ear)|Make a friends heart flutter with these glamorous earrings.|Female-Jewellery|L
88CAEE20-F5FD4F75-8B080737-0E6E8173|Treasure Earring (Sapphire, Right Ear, Women)|This gem is a sapphire a variety of corundum that is blue in colour. For the right ear. (Mohs hardness 9)|Female-Jewellery|L
891AEAF1-241B47AA-8DAEEEB5-11BE1A87|Kiwi Jewel Right Ear Zingi Tama (for Women)|Female JewelRightEar Zingi Tama|Female-Jewellery|L
8A6C1B95-6887413C-B26EB21E-6857B82E|Spade Earrings (Female)|Spade shaped earrings.|Female-Jewellery|L
8A6EE890-5A38420A-AA76A211-8749BA65|Glow Spiral Earring - Red (for Female Left Ear)|Pick a color, pick a style, or be avant garde and mix em up. How glow will you go?.|Female-Jewellery|L
8AD53CB3-3DE14FC4-9488ECFE-7656535C|Lucky Earring (Left Women)|Earring For The Left Ear Which Improves Your Luck. For Female. By Equipping, The Obtainable Probability Of Rare Items At L-Project Of Peakvox Labs Goes Up.|Female-Jewellery|L
8C108D39-670A4449-A2E3B75A-2E446251|Dolphin Earring (Right Ear, Female)|A tiered earring featuring a dolphin hanging from a heart Cuteness |Female-Jewellery|L
8C5269F7-59DC460B-89215A8D-6358B469|C. Viper Earrings|Feel like C. Viper from Street Fighter IV with this set of luxurious earrings. Look good in and out of the ring. Street Fighter IV CAPCOM U.S.A., Inc.|Female-Jewellery|S
8CBA3C0A-F6014468-8D678217-E51DC341|Glow Alien Earring - Pink (for Female Right Ear)|Pick a color, pick a style, or be avant garde and mix em up. How glow will you go?.|Female-Jewellery|L
8CDFB8DD-7469498E-A7A76DEC-EB111334|Pumpkin Earring (Left Ear, Female)|Pumpkin Earring|Female-Jewellery|L
8D263A87-41354679-B56037DB-D540E96A|Earrings of the Seven Winds (Female) Black (Left Ear)|Exotic and sophisticated.|Female-Jewellery|L
8D419774-BC5F4942-8827731F-0B31E0EF|Star Earrings Right Ear (Female)|Worn On The Right Ear, Star-shaped Earrings.|Female-Jewellery|L
8D59970C-08CE4D4D-BDDB0D2A-A4757FD7|Glow Double Eyebrow Ring - Yellow (for Female)|Bright eyes, bright eyebrows.|Female-Jewellery|L
8DB1A57D-AEF64CD1-8661FAB6-78400953|Playground Star Earrings (Right)|Theyre only lucky if you want em to be.|Female-Jewellery|L
8E15D815-4B5F4A2D-B9948D1A-E1B11D78|Blue Pearl Earring (Right)|The Large Pop Earrings Come In Three Color Variations. The Fresh Blue Color Gives An Intellectual Impression.|Female-Jewellery|L
8E85AF3C-32D84F5F-938CD46B-65902590|Chrome Gauge - Left Ear (Female)|Expand your fashion horizons (and your earlobes) with this exclusive ear gauge from the Giftinator 9000.|Female-Jewellery|L
8EC4C608-800445A2-A9D09A9F-10473F16|Black Gauge - Left Ear (Female)|Expand your fashion horizons (and your earlobes) with this exclusive ear gauge from the Giftinator 9000.|Female-Jewellery|L
8F129886-2D4F4DBB-8AC2D795-9BF7C103|Etnas Earring|Right Earring Worn By Etna From Disgaea.|Female-Jewellery|L
8F31D460-F7D3441E-B2A16D6C-93093CDD|Pumpkin Earring (Right Ear, Female)|Pumpkin Earring|Female-Jewellery|L
90615674-85494EBC-8D3AF9E4-F82D98E1|Treasure Earring (Sapphire, Left Ear, Women)|This gem is a sapphire a variety of corundum that is blue in colour. For the left ear. (Mohs hardness 9)|Female-Jewellery|L
9094D881-36734806-88C83613-954E3B03|Treasure Earring (Opal, Right Ear, Women)|This highly popular gem features a rainbow-coloured sparkle against a milk-white background. For the right ear. (Mohs hardness 6)|Female-Jewellery|L
91401B00-4D514E8F-AF7407BD-4A06C345|Glow Spike Earring - White (for Female Right Ear)|Pick a color, pick a style, or be avant garde and mix em up. How glow will you go?.|Female-Jewellery|L
9172492E-1DD64A1A-A043DF3F-5EB4C264|Drey Prism Earring - Green (Left Ear)|Jewel-bright jewellery from Drey.|Female-Jewellery|L
9216946A-C7AF4083-B4140591-1F744AA9|Glow Eyebrow Spike - Red (for Female)|Bright eyes, bright eyebrows.|Female-Jewellery|L
92F6FFBF-85B146C1-A77BAB77-03F5CB36|Glow Alien Earring - White (for Female Right Ear)|If you have trouble spotting your friends in dark places gift them these dayglow earrings and youll spot them a mile off.|Female-Jewellery|L
937A2E59-6F1C4FE7-941F319A-2854C9B7|They glow. Loco Earring L (Kulche womens)|They glow. Loco Earring L (Kulche womens)|Female-Jewellery|L
9428C049-D6C2403A-8C0F07C2-4D0A9902|Casino Hostess Earring (Right)|Dress up your look with these earrings.|Female-Jewellery|L
943D5D74-1F3F458D-8E7A8072-33815E17|Drop pearl earring, right (Women)|Right earring with a dangling pearl. Sexiness |Female-Jewellery|L
9495A497-640341AD-8C24583A-559FEA56|Glow Eyebrow Bar - Purple (for Female)|Bright eyes, bright eyebrows.|Female-Jewellery|L
94E853B4-737A4741-A8DDF12A-45804642|Treasure Earring (Opal, Left Ear, Women)|This highly popular gem features a rainbow-coloured sparkle against a milk-white background. For the left ear. (Mohs hardness 6)|Female-Jewellery|L
959DE9ED-83AC4192-90F4C79B-0899C7BA|Drop pearl earring, left (Women)|Left earring with a dangling pearl. Sexiness |Female-Jewellery|L
95C43332-775047E0-B157AC6F-27C2C6FB|Delinquent Earring (Right Ear, Black and Gold, Women)|A spiked delinquent earring. Coolness |Female-Jewellery|L
95FA2C93-A3CF4DC0-BE686643-BE31FFF1|Bunny Earring Right|Join the sweetest revolution. Kawaii is the cutest collection inspired by Asian designs, it combines pastel tones with the Pop style, it s the most original mix around.|Female-Jewellery|L
9604B6C4-4E8B487D-9BD3C3C7-D4C4615E|DNA (White) Earring (Left Women)|DNA (White) earring for the left ear. For female.|Female-Jewellery|L
978913F8-FB484940-B866C880-6E7DDE52|Delinquent Earring (Left Ear, Black and Gold, Women)|A spiked delinquent earring. Coolness |Female-Jewellery|L
97C1CD79-0B0C46A6-898D6A6B-6C13DAC5|Snorkel (Yellow, Women)|A yellow snorkel. This accessory allows you to spend long periods of time underwater. Swim with the tropical fish.|Female-Jewellery|L
986290FF-04684339-9BFAA0D0-8F043586|Glow Spike Earring - Pink (for Female Left Ear)|Pick a color, pick a style, or be avant garde and mix em up. How glow will you go?.|Female-Jewellery|L
9A2B44F7-50CC4660-B38E3602-A49FDC7D|Succubus Earring (Left Ear, Women)|Heart-shaped earring to decorate on a succubus left ear. Magic Power Nightmare Level Sexiness +|Female-Jewellery|L
9A93AA53-D94E4D1C-879CCC9D-1D3BA5EE|Animated Diamond Earring (Left)|Animated diamond earrings.|Female-Jewellery|L
9ABCC3FD-4F55401C-B5EEE753-347A3D60|Shocking Pink Lightning Bolt Earrings (Left)|Give your loved one that magical jolt of electricity.|Female-Jewellery|L
9B2CD097-175B47A9-86E96E1E-F806C5D8|Drey Chic Twist Earring - Red (Right Ear)|Shes the belle of the ball in the latest party attire from Drey.|Female-Jewellery|L
9BC14FFC-977D4A84-9FC0D425-4694B009|Storm of the North - Southern Lady - Right Earing - Gold (Women)|A beautiful earing.|Female-Jewellery|L
9C32E80A-994B4B0F-A72D7710-4EC3187A|Sword Master Right Earring|The Sword Masters right earring.|Female-Jewellery|L
9C52DE0B-52C24860-B8415F2A-D9AD266A|Succubus Earring (Right Ear, Women)|Heart-shaped earring to decorate on a succubus right ear. Magic Power Nightmare Level Sexiness +|Female-Jewellery|L
9C59A3BA-B67349B2-85C7FB28-0E102A2E|Shell Pink Floral Earrings, Left Ear (for Women)|Feminine And Pretty Floral Earrings For Left Ear. Shell Pink Gives A Soft And Gentle Impression.|Female-Jewellery|L
9D09C509-3BBF419F-AB5C6B99-4179D19D|Treasure Earring (Obsidian, Right Ear, Women)|This black gem is volcanic stone that has been worked to give it a glassy sheen. For the right ear. (Mohs hardness 5)|Female-Jewellery|L
9D0A3701-256C4BFE-9EA9BB79-764167DF|Glow Alien Earring - Red (for Female Right Ear)|Pick a color, pick a style, or be avant garde and mix em up. How glow will you go?.|Female-Jewellery|L
9DF0C7CC-FB8E4761-8152BFDA-006DB98F|Kingdom Official Earring Right Ear (bronze) For Woman|Bronze Earring In The Shape Of A Crown. It Is A Wonderful Item Given To Those Who Played An Active Role In The Kingdom.|Female-Jewellery|L
9E1099CF-ADC94A16-B2ABC754-533D6CD3|Glow Eyebrow Ring - Blacklight (for Female)|Bright eyes, bright eyebrows.|Female-Jewellery|L
9E1557A8-B75A4F65-8F56E73A-BE526C73|Drey Spiked Earring - Shark (Right Ear)|Featuring a spiked hoop design, these earrings bring together edgy street style and cutting edge fashion.|Female-Jewellery|L
9E345416-407D470A-ADED21D3-AA40FE18|Heart Shaped Earrings (scarlet Right)|Heart Shaped Earrings Given At White Day Event In 2012|Female-Jewellery|L
9F203DEC-AE7D441D-A1E449C8-C041C4FB|Blue Flower Earrings, Left Ear (for Women)|Flower Motif Earrings With Blue Tone (for Left Ear). The Three Flowers On Them Are Very Voluminous, While The Color Is Elegant.|Female-Jewellery|L
9F4A097B-B7C24340-96FDF6EF-8EF0B6C3|Treasure Earring (Obsidian, Left Ear, Women)|This black gem is volcanic stone that has been worked to give it a glassy sheen. For the left ear. (Mohs hardness 5)|Female-Jewellery|L
9F9CDC76-F68444E4-A62CE9DE-0E00FCEC|Bite Me Prize 6|Bite Me Prize 6|Female-Jewellery|L
9FCCD3A2-763B43FD-B0A812CD-E2B83C8B|Black Naveen Earring (Left)|The Occasions Collection brings you style, elegance and class, all wrapped up in the perfect outfit to wear to any of lifes big occasions. Go for the full, colour block look or mix and match for a touch of individuality.Make an impression, whatever the occasion.|Female-Jewellery|L
9FEB8860-F6804281-9A41FA72-AC5A71A6|Mermaids Earpiece (left Female)|Mermaids With Fins And Water Pincers On Her Hands And Feet, In The Shape Of Fins. (From Semifinalist Fantasia|Female-Jewellery|L
9FFD8B69-F2484D87-A3FB3D18-AFAF8CF0|Glow Eyebrow Ring - Pink (for Female)|Bright eyes, bright eyebrows.|Female-Jewellery|L
A0C79F77-92194672-B03ADDA6-94189371|Playground Checkerboard Earrings (Left)|Checkerboard pieces not included.|Female-Jewellery|L
A0CD2B47-305D4B6B-8AD31065-3DE10BD1|Cameo Earrings|Your great grandmothers family heirloom.|Female-Jewellery|S
A0D08D25-BC5C4820-AD6AE33B-16052ACA|Drey Chic Twist Earring - Red (Left Ear)|Shes the belle of the ball in the latest party attire from Drey.|Female-Jewellery|L
A22F7B33-8585494D-9019220A-A8C8D75E|Drey Spiked Earring - Jaguar (Left Ear)|Featuring a spiked hoop design, these earrings bring together edgy street style and cutting edge fashion.|Female-Jewellery|L
A24CCE86-D33241DA-9DD3EE47-16E8B2AA|Heart Shaped Earrings (mint Left)|Heart Shaped Earrings Given At White Day Event In 2012|Female-Jewellery|L
A261ED4C-6E6F4973-9FF66159-01907625|Gold Hoop Earring (Left)|B-Girl Must Have. These Large Gold Ring Earrings Are A Must-have For B-girls.|Female-Jewellery|L
A327D749-305A42D1-B722CD71-36684285|Glow Eyebrow Spike - Black (for Female)|Bright eyes, bright eyebrows.|Female-Jewellery|L
A3AF2F8E-320F4633-BA58E828-BF4D6FC0|Spade Earrings (Female)|Spade shaped earrings.|Female-Jewellery|L
A4D865D7-F44544F5-9AB40E4F-AB2719FE|Paris Classical Earrings (Right)|Learrings pour votre ears.|Female-Jewellery|L
A5B90E20-B21446E8-BD41CE66-FF99FE8F|Cherry Right Earring|The Rockabilly line is inspired by the 1950s and is characterised by its vintage, casual and striking style. The leather, jeans and prints are the stars of this collection. It will be impossible not to triumph on the dance floor.|Female-Jewellery|L
A5E20A0E-654D4BEC-8501430C-9710AE75|They glow. Loco Earring L (Tupley womens)|They glow. Loco Earring L (Tupley womens)|Female-Jewellery|L
A62E6EFE-C1B04C77-A40E4D25-AE1AFC6B|Right Ear- Yellow Diamond Earring|Yellow diamonds are in this season. This earring is a lovely accent to any outfit.|Female-Jewellery|L
A645E41A-81A14FFE-9AE057F2-5E9E3188|Frog Flinger Prize 2|Frog Flinger Prize 2|Female-Jewellery|L
A6921F92-5D1A41FB-A05A3F63-65D8BA60|Spider right Earring|Creepy but sexy obsidian and silver made spider earrings.|Female-Jewellery|L
A7274D2C-E51F4EC1-AF565A80-337C63EB|Christmas Flower Earrings, Right Ear (for Women)|Christmas Color Flower Motif Earrings (for Right Ear). Why Dont You Start The Christmas Feeling From Your Ear First?|Female-Jewellery|L
A78826C9-A27742DD-8EAB86EB-F3E1192A|Earrings of the Seven Winds (Female) Red (Left Ear)|Exotic and sophisticated.|Female-Jewellery|L
A7A60B31-88AA4D11-9DB562C7-393D81AD|Paris Classical Earrings (Left)|Learrings pour votre ears.|Female-Jewellery|L
A7EB6B6C-F5694174-95C9AD67-638DB35B|Aquamarine Left Earring|Altamar delivers high quality, stylish clothes with this discreet but captivating line. It specializes in couture designs, suitable to dazzle at any occasion. Perfection, beauty and taste are combined in this superb collection. Dress with taste, dress with Altamar|Female-Jewellery|L
A83C5C47-F4524F22-97DA2CAD-7CCF5D8C|Brides Earring (Left Ear)|Lockwood Weddings - everything you need for your special day.|Female-Jewellery|L
