id|name|desc|category|thumbnail
3ECEDE61-3AA14539-B2ECBDF2-672416F2|Obsidian Reigning Blades Forearm and Calf Tattoos|Reigning Blades tattoos let everyone know that you are not messing around. Youre in the danger zone. Note Not all Torso or Leg items are created equal. When purchasing this Tattoo accessory item it may not work well on all clothing items. Please feel free to pick up our complimentary Bare Canvas torso item for male female to properly display your new ink.|Female-Hands|L
3F299888-A17D4537-AAE4C2B8-03F20FE3|Anime Ninja Kunai and Gloves - Navy (for Female)|Live your life as a noble Ninja or just cosplay for fun.|Female-Hands|L
3F4F61E6-C99C48B4-89CCBB42-B3B3109E|Pillow in Hand (Red Checked, Women)|Soft pillow held in hand. Sleepiness |Female-Hands|L
3F5A831F-E2C141FE-80546A6B-E93E6012|Tidal Wave Outfit - Wave Bracelets|This elegant evening gown set brings you all the feel of the ocean.|Female-Hands|L
3F6358DD-3AEA4BCD-A71E183A-8D1352AA|Rat Tail|Rat tail|Female-Hands|L
3F702984-7A4048B5-92EB7240-BFA0293F|Paris Victorian style gloves (female)|Long lacy gloves cover your delicate hands.|Female-Hands|L
3F9F619A-69DC468C-A9D5D6B9-CB2D633A|Beam Swordsman, Sword Lv4 (red) When Drawn (female)|Beam Swordsman, Sword Lv4 (red) When Drawn (female)|Female-Hands|L
3FB57827-E9264BCA-95764F08-BDEB810A|Long Rifle and Gloves (White Gloves, Women)|A rifle carried over the shoulder and finger-less gloves. Attacking Strength Sniping Ability |Female-Hands|L
3FE58097-093C4EB2-B2650DCC-778A9FDD|Noble Gloves (Pink, Women)|Lace gloves for a woman of nobility. Gorgeousness |Female-Hands|L
3FF499AE-08D34641-92005AF0-8525FC45|Ms Mayhem Gloves (for Female)|No-one knows how Ms Mayhem acquired her Fists of Flame and Cape of Flight, and shes not about to tell anyone.|Female-Hands|L
3FF8B0D5-5FAF4ECD-A6BB9697-1DBCC8FD|Wind and Earth Bangles (Silver and Black, Women)|Bangles worn by the people of the Wind and Earth. Wind and Earth Level |Female-Hands|L
3FFC8EAC-2028418F-85E77833-91914926|Noble Gloves (Yellow, Women)|Lace gloves for a woman of nobility. Gorgeousness |Female-Hands|L
40017270-10F44E9E-BAF77098-9688E593|Joker Scepter (Female)|Rule with your jokes.|Female-Hands|L
401763CA-9EA64451-A51548FF-B1528491|Gnome Curling - Fishing Rod Female|Gnome Curling - Fishing Rod Female|Female-Hands|L
4030EB91-CF2D498D-B584D7AC-D2F3F786|Orange Heart Clutch Purse (for Female)|Beautiful and useful too.|Female-Hands|L
4055FD1D-461A4329-8A23E6DD-A5E4B3D5|fnr4_boxinggloves_gold|fnr4_boxinggloves_gold|Female-Hands|S
40B05DB3-31AA4492-B53D4EC7-BB97E755|Magic Sparkles - Bracelet (female, black)|Add a touch of magic wherever you go. By Dani.|Female-Hands|L
40C8938A-3CEC4295-AD70E2C1-B7DA513A|Pink Roses (for Female)|Spread the love with this beautiful bunch of roses. (Hand)|Female-Hands|L
40CFDC05-FF52441B-9C1BC97E-7D83BA5D|Egyptian Goddess Gauntlet Princess Pink|Enjoy this Egyptian themed attire worthy of a goddess.|Female-Hands|L
40FA4D23-3D704DF4-800C144F-9CB6263B|Celestial Arm Accessories (Red, Women)|A star pattern accessory that covers down from the upper arm. Magic Power |Female-Hands|L
411E7081-2ADB4714-BACA2565-828BAB50|Healing Wand (Female)|A Magical Wand That Heals Wounds With Healing Magic. (From Semi-Finalist Fantasia) Resilience , Defense -, Combo 2, Attribute Holy, Magic Fine Light The Weapon Is Worn On The Hands During Combat Events. During Normal Times, The Weapon Is Worn On The Back.|Female-Hands|S
4154C79D-38B643DA-A7AE9F6E-0E86C0D4|Suzaku Spear (Female)|Female Hands Kirinweapon Suzaku|Female-Hands|L
41619586-2E284F7A-8F5C0476-150A9E03|Red Rose (for Female)|Show your romantic side with a single red rose. (Hand)|Female-Hands|L
4174DA76-807D4656-9A4954C3-42251317|Ruby Suit Hands (Female)|A brilliantly polished cane with a glowing ruby sitting atop it.|Female-Hands|L
41827289-39F44896-98015E41-99CE9AAB|Drey Small Clutch - Reptile Print|An ideal gift for any occasion.|Female-Hands|L
419C324D-0DC44D85-823069E9-7ACA4C9C|Uncharted 3 Drakes Deception AK-47 Assault Rifle (Female)|Not a single enemy escaped. Drake would be proud.|Female-Hands|L
41CD7305-C02E45E3-8A21FF2B-1D62F847|Yo-yo in Hand (Black, Women)|Black yo-yo with lead centre that gives it a destructive force. Attacking Strength + Attack Range Youth Level Sense of Justice |Female-Hands|L
41DCF3DF-19E2440F-9317046E-B46AEFA2|Heavy Strike Walkie Talkie|Call down the thunder with your Heavy Strike Walkie Talkie.|Female-Hands|L
420C5014-EC734179-BD37EF70-0C705D7C|Long Tube Gun1 Battling Girl|Long Tube Gun1 Battling Girl|Female-Hands|L
42347E12-C70F4FE8-B43F04B8-F4D062ED|Spike Hammer (Female)|Female Hands Arms Otsuchi02|Female-Hands|S
423ACC3A-308947E2-810B1008-687815F8|Wedding Bouquet of Blue Gerberas (Women)|A bouquet of blue and purple gerberas to be hold by hand.|Female-Hands|S
423F5887-B85F44D7-A7055490-9E6C1EA7|Beam Katana LV3 (Purple Beam Female)|Beam Samurais Main Weapon. Attack Power For Killing Mononoke + Attack Power Against Kikai Machines + Attribute Electricity Resistance Kikai Machine Degree + Enhancement Level LV3 With Charge Attack|Female-Hands|L
4242780A-7E5345FC-8CB80ED9-E87F828C|Bangle Of The People Of Wind And Earth (Silver & Black Female)|Bangle Worn By The People Of Wind And Earth. Wind And Earth Degree |Female-Hands|L
4245DD3A-4B6A4513-B656E72B-92819121|Lace Choker - Blue|Inspired by Victorian fashion and with a gothic touch, this beautiful lace choker will turn heads.|Female-Hands|L
424E6795-0B384A15-A2B49B99-F403DC72|Glowing Folding Fan, Roses (Women)|A folding fan that glows in the dark.|Female-Hands|L
4255439C-EED84231-A7DC940B-6CF544A6|Obsidian Vengeful Oni Lower Back and Calf Tattoos|Infused with demonic power, these tattoos are anything but typical. Note Not all Torso or Leg items are created equal. When purchasing this Tattoo accessory item it may not work well on all clothing items. Please feel free to pick up our complimentary Bare Canvas torso item for male female to properly display your new ink.|Female-Hands|L
425B798C-2370435A-A3396D9B-D854B1DC|Beam Swordsman Sword Lv4 (Green)|Beam Swordsman Sword Lv4 (Green) When Drawn (Female)|Female-Hands|L
42677818-27FB43EE-89070A1D-7B7C1592|Drey Vanity Case - Pale Pink|Vintage detailing meets modern sexiness.|Female-Hands|L
4271B645-F01B4721-AF7468E7-28BDD7E2|Glowing Fan, Butterflies (Women)|A fan that glows in the dark.|Female-Hands|L
427E0355-5E674609-AF470690-ABB342F2|Yo-yo in Hand (Red, Women)|Red yo-yo with lead centre imbued with a fiery element. Attacking Strength Attack Range Youth Level Sense of Justice |Female-Hands|L
4286C8AB-E8F04552-9689D08C-3C03F344|Dagger Skipjack And Poor Cat Shield (female In Combat)|Dagger Skipjack And Poor Cat Shield (female In Combat)|Female-Hands|L
428B3A90-7E684FA0-B51B1871-81E8AA3D|The Sports Bar - Foam Hand (Women)|A foam hand with the Sports Bar logo. Exclusive to the VEEMEE 3D Printer.|Female-Hands|L
42C09733-105247C4-B5B84C9E-CA039A91|Glowing Fan, Heart (Women)|A fan that glows in the dark.|Female-Hands|L
43546BD3-FAA94AF8-B986BA92-E084C3C2|Rebel Snowspeeder Pilot Gloves|The gloves of the fearless Rebel pilots who went head to head with the Imperial army at the great Battle of Hoth.|Female-Hands|L
4359D372-1D0D4173-88234A87-4B71C2C0|Festival Fan (for Women)|Just Holding It Makes You Feel Festive.|Female-Hands|L
437ED801-AECD4C6D-A4B49C6A-22A1ED37|Wardrobe Wars - Catwalk Purse and Wrist Jewelry - Female|Female purse with and charm bracelet style jewelry.|Female-Hands|L
4389C7EE-0E0C4242-9A609436-E034F3A7|Glowing Fan, Star (Women)|A fan that glows in the dark.|Female-Hands|L
43A24722-1963495D-830F0173-255C7B20|Beam Swordsman, Sword Lv3 (Pink)|Beam Swordsman, Sword Lv3 (Pink) When Batted (Female)|Female-Hands|L
43E0C5FC-07344BC5-BE6B807F-6826959A|Freedom Sparklers (Female)|Sparklers to celebrate our nations freedom|Female-Hands|L
43E5DF3F-2E4A4156-BE34472E-4A63D9D7|Beam Swordsman Sword Lv4 (Purple)|Beam Swordsman Sword Lv4 (Purple) When Drawn (Female)|Female-Hands|L
44297334-78154DE0-B8ED4A02-5E0A0DC1|Sparklers - Blue|These Sparklers are the perfect addition to any celebration|Female-Hands|L
4446FFE6-85E04ADC-BB5D40BC-ECAF87B2|Yokuto Hyakushimaru (Female)|Spiritual Sword With A Centipede Motif, Said To Be An Incarnation Of The Great Centipede. Attack Power - Concentration +|Female-Hands|L
4452CC1D-867E4E7C-A5E6BC8F-6754EA5D|Glowing Fan, Cat (Women)|A fan that glows in the dark.|Female-Hands|L
4454E7B1-2D50497D-A84488A1-2460A809|Glowing Fan, Oni (Women)|A fan that glows in the dark.|Female-Hands|L
4466B60B-CE104767-B40460B6-FE1A47B1|Itinerant Priests Rod (Female)|Rod For The Disciplinant Of Ninjutsu In The Mountains.|Female-Hands|L
44895FEA-C3D540EF-9DFF7874-C3C930C1|Country Flag - US (Female)|Celebrate the Summer Games.|Female-Hands|L
448B2B54-16614EB9-8B17D749-13A0526A|Triple Stack Icecream (for Female)|A tower of vanilla, chocolate and strawberry ice cream in a cripsy cone.|Female-Hands|L
44A9B732-326B4F98-B03D0DF7-343A4DF9|Diamond Watch|An elegant and pricey diamond watch. All the other girls will be jealous.|Female-Hands|L
44ACFC83-3A88466F-BFBAAA2D-33403D35|Glowing Folding Fan, Watermark (Women)|A folding fan that glows in the dark.|Female-Hands|L
44AF9759-B6624E82-A97654D2-E9BD79EE|Resistance Burning Skies Fire Axe (Female)|E3 2012 Reward.|Female-Hands|L
44B60BD3-83024CCB-A06109FB-E4EF3323|Conspiracy Briefcase|You have The Goods. Be alert. Dont take your eyes off them for a minute. They are watching.|Female-Hands|L
44D74691-A6814B1D-ADBEA4ED-3944BD86|Element - Mirage Tote Bag - Natural (Women)|Desert Oasis collaboration tote bag with woven logo label.|Female-Hands|L
44FF7FF4-9789419E-B0EF5046-23CA582C|Glowing Fan, Roses (Women)|A fan that glows in the dark.|Female-Hands|L
450090E0-879949EF-9BFC3087-B621724D|Wooden Sword When Battled(Female)|Wooden Sword When Battled(Female)|Female-Hands|L
452D1F2A-C8344C6F-A39E9982-8EF288F2|Butterfly Hand Jewelry|Butterfly Hand Jewelry part of the Butterfly Girl costume.|Female-Hands|L
453F7C89-2A084C97-9E2846FC-696AA02B|Glowing Folding Fan, Butterflies (Women)|A folding fan that glows in the dark.|Female-Hands|L
4583FB85-42CA4E0D-8CD1439C-46B45214|Glowing Folding Fan, Night Sky (Women)|A folding fan that glows in the dark.|Female-Hands|L
45BEE22B-BFF04B53-AD1896AB-6BB406C9|Long Rifle and Gloves (Blue Gloves, Women)|A rifle carried over the shoulder and finger-less gloves. Attacking Strength Sniping Ability |Female-Hands|L
45C75F66-997C42CC-822D211A-7264223B|Lightning Chick Hands (Female)|Were sure youll be the life of the party when you show off your electricity handling skills.|Female-Hands|L
45D36B29-B576403B-BFB409FB-1B491EE6|Yo-yo in Hand (Blue, Women)|Blue yo-yo with lead centre imbued with a watery element. Attacking Strength Attack Range Youth Level Sense of Justice |Female-Hands|L
461C787B-537A4E39-A69195B8-94DB6918|Casual Backpack (White, Women)|A backpack featuring a casual design. The backpack is attached to the hands.|Female-Hands|L
462EEAE9-F4554273-AC4E5EFC-3AF3BFEF|Magic Sparkles - Bracelet (female, white)|Add a touch of magic wherever you go. By Dani.|Female-Hands|L
466BC47A-16934DB5-AC0A52FE-539FE1D4|Tennis Racket and Ball (Pink, Women)|A racket and ball used by tennis athletes. Cuteness |Female-Hands|L
4674506F-D453499C-B0BDC658-A1D35037|Drey Oversized Leather Clutch - Yellow Topaz|An ideal gift for any occasion.|Female-Hands|L
467C71DD-131E4D12-9D19C265-20F5E690|Nekomata Claws (Black, Women)|Fingers with sharp Nekomata claws. Mononoke Level |Female-Hands|L
46A97216-BC854292-8F1776F3-48AD3D0F|KIF - Gloves (Col. Kurahashi Model, Women)|Gloves worn by Col. Fumika N. Kurahashi in the Kanazawa Independence Front 4-panel comic series on the Granzella website.|Female-Hands|L
46D45B39-28F748C7-803D7E9E-CFC0BA3D|EMF Detector Hand Item (Female)|An essential ghost hunting tool - this hand-held meter measures changes in electromagnetic fields which often indicate paranormal activity.|Female-Hands|L
46DCB395-D45643C4-B6D3FDE7-5CEDE4E7|Female Medieval Armor Gauntlets|Stylish and brutally effective.|Female-Hands|S
46F258B6-EB2E4BEF-B3199265-664964B6|Sweet Bear (Red)|Stuffed Bear Given To Me At The 2010 White Day Event|Female-Hands|L
47117DFB-7F234218-80FB1724-147EC71A|Long Tube Gun 2 Battleship Female|Long Tube Gun 2 Battleship Female|Female-Hands|L
471289F5-E4F44CB5-9C3018C8-A4618B66|Airsoft Digital Camo Gloves (for Female)|Hide from enemy Airsoft players in many terrains with hi-tech digital camouflage, created by Double Time. Skill + Style = Win|Female-Hands|L
4727B482-2E7F40C8-8074B306-BD7F10C6|Wind and Earth Bangles (Black Silver and Black, Women)|Bangles worn by the people of the Wind and Earth. Wind and Earth Level |Female-Hands|L
4782707B-E2CD4BD2-AC0BA70C-6CAB9A59|Junk Guy Santa Backpack (female)|Celebrate the holidays in style with a holly jolly Santa backpack thats Junk Guy Approved.|Female-Hands|L
478964CC-F9D14EC0-B5003477-8099AAD4|Purple and Light Blue Double-Ring Bracelets (Women)|A purple and light blue double ring bracelet. *Item is worn on the left hand.|Female-Hands|L
479B9F6E-17B7436C-83D2590D-96904385|Lost Planet 2 Jungle Pirate Gloves (for Female)|Show the other E.D.N. III factions whose side youre on by dressing as a Jungle Pirate.|Female-Hands|L
47B3DD97-A6494316-B8057D64-2A7A9DA7|Penny Scarlett - Ring and Cuff|Welcome to the world of the secret agent, where espionage and double dealings are a way of life. Slip undercover oozing charm and sophistication with a deadly appeal, ruthlessly sexy and chillingly alluring. Feel the bonds of love pull tighter just be careful who you fall for.|Female-Hands|L
47B6B784-70E84CD1-9B745C61-1F14C361|Necronomicopedia (Pocket Edition)|This odious accessory exudes an aura of pure evil.|Female-Hands|L
482171BD-81E94EB8-832821F4-BCB6B280|Venetian Gloves & Rapier White (Female)|Female Hands Venetian Sword05|Female-Hands|L
4865E545-1E8D43CA-90DD4AFA-7AAA6A4E|Female Beam Swordsman Sword Lv0 When Drawn|Female Beam Swordsman Sword Lv0 When Drawn|Female-Hands|L
48891B53-CF5743AF-89DCED3E-53DEEDED|Studded Collar - Circle Studs (for Female)|Total stud.|Female-Hands|L
48916A6B-EEE74978-ABEFA125-86712869|Lanka Lee Cheering Psyllium (for Women)|The Cheering Psyllium Imitating Lankas Image Colors To Liven Up Macross Super Live. 2007 VicWest Macross F Production Committee MBS|Female-Hands|L
489549CA-66A3446F-8FB2BFBA-FC97EA7D|Tribal Lifesnare Club (Female)|Lead your posse with this life sapping animal jaw-bone.|Female-Hands|L
48BAE4E2-68A04A4C-8AA06737-B0F21230|Futuristic Combat Hands|The combat gloves of the FUTURE.|Female-Hands|L
48C88D9E-E166414C-91A4BE40-65FA0F3D|Moonstone Ring (Right Middle Finger, F)|A Ring Embedded With A Shimmering, Pale-blue Moonstone On The Middle Finger Of The Right Hand. (Mohs Hardness Of 6)|Female-Hands|L
48E55956-C94441C9-B47BD0B9-8F24ECAC|Playground Female Red And Black B-Boy Gloves|Guaranteed for extra flex when gripping the mic.|Female-Hands|L
49118954-C9FE43E4-8C5402CA-A4D98D37|Gold tortoise shell(female)||Female-Hands|S
494279DE-48A844BE-AE1CD7CA-CA3F75B2|Gold Bracelets (Women)|Gorgeous, sparkling gold bracelets worn on the right wrist.|Female-Hands|L
494BF13A-6A0D4DEB-A4D07B2E-BB16C149|Drey Zipper Clutch - Lime|This bright, compact clutch has a chunky zip detail and comes with a set of versatile bangles.|Female-Hands|L
495A9A71-BC794B25-B6912FEC-34AE3606|Female Villain Wild Scarlet Gloves|Wear gloves to make sure no nails are broken while on the road to global domination.|Female-Hands|L
495D6E98-E3E24686-9AF9427F-C41AB52C|Camcorder Hand Item (Female)|A handy tool for recording your ghost hunting exploits.|Female-Hands|L
49800D47-782B4373-B39F11E9-8CD7C3A6|Bunny Cufflinks In Metallic Emerald Green Female)|Metallic Emerald Green Buttons For Bunny Suit.|Female-Hands|L
498D542D-19674E1C-99FD37BA-96CEB6B0|Sword Of Memories And That Persons Photo Shield (Female)|Set Of A Sword Whose Blade Reflects The Owners Memories And A Simple Shield With A Handle On A Photo Stand With A Dazzling Smile Of That Person. (From Semifinalist Fantasia) Attack +, Defense , Combo 2, Attributes - The Weapon Is Worn On The Hands During Combat Events. During Normal Times, The Weapon Is Worn On The Back.|Female-Hands|L
49985106-A1C041B1-9E1BAA73-F60ADB2C|Gloves Of Unidentified Sentai Youman (Youma Pink Female)|Gloves Of Unidentified Sentai Youman. Heroism |Female-Hands|L
49B03F46-41724CE3-92E34D1A-AC394C7E|Red Corsage and Chain Ring|The Occasions Collection brings you style, elegance and class, all wrapped up in the perfect outfit to wear to any of lifes big occasions. Go for the full, colour block look or mix and match for a touch of individuality.Make an impression, whatever the occasion.|Female-Hands|L
49C53A7F-F81A4B52-AAD3BAD2-C7B0874B|This Mysterious Taimatsu (female)|Taimatsu Is A Mysterious Tree That Keeps Burning In The Rain, In The Wind And Underwater Without Extinguishing. (From Semi-Finalist Fantasia) Attack +, Defense -, Attributes - |Female-Hands|L
49D0C638-50C440C7-AEA5EB1F-37FF9349|Animated Ice Mace Flail (Female)|Fashioned within the freezing forge of frost. A chilling aura emits from its head.|Female-Hands|L
4A17F6C1-978A4F66-B64156F0-9E30E56C| Best Machinima Megaphone|Congratulations. You ve been awarded the Grand Prize in the Alien vs. Androids II Machinima contest. Now, go out there and let your voice be heard. You make LOOT proud.|Female-Hands|L
4A21866C-D6CD4E77-B2E90136-5E2EDEFF|Ray Gun (for Female)|KER-POW. Hopefully your friends will send you a ray gun back so you can defend yourself.|Female-Hands|L
4A2664A7-FBA1422B-870814C7-EF91F5DA|Hands_Diver_glove|Hands_Diver_glove|Female-Hands|S
4A5F1C78-AC394EE4-9343342C-5F0161F0|Magic Sparkles - Bracelet (female, pink)|Add a touch of magic wherever you go. By Dani.|Female-Hands|L
4A9B65D8-6DA64BCC-A87405F2-BFD1DE45|Garnet Ring (Women)|This Is A Garnet Ring, The Birthstone Of January. It Has The Meaning Of Truth, Friendship, And Fidelity. When Worn, It Is A Chattering Farm And Has The Following Effects. Garnet Ring (for Women) It Has The Effect Of Slightly Increasing The Amount Of Minori.|Female-Hands|L
4AD48B53-5AB6447D-ADF74629-7E88291C|Carrot on a Stick (Female)|For when your hungry horse needs a little bit more motivation.|Female-Hands|L
4ADEBF0D-53F64933-972B7446-76715789|Tiny Oni Bracelet(female)|The Bracelets Worn By The Little Oni. They Are Much Heavier Than They Look, So They Are Said To Strengthen The Wrists.|Female-Hands|L
4AEE2F2C-A6B149AB-A4A3634B-0C378ACD|Destruction Fishing Rod(female)|A Rod With The Power Of Destruction And Regeneration. It Has A Moderate Pulling Power. It Can Use Sacred Art Resshin Twice Per Fishing. Sacred Art Retsushin Has A Special Effect On Wind Elemental Fish.|Female-Hands|L
4B40E1C1-21DA4175-B7C42759-431BA20D|Paintball Gun and Gloves - Green Splattered (for Female)|If they didnt run fast enough, send them this. Created by Double Time Play to Win, Play Double Time.|Female-Hands|L
4B43DE95-AA294072-8A285BE1-0020B139|Retro Pink Nail Varnish|Salon Nails available in a variety of colors - find the perfect one to match your outfit|Female-Hands|L
4B45256E-DE244034-BDB91662-809721DB|Wedding Ring (Women)|The ultimate gift to give to that special someone. Exclusive to the VEEMEE 3D Printer.|Female-Hands|L
4B504DEC-F6A04878-8C727648-D77BE467|Exotic Hand Accessory (Green, Women)|An exotic accessory worn on the back of the hand. Gorgeousness |Female-Hands|L
4B576596-9BFD46D3-A7EA72BE-A3C62555|Lidiceas Gauntlets (Legendary Armor)|The Legendary Armor of Lidicea, the Queen of Mercia who abdicated her throne to unite the lands, uniting the people against the shadows and forming the Guardians of Mercia.|Female-Hands|L
4B64923A-3F3D4AF9-A8AE72AD-460AAA4F|Country Flag - PL (Female)|Celebrate the Summer Games.|Female-Hands|L
4B89C08D-B8294849-A628E3F5-B7AA2EC6|Meito Dotanuki, When Drawn With Sword (female For Large Garment)|Meito Dotanuki, When Drawn With Sword (female For Large Garment)|Female-Hands|L
4B933E89-753B4431-BA2209B5-C7583547|Blaster (Female)|The quintessential utility weapon, this is standard issue for any MiniBot in the field. Veteran MiniBots quickly replace this with a superior weapon. Awarded for scoring 10 kills with the Blaster in a multiplayer game of MiniBots.|Female-Hands|L
4BABDF7A-347B450C-94A659C4-10674914|Poker Tournament - Tournament 23 Bracelet (Female)|Poker Tournament - Tournament 23 Bracelet|Female-Hands|P
4BDD768E-236643A0-8F34C5B4-926CC98D|PlayStation Move Motion Controller For Women. 2010 SCE Inc. All Rights Reserved.|Female-Hands|Female-Hands|L
4C056486-5E0D47C1-BD58AADC-968E4D9F|Meito Onimaru Kunitsuna (for Large Garments Female)|One Of The Most Famous Swords Under Heaven That Cuts Through The Specter Of Things. It Is Charged With The Fire Attribute. (Belt State) Attack Power -|Female-Hands|L
4C12E306-FFEF4881-998E8146-96286148|The Second In The Zodiac Sign Series Rabbit Glove (White For Women)|This Stuffed Glove Features The Motif Of A Rabbit, The Zodiac Sign For 2011.|Female-Hands|L
4C2E7F95-11D24A01-9CFEDF0D-DB84073C|Assassins Creed 2 Renaissance Fan|Assassins Creed 2 Renaissance Fan - Feathered Fan.|Female-Hands|L
4CA48374-0D414EAE-BC6E6C41-B8F9CC90|Alien Glove Gold (Women)|Glove Which Resembles A Gold Alien. For Female.|Female-Hands|L
4CA4B358-823141D6-96CC62A0-0816EBE3|Animated Flower Bouquet - Pink|An animated bouquet of flowers.|Female-Hands|L
4CD0AB38-FA4C4758-96606DD5-95AC60CF|She shot me down.|Because experience never presents to us the greatest of all possible effects clarity.|Female-Hands|L
4CD4D62A-DD814F69-BD2E98EB-EB2C6888|Hand-held Shaker (Women)|A shaker, a bartenders favourite item used to mix together various drinks. Bartender Skill |Female-Hands|L
4D096A42-5F024894-8E663D2A-5E04DB94|Foal Festival Wristbands (for Female)|Hot festival pieces from Foal. Not especially practical for muddy fields, but youll be the best dressed there.|Female-Hands|L
4D2A3D7A-64EF429B-A454FFEC-D9432D85|Killzone 3 Capture Trooper Gloves (for Female)|The gloves of the Helghast Capture Trooper costume.|Female-Hands|L
4D2E8BA0-239F40AE-970C5232-0483D9F0|Obsidian Arthropod Lower Back and Calf Tattoos|Sealife is the inspiration for this unique tribal look. Note Not all Torso or Leg items are created equal. When purchasing this Tattoo accessory item it may not work well on all clothing items. Please feel free to pick up our complimentary Bare Canvas torso item for male female to properly display your new ink.|Female-Hands|L
4D33730F-072A4E10-9D483B4C-AD6DE4EE|Yellow Short Wedding Gloves with Lace (Women)|A pair of yellow short gloves with lace for wedding.|Female-Hands|L
4D501066-6BE94F30-B6D58C3C-573C38C2|Spark Gloves|Boogie down with the Spark Gloves.|Female-Hands|S
4D6684B5-94414CCD-80ADE3CD-11432AE6|Kawaii Maid Gloves|Join the sweetest revolution. Kawaii is the cutest collection inspired by Asian designs, it combines pastel tones with the Pop style, it s the most original mix around.|Female-Hands|L
4D6F6250-F6AC48E4-ACF830BD-9A149387|HJPS Moo(te)|hands_dogrobot|Female-Hands|L
4D7CF436-D91C47F9-89815430-134E3ADE|Tennis Racket and Ball (Black, Women)|A racket and ball used by tennis athletes. Cuteness |Female-Hands|L
4DB2A666-FE914189-BB0A5435-429C5C77|Double Name Tote Bag (commemorative Limited Color For Women)|PlayStation Network Made To Celebrate Reaching 5 Million Accounts In Japan Store X PlayStation Home Double Name Tote Bag Limited Color For Women - Tote Bag - Material Double Name Canvas - Handle (Material Nume Leather) - Brass Hardware (Color Gold) When Purchased, The Item Will Be Added To Clothes > Hands In The Customize Avatar Section. Clothes>Hands.|Female-Hands|L
4DDB9030-E6EA4E0B-BCE856E4-1769FA56|Fingerless Gloves (Black Female)|Fingerless Punk Gloves. Coolness |Female-Hands|L
4DF43780-C3DE4361-9D7FEC59-6888A73B|Gothic Parasol|Your Bewitching Companion.|Female-Hands|L
4DFEC824-E57547C1-B250DE9A-4C4637B1|Drey Red and Green Giant Flower Ring|Feel the romance in the Drey giant flower ring with edging detail.|Female-Hands|L
4E053C19-918F4D3E-8FAFE13C-56FC50D6|Long Tube Gun 3 Battleship Female|Long Tube Gun 3 Battleship Female|Female-Hands|L
4E05AC6B-49204DA0-9B2B9B27-C4CE4722|KIF - Wristbands (Lt. Suzumiya Model, Women)|Wristbands worn by Lt. Sachiko G. Suzumiya in the Kanazawa Independence Front 4-panel comic series on the Granzella website.|Female-Hands|L
4E089F21-4FF74FFA-9795E61B-67E24F0A|Long Gloves Of Succubus (Violet Female)|Long Purple Gloves That Wrap The Hands Of A Succubus. Halloween 2012 Limited Item Magic Dreaminess Sexy +|Female-Hands|L
4E125EBA-D5894A4D-9ADD21A3-DC966B02|Stein (Female)|Mugs are for coffee, steins are for partying.|Female-Hands|L
4E40689F-C0A142C4-9CBD510C-7B92E522|Female Pirate Gloves|All hands on deck in your Pirate Gloves.|Female-Hands|S
4E8AE3F9-31004C77-B9B4C271-80C4617C|Prinis Jumbo Fan, Regular Type (for Women)|The Perfect Item For The Lingering Summer Season Is Here. Choose Your Favorite One From A Wide Variety Of Colors To Match Your Mood.|Female-Hands|L
4EB1D65A-84504571-AA3E4CE7-49EC4DD4|White Microphone (for Female)|Its karaoke time, choose your color and sing your heart out.|Female-Hands|L
4EB201C4-EDA5489B-8F3E3873-DCC94BC5|Ladybug Wings and Mittens - Yellow (For Female)|Yellow ladybug wings with a pair of mittens.|Female-Hands|L
4EDBE4BD-701E44D3-93729F70-519D844E|Aqua Aura female |Water swirls softly around the avatar.|Female-Hands|L
4EE3B9A2-9F1E4672-A460610B-430C986B|Beam Katana, Lv1 (Blue Beam, Women)|The main weapon of a beam samurai. Mononoke Hunt Attacking Strength - Against Kikai Machine Attacking Strength + Attribute Electricity Kikai Machine Resistance Power-up Level Lv1 *Charge attack available|Female-Hands|L
4F025E36-A0A546D5-BD792BD3-1DB76433|Handcuffed Briefacse (Female)|Dont let your chips out of your sight.|Female-Hands|L
4F0318C2-B24344D8-B55A2BBD-DCF95F53|Jumbo Prinny Fan - Overlord (F)|Here are some items that are perfect for the season. With lots of different ones to choose from, you can take your pick from any of them.|Female-Hands|L
