id|name|desc|category|thumbnail
AACAB85D-8D1F4B0C-B8A0A35A-8BB5EED1|Glitter Jelly Heels - Black|Give a girl the right shoes, and she can conquer the world - Marilyn Monroe.|Female-Feet|L
AAED1552-46CC4661-9820630A-087E927A|Strap High Sole Pumps & Tights (Black Women)|Gothic & Lolita Fashion, Thick Sole Pumps. Defense Cuteness |Female-Feet|L
AB4C92D7-D5B14DE6-A946BB8C-3F58B275|Double Time Football Boots - England (for Female)|Celebrate that winning goal with these patriotic football kits from Double Time.|Female-Feet|L
AB9054D8-B25D4A63-9CBC563A-F658134A|Ethnic Boots - Purple (For Female)|The length of these purple ethnic-style boots is perfect for a skirt, and the yellow flower corsages add a cute touch to the feet.|Female-Feet|L
AB9BCF42-E3B24AB7-A04D3E6D-9461BE03|Classic Shoes|Altamar delivers high quality, stylish clothes with this discreet but captivating line. It specializes in couture designs, suitable to dazzle at any occasion. Perfection, beauty and taste are combined in this superb collection. Dress with taste, dress with Altamar|Female-Feet|L
ABB18562-DAEE433A-93906BC6-A4AF4B2F|Miko Miko2|Female-Feet|Female-Feet|L
ABDCFC2B-2FA44714-A1EA9F89-2673A01D|Perky Betty Wedge Platforms|White and blue striped Platforms with red polka dot wedge heels.|Female-Feet|L
ABFDA993-14724289-AC1397E9-5A7A8266|Agent 47 Outfit - female|Wear the suit of the ultimate assassin Agent 47. The black suit, the white shirt and the classic red tie.|Female-Feet|L
AC22A860-30414368-B77D8B73-34B3C914|Gold Japanese Sandals (Women)|A pair of gold Japanese sandals decorated with gold embroidery. Come with a pair of white socks.|Female-Feet|L
AC3A485C-AC0847D3-925FECA6-AD1B2E7B|Sausage Dog Slippers (for Female)|Comfy, cute, cool.|Female-Feet|L
AC3BE795-84164A8A-8BCDE715-739E796D|Pink Punk Rock Bomber Girl Boots|Pink and black Bomber Girl Boots.|Female-Feet|L
AC553773-B74E4183-9CF3D5F5-C8F34F65|Lightning Chick Shoes (Female)|We doubt theres many places that sell wired leather boots like ours.|Female-Feet|L
AC61E956-8CF644E3-BCD79451-C0ADC59D|Villains Boots|Evil Villain boots.|Female-Feet|L
AC7CBA2F-CC674B5C-ADEC213F-6CF5AA51|Musketeers Boots|Heels make fighting easier.|Female-Feet|S
ACA444DC-EFB040E3-9DA484B1-08E148C5|Studded pink sneakers (Women)|Those sophisticated sneakers will look perfect with a trendy outfit.|Female-Feet|L
ACA5EAE5-0C26444A-9ADEA728-8F5EFE70|Boots w Rose Corsage - Black (For Female)|Black boots with red rose corsages that will make your feet look fluffy and cute.|Female-Feet|L
AD09A380-829248E9-AFA100ED-3752C73A|Ninja Boots (Deep Blue, Female)|Deep blue boots worn by ninjas. Defensive Strength + Stealth Level |Female-Feet|L
AD26F32F-265345AF-B8F9743B-0D11797E|Vertical Belt Long Boots (Black Female)|Long Boots With Vertical Belt On The Side. Cuteness Defense |Female-Feet|P
AD4D6C80-2B0B433A-B2C60EAB-D63D8402|Stilettos with Leg Warmers - Gray (for Female)|Get that 80s pop star look with this heels and leg warmer combo.|Female-Feet|L
AD6A425D-917D4B11-A7D27CEE-C530D16A|Red Hibiscus Anklet (F)|A anklet crafted from a red hibiscus flower. *Item is worn on the right foot.|Female-Feet|L
AD92877F-E3F14284-B294B277-3A4FEABF|Moroccan Embroidered Pumps - Pink|Give a girl the right shoes, and she can conquer the world - Marilyn Monroe.|Female-Feet|L
AD9E0529-89F44EA2-BF4B919B-E939B879|Animated Flashing Glow Camo Sneakers - Green with Yellow Glow|Animated Flashing Glow Camo Sneakers - the best way to stand out in a crowd|Female-Feet|L
ADB2607D-478346E8-9ABA7A49-5F529E93|Rust Marine - Heavy Combat Boots|Heavy armour offers the best protection around but comes with a high weight penalty.|Female-Feet|L
ADC54D33-89554149-86FA7582-72B6DBC0|GZ Burgers shoes and knee-high socks (Black, Women)|A pair of knee-high socks printed with GZ logo and a pair of black shoes are part of the GZ Burger unifrom for employees. Defensive Strength |Female-Feet|L
ADF58DB0-5F8A460E-A2B1F6FE-BEF7CD4B|Leopard pattern sneakers (Women)|Those timeless casual sneakers will look good on any occasion.|Female-Feet|L
AE46342C-D7E94644-9C437994-B2D8A402|C. Viper Boots|Feel like C. Viper from Street Fighter IV with these fantastic bombastic battle boots. These boots were made for kicking butt. Street Fighter IV CAPCOM U.S.A., Inc.|Female-Feet|S
AE5220EF-3D0347FF-BF076A15-71B4F572|Office Heels (Red Female)|Dignified Red Heels Worn By Women Who Can Work. Defense Sexy |Female-Feet|L
AE78FA34-8BDD400D-943AFAC5-2C037B9E|Flippers (Pink, Female)|Pink flippers that allow you to swim freely through the ocean. Increases swim speed during the ocean swim minigame.|Female-Feet|L
AE8B1DDB-FF084C58-8AEF0B2A-03DBBB83|Brides Shoes|Lockwood Weddings - everything you need for your special day.|Female-Feet|L
AEDE0715-A5244447-8BF6F25C-926792B7|Echochrome Costume (Bottom)|Echochrome Costume (Bottom)|Female-Feet|S
AEDF5B89-D1954BC8-A835D37E-B54B581A|Gunslinger Boots (Female)|Dark colored leather boots.|Female-Feet|L
AEF5A525-9A514AAD-9B61CB23-E11B5AFA|Dokuganryu Shinplate (Red Bronze Female)|This Is An Inlaid Red Copper Shinplate Modeled After A Dokuganryu Warlords Tsukusoku.|Female-Feet|L
AF09E6EB-518F4118-BC6BDC78-52D9AE96|Pink Clouds|Invisible pink unicorns not included.|Female-Feet|S
AF55C9D5-AD68454E-89A1D4B3-8FD63141|The Stars and Stripes Wedge Boots|The Razor Collection brings you casual style with a cutting edge. We bring you trousers, boots, tops and gloves. Mix it or match it, the choice is yours, cohesion or clash, cut a dash in the Razor Collection.|Female-Feet|L
AF600F3B-48EC458F-BBAFD380-42CB8EA7|Classic Stiletto Heels - Leopard (for Female)|There is no such thing as Too Many Shoes.|Female-Feet|L
AF6679DE-D6594843-9D039776-AF8AE4A5|Penny Scarlett - Shoes|Welcome to the world of the secret agent, where espionage and double dealings are a way of life. Slip undercover oozing charm and sophistication with a deadly appeal, ruthlessly sexy and chillingly alluring. Feel the bonds of love pull tighter just be careful who you fall for.|Female-Feet|L
AF8CA7FF-00104529-B15372D3-315DD929|Tan Gathered Ankle Boots|Featuring leather upper and lining these womens pull-on tan leather ankle boots finish with a gather at the top.  PMExtraCommerce |Female-Feet|L
AFC4AF86-3CEB4391-9671732D-8B32DC74|Creepers Red|The Rockabilly line is inspired by the 1950s and is characterised by its vintage, casual and striking style. The leather, jeans and prints are the stars of this collection. It will be impossible not to triumph on the dance floor.|Female-Feet|L
AFD55362-46BD4D5C-9AF2CD74-AB908AE4|Magic Sparkles - Shoes (female, pink)|Add a touch of magic wherever you go. By Dani.|Female-Feet|L
AFDF703E-173F4B7F-962559F6-7B7A6415|Kanazawa Independent Front Military Shoes (short Boots Lt. Suzumiya Model Female)|Lt. Sachiko G Suzumiya Model Appearing In The Four-panel Comic Kanazawa Independent Front Serialized On The Granzella Website. Short Boots Military Shoes. Defense |Female-Feet|L
AFFD8C96-0D264DA3-BEAAD3D2-97282447|Hot Feet (Female)|These could make you faster, or they might just make you look faster, which is practically the same thing. Dance all night, you are on fire.|Female-Feet|L
B0000880-59A04E9D-81E3D0F3-87416D2E|Sheepskin Ankle Boots - Fawn|Theres no such thing as too many pairs of boots.|Female-Feet|L
B039C562-A0C14E47-9BEE01D6-0985C952|Chun-Li Boots - alternate|Feel like Chun-Li from Street Fighter IV with this set of alternate shoes. Move around easily with these comfortable flat shoes. Street Fighter IV CAPCOM U.S.A., Inc.|Female-Feet|S
B0823B35-64C34EF3-A68FC78D-60894B69|Witch boots (Blue, Women)|Witchs boots which are suitable as Halloween costumes. Defensive Strength Magical Power |Female-Feet|P
B0C7DFD0-B1AC4CF0-AC0EA7B8-8070048D|Cutey Mules (Blue Female)|Simple Blue Mules To Enhance A Womans Charm. Defense Sexy |Female-Feet|L
B0F0EF02-4A7247F1-B9ED6A1A-A43FFC03|Rocket Boots|Rock these stylish robotic boots from the MiniBots game. BONUS unlocks the Rocket Boot gadget for use in MiniBots Battlebox and in MiniBots multiplayer. Death from above.|Female-Feet|L
B0F353C8-2BCC44D9-8E619C72-D5DBBAF6|Miss Behave - Camouflage Knuckle Duster Shoes (with stockings)|With this collection you will show you mean business, the family business. Ladies can be super sassy and sexy while the gents can be dapper and dashing.|Female-Feet|L
B11CFE3E-A9D043AE-BE0C9D2C-49E831F6|Santas Clothes (Boots)|These Boots Are Part Of The Santas Clothes Set. They Are Engineer-style Boots With Feminine Lines.|Female-Feet|L
B13E8BD5-10E840C3-85FC62AC-2D59CCBE|Dokuganryus shin guard (Silver, Women)|A silver shin guard said to be worn by Dokuganryu Masamune. Attacking Strength + Defensive Strength Stylishness |Female-Feet|L
B16506E9-D9184E77-A9538A02-55C8853D|Spike Heel Stilettos - Gold|Only available in the Exclusive Commerce Point, as seen in the Dream Yacht, Dream Island and Sunset Lounge spaces.|Female-Feet|L
B1710A80-DA334027-8F62F545-207CA8DC|Silk Ribbon Tie Shoes - Cherry|The ideal dramatic finishing touch to complete a stylish outfit.|Female-Feet|L
B17CDEBF-E3524F09-AD33BC86-FED097F9|Serenity Ladys Pumps - Gray|The Serenity Clothing combines Eastern Asian elements with comfort and style.|Female-Feet|L
B17F4E16-9D334226-B0AE9050-68DCDA09|Multi-Strap Mules (Red Female)|Cool Mules Worn On Bare Feet. Defense Cuteness |Female-Feet|L
B17FBA27-47744765-ADDDD4DE-CA3E13A4|Female cowgirl boots|Just as functional as the mens boots, only cuter.|Female-Feet|L
B19BA2DD-0FA14EDF-91870182-DE667995|Witch boots (White, Women)|Witchs boots which are suitable as Halloween costumes. Defensive Strength Magical Power |Female-Feet|S
B1CC14E7-6A09417A-B10F4031-2551B192|Ankle Zip Boot|Classic ankle zip boots. A versatile addition to any wardrobe.|Female-Feet|S
B1CC31B7-2EEC44F3-A3F5FC70-89E04CD3|Kunoichi Tabi Shoes (Black Female)|Black Tabi Shoes Worn By Kunoichi. Defense + Creepiness |Female-Feet|L
B1E67BFE-CB744D8E-AB79371A-CA2996D1|Gogo Fur Boots - Black|Get on the dance floor and show off your moves in these hot clothes.|Female-Feet|L
B1E9299D-A7FF4358-84D9BED7-1C8F1408|Drey Polka Dot Wedges - Cherry Red|An ideal gift for any occasion.|Female-Feet|L
B1EB2A92-637D4718-8A928DAA-9313F798|Contemporary Oriental Heels - Red|A modern, fashionable twist on traditional Chinese formal wear.|Female-Feet|L
B231C660-15DC49F8-92047D71-EB291091|Strapped High Heel Pumps (White, Women)|Thick-soled pumps in Gothic Lolita fashion. Defensive Strength Cuteness |Female-Feet|L
B2445D9D-11E44DB3-9A3216FB-2FFBC9DA|inVerse Laceless Low Sneakers - Red Plaid - Female|The inVerse canvas Laceless Low sneaker is the perfect shoe to compliment any outfit.|Female-Feet|L
B252F96B-614D470D-833628A0-3195123E|Gold Buckled Slip-ons|White little shoes with cute little buckles.|Female-Feet|S
B2806D88-2BA54057-AFD1A488-DE2C7F25|Suede Boots - Brown|Give a girl the right shoes, and she can conquer the world - Marilyn Monroe.|Female-Feet|L
B2BA1DA6-41BE4DC0-9A8F9953-46D7C12B|White Boots (Female)|Dont get these guys dirty.|Female-Feet|L
B2BCDC7C-40BD49EA-B210D3FD-264295C8|Big Tiger Feet (Female)|Big Feet In The Shape Of A Tiger.|Female-Feet|L
B2CA0547-BF75459C-A143EA9C-D1DA055B|YOU CAN TAKE THE GIRL OUT OF THE SHOE BUT...|Hot pink high heels.|Female-Feet|S
B2D5548F-7281441D-83DD8858-895127D0|Strapped High Heel Pumps and Tights (White, Women)|Thick-soled pumps in Gothic Lolita fashion. Defensive Strength Cuteness |Female-Feet|L
B2EB5B52-86EC4C64-95625051-1BDDC318|Express Your Color Shoes (Female, Pink)|Express yourself with these stylish shoes in various colors. By Dani.|Female-Feet|L
B30B9189-FE774CCD-A258D1CE-88AB19B4|Desert Camo Bomber Girl Boots|Light tan Bomber Girl boots.|Female-Feet|L
B327C044-93BE431C-BB9B70F2-1CED36CE|Midnight Rogue-Whip Feet (Female)|Heels help give your outfit that classy feel.|Female-Feet|L
B327F8D4-C0E84022-A7923CB7-9C08D583|Classic Stiletto Heels - Black (for Female)|There is no such thing as Too Many Shoes.|Female-Feet|L
B33BCFEE-D8A04A8C-87EC0281-6CFB2EB9|Long Boots Of Succubus (Black Female)|Long Black Boots Suitable For Succubus. Halloween 2012 Limited Item Defense Magic Dreaminess Sexy +|Female-Feet|L
B345F039-5D504DC1-B646CBA4-157F8ACC|Jenny Black - Shoes|Welcome to the world of the secret agent, where espionage and double dealings are a way of life. Slip undercover oozing charm and sophistication with a deadly appeal, ruthlessly sexy and chillingly alluring. Feel the bonds of love pull tighter just be careful who you fall for.|Female-Feet|L
B347F4D7-91344596-A801BCFA-FCFBC69A|Defense Force Boots (Black Female)|Black Boots Worn By Defense Force Members.|Female-Feet|L
B34C81B5-2E48408B-A11E5B57-8A05972B|Aqua Suit Feet (Female)|Brown leather boots with rustic bronze straps.|Female-Feet|L
B35DF94E-37914E40-910B7EBC-8F2F5B37|Cowboy Boots - Star Stitching (Female)|This is a mighty fine pair of boots right here.|Female-Feet|L
B39C742B-A50D4B68-A145623C-9D9F5C73|nFashion Buckle Ankle Boots (Zebra)|Just like a little black dress, these voguish boots are an essential part of any wardrobe. These shoes look fantastic when worn with LMO High Heels, transforming them into a pair of chic high heel ankle boots.|Female-Feet|L
B39CDEF1-9E35463C-8376DF1F-917C9120|Angelic Heels|These Heels will keep you cool during the summer and your feet protected and looking chic.|Female-Feet|S
B3FC0F08-3E8B4F13-BD936E91-5950F689|Majorette Heels - Ruby|Familiar festive fairy tale outfits for a unique holiday look.|Female-Feet|L
B40FCABB-378B448C-8E2049B6-C7FFFFBB|Flippers (Orange, Female)|Orange flippers that allow you to swim freely through the ocean. Increases swim speed during the ocean swim minigame.|Female-Feet|L
B41AB3E1-72B14047-949D3318-4E8AE53B|Golden Shoes (female)|Altamar delivers high quality, stylish clothes with this discreet but captivating line. It specializes in couture designs, suitable to dazzle at any occasion. Perfection, beauty and taste are combined in this superb collection. Dress with taste, dress with Altamar|Female-Feet|L
B41AB754-8C674FF3-A5ADB99E-C4C9E66A|Waterfall Terrace Reward Boots||Female-Feet|L
B47C7F8C-8B0648D8-802CBD71-3DB2ABED|Sexy Bartender Heels (Black Female)|Sexy High Heel Sandals Worn By Bartenders. Defense Bartender Skills Sexy |Female-Feet|L
B49B7FE1-C2404B8C-8E58A084-08CD4A6C|Gogo Cowgirl Boots - Blue|Get on the dance floor and show off your moves in these hot clothes.|Female-Feet|L
B4B6BCD4-3FD0483C-9DFE565B-A0B5086E|Animated Sneaker Heels - Silver|A Lockwood classic reimagined for a new era of footwear.|Female-Feet|L
B4E3F1BC-410543AE-979BFABD-6755BFB0|Baby Blue Peep toe platform high heels|The sexiest killer heels available in an exciting color range that will suit any outfit|Female-Feet|L
B52F1CF2-D1BB44FD-90157EC4-7E7D7EA8|Anime Gothic Lolita Boots - Red|Lolita goes dark in this fun attire from Anime.|Female-Feet|L
B55A9039-805A49EA-A59D0B28-16CF10EF|Billabong - Above Clouds Socks - Multi (Women)|The Above Clouds is a lightweight pair of knee socks with a jacquard knit pattern.|Female-Feet|L
B55AA644-1FCD4AAF-9C62C2C1-36B207D3|Front Laced Moccasin - Black (Female)|A comfortable, laced, knee high moccasin .|Female-Feet|L
B5761606-D05140F7-BF7130FF-8689CE99|Suede Leather Boots with Faux-Fur Trim - Cream (for Female)|Add a little festive cheer to your holiday outfit.|Female-Feet|L
B5799D9F-3DBA48D9-8BB713F6-23C0C6F4|Olive and Orange Double-Ring Anklets (Women)|A light green and orange double ring anklet. *Item is worn on the right foot.|Female-Feet|L
B58ACB65-487E40B2-99C981C0-6E86CCA4|Ribbon high sole pumps and Tights (Pink, Women)|A pair of sole pumps for gothic and lolita fashion. Defensive strength Cuteness |Female-Feet|L
B5B9C7C7-65D245A4-92CA1524-9A7F8B50|Bow Cuff Ankle Boots - Sugar Plum|Simpering princesses need not apply - this is fairytale footwear with attitude.|Female-Feet|L
B5F2F345-EDF34AEF-99119F14-041F3467|Bridesmaids Pendant Shoe|From our formal wedding footwear collection.|Female-Feet|S
B64C7B6C-CFB4411D-A1D0DCC5-F01AF5B2|Lockwood Motorcycle Club Boots - Red (for Female)|Only for the baddest bikers.|Female-Feet|L
B6584236-F5D34EB9-90B0EF40-D08ACAA6|The Morbids Sad Clown - Shoes (Female)|A pair of Pom-pom shoes. This is part of the The Morbids Sad Clown clothing set.|Female-Feet|L
B6FA8F70-2F9C4E93-9294104C-F86B1E66|Animated Electromagnetic Foot Armour (Female)|Armour for the 21st century. Electromagnetic waves hold this armour in place.|Female-Feet|L
B7483FB1-84C5470E-B5A6C884-F0E021F4|Gold Enamel Boots (Women)|A pair of gold enamel boots long enough to cover your knees and can make the line of your legs stand out more.|Female-Feet|L
B7B1DB0B-5E954994-ADED3B58-E32FFE4D|Monk Treads (Female)|These flexible treads let you dance through your enemies, landing lightning-swift blows while never receiving so much as a scratch.|Female-Feet|L
B7B3E92E-D283400B-8F41C116-153C0B28|Brown Boots (Female)|Match your boots to your saddle.|Female-Feet|L
B7DB7D1C-2DDE4570-9C3F90CC-8577C6DD|Samurai ghost shin guards (Crimson, Women)|Shin guards which are worn by samurai who kill ghosts. Attacking Strength Defensive Strength + Defensive Strength towards demons +|Female-Feet|L
B80DE250-7D0C4DAA-821A557D-9FB6A87E|Pandora Shoes - Red|Be just like Pandora and wear these classic, classy colours - red, white and blue.|Female-Feet|L
B80F705A-70BB49D9-980D4821-0FC7C98A|Turquoise Boots|Bellver, the haute couture line for exclusive people. Outfits designed with class, combining fabrics of the finest quality with a casual and elegant style.|Female-Feet|L
B8142061-F5C54066-90B843F4-D00BFC4D|Foal Wedges - Magenta|Fun and fashionable the hottest trends from Foal.|Female-Feet|L
B818B05F-1250473C-AD6C85CD-0D3A20C9|Stilettos with Leg Warmers - Gold Edition (for Female)|Get that 80s pop star look with this heels and leg warmer combo.|Female-Feet|L
B83769A8-57324340-910C4B4B-E2CE4897|White Pearl Shoes RaceOn.|Every pit stop beauty needs stunning stilettoes, these are white pearl.|Female-Feet|L
B84D2D63-506648FA-AE2FBC99-33B94CAF|Roller Skate Shoes, Quad Type (White, Women)|Shoes outfitted for Quad Type Roller Skates. Defensive Strength |Female-Feet|L
B8801E2C-FCB0408D-B76A4413-9D7F3107|Gogo Cowgirl Boots - Orange|Get on the dance floor and show off your moves in these hot clothes.|Female-Feet|L
B8E2592D-E31B416B-AF9F3D73-1BEE7C62|School Shoes|Fabulous and fashionable, these leather shoes are a comfortable, practical choice for growing feet.|Female-Feet|L
B907C878-62204802-93985588-0584DA10|Sandals Rhombus|AQUA is the most refreshing collection from PlayStation Home, it offers light summer outfits that are ideal for welcoming the heat.|Female-Feet|L
B9108AFC-23B54206-ADD9B6AA-75C5673D|Cheerleading Shoes & Loose Socks (Blue & White Women)|Loose Socks And Cheerleading Shoes. Defense Cuteness |Female-Feet|L
B919ED7E-779A4397-9B7DC9B3-D86FCFFA|Bridesmaids Shoes|No need to worry about how you look, Lockwood has EVERY aspect of the wedding covered, just concentrate on helping things go smoothly.|Female-Feet|L
B922DA6F-9689428D-A57B243A-1015DD3F|Footwear - Pumps - Mint Green (Women)|Pick up these stylish green shoes for women|Female-Feet|L
B927F7B9-36B9400C-8FB01173-CAC6109B|White Knee-high Boots|A pair of eye-catching, white knee-high boots to make your legs look long and slim.|Female-Feet|L
B93E0939-8F5F4E11-A326AF81-073C3530|Uproar - Swyfts Flats (for Female)|Represent your chosen Uproar gang by wearing this clothing item in-game and around PlayStation Home.|Female-Feet|L
B9541486-F9894526-880BA026-F327ED40|Drey Boot Heels - White|Chic, cute and stylish, Drey channels a little Parisienne flavour.|Female-Feet|L
B9929055-67F34EE8-8C592078-CB25A809|Blue Beach Shoes|Comfortable and versatile. These blue beach shoes are perfect wherever you are.|Female-Feet|S
BA0316C5-A9B440C3-9CE195ED-7580770B|School Umbrella (Red Female)|Student Umbrella. Defense Youthfulness |Female-Feet|P
BA5671F0-5EF541E4-A2276457-5217D2B5|Pumps with ribbon (White, Women)|Pumps in white with ribbon.|Female-Feet|L
BA60C5E2-73E74918-91116457-5C7C554E|Tall Clogs (Scarlet Female)|Tall Clogs With Higher Teeth Compared To Common Clogs. Defence Medetas |Female-Feet|P
BA8710B3-3FA544C9-9B5D42AD-462B4256|Drey Ruby Red Lace Sandal Boot|Step in with an air of grace with Dreys modern approach to vintage. Team a sexy floral lace ankle cuff with asymmetric construction and soft ribbon for the look that says confident, elegant, playful. Style Asymmetric Playful Upper Vintage Lace|Female-Feet|L
BA93F862-7B4B4F19-8158AFF7-225A6192|Mules w Ribbon (Red and Pink Ribbon, Women)|Thick-soled mules with red straps and attention-grabbing pink ribbons.|Female-Feet|L
BB1D8107-C7084CC4-B7F51376-0F1BF953|Elf shoes (for women)|Dress up like Santas helper, with this elf attire.|Female-Feet|L
BB3C8E81-EC824B10-8781DE31-0A02E14A|Steampunk Anachropologist Boots - Copper|Whether youre into interplanetary time-travel, solving mysterious crimes, or exploring Victorian London youll look the part with Delirious Squids latest Steampunk offerings.|Female-Feet|L
BB6858DC-A9E0464B-B8F33CCB-FE24EC21|Rose Shoes - alternate|Feel like Rose from Street Fighter IV with this alternate pair of boots. Beautiful high-laced boots, just for you. Street Fighter IV CAPCOM U.S.A., Inc.|Female-Feet|S
BB734267-294C4C87-8B242022-FBA8BAE7|Leprechaun Buckle Shoes (Female)|The perfect accessory for St. Patricks Day.|Female-Feet|L
BBEF9353-90B447D2-AACF9A06-BD522949|Pricilla Shoes - Tartan|Be just like Pricilla and be bright and beautiful in orange and purple.|Female-Feet|L
BC2D97E8-59004DFA-B4660CE5-64C45B5E|Chaos High-ankle Shoes (Female)|This item includes the Chaos High-ankle Shoes (Female). Dazzle friends and foes alike with the animated pandemonium of the Chaos clothing line. Enjoy being the life of every party, and even confound dangerous predators when in a pinch. There s nothing that Chaos can t handle.|Female-Feet|L
BC598837-8CF34E22-8FD8A67A-4616F521|nFashion Ankle Strap Flats (Cheetah)|Classy yet understated, these shoes just scream FABULOUS. . These shoes look fantastic when worn with LMO High Heels, transforming them into a pair of chic ankle strap high heels.|Female-Feet|L
BC7119CD-0571472E-B75D32FC-389EF3BA|Purple glitter sneakers (Women)|Those glam sneakers will look fab with a party dress.|Female-Feet|L
BC874F05-54254A9F-87A341C8-80D341BF|Raptor - Medium Assault Boots|Medium armour offers good protection and moderate weight penalties.|Female-Feet|L
BC8A4AC8-DFBD4BEC-B850CBC1-D4EC0AC2|Leather and Lace Thigh Boots (for her) - leopard|Stand out from the crowd in leather and lace .|Female-Feet|L
BC8F0280-FF784674-A9321BAF-F097354E|inVerse Laceless Low Sneakers - Forest Green - Female|The inVerse canvas Laceless Low sneaker is the perfect shoe to compliment any outfit.|Female-Feet|L
BC974C5E-793A4BCA-BFB407CA-932813E1|Baseball Spikes (Black Female)|Spikes Worn By Baseball Players. Defense Coolness |Female-Feet|L
BCAA736E-081D4137-9642F4A4-EAF94F07|Kigu Fox Shoes (female)|Reinvent the Pajama Party. Change your boring outfits and add a touch of color to your nights. Fun and different the Kigurumis suits your personality. Are you daring, curious, agile or strong? No matter who you are. There is always a Kigurumis for you. Become the focus of attention in the most original way, engage your instincts and start your wildest parties.|Female-Feet|L
BCCD08D2-67BB4F7B-8B6D8DA8-7F3C8459|Classic Stiletto Heels - Cream (for Female)|There is no such thing as Too Many Shoes.|Female-Feet|L
BCF41998-B5A1480A-BAFB69AA-9C9563F8|Cowgirl Boots (Dark Brown, Women)|Brown cowgirl-style boots that like those in western films. Westernness Defensive Strength |Female-Feet|L
BCF71FDB-BCD1437F-847361E0-9EE139BE|Cowgirl Boots (Black, Women)|Black cowgirl-style boots that like those in western films. Westernness Defensive Strength |Female-Feet|L
BD0FEB3C-70CF40F5-B3F0EB70-CFFB2B14|Roller Skate Shoes, Quad Type (Black, Women)|Shoes outfitted for Quad Type Roller Skates. Defensive Strength |Female-Feet|L
BD1BB6C3-A4C04A60-891ADDE6-08EC67E8|Spacewalk Propulsion Boots (female)|These boots utilize impulse thrusters to allow the wearer to move more quickly in zero-G environments. This also applies to those using the Zero-gravity Simulator to float within the station.|Female-Feet|L
BD37B191-0A254B56-944A59CE-DF580CB2|Magical Boots (Mint)|Boots Included In Magical Dress Set (Mint).|Female-Feet|L
BD457F63-1D5744F0-953AEE77-A01F1824|Roller Skate Shoes, Quad Type (Red, Women)|Shoes outfitted for Quad Type Roller Skates. Defensive Strength |Female-Feet|L
BD55BF3A-FB4442FF-978118A4-B9FC1251|Brokejaw the Zombies Feet|Brokejaws favorite trainers.|Female-Feet|L
BD743E43-873A459D-A0A809AC-77AC8F34|Brown Shoes (female)|The return to the 1970s. Inspired by the hippy and disco movement, this collection gives you the freedom to combine your favourite colours, fabrics and prints. This line represents a whole life style.|Female-Feet|L
BDAD6615-C99D4291-98BEAB63-522776C3|China Pumps (silver Thread Blue Female)|Low Heeled Blue Pumps With Silver Flower And Butterfly Embroidery. Defense Sexy |Female-Feet|L
BDBF0F71-70E7452D-8C7B08A5-92FB8642|Dragon Clan Female Ninja Boots - Black|Dragon Clan Female Ninja Boots - Black|Female-Feet|L
BDC86993-4CBB4BBB-BC1B9048-A999C36E|Miss Stripes Flat Shoes|Be bold and proud and stand out from the crowd in our range of body paint effects. Get in touch with your inner artist and show off in unique style.... complete the look with the accessories and show your artistic flair, be Painted Bare.|Female-Feet|L
BDD36AD0-D737422E-A4A19970-8813518C|Fluted Leggings (for Women)|Protective Gear From Demons Soul. A Foot Armor Made Of Iron, With Fine Grooves Carved Into It. It Is Used By Knights In Relatively Advanced Areas In The South Of Boletaria. The Fine Grooves Are Intended To Enhance The Protective Effect Of The Thin Iron Plate. Because Of Its Weight, It Slows Down The Recovery Of Stamina. It Is Also The Initial Equipment Of The Player Character knight.|Female-Feet|L
