id|name|desc|category|thumbnail
7327D915-03A546F7-A8A1ADE8-EBE6FAA7|Slingback Wedges - Coral|A little bit sandal for casual combos, a little bit espadrille for days at the beach and a little bit slingback for more formal events - one pair of shoes CAN do it all.|Female-Feet|L
732A9B93-E9AC40A7-AF54D316-AA51DC6D|Team LKWD Animated Hi-Tops - Black (for Female)|Youve tried the rest, now support the best with the official Team LKWD merchandise.|Female-Feet|L
7358B352-039C4671-A0C21CE6-8A4E488A|Blue Stilettos with Buckle|The Long awaited Stiletto - available in a variety of colours, find the perfect pair for any outfit|Female-Feet|L
7375F02C-EAAC4B35-B8EC5650-BADA55E1|Playground Female Neon Green Low Tops|It s easy being green when you re rockin these kicks.|Female-Feet|L
73A2E404-2D524FEE-A6D49CFA-C8BA8042|Gusoku Of Fallen Warrior (vermilion Female)|Cracked Vermilion Armor Said To Have Been Worn By A Fallen Warrior. Attack Defense +|Female-Feet|L
73AEA897-5CBC4666-9FF29536-1CAC5904|Black Wedge Platforms|Black platforms with wedge heels.|Female-Feet|L
73D530C3-8B814BF2-B6A8CD3C-04BF4578|Ninja -Lilac Ninja Shoes (Female)|Costume Of Graduation From Purple Ninja Rank. With Wearing This, Look Like An Ethereal Flower In The Battle Field.|Female-Feet|L
73F6FE44-CA0643C1-AB16C755-F4510EE1|Mischievous Imp Boots (Orange, Women)|Some mischievous imp boots. Defensive Strength Magic Power Cuteness |Female-Feet|L
73FBFB65-2E1E47CC-B4C40975-5EC3DB6D|Black Santa Boots (Women)|Santas Boots To Make Childrens Dreams Come True.|Female-Feet|L
740DEC3F-D74A4650-801AF8B0-037E8DFC|White Tempting Tigress Flat Shoes|Be bold and proud and stand out from the crowd in our range of body paint effects. Get in touch with your inner artist and show off in unique style.... complete the look with the accessories and show your artistic flair, be Painted Bare.|Female-Feet|L
7419E5CA-FD314A4C-BC5E6152-754E60E5|Demon Samurai Boots (Crimson, Women)|armoured boots worn by samurai that hunt down demons. Attacking Strength Defensive Strength + Ogre Defensive Strength +|Female-Feet|L
7426E736-389C4999-8D5AC94A-E6BAB373|White Peep toe platform high heels|The sexiest killer heels available in an exciting color range that will suit any outfit.|Female-Feet|L
743238DF-7D074E5E-8E9ABF2A-E84DCF40|Cutie Mules (Purple, Female)|Simple purple mules that bring out a ladys attractiveness. Defensive Strength Sexiness |Female-Feet|L
744FADF2-6661434D-984CBCB8-0C633F7C|Cutie Mules (Blue, Female)|Simple blue mules that bring out a ladys attractiveness. Defensive Strength Sexiness |Female-Feet|L
7466297F-2BD44543-BC351891-290D6590|Ribbon High Sole Pumps (Pink Women)|Gothic & Lolita Fashion, Thick Sole Pumps. Defense Cuteness |Female-Feet|L
74B413B0-224F4BB4-8E1D93C9-C685024E|Double Time Hi-Tops - Black (for Female)|Double Time is back on track with a new range of sporty tracksuits. Ready, Set, Go.|Female-Feet|L
74B6CC97-07C3458F-920B09A9-984B944B|Silent Night Boots (Green, Women)|Boots that are perfect for Silent Night. Defensive Strength |Female-Feet|L
74C7F015-2655495D-AA080550-3639D116|Gunfighter Boots (Black, Women)|Boots fitted at the ankle for an active lifestyle. Defensive Strength Sniping Ability - Stylishness |Female-Feet|L
74ED0EED-AE5D498E-A99068E4-BA50E2D7|Cat-style High Heels (Red, Women)|Costume high heels with a cat motif. Defensive Strength Sexiness |Female-Feet|L
74F49962-F7DC4037-A6443B0D-AC351CC9|Playground White And Brown Leg Warmers With Ballet Shoes|Today s forecast a 100% chance of flash dancing.|Female-Feet|L
75029C74-1C5948F4-9FBF6159-A613F3E5|Krystal s Boots|Dash into and out of danger with Krystal s boots.|Female-Feet|L
752B5E5A-18A14EDB-9784B470-F0EBD908|inVerse Laceless Low Sneakers - Rich Maroon - Female|The inVerse canvas Laceless Low sneaker is the perfect shoe to compliment any outfit.|Female-Feet|L
754060FC-9F6D4C06-832274C4-5A2CFD70|Bunny Girl High Heels (Blue Lame Female)|Blue Lame High Heels Worn By Waitresses In Exclusive Clubs. Defense Sexy |Female-Feet|L
7553A329-C3EA4C3A-AB0BD3A2-BDFBBB62|Money God Siss High-Heeled Shoes (Gold, Women)|Elegant high-heeled shoes. Defensive Strength |Female-Feet|S
755B0C03-07D2415E-A7E5367C-3B88202A|Anime Battle S1 Shoes (Female)|Anime inspired shoes.|Female-Feet|L
75B3E028-C3714B39-91CEC305-00B204A2|Fringed Moccasin - Black (Female)|Stylish calf high boots made of suede.|Female-Feet|L
75BB196A-AA96463C-831EF287-B55FBCF6|Kawaii shoes|Join the sweetest revolution. Kawaii is the cutest collection inspired by Asian designs, it combines pastel tones with the Pop style, it s the most original mix around.|Female-Feet|L
75D1ADB2-1C1B462B-89E936AE-7B43E37F|Nekomata Paws (Peach Female)|Sharp Clawed Hairy Legs. Defense Mononoke Degree |Female-Feet|L
75D32D52-E5D44B59-91800153-35EA0F43|Polar Rush Snow Boots - Gray (for Female)|Suit up and hit the snow drifts with this extreme winter sports clothing range from Lockwood.|Female-Feet|L
75E4131C-1E3945C8-A5BB9C65-0453DFFA|China High Heels (Gold Thread Black Female)|Black High Heels With Golden Flowers And Butterfly Embroidery. Defense Sexy |Female-Feet|L
7603477B-6AE64941-84EF45EA-4593CB17|Cheer Shoes and Loose Socks (Pink and White, Women)|Baggy socks and cheerleader shoes. Defensive Strength Cuteness |Female-Feet|L
762A7D67-54D74F55-94FE1B93-212DDA5B|Taisho style school boots (Black, Women)|Japanese Taisho style boots. Defensive Strength Youthness |Female-Feet|S
76555DEA-C01241B0-8E91C960-F053040E|Pink Boots|The return to the 1970s. Inspired by the hippy and disco movement, this collection gives you the freedom to combine your favourite colours, fabrics and prints. This line represents a whole life style.|Female-Feet|L
768C41D4-00C64912-BBF91839-38520FC3|Paige - Ankle Boots|Jive is our new virtual fashion label that is fun, flirty and colourful. Mix it or match it the choice is yours. Be just like Paige and wear your peacock colours with pride.|Female-Feet|L
76C9ED7B-84114924-935BA330-274F8D02|The Gusoku Of Dokuganryu (Black Female)|The Black Armor Said To Have Been Worn By Dokuganryu Masamune. Attack + Defense Chic |Female-Feet|L
76D04B5A-56B84299-95159E3C-9597E2FA|Cybergoth Monster Fur Boots - Fiendish Black|Skaters, Goths, Punks, Emo Kids, and now Cybergoths. No one brings you street fashions quite like Delirious Squid.|Female-Feet|L
76F26EAC-27FF40A8-B0697979-69646E22|Sengoku Boots (Black, Women)|Boots fit to survive any battle Defensive Strength + Hero Point Bonus |Female-Feet|L
7703A470-08AB44CC-9F74AE2E-7FD01B4D|Old Leather Lowtop Boots|Nice score from the Thrift Store.|Female-Feet|S
770D9513-55FE4C98-B24CC3F4-90AC4C89|Drey High-Heeled Lace-Ups - Black|He was not taken in by her genteel country manners. That broad had an inner-city edge.|Female-Feet|L
7715F615-01F6412B-8B666DCF-9E70CE7C|Bride of Frankenstein Feet|Becoming this monster is up to you.|Female-Feet|S
771FB342-A45D4BA1-8A92D309-55B152AF|Cheer Boots (Pink, Women)|Boots for cheerleaders. Defensive Strength Sexiness |Female-Feet|L
7741DB64-7A994E64-96899613-9A455F55|Majimajo Boots White|Female Feet Majo02|Female-Feet|L
774F722A-0D2C4E38-AC67512E-DC74852F|High High Heels - Sterling|So high, youll be out of this world.|Female-Feet|L
775F4691-F5994E35-BA3A1E3E-ECCED8BF|Peep-toe Heels (Sky Blue, Women)|Heels with a small open-toe Defensive Strength Cuteness |Female-Feet|P
776FA961-15804591-BD1E8DAD-D33A65FC|Leather and Lace Thigh Boots (for her) - blue|Stand out from the crowd in leather and lace .|Female-Feet|L
777A260E-503D469E-A9A80AC5-470D856F|Moroccan Embroidered Pumps - Purple|Give a girl the right shoes, and she can conquer the world - Marilyn Monroe.|Female-Feet|L
779C5AF5-459A4D90-9B58AF9F-0F17598A|Buckled Stilettos - White|A stylish pair of buckled stiletto shoes.|Female-Feet|L
77A14928-03E7419C-B59A824C-751699FD|Go-Go Dancer Boots|Soft soled for dancing on tabletops.|Female-Feet|S
77B566F4-F7594F1D-8111A20F-0B235C20|Flower Mules (Black, Female)|Black mules with a flower ornament. Defensive Strength Sexiness |Female-Feet|L
77C6546E-7F864A15-B5EBDF2C-1189D0BB|Black Rock Boots|Alternative Rock Boots|Female-Feet|L
77C8C592-66634119-8A54A169-C7AD204C|Womens Cute Nordic Boots (Beige)|Warm Boots Included In Cute Nordic Set|Female-Feet|L
77ECCE1A-AF20485C-A78040A6-E5B5C522|Flower Mules (Pink, Female)|Pink mules with a flower ornament. Defensive Strength Sexiness |Female-Feet|L
77F1CE87-E35A430D-B6C85E06-1A090714|Flower Mules (Purple, Female)|Purple mules with a flower ornament. Defensive Strength Sexiness |Female-Feet|L
7862993D-87DE483D-A5B10CE5-32267A11|Battlesuit Leg Parts (Female)|Battlesuit Leg Parts For Defense Forces. Anti-Kikai Machine Defense -|Female-Feet|L
78651B37-77D94499-ACCCBE19-4EDD10A6|Stiletto Boots - White (for Female)|Over-the-knee leather stiletto heel boots. Need we say more?|Female-Feet|L
786F89E2-377D4ED5-BB0A8DE9-4502511F|Mules w Ribbon (Black and Red Ribbon, Women)|Thick-soled mules with black straps and attention-grabbing red ribbons.|Female-Feet|L
78904C6D-D44E4B05-8FED38A6-DC89E288|Black Enamel Boots (Women)|A pair of black enamel boots long enough to cover your knees and can make the line of your legs stand out more.|Female-Feet|L
7893A7F8-80E143C5-B57FE0F5-C390B70A|Straps High Sole Pumps & Tights (white Female)|Gothic & Lolita Fashion, Thick Sole Pumps. Defense Cuteness |Female-Feet|L
78BF557D-453F42D3-B498882A-17FEFFBE|Street Fighter X Tekken - Chun Li Boots|Can you kick it? Yes you can.|Female-Feet|L
78CD23C0-D43243BA-ABAF9617-0D0BB3B9|Exquisite Fairy Sandals (Blue, Women)|An exquisite fairys boots Defensive Strength |Female-Feet|L
78DA1613-FA144FE8-B47DBB4E-BB9A1FA1|Gladiator Sandals (Pink, Women)|Sandals designed with many thin leather bands covering the feet. Defensive Strength Cuteness |Female-Feet|L
78DDD0E0-39F94928-B756FE4C-48821C3F|New Studs with Orange Socks Female|Studs with eye-catching football socks.|Female-Feet|L
7916E6BD-95BC4029-B292484F-E6CE49D7|Mercian Defender Khul Sabatons (Female)|Defenders can withstand the onslaught of heavy attacks, providing unstoppable force and raw power for the dedicated melee Warrior.|Female-Feet|L
7944AABA-4B294E09-A9AACCE9-3E47C0F6|Lockwood Motorcycle Club Boots - Black (for Female)|Only for the baddest bikers.|Female-Feet|L
7950511B-33DD458C-8A118B9B-0EC397F8|Pin Heels (Gold, Women)|A pair of thin pin heels. Defensive Strength Gorgeousness *A gift from GZ gift|Female-Feet|L
7969FB50-29FF4C20-9FBDF852-A7A5CF9B|Demon Hunter Sabatons (Female)|This armor was designed with speed and offense in mind as much as protection. After all, Demon Hunters are hardly limited to killing with just their fists.|Female-Feet|L
79A1B36E-EC304853-ADF7E057-9F799FF0|Strap High Sole Pumps (White Women)|Gothic & Lolita Fashion, Thick Sole Pumps. Defense Cuteness |Female-Feet|L
79A55AF5-E0EF43CD-98CA4CAA-EDF10E2B|Cat Ballet Pumps|You enjoy wearing the latest fashion and youre able to mix and match any item and turn it into an original and unique outfit combination. You know how to have fun, live in the moment and most importantly how to dress for any occasion. Dont miss the moment, make the most of it.|Female-Feet|L
79A61280-B9C34492-AC090F4D-7AE36032|God of War Ascension - Grecian Boots (Female)|E3 2012 Reward.|Female-Feet|L
79B74CA4-8F0D49F1-89EE393A-9D893FCB|Flower Mules (Blue, Female)|Blue mules with a flower ornament. Defensive Strength Sexiness |Female-Feet|L
79B9A3DE-F2C84796-9F3A520F-4977E878|Worn-out Samurais Leg Armor (Black, Women)|A set of black, worn-out leg armor said to be worn by a nameless samurai. Defensive Strength -|Female-Feet|L
79C89E1A-DF1F4AB5-8C41A899-2B75D5D6|Roller Skate Shoes, Quad Type (White, Women)|Shoes outfitted for Quad Type Roller Skates. Defensive Strength |Female-Feet|L
79E1F31F-C97E4598-BFACD1F3-7DC0E998|Glow in the Dark Jon Burgerman Ice Sneakers (for Female)|The Glowing Footwear Range based on the designs of Jon Burgerman.|Female-Feet|L
79E2A4A4-3565479A-92C7072A-2F61314A|J-Metal Leather Buckle Boots - Scarlet|Move over J-Pop, theres a new musical behemoth in town. Dress like your favourite J-Metal star thanks to Anime.|Female-Feet|L
7A0DBBBA-F2154E92-8010A6F2-D74B102C|Silver Gorgeous Sandals (Women)|A gorgeous pair of silver sandals decorated with numerous gems.|Female-Feet|L
7A14D9AA-82C84E81-87805FEB-81522862|Blue Suede Heels|Dont you step on my...|Female-Feet|S
7A4904BC-B0CA4399-B7CB7E53-955CFFDD|Dead to Rights Retribution GAC Scout Shoes|GAC model 12 footwear combines a firm durable top with reinforced carbon fibre para-aramid toe caps and high traction sole for superior slip resistance in virtually all slick conditions. A built-in Shock Diffusion System combines optimal boot support and performance with the comfort and lightweight properties of an athletic shoe.|Female-Feet|S
7A6F2972-CFF8497F-B7E06D11-1443B94D|Roller Skate Shoes, Quad Type (Black, Women)|Shoes outfitted for Quad Type Roller Skates. Defensive Strength |Female-Feet|L
7A6FF872-F9224CE2-819DE93E-5E314EA2|Ribbon Booties (Blue Gray, Female)|Ribbon booties that accent the ankles and are highly fashionable. Defensive Strength Cuteness |Female-Feet|L
7A71DC2E-93EC4D61-BF123D4D-7C6E3E27|Shin-length Lame Rain Boots (pink Women)|Shin-length Pink Lame Rain Boots Perfect For Rainy Days. Defense Outdoor Degree |Female-Feet|L
7A86922B-E9B0441B-B18CA324-10852788|Kanazawa Independent Front Military Shoes (Long Boots Female)|These Long Boots Military Shoes Appear In The Four-panel Comic Kanazawa Independent Front Serialized On The Granzella Website. Defense |Female-Feet|L
7AA172C3-B3B048FD-98040791-0585BAD8|Sheva BSAA Costume Boots|Shevas BSAA costume (boots) from RESIDENT EVIL 5. Get the whole outfit and become a BSAA agent today.|Female-Feet|S
7AAA4B8D-A4E040B5-975F613F-8DF0F76F|England Soccer Home Shoes|England Soccer Home Shoes.|Female-Feet|L
7AAA77CB-6B104595-BF8B2F43-6EC65856|New Studs with Blue Socks Female|Studs with eye-catching football socks.|Female-Feet|L
7ADA129B-CAD54F4D-96917278-4C46ED4E|Team LKWD Animated Hi-Tops - White (for Female)|Youve tried the rest, now support the best with the official Team LKWD merchandise.|Female-Feet|L
7B36CC7D-14FF4BDB-9ACAFC95-3D409563|HJPS | |Female-Feet|L
7B5F45E0-C3AC4C38-BF2F1F2C-4E2D51C8|Baby Pink Stilettos|The Long awaited Stiletto - available in a variety of colors, find the perfect pair for any outfit.|Female-Feet|L
7B62A56B-919C4DFA-B33E88F9-CFA7BA6A|Foot Jewellery|Add a little sparkle to a special ladys life.|Female-Feet|L
7B7F67BA-846F4040-A795A4C7-2729CFCD|Roller Skate Shoes, Quad Type (Red, Women)|Shoes outfitted for Quad Type Roller Skates. Defensive Strength |Female-Feet|L
7B9E270F-B1894189-8F1B3FBE-07A9A5B0|Black Stilettos|The Long awaited Stiletto - available in a variety of colors, find the perfect pair for any outfit.|Female-Feet|L
7BC0DD1F-613247D3-9D4CF1B6-A2399F3C|Dirtee Kicks (Female)|Dirtee Kicks with fly logo|Female-Feet|S
7BDDD64F-ACDE411A-8425E0C5-7623D007|Polaris Boots (F)|These boots are part of the Polaris clothing line and are manufactured by WisperWyre Bioscience.|Female-Feet|L
7BEE1780-4184432E-A71CC77A-312DB17B|Ribbon Booties (Blue Gray, Female)|Ribbon booties that accent the ankles and are highly fashionable. Defensive Strength Cuteness |Female-Feet|L
7BFDD5E9-F67941FE-A0FC9826-92470FEB|Purple Laced Boots (Female)|Knee-high leather boots.|Female-Feet|L
7BFFBB80-26734AFD-AEAA4B3B-67E0FD0B|Flower Mules (Purple Female)|Purple Mules With Flower Ornaments. Defense Sexy |Female-Feet|L
7C372784-866A4D6F-9E72390E-59A08FEF|Lady Pink Purrfect Flat Shoes|Be bold and proud and stand out from the crowd in our range of body paint effects. Get in touch with your inner artist and show off in unique style.... complete the look with the accessories and show your artistic flair, be Painted Bare.|Female-Feet|L
7C3D83D1-289B4ABD-881EBF5A-570F2C6B|Sapphire - Sparkle Wedges (for her)|Ever wanted to be a star of the glitter ball? Ever wanted to grab your partner and sparkle in the limelight? Now you can. So shine bright like a diamond, sparkle with success and bring on the bling.|Female-Feet|L
7C5BB5A0-E6B746AD-AFB4B380-996B5E17|Silent Night Boots (Red, Women)|Boots that are perfect for Silent Night. Defensive Strength |Female-Feet|L
7C73A6FE-AD2C4EA6-8ED8439A-F0B84E92|nFashion - Harajuku Sandals (Female) (Version 1)|Stand out on the streets of PlayStation Home with this Harajuku inspired clothing item.|Female-Feet|L
7C77D410-64704943-B0A39768-E2FAA2A9|Cowboy Boots|Yehaw cowboy. Keep your feet protected from all the critters roamin around outside. And with them shiny spurs your horsell be riding like the wind. Just watch out no one has gone and put a snake in them. That would be mighty rough.|Female-Feet|L
7C93464F-080E4E10-88D09C3F-BBD52385|Paige Shoes|Be just like Paige and wear your peacock colours with pride.|Female-Feet|L
7CA3D909-95F04F6D-A83EBA87-9D464467|Animated Flashing Glow Camo Sneakers - Gray with Yellow Glow|Animated Flashing Glow Camo Sneakers - the best way to stand out in a crowd|Female-Feet|L
7CB3B312-90E2466F-977A4E34-F720B8A9|Frilled tights and High heel (White, Women)|White, frilled tights with high heel. Defensive Strength Sexiness |Female-Feet|P
7CD2910F-70FA4CB9-B4707411-6A14670F|Energy Boots|Get ready for an exciting adventure. Its time to stop dreaming and write your own story. Create a fantasy world where you are the protagonist. Designed exclusively for you, we give you the opportunity to become your favourite character. Get ready for an exciting adventure ...And have a happy ending.|Female-Feet|L
7D308A17-97384584-9970B6A1-647D0065|Express Your Color Shoes (Female, Peach)|Express yourself with these stylish shoes in various colors. By Dani.|Female-Feet|L
7D346D60-5713419D-878BE1DC-FD8C53C2|Drey Classic Multi-Color English Brogue Shoe|Stride into the new season in this classic English Brogue. In a leather finish with punch detailing, these shoes have timeless appeal.|Female-Feet|L
7D7E2ED2-08584D3C-B8675D52-BA3E014F|Barbarian Greaves (Female)|These greaves transform a Barabarians legs into deadly weapons. Stomp and kick your way through the enemy ranks.|Female-Feet|L
7D965A78-394349BA-A38A72A5-C02BBF58|Worn-out Samurais Leg Armor (Red, Women)|A set of red, worn-out leg armor said to be worn by a nameless samurai. Defensive Strength -|Female-Feet|L
7D9C5357-3C424C33-AE81F22F-9A93AE10|Rainbow shoes|Long live the party. Rave Party is the ideal collection for all those who love to go out to have fun and dance. Dare to combine different designs and create your own style.|Female-Feet|L
7DA778C3-11C3436B-893CF5DE-1720F7E7|Snow-white Boots (Long Type, Women)|Snow-white coloured long-type boots. Defensive Strength Sexiness |Female-Feet|L
7DABBA11-EB3D4847-902EDDFF-73967B01|Silver Spike Shoes (Feva Shooting Edition Female)|Prize Of Feva Shooting All Cleared Award. (Original Silver Spike Shoes)|Female-Feet|L
7DB287A3-DAF840E0-BEE5F564-CA761A26|Roller Skate Shoes, Quad Type (Blue, Women)|Shoes outfitted for Quad Type Roller Skates. Defensive Strength |Female-Feet|L
7DF72436-E4424E04-A518CA6D-365DFDB0|Cute shoes|Join the sweetest revolution. Kawaii is the cutest collection inspired by Asian designs, it combines pastel tones with the Pop style, it s the most original mix around.|Female-Feet|L
7E364195-C9794610-B435942D-E6A6F3F8|Ninja Boots (Deep Blue, Female)|Deep blue boots worn by ninjas. Defensive Strength + Stealth Level |Female-Feet|L
7E431C79-9CD94922-A2874F34-5EB78C0E|Rockabilly Rose T-Bar Shoes - Bluebell|Give your feet a reason to dance.|Female-Feet|L
7E4982A9-E4B947BA-8BA15179-7543FE6A|Fleeing Samurais Leg Armor (Black, Women)|A set of black leg armor with cracks and said to be worn by a fleeing samurai. Attacking Strength Defensive Strength +|Female-Feet|L
7E57770B-DDDA49FE-B83CB827-E8BB00EF|Green biker boots for women|Those timeless green leather boots will spice up any casual outfit.|Female-Feet|L
7E720DA2-928B49F5-80C7C6CB-5E493655|Gunfighter Boots (White, Women)|Boots fitted at the ankle for an active lifestyle. Defensive Strength Sniping Ability - Stylishness |Female-Feet|L
7E8ED381-CAD94DD5-83B6CDA6-5006BE0B|Seductive Witchs High Heels (Black, Women)|High-heels with pointy toes. Defensive Strength Magic Power Sexiness |Female-Feet|L
7E9C5369-999F4BA7-A3CA5D49-907EDAB4|Cat-style High Heels (Pink, Women)|Costume high heels with a cat motif. Defensive Strength Sexiness |Female-Feet|L
7EB79EA0-10094D23-ABE99847-6837F66E|Gladiator Sandals (Aqua, Women)|Sandals designed with many thin leather bands covering the feet. Defensive Strength Cuteness |Female-Feet|L
7EB802DA-A8A74946-A3103844-A006971E|Exotic Shoes (Green Female)|Pointed Toe, Exotic Shoes. Defense Gorgeousness |Female-Feet|L
7ECEAB8D-C8E246C2-8D8D8863-AABED16E|Playground Female Neon Orange Low Tops|It s the orange of the future.|Female-Feet|L
7F0978C7-C9F84D15-B7801D10-35A4FBA4|Noble High Heels (Pink, Women)|High heels with ribbons for a woman of nobility. Defensive Strength Gorgeousness |Female-Feet|L
7F0FA6AC-7C994131-AA93C54C-8785B3AD|Bunny Slippers (Women)|A pair of rabbit slippers|Female-Feet|L
7F123F0A-884C4E97-A82336F4-996D9E71|Worn-out Samurais Leg Armor (Silver, Women)|A set of silver, worn-out leg armor said to be worn by a nameless samurai. Defensive Strength -|Female-Feet|L
7F1B30D3-8B524B03-A4EFA2A0-FA72459E|Kikai Slippers (Women)|Slippers designed with a Kikai soldier pattern. Defensive Strength *Only available for event|Female-Feet|L
7F43FA0D-92904AF6-B035F229-82C85498|Shamrock Shoes|Walk the lucky way with these Shamrock shoes.|Female-Feet|L
7F734295-A7B3451A-B686B8A7-2E3ED6F5|Special edition Mahogany Peep toe high heels with red platform|The sexiest killer heels available in an exciting color range that will suit any outfit.|Female-Feet|L
7F800866-0FCC4F40-871E2061-CAA504B7|Taisho style school boots (White, Women)|Japanese Taisho style boots. Defensive Strength Youthness |Female-Feet|L
7F83BF1E-22694620-ABEF7D3B-6771B76A|Female Hover Boots (Red)|Female-Feet|Female-Feet|L
7FAE61C3-BDC149F8-A4F4D25A-A5BEBF58|Foot Fins (Red Female)|Red Foot Fins For Swimming Freely Underwater. It Increases The Speed Of Swimming In The Underwater Swimming Mini-game.|Female-Feet|L
7FFD7116-6B72496A-998606EB-C10A8F1A|Silver Skull - Superheavy Reaver Boots - Female|Armour of the infamous Reaver Clan of the waste, only a dead man stands against them.|Female-Feet|L
800CDED2-FE1A4BC4-B3085AA9-AFB983E2|Vampiric Feet|While lacking reflection they live with each other, a human in one form a beast in another.|Female-Feet|S
8017A431-A2844FB3-8A584801-188B5CAE|Foal Leather Slouch Boots - Oxblood|Hot festival pieces from Foal. Not especially practical for muddy fields, but youll be the best dressed there.|Female-Feet|L
80309E0C-B4F8494A-928C46B8-9E6C552E|Peep-toe Heels (Lemon, Women)|Heels with a small open-toe Defensive Strength Cuteness |Female-Feet|L
80BACFE5-8DA741AB-A4433FBE-BB135D80|Roller skates shoes, rocket type (White, Women)|Rocket type shoes suitable for roller skates. Defensive Strength |Female-Feet|L
80EA2E90-06374912-B93974C4-0F929E69|Stiletto heels and Stockings (Red and Black, Women)|Black stockings and red stiletto shoes with tall, slim heels. Defensive Strength Sexiness |Female-Feet|L
80EDB8D9-38034CAC-9372B636-E53D03DF|Flip-flops (Pink, F)|A pair of pink footwear with rubber soles, rubber straps and a flower accent. Dont go to the beach without these.|Female-Feet|L
80FE61D2-080441F6-A868198A-B38A46C2|Anime Ninja Jika-tabi Boots - Black (for Female)|Live your life as a noble Ninja or just cosplay for fun.|Female-Feet|L
81134C10-816640C6-95866D6E-1042741B|Drey High-Heeled Lace-Ups - Tan|He was not taken in by her genteel country manners. That broad had an inner-city edge.|Female-Feet|L
81243ABF-C9D6457B-871CF2C4-0FA4A687|Sodium Scorpion Stomper Boots Grade Two (for Female)|Concrete Boots for Stomping Scorpions - Grade Two Achieved.|Female-Feet|L
812B8689-713142E7-B563955A-3810D6BE|Flippers (Black, F)|A pair of black diving flippers. The ladies version has a more rounded edge.|Female-Feet|P
813B9E49-243940BD-807DD4D1-A4E390CF|Billabong - Above Clouds Socks - Moonlight (Women)|The Above Clouds is a lightweight pair of socks with a jacquard knit pattern.|Female-Feet|L
8148AA2D-A70D4C50-AB22DEC1-689F3BEC|Flashy Patent-Leather Shoes (Red Women)|Dazzling bright red patent-leather shoes. Paired with black socks.|Female-Feet|L
815C48C9-1DDD46BF-A2001CF2-17F4FD1D|Lovely Pumps (pink, women)|Charming Pumps with cute Leg Warmers, decorated with beautiful loops.|Female-Feet|L
8160CC31-EB494DD4-90CCA484-1F387A3A|Dolphin Slippers (Pink, Female)|A pair of dolphin-shaped slippers Defensive Strength Cuteness |Female-Feet|L
81695BCC-4EC841B1-A1050514-94865C6D|Metallic Ankle-strap Heels - Gold|Figment has the perfect pieces for a sophisticated date night, whether its a night out at the theatre or dinner on the deck of a yacht.|Female-Feet|L
81800555-25E844E4-A2043670-4D820889|Sengoku Boots (Black, Women)|Boots fit to survive any battle Defensive Strength + Hero Point Bonus |Female-Feet|L
81BC638A-D880486C-A53DCB81-F5AB6A84|Railroad Worker Shoes (Women)|Shoes worn by railroad employees. Defensive Strength Coolness |Female-Feet|L
81C2D071-780C4F22-987DCBFA-B489CDBC|Dark Knight Greaves|Heavily armored feet for stomping heads.|Female-Feet|L
81CC40C4-A15C4C20-A7DE9CD9-9DD0DB5F|Mercian Ranger Khul Boots (Female)|The light Armor of a Mercian Ranger, the agile and nimble scouts of Mercia.|Female-Feet|L
81CCF6D6-22A64F35-A7698DD2-0DC7BF01|Soft Ox Leather Boots - Arctic (for Female)|Roguish behaviour encouraged.|Female-Feet|L
81D53DA4-3B604914-81D65E5D-AE6E6D4A|Drey Strappy Heels - Aztec|A high heel with a platform sole and thin, criss-crossing straps.|Female-Feet|L
81E2CBA2-0E8E4F62-87534824-EB3A39B1|Black Ops - Medium Assault Boots|Medium armour offers good protection and moderate weight penalties.|Female-Feet|L
81E5B4D2-061444A5-885A2BA1-7C9127CE|Shanti Shoes|Youll never get the blues with your Shanti Shoes.|Female-Feet|L
