id|name|desc|category|thumbnail
50335847-39DC4159-A74A4F0C-90B47760|VICKIE Headphones (for Male)|Show your appreciation for VICKIE with some authentic imitation VICKIE Headphones - If you also own a VICKIE statue she just might show her appreciation back.|Male-HeadPhones|L
5091B278-4D9C47BA-89F7B49A-F0E5B84D|Miniature Sentry (Male)|Awed by your prowess in battle, this tiny flier has defected to your side (head accessory).|Male-HeadPhones|L
50A967B6-EA3A4B92-B479753D-77CB9C30|World Flag Icon - Northern Ireland (Male)|Show your love for this country by wearing this world flag icon.|Male-HeadPhones|L
50BCAA6E-4A0D4332-9AA7B50D-2A06763B|Retronaut Headset - XE3 (for Male)|Fool Throttle now caters for Space Travellers too. Grab the latest in Galactic Leisurewear.|Male-HeadPhones|L
50C142C2-60674DEE-80565F75-58470F14|Shining Single Oni Horn (Short, Red, Men)|Single horn of demon with shining stripe pattern.|Male-HeadPhones|L
50E9AA5B-BF6E4333-AC8B48EB-8E49326C|Halo (Men)|A ring of light floating above the head. Sense of Justice |Male-HeadPhones|L
5130166F-88324568-A2164163-BC37BDD8|Noble Tricorne (Black, Men)|Tricorne with a decorative feather for a man of nobility. Gorgeousness |Male-HeadPhones|L
514F391B-8FB84B23-8164C581-8BEA190E|Elf Ears (for Male)|If youre a mischevious character, or if you just prefer looking a little out of the ordinary, don some ears for a quirky look.|Male-HeadPhones|L
5155AF27-90FC45DD-94EC9E06-6CFB7F05|Category Phantom Species Gold Medal For Men|Male HeadPhones LPmedal|Male-HeadPhones|L
517489BB-259948E8-86CEC887-C96529D3|Raver Horns - Glowing|Wear these bright and flashy clothes while supporting Peace, Love, Unity and Respect.|Male-HeadPhones|L
51BB08F6-182F490C-A11447DB-1CC07EEA|Ahair Brown Hair (for Men)|Male HeadPhones Foolish Hair|Male-HeadPhones|L
52267C05-4C17415F-A27CEBB5-E1E035D6|Slightly large sun visor (Red, Men)|Red sun visor for hair with volume.|Male-HeadPhones|P
52765D24-6AF347B3-8E18E367-F363AA6B|Single Status Symbol (Male)|Let everyone know youre single.|Male-HeadPhones|L
5286D442-3A534548-B78C5705-E3CBA326|Nightcap (light Blue Male)|Hat To Wear When Sleeping. Restful Sleep |Male-HeadPhones|L
52C1511E-42E9425F-8125B060-E2B643C0|Silent Night Silk Hat (Red, Men)|A silk hat perfect for Silent Night. Defensive Strength |Male-HeadPhones|L
52C48B45-0940476B-A8FF910D-913B7136|Slightly large sun visor (Black, Men)|Black sun visor for hair with volume.|Male-HeadPhones|L
52D169EF-08104380-A897EF04-83E350D2|Time Crisis Razing Storm headgear with HUD|An exclusive Time Crisis Razing Storm headgear with HUD.|Male-HeadPhones|S
533D1AC7-4CBF467E-80AFB0E3-E4BFB38C|Knit Pilot Cap Medium (brown Male)|Knit Hat With Ear Pads. Standard Size Type. Warmth |Male-HeadPhones|L
53954EB4-54F445A3-8ABD1509-4D17AE19|Prehistoric FourHorns Male|Male HeadPhones FourHorns|Male-HeadPhones|L
53AF6D91-85CF437D-800F7C9E-60264EA5|Knit Hat Extra Large (White Male)|This White Knit Hat Can Be Combined With A Voluminous Hairstyle. Size XL Coolness |Male-HeadPhones|L
53BC5C5D-2AF846C9-A4782B4B-057F22F7|Slightly large sun visor (Blue, Men)|Blue sun visor for hair with volume.|Male-HeadPhones|L
5418CEA3-E6C94A88-BE7554CD-D2C3ADA0|Straw Hat Style Accessory (for Men)|Straw Hat Style Accessory Included In Farm Style Set. When Worn, It Is A Talking Farm And Has The Following Effects. Straw Hat-Style Accessory (for Men) Effect That Increases The Number Of Shinka Powers Gained By One|Male-HeadPhones|L
5461EE95-B0BC4530-B0BD3A22-42758BC0|Animated 2010 Neon Head Boppers - Green|Glowing Neon 2010 Head Boppers|Male-HeadPhones|L
549C5A14-36CA407D-81475458-84BF9C60|Slightly large sun visor (White, Men)|White sun visor for hair with volume.|Male-HeadPhones|P
54AA602D-F92E4728-A60A83D3-8E24C04B|Pointed Horns (Men)|A set of spiked horns growing from the head. Magic Power |Male-HeadPhones|L
54C98DEC-83FB471A-93EB42C1-F70134E4|Screw Head (Male)|Male HeadPhones Headbolt|Male-HeadPhones|L
55020BBC-4F374F78-A93555F8-2E45D3AE|Halloween Head Boppers (male)|Finish off your Halloween costume with this fun gift.|Male-HeadPhones|L
551BECBD-50F5462E-A5EEA98F-D1C47B7B|Valentines Orbiting Hearts (Men)|So stricken with love that youre seeing hearts. Only available from Valentines Day Acorn Meadows Park.|Male-HeadPhones|L
5531B775-8E2D4947-B8291260-99CAFD63|Sun visor (Black, Men)|Black sun visor for compact hair.|Male-HeadPhones|L
55561A4B-13AF4128-A1502F26-5D5D3D0D|Sun visor (Blue, Men)|Blue sun visor for compact hair.|Male-HeadPhones|L
557A60FE-B5A8407F-8A92E62E-9E5154FC|Cake Hat (Male)|A Hat Made Entirely Of Confectionery. It Is Elegantly Sweet With Low Sugar Content And Is Health Conscious. (From Semi-Finalist Fantasia) Defense +, Attribute Food It Is Attached To Headphones.|Male-HeadPhones|L
558D6C22-8C734B88-8958BCE1-D4B841AE|Wolf-style Ears (Blue, Men)|A hairband modeled after wolf ears. Defensive Strength Coolness |Male-HeadPhones|L
55D76547-EA85434C-8C5B35BC-CFBF3D13|Alien Ears-Orange|The better to hear you with.|Male-HeadPhones|L
56629EA1-74CF455A-86B2316B-3F6A23E1|AAA - Beats by Dr. Dre Studio Headphones In Red|High Definition Powered Isolation Headphones|Male-HeadPhones|L
56CE0D13-0DCB4459-8DBB9788-52D2AE05|Nekomata Ears (White, Men)|The ears of the Nekomata yokai, said to be transformed from a house cat. Mononoke Level |Male-HeadPhones|L
574CB546-928F4E50-8614333E-0A84DDD0|Sun visor (White, Men)|White sun visor for compact hair.|Male-HeadPhones|L
575F2CEC-10184A91-AB9B53A3-08CDB90C|Shining Single Oni Horn (Long, Red, Men)|Single horn of demon with shining stripe pattern.|Male-HeadPhones|L
576E89E0-3E664555-B9A31DC0-DFEF6C8A|Can-can Hat (brown Male)|Made Of Straw, Very Hard And Sturdy. Defense Tropicality |Male-HeadPhones|L
57CA5531-48F64629-A6511564-DF1D067F|Seductive Wizards Hat (Black, Men)|A wide-brimmed pointed hat. Defensive Strength Magic Power Sexiness |Male-HeadPhones|L
57F55FE0-51354CED-9E918791-C04B82E7|30 million stomps emoticon (for Male)|Our thank you to all the community that have helped so far in our attempt to eradicate this mechanical pest.|Male-HeadPhones|L
58088653-7E214EA1-BCEFFA53-D6D28A5F|Stationmasters Hat (medium Male)|Hat Worn By A Railroad Worker Stationmaster. Defense Coolness |Male-HeadPhones|P
5850B9C3-BC884751-B8649AC6-D6E69D38|Shining Double Oni Horn (Short, Purple, Men)|Double horn of demon with shining stripe pattern.|Male-HeadPhones|L
586498B6-00834428-B78382C0-498C40AA|White Silver FourHorns Male|Male HeadPhones FourHorns|Male-HeadPhones|L
5921717B-84CE448F-B1DCD6C7-A7313B0C|The Dragon (yellow, For Men)|The Dragon (yellow), Still A Child, Likes Heights But Cannot Fly High. Would You Like To Put Him On Your Head?|Male-HeadPhones|L
59776AC2-089B4C2E-884B3261-AD384FA0|Sideburns, thick (Men)|Sideburns growing down to the mouth. Coolness |Male-HeadPhones|L
5A6B56E9-ADC8459B-A2381654-635D2542|Moon Jelly Hair Accessory (Mens)|Now On Sale. This Is A Glowing Headdress With A Motif Of water Jellyfish Included In The Jellyfish Pack, An Additional Item For Blue Oasis Healing Space For Fish. This Item Is Free Of Charge.|Male-HeadPhones|L
5ADA5612-D60B4324-A4327089-06938834|Nightcap (Light Blue, Men)|A cap worn while sleeping. Sleepiness |Male-HeadPhones|L
5B1C66D4-D0714FE2-AD7CBC61-CBE80F08|Easter Egg(Dot)|Place It On Your Head And It Will Instantly Make You Feel Like Easter.|Male-HeadPhones|L
5BA6E37A-8D3548D8-B510A7D4-5FF83525|Nightcap (Blue Checked, Men)|A cap worn while sleeping. Sleepiness |Male-HeadPhones|L
5C21B73D-C1E84862-B287A1C5-7174CE6B|Shooting Star Hairpiece (Men)|A hairpiece in the shape of a star and its tail. Magic Power |Male-HeadPhones|L
5C40CA81-49A44002-932E23D8-334BDBA6|H Helmet Of Flame (male)|A Helmet Covered With A Mysterious Flame That Never Goes Out. (From Semi-Finalist Fantasia) Defense +, Attribute Flame It Is Attached To Headphones.|Male-HeadPhones|L
5CAA4C88-2E0345E3-8DB8B02C-D1C4C411|Ghosts Triangle Kerchief (Men)|A white triangle kerchief that goes around the forehead.|Male-HeadPhones|L
5CF526F2-494947BC-AF5B350A-B5132982|Nightcap (Black, Men)|A cap worn while sleeping. Sleepiness |Male-HeadPhones|L
5CFB2C75-30EB4968-A999A1AB-5ADFAA80|Nightcap (Red Checked, Men)|A cap worn while sleeping. Sleepiness |Male-HeadPhones|L
5D2689E7-7ABE415D-8B03304A-62E17282|Short Twintail Silver Hair Male Wearing Type|Male HeadPhones Twintale Short|Male-HeadPhones|L
5DC83818-DFB04E3F-AABDC666-70C7FAFF|World Flag Icon - Spain (Male)|Show your love for this country by wearing this world flag icon.|Male-HeadPhones|L
5E11220E-DB4F40B0-A22D64F0-7A8DEFA4|Wolf-style Ears (Brown, Men)|A hairband modeled after wolf ears. Defensive Strength Coolness |Male-HeadPhones|L
5E375CC4-14A040DD-921D9E79-D741A64E|Nightcap, Slightly Large (Light Blue, Men)|A slightly large cap worn while sleeping. Sleepiness |Male-HeadPhones|L
5E601CA6-E1AC4792-AE3931BB-65992891|White Santa Headdress (Men)|Santas Headdress To Make Childrens Dreams Come True.|Male-HeadPhones|L
5EEC74ED-758F475A-98D1B715-51D92372|Shining Double Oni Horn (Long, Purple, Men)|Double horn of demon with shining stripe pattern.|Male-HeadPhones|L
5F44E539-2B3C411A-AE2EA4E3-02B42F67|Wind and Earth Headdress (Small, White Feather and Yellow Feather)|Hair decoration worn by the people of the Wind and Earth. Wind and Earth Level |Male-HeadPhones|L
6063A769-EF714471-B37D3C20-37DC962C|Straw Boater Hat (High, White, Men)|A very sturdy hat made of wheat straw. High placement type makes it easy to coordinate with high-volume hairstyles. Defensive Strength Tropicalness |Male-HeadPhones|P
6070FC99-D6314588-80C79FFC-01FC8121|Wind and Earth Headdress (Large, White Feather and Yellow Feather)|Hair decoration worn by the people of the Wind and Earth. Wind and Earth Level |Male-HeadPhones|L
60752CB8-C73241F8-B737E620-3B0E63BE|Straw Boater Hat (Low, Black, Men)|A very sturdy hat made of wheat straw. Low placement type makes it easy to coordinate with low-volume hairstyles. Defensive Strength Tropicalness |Male-HeadPhones|P
60B1EF16-C40C4307-9E52A58F-F3E53882|Knit Beanie, Small (Brown, Men)|A knit cap with ear flaps. This type matches easily with thinner hairstyles. Warmth |Male-HeadPhones|L
60D67EF6-B2C440B0-820A8A55-1D376128|Nightcap, Slightly Large (Black, Men)|A slightly large cap worn while sleeping. Sleepiness |Male-HeadPhones|L
60E61B0D-BE624076-8745986A-A3563940|Wolf-style Ears (White, Men)|A hairband modeled after wolf ears. Defensive Strength Coolness |Male-HeadPhones|L
611A1B0F-DD7A4A25-A3EA3D54-9228BCE6|Nekomata Ears (Black, Men)|The ears of the Nekomata yokai, said to be transformed from a house cat. Mononoke Level |Male-HeadPhones|L
611FB6C3-429440B9-BD054D94-AC7E4DE1|Tennis Sun Visor (Large, White, Men)|A slightly large sun visor worn by tennis athletes. Coolness |Male-HeadPhones|P
619E5D16-296A4CC6-990474EF-8512B777|Knit Beanie, Small (Black, Men)|A knit cap with ear flaps. This type matches easily with thinner hairstyles. Warmth |Male-HeadPhones|L
61C82E4D-AEC5450D-8C18ACD7-514D059A|Party Hat (for Male)|Organize a party and send this celebratory item to all your friends.|Male-HeadPhones|L
61D7386B-19A84B24-AA00A0A8-8EC14130|Retronaut Headset - Z1726 (for Male)|Fool Throttle now caters for Space Travellers too. Grab the latest in Galactic Leisurewear.|Male-HeadPhones|L
61F5474D-CBD04854-9A332581-7A9E8A9E|Knit Beanie, Small (Red, Men)|A knit cap with ear flaps. This type matches easily with thinner hairstyles. Warmth |Male-HeadPhones|L
6259E9F8-FE7E463A-ABC4223C-7A0B6E94|Catchers Mask (Black, Men)|Catchers mask used by a baseball player. Defensive Strength Coolness |Male-HeadPhones|L
627F5B9D-D0424F58-B1C68B51-4DAF837C|Buck Antlers (male)|Buck Antlers, a fashion statement and an awesome stage name.|Male-HeadPhones|L
6290D2B5-DB9D48A2-AFEB448C-CF6837FB|World Flag Icon - Scotland (Male)|Show your love for this country by wearing this world flag icon.|Male-HeadPhones|L
62AA356A-48624866-B8A89309-759AD0F4|Red Tabby Cat Ears (Men)|A Head Accessory That Has A Cat Motif.|Male-HeadPhones|S
632473D9-C7684114-B3FD0157-8EEE2664|Straw Boater Hat (High, Black, Men)|A very sturdy hat made of wheat straw. High placement type makes it easy to coordinate with high-volume hairstyles. Defensive Strength Tropicalness |Male-HeadPhones|L
6362F016-FBBD48DB-A61765FE-072BEDFC|Delirious Squid Headphones - Sterling|Like an underwater bullet, Delirious Squid is sleek and deadly.|Male-HeadPhones|L
63724660-A1424513-B6F62880-DF2A8225|Married Status Symbol (Male)|Let everyone know youre taken.|Male-HeadPhones|L
63B0ADA0-2D964BD6-8C2BBAA7-421C8196|Hibiscus Hair Accessory (Pink, Men)|A large, pink tropical hibiscus and plumeria hair accessory.|Male-HeadPhones|L
63B9388F-8ACF4E97-83EC6C1E-8CAD8C99|Rave Yellow Horns|Long live the party. Rave Party is the ideal collection for all those who love to go out to have fun and dance. Dare to combine different designs and create your own style.|Male-HeadPhones|L
63D1E3F6-3CE247F4-AC6816DC-DC7E90C7|Kikai Mask (Men)|Mask designed with a Kikai soldier pattern. *Only available for event|Male-HeadPhones|L
63EB3B80-BC0A4ED4-934E1A3A-28530634|Medium Hat Small (black & Red Line Male)|Casual Medium Hat. Defense Coolness |Male-HeadPhones|L
640BDF2B-6B904451-9218B459-822B12A4|Loco Badge (BuiBui mens)|These badges feature characters from the LocoRoco series. Clip them on your hair or hat to accessorize.|Male-HeadPhones|L
6414234C-C3E24497-AEE473A9-A8284937|Knit Beanie, Small (Blue, Men)|A knit cap with ear flaps. This type matches easily with thinner hairstyles. Warmth |Male-HeadPhones|L
64816FD3-37A346FB-BCDD3C72-9CE0D744|Straw Hat (Brown, Men)|A very sturdy hat made of wheat straw. Defensive Strength Tropicalness |Male-HeadPhones|L
6514C804-E8384209-A0A8FF21-4E5ADB68|Retro Headphones (for Male)|If they love antiques, music, or both, youre onto a winner.|Male-HeadPhones|L
6596F9CD-3A74482E-9F774018-D85E586B|Straw Hat (White, Men)|A very sturdy hat made of wheat straw. Defensive Strength Tropicalness |Male-HeadPhones|L
659F6FB1-FD0E4D7B-8150CE9E-CA9DA679|HGL Head Symbol - Undead (Male)|A floating Undead symbol for supporters.|Male-HeadPhones|L
65D43527-F361432B-8E67DE3C-BBF4AF61|Tennis Sun Visor (Small, Red, Men)|A slightly small sun visor worn by tennis athletes. Coolness |Male-HeadPhones|L
66070CF4-4BF64858-B9023ACD-D58131AA|Straw Hat (Male)|Male HeadPhones Mugiwara2|Male-HeadPhones|L
663333C0-0FDC4FD7-8FAFEF0E-BBA69158|Silent Night Silk Hat (Green, Men)|A silk hat perfect for Silent Night. Defensive Strength |Male-HeadPhones|L
66735287-220047BA-8227E8A5-CB80035F|Knit Cap, Medium (White, Men)|White knit cap that you can combine with your hairstyle of choice. Size M Coolness |Male-HeadPhones|L
66973361-F68D444C-82B96AE5-6E6EF33B|Flirt Crown|Youre the hottest guy in town. Wear this crown to let everyone else know who is the  1 hottie.|Male-HeadPhones|L
66AAB46F-FC094F1B-B01FED0D-D75715D3|Category Beast Species Gold Medal For Men|Male HeadPhones LPmedal|Male-HeadPhones|S
66B80D4D-1F954E3F-977C7BD8-1F86F958|Knit Cap, Medium (Black, Men)|Black knit cap that you can combine with your hairstyle of choice. Size M Coolness |Male-HeadPhones|L
66BB4A8F-7A4C4120-90C2CA3F-728E4BA9|Attack-type Partner, Dog Mask, Straight (Men)|A mask of a partner robot of the Granzella Self-Defence Force, worn properly.|Male-HeadPhones|L
66E347F2-E78B48DE-BCB4CE1D-B53B9F31|Attack-type Partner, Dog Mask, Crooked (Men)|A mask of a partner robot of the Granzella Self-Defence Force, worn in a crooked position.|Male-HeadPhones|L
66FB7795-B6714B95-B3F79F22-F3ADF223|Anime Animal Attire Fox Ears - Gray (for Male)|If youre feline foxy (get it?) then dress up in these animal inspired items. Very Kawaii.|Male-HeadPhones|L
672A87C6-68024F9C-A60C8574-67835F1B|Toy Arrow Novelty Hat|Its a toy arrow through the head novelty hat. Classic..|Male-HeadPhones|L
67C0AB81-E9554435-A9BCF78C-95BC3204|Spider deely boppers (Men)|Worn atop ones head the last minute dash for something to wear for the nights events. Exclusive to Acorn Meadows Park Halloween.|Male-HeadPhones|L
685BDF25-48D44D1B-B0FCFBEC-F582BCD2|Helmet Of Steel (Male)|Tough Helmet Made Of Forged Steel Plates. (From Semi-Finalist Fantasia) Defense , Attributes - It Is Attached To Headphones.|Male-HeadPhones|L
68AE29F5-685D4CCD-A3C52105-07558B19|Recovery-type Partner, Rabbit Mask, Straight (Men)|A mask of a partner robot of the Granzella Self-Defence Force, worn properly.|Male-HeadPhones|L
693B2283-88EB4BD3-974BE498-AB5DC7E2|Bundled Back Hair (black String Male)|Bundled Back Hair With String That Can Be Combined With Normal Hairstyle.|Male-HeadPhones|L
693EDAB3-2D134D58-93DE1A3B-E9AE9375|Tennis Sun Visor (Small, Light Blue, Men)|A slightly small sun visor worn by tennis athletes. Coolness |Male-HeadPhones|L
695896E4-16F94772-BC17DA23-8F488566|Knit Cap, Medium (Green, Men)|Green knit cap that you can combine with your hairstyle of choice. Size M Coolness |Male-HeadPhones|L
6978B3E7-EAE942A6-8BA26DF2-3B58BFA5|Tennis Sun Visor (Large, Light Blue, Men)|A slightly large sun visor worn by tennis athletes. Coolness |Male-HeadPhones|L
69B0E004-4B2240E6-BF28E1B9-34FDA689|Brown Tabby Cat Ears (Men)|A Head Accessory That Has A Cat Motif.|Male-HeadPhones|L
69EA70BB-F21743FD-B9ACBFE9-1FACED60|Knit Cap, Small (White, Men)|White knit cap that you can combine with your hairstyle of choice. Size S Coolness |Male-HeadPhones|L
6A0205C5-C1D948FA-B1E05EC7-C3E96A19|Recovery-type Partner, Rabbit Mask, Crooked (Men)|A mask of a partner robot of the Granzella Self-Defence Force, worn in a crooked position.|Male-HeadPhones|L
6B0B0E19-BE5F4A63-B238AD86-A1A8E738|Wind and Earth Headdress (Small, White Feather and Green Feather)|Hair decoration worn by the people of the Wind and Earth. Wind and Earth Level |Male-HeadPhones|L
6B2601A5-2F1F41B5-8DF28F88-3C6E0AD0|Knit Beanie, Medium (Brown, Men)|A knit cap with ear flaps. This type is a standard size. Warmth |Male-HeadPhones|L
6B54CCE7-A29643F9-8348684B-9409FBD7|Wind and Earth Headdress (Large, White Feather and Green Feather)|Hair decoration worn by the people of the Wind and Earth. Wind and Earth Level |Male-HeadPhones|L
6B7352EA-20AC4A52-AA29F8EF-820AEEDC|Raver - Ram Horns|Capture the attention of everyone around as you dance with these colorful horns.|Male-HeadPhones|L
6BDB7101-2A554862-822FB215-CEC661C9|Straw Hat (Black, Men)|A very sturdy hat made of wheat straw. Defensive Strength Tropicalness |Male-HeadPhones|L
6BDEDFB1-08704219-8366A11E-794F29CB|Beam Samurai Headset (Male)|Headset Made For Beam Samurai. Defense Against Mononoke Extermination - Defense Against Kikai Machines Resistance To Kikai Machines |Male-HeadPhones|L
6C169CD6-FCBC4FF3-B3A67296-AE88582E|Knit Cap, Large (White, Men)|White knit cap that you can combine with your hairstyle of choice. Size L Coolness |Male-HeadPhones|P
6C1CFA40-769C4168-8AA432E5-69BC3530|Seductive Wizards Hat (Purple, Men)|A wide-brimmed pointed hat. Defensive Strength Magic Power Sexiness |Male-HeadPhones|P
6C2C526A-2B184A0C-93400069-B7D0531F|Knit Cap, Large (Black, Men)|Black knit cap that you can combine with your hairstyle of choice. Size L Coolness |Male-HeadPhones|L
6C62342B-DACA4D0C-9DB588E3-C9F65751|Moisture Dark (Male)|Moisture Growing Down To The Side Of Mouth. Coolness |Male-HeadPhones|L
6C68E045-B8C045C5-9A91052F-E1D35058|Knit Pilot Cap Large (brown Male)|Knit Hat With Ear Pads. This Type Is Easy To Match With Voluminous Hair. Warmth |Male-HeadPhones|L
6C884A0F-773D48AF-B9348930-6B679648|Knit Beanie, Medium (Black, Men)|A knit cap with ear flaps. This type is a standard size. Warmth |Male-HeadPhones|L
6C990F55-8C57474C-A81F73C4-FF55F438|Gold Paper Helmet For Boy|Male HeadPhones PaperHelmet Gold|Male-HeadPhones|S
6D044315-FECC4324-838A9F33-AF560022|Two-horned shiny demon (short, purple, male)|Two-horned shiny striped demon.|Male-HeadPhones|P
6D142120-179F496A-8910A1E8-EC8B7419|Hachimaki With Harukas Name On The Front. Tighten It Tightly And Youll Be In High Spirits. Dont Miss The One-pointed Design On The Edge. This Item Will Be Placed In Accessories > Headphones After Purchase. Toshiyuki Kubooka 2002-2009 NBGI DynaFont Is A Registered Trademark Of DynaComware Taiwan Inc.|Male-HeadPhones|Male-HeadPhones|L
6DBEFCAB-BACE4C69-BB2E3496-534CC0A5|Category Aquatic formeters per secondilver Medal (Men)|The Certificate Of The Resercher Who Activated In Large Numbers. (Men)|Male-HeadPhones|L
6E317D20-80E74FCC-9701B86F-111222DB|Head Horns|Head Horns|Male-HeadPhones|L
6EC97F61-17A24B58-B04A90B7-0EB014B5|Delirious Squid Headphones - Skelly Squid|SOLD - to the highest squidder.|Male-HeadPhones|L
6EEEA824-46FF41A8-8482ADF3-049ADC69|Twisthorn In Jet Black For Men|Male HeadPhones Twisthorn|Male-HeadPhones|L
6F2AF2BA-E9554F47-96F4CDB2-DDDAA60D|Nekomata Ears (Brown, Men)|The ears of the Nekomata yokai, said to be transformed from a house cat. Mononoke Level |Male-HeadPhones|L
6F2FBCB7-26F14F12-916B12B5-37ECD84F|Knit Cap, Extra-large (Black, Men)|Black knit cap that you can combine with a hairstyle with volume. Size XL Coolness |Male-HeadPhones|P
6F72ABC2-2D324A03-8E0B8284-99279C14|Raver - Antlers|Capture the attention of everyone around as you dance with these colorful horns.|Male-HeadPhones|L
6F8BB01B-79D74529-AB36E29A-DC2CE60F|Knit Cap, Extra-large (Green, Men)|Green knit cap that you can combine with a hairstyle with volume. Size XL Coolness |Male-HeadPhones|L
6FDC08C7-806A4476-B1935117-B1E76409|Anime Animal Attire Fox Ears - Blue (for Male)|If youre feline foxy (get it?) then dress up in these animal inspired items. Very Kawaii.|Male-HeadPhones|L
700E1208-C36E4604-BB9AAC45-DAD76B75|Knit Beanie, Medium (Red, Men)|A knit cap with ear flaps. This type is a standard size. Warmth |Male-HeadPhones|L
70779F45-4246420F-971E55A2-4290C19A|Elfin Ears|Elfin Ears|Male-HeadPhones|L
70BBCD5F-74B246A5-80777026-19B8307E|METAL GEAR SOLID Question Mark|METAL GEAR SOLID Question Mark|Male-HeadPhones|L
70C15441-4C2B4A91-97FC7E91-EC53903F|Straw Hat Lowered Behind The Neck Relatively Close To The Neck (black Ribbon, Male)|Straw Hat Lowered Behind The Neck, Wrapped With A Black Ribbon. Type Relatively Close To The Neck. Youthfulness |Male-HeadPhones|L
70E066EA-E2914454-9B8D6E8A-B2AD9046|Drey White High Definition Headphones (for Male)|Drey delivers all the power, clarity, and deep bass in a sleek, bold casing.|Male-HeadPhones|L
70E0F655-A02E4815-BBF80560-FCE2B945|Pale Curved Horn For Man|Male HeadPhones BuffaloHorn|Male-HeadPhones|L
712EA94D-7ECA4838-9BEC9E4D-118F305A|Delirious Squid Headphones - Humboldt (for Male)|Live dangerously.|Male-HeadPhones|L
714DEE2A-DDD14B40-81124134-AAF718CB|Black and White Cat Ears (Men)|A Head Accessory That Has A Cat Motif.|Male-HeadPhones|S
7152D4DC-83454187-830E8DBB-32C244C7|Atama Basket Of Freshly Plantain (for Men)|A Basket Full Of Freshly Plantain. It Looks Heavy, But When You Put It On Your Head, Its Not So Heavy.|Male-HeadPhones|L
715B5331-B3394EB1-8385CCFA-B67F5B31|Seductive Wizards Hat (White, Men)|A wide-brimmed pointed hat. Defensive Strength Magic Power Sexiness |Male-HeadPhones|L
71F286C4-A94C490A-A2ECAE63-ADC19399|Wind and Earth Headdress (Small, White Feather and Red Feather)|Hair decoration worn by the people of the Wind and Earth. Wind and Earth Level |Male-HeadPhones|L
72571E04-BA284206-98B49D85-0BE006F5|World Flag Icon - Wales (Male)|Show your love for this country by wearing this world flag icon.|Male-HeadPhones|L
72858C41-8DA84566-857D3D54-6A4A20D5|Wind and Earth Headdress (Large, White Feather and Red Feather)|Hair decoration worn by the people of the Wind and Earth. Wind and Earth Level |Male-HeadPhones|L
72A9F2DC-07B74937-8CD91CC3-7FE6E431|Knit Beanie, Medium (Blue, Men)|A knit cap with ear flaps. This type is a standard size. Warmth |Male-HeadPhones|L
734EB31F-44424109-AC52DB81-ED849362|David Guetta Headphones (male)|David Guetta Headphones (male)|Male-HeadPhones|L
7381E726-11334457-85087FCD-9DA33135|Knit Beanie, Large (Brown, Men)|A knit cap with ear flaps. This type matches easily with voluminous hairstyles. Warmth |Male-HeadPhones|L
73A9289F-165B4AAF-BDBCDB20-2B85E0A8|Arrow Through the Head|Arrow Through the Head|Male-HeadPhones|L
742BA6EF-B1404CFD-AFAE969E-4610F680|Kankan Hat (Black Male)|Made Of Straw, Very Hard And Sturdy. Defense Tropicality |Male-HeadPhones|L
74534513-BE744C3B-B8FB3D3F-02DB5B6B|Ladybug Antenna (For Male)|A pair of ladybug antenna.|Male-HeadPhones|L
748B1E73-51E648FD-AE2519C8-CD849345|Knit Beanie, Large (Black, Men)|A knit cap with ear flaps. This type matches easily with voluminous hairstyles. Warmth |Male-HeadPhones|L
74C30607-DC2C442C-B49BACBE-3AD02D6F|Heart Headband (Men)|A headband with two glowing hearts attached to it. Happiness |Male-HeadPhones|L
751E84A6-F05C4EDE-AF8D1EAB-BFDB58B7|Gold Fez (Male)|You can find this gift at the Giftinator 9000 from Hellfire Games.|Male-HeadPhones|L
751F1043-444B43BA-B2964114-7F056025|Cheering Hachimaki With Chihayas Name Male|Hachimaki With The Name Chihaya Kisaragi On The Front. Tighten It Tightly And Youll Be In High Spirits. Dont Miss The One-pointed Design On The Edge. This Item Will Be Placed In Accessories > Headphones After Purchase. Toshiyuki Kubooka 2002-2009 NBGI DynaFont Is A Registered Trademark Of DynaComware Taiwan Inc.|Male-HeadPhones|L
758200DB-8775444B-97E591E3-12064FCB|Knit Beanie, Large (Red, Men)|A knit cap with ear flaps. This type matches easily with voluminous hairstyles. Warmth |Male-HeadPhones|L
75DB3CC0-77D84F3D-95B20E3C-FC9C6289|Cat Ear Knit Hat (White, Male)|Knit hat with two cat ear-like projections. Cuteness |Male-HeadPhones|P
760C120C-DDA64F0D-91DB6AA3-78D14B9B|Elfs Hat (Male)|A Small Hat That Does Not Interfere With The Elfs Pointy Ears. (From Semi-Finalist Fantasia) Defense , Attribute Holy It Is Attached To Headphones.|Male-HeadPhones|L
76A60336-13314F6F-AC8EDD28-5E83A52D|Horns of the Sunless Kingdom (Male)|Master of conjuring, this is your reward for your experimental research with the Cauldron of the Sunless Kingdom.|Male-HeadPhones|L
