id|name|desc|category|thumbnail
8849F077-14C8454B-A2C2819F-5ECA4235|LMO - Bon Dance|When used, the avatar will begin to Bon Dance. Movement speed *LMO (locomotion) is a portable item.|Portable-Animation|L
886C449E-E49A4307-8994C01D-14F78FD8|Jungle Dance Pack - Loop (for Female)|Jungle Dance Pack - Loop (for Female) This pack includes the following animations Praise Celebration Elation Power Blend in with the local jungle tribespeople with these wild animations.|Portable-Animation|L
8906D2EF-B0584F76-A6347FD1-A916C31E|Delirious Squid Cybergoth Industrial Dance Pack (for Male)|Delirious Squid Cybergoth Industrial Dance Pack (for Male) This pack includes the following animations Melbourne Shuffle Dynamo Rave Ripple Cyber Dip The Serpent Dance like no one is watching, Cybergoth or not.|Portable-Animation|L
895B7B25-FD2D4CAA-BCE3FE94-E1A9DF1C|More K-Pop. Dance Pack 1 (Female)|Get ready for more amazing K-Pop dances with these bold new moves from nDreams. Includes the 4Mint dance move.|Portable-Animation|L
8B949D58-B2DA4B04-B3AAD792-91CDDF0A|nDreams Dance Pack - Body Popping (Male)|Show off the coolest moves in PlayStation Home with this pack of three body popping moves.|Portable-Animation|L
8BE2C562-EA2343FF-9D881D10-A08836BA|GST - nDreams Dance Pack - Reward|Please accept this gift as reward for your dedication.|Portable-Animation|L
8C60D8A4-6DCA408D-8C2FB6C9-14546F46|Space Walk Locomotion Pack|Float around like youre in space.|Portable-Animation|L
8CC486C3-69CD4A32-97C62648-B08D23A1|GST - Diva Pose Pack (for Female)|GST - Diva Pose Pack (for Female) This pack includes the following poses Sultry The Hourglass Muse Prima Donna Coquettish The Bombshell Showcase your inner diva with these fun poses.|Portable-Animation|L
8DDE95AD-F2B14E44-985446F6-87DDFF18|Anime Animation Pack|Impress all your friends with this collection of anime related animations.|Portable-Animation|L
8F0A90CB-F38345E1-B67F1A02-6ACD1E75|Drey Supermodel Pose Pack 3 (for Male)|Drey Supermodel Pose Pack 3 (for Male) This pack includes the following animations Attitude Melancholic Romantic Enchanting Dreamer Model behaviour returns to Drey. Find your light.|Portable-Animation|L
8FEF30D8-BC5240A3-A2B06188-E3EBE50A|GST - DanceFlash Dance Pack (Male)|This dance pack includes three DanceFlash style dances.|Portable-Animation|L
9010B632-07DB4FFD-AF9B8253-87D6D8D6|Locomotion - Bon Festival Dance|When used, the avatar starts doing the Bon festival dance. Locomotion Speed *Locomotion is a portable item.|Portable-Animation|L
908C15AF-D9B4410C-A6BDC7DF-DA18DEB1|Jungle Dance Pack (for Male)|Jungle Dance Pack (for Male) This pack includes the following animations Praise Celebration Elation Power Blend in with the local jungle tribespeople with these wild animations.|Portable-Animation|L
918AE98E-BF204188-B26B7BE8-AC8ED5D9|Yoga Pose Pack|Hold that pose. Who knew Yoga was this difficult?|Portable-Animation|L
92E21306-10EC4F1E-94F43D78-FB667B51|GST - Dance Battle 2 (Female)|Battle it out on the dancefloor with these two dance battle animations Battle and Put Down. The perfect item to accompany the Dance Battle 1 animation pack.|Portable-Animation|L
93401EE4-28124BA7-BB40FE9D-004E5CF0|GST - Dance Battle 1 (Female)|Battle it out on the dancefloor with these two dance battle animations Battle and Put Down. The perfect item to accompany the Dance Battle 2 animation pack.|Portable-Animation|L
9515A186-AF69441A-BD9D8D2C-C65A8BC9|Animal Imitations Animation Pack (for Male)|Animal Imitations Animation Pack (for Male) This pack includes the following animations Gorilla Eagle Tiger Elephant Chimpanzee Release your inner animal with these wild animations.|Portable-Animation|L
958DCC58-E51243B6-BD2D9A72-01052CC8|Paradise Health Club Yoga Poses 3 (Male)|Re-energise your soul with these new yoga poses from nDreams.|Portable-Animation|S
95C247F3-581F4977-B425BE34-DCA178B5|The Boutique Apartment Dance Pack 2 (Female)|Dance around PlayStation Home in style with this new dance pack from nDreams.|Portable-Animation|L
9638B3D5-C8BB4D69-8D1299B9-47E7747E|Anime Dance Pack|Dance the night away with this popular dance.|Portable-Animation|L
97191090-AC7F4BD5-AE14674D-4C7C7151|Party dance moves|Get in the mood for the festive season with these party dance moves. Contains classic moves for both male and female avatars the Charleston, the Shuffle, the Latin Routine, and the Sprinkler.|Portable-Animation|L
97967DAA-19164679-9B7C7AEB-C2CE8089|AVAN - Emotions Pose Pack (for Male)|AVAN - Emotions Pose Pack (for Male) This pack includes the following moves Happy Surprised Excited Sad Angry Show your true emotions.|Portable-Animation|L
98B56BC0-332143FF-A7D2692D-A61FE34F|Hip Hop Dance Pack|Show off your skills on the dance floor with this animation pack. A randomizer will string the dances together in randomized fashion.|Portable-Animation|L
99CBEC33-B70A4D80-A977F159-D5569BA1|Diva Dance|Dance like a diva in this popular dance pack.|Portable-Animation|L
9AC7FA23-911B4AC9-BFD8A5F4-D6A89720|More K-Pop. Dance Pack 1 (Male)|Get ready for more amazing K-Pop dances with these bold new moves from nDreams. Includes the 4Mint dance move.|Portable-Animation|L
9AF152B1-4B9F45BC-93DC3F36-422CAC95|Epic Moves 2 - Dance Pack 3 (Male)|The Epic Dance Moves are back. Pull even more epic moves in PlayStation Home with this new dance pack from nDreams. Includes moves such as The Kick, The Mowed Lawn and Shuffle Feet.|Portable-Animation|L
9C27EE55-D0104C31-B78057B4-7E7AB4F3|Tricking Animation Pack (for Female)|Tricking Animation Pack (for Female) This pack includes the following animations Butterfly Twist Back Flips Tornado Areal Get Tricky.|Portable-Animation|L
9CB2F9B6-30924800-86D3B956-AB6D62C7|New. K-Pop Dance Pack 1 (Male)|Get ready to Jump and Pop with this new K-Pop inspired dance pack from nDreams.|Portable-Animation|L
9D89F975-15FA4A70-BCF58CEE-30E938EB|Paradise Health Club Yoga Poses 2 (Male)|Re-energise your soul with these new yoga poses from nDreams.|Portable-Animation|L
9E1C93AE-BCB74F2E-B2CBB1AF-7823103B|Street Wear - Dance Pack 1 (Female)|A fully motion captured dance pack featuring three awesome Street Dances. Please Note Individual dances available via the Street Wear Full Body Outfits|Portable-Animation|L
9E1EC994-575442F0-AE906FB9-94FC8ACA|GST - Standing Poses - Pack 2 (Male)|This gesture pack includes 5 standing poses.|Portable-Animation|L
9EE1A8CF-BEA443D0-9AD300DF-E30AF371|The Hot Dance Pack Lust (Female)|Show off the hottest moves in all of PlayStation Home with these new motion-captured dances from nDreams.|Portable-Animation|L
9F1B9EDF-193144AA-91DE28A4-70BBB852|Jumpstyle Dance Pack (for Male)|Jumpstyle Dance Pack (for Male) This pack includes the following animations Hardjump Freestyle Shaker Hearns Hustle Jump Kick Bust out the big boy moves and put others to shame, with awesome Jumpstyle dances.|Portable-Animation|L
9F3A4C0F-C4A94A2D-B96491C8-57A39FCA|GST - Shufflin Dance (Male)|This dance pack includes 3 Shufflin style dances.|Portable-Animation|L
9FECD1D2-25B34717-AAEFC9CD-04E93996|GST - Romantic Gestures (for Male)|Pack includes Catch A Kiss, Heartfelt, Be Mine?, and The Lean In. Send them these Romantic Gestures to show you care and if youre lucky they might just strike a pose for you.|Portable-Animation|L
A279BB1D-605741B8-9A663198-CBDE8387|Winter Activities Pack (for Male)|Winter Activities Pack (for Male) This pack includes the following animations Hand Warming Shivering Slide Slip Over Snow Angel Winter has arrived and now you can show just how it affects you.|Portable-Animation|L
A30DC2C4-271543F5-BA90C667-20F68C75|Epic Moves 2 - Dance Pack 2 (Male)|The Epic Dance Moves are back. Pull even more epic moves in PlayStation Home with this new dance pack from nDreams. Includes moves such as Slap Groove, The Leg Tug and Clean Windows.|Portable-Animation|L
A45D8D2C-37B047B9-B0178AB8-FFD2867F|Spunims 1|Dance like a Sonic Spunner or dance like your dad with the S.P.U.N dance. Spell out SPUN with our 4 individual letter poses S.P.U.N|Portable-Animation|L
A4E777DF-F17044BD-B045429E-28BD1F91|GST - Ballet Dance Pack (Female)|This dance pack includes three ballet style dances.|Portable-Animation|L
A588B8A2-4A53479C-A4B7FE93-F197942D|Epic Moves 2 - Dance Pack 4 (Male)|The Epic Dance Moves are back. Pull even more epic moves in PlayStation Home with this new dance pack from nDreams. Includes moves such as The Diver, The Solo Waltz and The Head Bop|Portable-Animation|L
A6914DB7-A81148BB-87825BEF-FB00FEEA|GST - Diva Pose Pack (for Male)|GST - Diva Pose Pack (for Male) This pack includes the following poses Sultry The Hourglass Muse Prima Donna Coquettish The Bombshell Showcase your inner diva with these fun poses.|Portable-Animation|L
A768E3BF-13954835-9CA024E5-D294AEC7|Gothic Dance Pack (for Male)|Gothic Dance Pack (for Male) This pack includes the following animations Spider Webs Gothic Step Apocalyptic Bees Falling Angels Haunting Willow Break out some perculiar, macabre dances to show people just how goth you are.|Portable-Animation|L
A850E754-3AEF49B3-ACBAD252-9E11DED8|MiniBots Victory Pose Pack|Awarded for reaching level 50 in MiniBots in Serenity Plaza.|Portable-Animation|L
A85DB290-1E344334-BD764170-F6700968|GST - Standing Poses - Pack 2 (Female)|This gesture pack includes 5 standing poses.|Portable-Animation|L
A86B5F86-10BA4B7E-8C464AE7-B574E365|Robo-Punk Dance Pack 1 (Male)|Show off your dancing talents with da funkiest electronic moves in PlayStation Home.|Portable-Animation|L
A92DA047-5EC24DB3-96B78FB1-AB3E66DE|Hip Hop moves volume 1|Hip Hop fan, youll love these dances. This collection contains 5 must-have moves, made especially for you the Chicken Soup, the Phat Daddy, the Soldier Boy, Cooking, and the Sponge Mob. All moves are for both male and female avatars. This pack also contains a randomizer, chaining the moves one after the other, for a more varied effect.|Portable-Animation|L
A976F2C4-9C6D4EDA-92FDEB50-E712172E|Animanga 3D Cute Animation Pack 1|Look cute with these Animanga 3D animations. {Includes 6 animations.}|Portable-Animation|L
A9A1C68A-2FA14065-A0D63FF2-8AE1B547|Paradise Health Club Yoga Poses 3 (Female)|Re-energise your soul with these new yoga poses from nDreams.|Portable-Animation|L
AAA600B4-E5D049F0-ABF44B1E-9DF306F7|Paradise Health Club Yoga Poses 1 (Male)|Re-energise your soul with these new yoga poses from nDreams.|Portable-Animation|S
AB18979D-26BF4ACC-BA8B9024-5579F62E|nDreams Gestures - Pack 1 (Male)|Time to show off your true emotions in PlayStation Home with this pack of five unique gestures. Gestures include air guitar, hip thrust, elegant bow, taunt and jazz hands.|Portable-Animation|L
ABE52C82-8AFB47F8-90EA25FF-80AEBDD5|More K-Pop. Dance Pack 3 (Female)|Get ready for more amazing K-Pop dances with these bold new moves from nDreams. Includes the Effects dance move.|Portable-Animation|L
AC8F9224-E8194683-868A8AEE-39F038FD|Sword Fighting Animation Pack (for Female)|Defend your honor - and that of your loved ones - with this swashbuckling animation pack.|Portable-Animation|L
AE52C773-BA154CAF-96E56FFC-F6A010E6|GST - Delirious Squid Gothic Poses (for Male)|GST - Delirious Squid Gothic Poses (for Male) This pack includes the following animations Swoon Memento Mori Despair Devil Horns Enjoy the darker side of life? Let everyone know it with a macabre pose from Delirious Squid.|Portable-Animation|L
AEED0F73-225F40A9-94FEAC9F-CC4F34FD|More K-Pop. Dance Pack 5 (Female)|Get ready for more amazing K-Pop dances with these bold new moves from nDreams. Includes the Gosh dance move.|Portable-Animation|L
AFC524EB-83F642DA-B448E3CE-227B8E6D|Robot Popping - Dance Pack 1 (Female)|Recreate THE ultimate street-dance style in PlayStation Home with this new Robot Popping dance pack from nDreams.|Portable-Animation|L
B04FCBF1-2BCF4493-A86DD619-A5AAA00F|GST - DanceFlash Dance Pack (Female)|This dance pack includes three DanceFlash style dances.|Portable-Animation|L
B053DEC7-74104308-943C97E3-49CE0E51|Bollywood Dance Pack (for Female)|Bollywood Dance Pack (for Female) This pack includes the following animations The Lotus Jubilation Indira The Saran Shake Usha Take to the dancefloor and shake your booty like a true Bollywood star.|Portable-Animation|L
B11F62E9-15DD4ACC-AE2D1F5A-66CD03E0|Traditional dances|This collection of 6 classic moves contain must-have traditional dances from around the world Line-dancing for both male and female avatars, the Belly-dancing, Indian dance and Hawaiian Hula for female avatars, the Capoeira and the Cossak jumpstyle for male avatars.|Portable-Animation|L
B3076B5B-D7D341C5-B9BB07AF-920F243D|More K-Pop. Dance Pack 2 (Female)|Get ready for more amazing K-Pop dances with these bold new moves from nDreams. Includes the Shiny dance move.|Portable-Animation|L
B30AC372-8A744BE6-8B193AE9-E4923BF9|GST - Breakdance Freeze Gesture Pack (Male)|This awesome gesture pack comes with three Breakdance Freeze poses Pike, Hollowback and Baby. Before pulling off the freezes, stand there arms folded waiting for your turn.|Portable-Animation|L
B3D5A16A-C0A84C3C-802971AA-C9374185|GST - Capoeira Dance Pack (Female)|Show off with this Capoeira inspired dance pack that includes three Capoeira dances|Portable-Animation|L
B480A3B8-0F454709-A33CE6E4-1610F855|GST - nDreams Dance Pack - Retro (Female)|New dances from times gone by for your avatar including Rock n Rollin, The Twist and Saturday Night Disco.|Portable-Animation|L
B49B1939-54204F4E-ADC07A22-7F184927|The Hot Dance Pack Envy (Female)|Show off the hottest moves in all of PlayStation Home with these new motion-captured dances from nDreams.|Portable-Animation|L
B4D7120D-A6644D6C-9494815E-EDF0E10A|AVAN - Demon Dance Pack (for Female)|AVAN - Demon Dance Pack (for Female) This pack includes the following poses Swinging Limb Zombies Sway Possessed Poser The Haunted Hustle Youve been possessed by the demons of dance. Throw some, quite frankly, terrifying shapes on the dancefloor.|Portable-Animation|L
B5906011-075F426B-A092EE52-EF55FF90|Epic Moves Dance Pack 1 (Male)|Pull the most epic moves in PlayStation Home with this new dance pack from nDreams. Includes moves such as The Herman, The Dipper and The Wibble.|Portable-Animation|L
B5AB98A1-568844A7-A08F7B5A-13F70F36|GST - nDreams Gestures - Rude 2 (Male)|The perfect Gesture pack for when words just cant convey your thoughts. Includes Whatever., Face Palm, Not Listening and Stop Talking. *This is a portable item.|Portable-Animation|L
B7474E67-C4164971-B7BD1CAB-E48B6426|More K-Pop. Dance Pack 4 (Male)|Get ready for more amazing K-Pop dances with these bold new moves from nDreams. Includes the BangBig dance move.|Portable-Animation|L
B97DF598-0E0540C2-9B20BEB8-C9E601B2|Smooth Moves Dance Pack 2 (Male)|With these new smooth moves from nDreams, you can show off your sultry side with style.|Portable-Animation|L
BAF031F0-67C14540-A67C5517-3F2B0232|Rock, Paper, Scissors Pack|Need to settle a dispute? Use this pack to play Rock, Paper, Scissors with your friends.|Portable-Animation|L
BB073869-E70542C7-8D209FE4-18DB36F2|Cute Anime Poses Pack (for Male)|Cute Anime Poses Pack (for Male) This pack includes the following animations Victory Wave Aye Aye Captain Lovey Dovey Cheeky Victory Huge Heart Extra super awesomely mega cute anime poses. Enjoy.|Portable-Animation|L
BB7C1A35-070F47FD-A861C1E5-700769C2|GST - Iconic Poses - Martial Arts (Male)|Become an icon with these fantastic poses. This pack includes Battle Ready, Single Leg Strike and Power Splits.|Portable-Animation|L
BBC759B3-4E024F3F-B8FFD0D8-0DF4239D|GST - nDreams Dance Pack - World Dances Pack 2 (Female)|Show off your heritage with the World Dances Pack. Includes Japanese Fan Dance, Bhangra and Walk Like an Egyptian.|Portable-Animation|L
BBFDD8DF-99714702-A87C3C6C-21848E02|AVAN - Demon Dance Pack (for Male)|AVAN - Demon Dance Pack (for Male) This pack includes the following poses Swinging Limb Zombies Sway Possessed Poser The Haunted Hustle Youve been possessed by the demons of dance. Throw some, quite frankly, terrifying shapes on the dancefloor.|Portable-Animation|L
BC7CE23B-442A44DD-9EC9A86E-F29B644C|Street Skills Breakdance Pack 1 (Female)|Show off your dancing skills with these awesome technical moves from nDreams.|Portable-Animation|L
BD0CF507-5A374FC1-A7DF6A9C-AFC2AB2D|Street Skills C-Walk Dance Pack (Female)|Show off your dancing skills with these awesome technical moves from nDreams.|Portable-Animation|L
BD9E5B7F-6FB443B3-AA9BEFE5-5A36C9A6|Paradise Health Club Dance Pack 2 (Male)|Dance your way to vitality with this motion-captured dance from nDreams.|Portable-Animation|S
C1F4AC43-14E04D45-A99C740A-431E2DFB|Super Aurora Dance Pack (Female)|This dance pack was rewarded for joining the nDreams VR mailing list.|Portable-Animation|L
C21BFAE3-3EDA4C6A-89D8ED17-EC7D6C1E|GST - The Nightclub Flow Dance Pack (Female)|High-attitude dance moves perfect for The Nightclub dance floor.|Portable-Animation|L
C21C4CE4-3C1A4F1A-8A29B446-C9028DA3|GST - Shufflin Dance (Female)|This dance pack includes 3 Shufflin style dances.|Portable-Animation|L
C27F763D-7CB64947-93764B6B-31595B8B|GST - Iconic Poses - Dance 2 (Female)|Become an icon with these fantastic poses. This pack includes Impossible Lean, Iconic Spin and Booty Master. This is a portable item.|Portable-Animation|L
C30E9AC3-93E44E60-AFF32BF6-05534220|Street Skills C-Walk Dance Pack (Male)|Show off your dancing skills with these awesome technical moves from nDreams.|Portable-Animation|L
C3E650AE-D773402C-A3EFEC0D-1968D469|Castle Greywold Dance Pack 2 (Male)|Show off your medieval moves with this new dance pack from nDreams.|Portable-Animation|S
C68688B5-C19C446C-ACAB4F89-FFFE92C7|Paradise Health Club Yoga Poses 4 (Female)|Re-energise your soul with these new yoga poses from nDreams.|Portable-Animation|L
C7434318-710B4168-878B0B34-D7E63D64|Dance Crazes Animation Pack (for Female)|Dance Crazes Animation Pack (for Female) This pack includes the following animations Hand Jive Hip Happy Time Hop Twist Row Boat Bust out some party friendly dance moves with this fun and familiar dance pack.|Portable-Animation|L
C7495F5E-E5054D91-A989E519-64A41C83|AVAN - Air Band Animation Pack (for Female)|AVAN - Air Band Animation Pack (for Female) This pack includes the following animations Vocalist Saxophonist Guitarist Drummer Get together with your friends and perform the greatest air concert of all time.|Portable-Animation|L
C7EEC5C7-0E80493D-A7265099-589A778C|Nineties dance moves|If you liked the 90s era, youll love these dances. This collection contains 6 must-have moves, made especially for you the Las Vegas Dance, the Alphonso Shake, the Strike-a-pose choreography, the Nerd, the MC Shuffle and the Hammered Jump, in true 1990s style. All moves are for both male and female avatars.|Portable-Animation|L
C8478CE8-E1124F45-B6D98DD7-82E6C720|The Hot Dance Pack Lust (Male)|Show off the hottest moves in all of PlayStation Home with these new motion-captured dances from nDreams.|Portable-Animation|L
C938A03C-D43E4793-AC03F003-8D7E6205|Mighty Martial Arts Pack (for Female)|Mighty Martial Arts Pack (for Female) This pack includes the following animations Kick Punch Punch Combo Spinning Hook Kick Leg Sweep Defend your honour or practise spiritual well-being with these martial arts animations.|Portable-Animation|L
CAA98A69-A76B4ED5-8AB9B87C-0913C81B|Dance Warp (for Male)|Dance Warp (for Male) This animation pack includes the following dance steps 1. Hands up 2. The hop 3. Knee knocking 4. Hip thrust 5. Hip rotation 6. Play all|Portable-Animation|L
CADEC115-A81D4C89-905E3CE7-37E40F39|Anime Ninja Animation Pack (for Female)|Anime Ninja Animation Pack (for Female) This pack includes the following animations Triple Spin Teleport Slash. Kip-up Starfish Kip-up Why spend years training with monks in the mountains when you can enable this pack and show off your Ninja skills.|Portable-Animation|L
CC0C637E-1CF24FCC-8B9FB898-B954D70F|Epic Moves Dance Pack 2 (Male)|Pull the most epic moves in PlayStation Home with this new dance pack from nDreams. Includes moves such as Cat Dada, The Doogie and Jump With It.|Portable-Animation|L
CDBEE7D0-E6554283-8AA4832E-60EC695C|GST - New. Toprock Dance Pack (Male)|This dance pack includes three Toprock style dances.|Portable-Animation|L
CDFDF1E7-F19E4404-813D4E0F-D1FF2EFB|Relaxed Poses Pack Two (for Female)|Relaxed Poses Pack Two (for Female) This pack includes the following animations Rest Eastern Squat Thoughtful Kick Back Puppy Sit More chilled poses to recline and relax in.|Portable-Animation|L
CF7E05FC-9C0548A9-B32F7971-1110C14F|More K-Pop. Dance Pack 4 (Female)|Get ready for more amazing K-Pop dances with these bold new moves from nDreams. Includes the BangBig dance move.|Portable-Animation|L
CFA8BF1A-7BB74906-82EB95E0-67083CAB|GST - Lockwood Anime Pose Pack (for Male)|GST - Lockwood Anime Pose Pack (for Male) This pack includes the following poses Triumphant Wallflower Chillax Peace, Out. Ooh, Fashion. Put together an anime cosplay costume, or maybe just an outrageous outfit. Lockwood has all the finishing touches.|Portable-Animation|L
CFE3EA6F-AE2341AE-982C17A1-B11EF3AF|Street Skills Breakdance Pack 2 (Male)|Show off your dancing skills with these awesome technical moves from nDreams.|Portable-Animation|L
D06DFF7E-AB3B442E-9F71424B-90EAD008|The Hot Dance Pack Passion (Male)|Show off the hottest moves in all of PlayStation Home with these new motion-captured dances from nDreams.|Portable-Animation|L
D09619F6-13694A79-A7C65FAD-217F5B2D|AVAN - Pop Dances Cult Icons Pack for Female|Pop Dances Cult Icons Pack for Female. This pack includes the following animations The Twister (Female) The Shooter (Female) The Deep Blue (Female) Give the gift of awesome dance moves to that friend with two left feet.|Portable-Animation|L
D191366C-824A485F-8710E11F-8C73AADE|Eighties Dance Moves|Party like its 1980 dance like a pop-star of the eighties. Those classic moves are for both male and female avatars the Zombie choreography, the Egyptian walk and the air-guitar.|Portable-Animation|L
D1BE8403-92424680-98FF0112-702744F4|GST - Retro Villain Animation Pack|This retro pack contains the Villain run, idle and emote from the Retro Villain Full Body Outfit. This item is for both male and female avatars. This is a portable item.|Portable-Animation|L
D4C65336-8C454F18-9E082AAA-C32CDCD4|Under The Weather Animation Pack (for Female)|Under The Weather Animation Pack (for Female) This pack includes the following animations Faint Headache Retch Stomach Ache Trip Get well soon.|Portable-Animation|L
D4FD0388-E4A84340-BAFB0559-78495F59|GST - nDreams Dance Pack - Famous (Female)|Instantly recognisable dances from some classic music videos. Includes Shake It., Single Person and The Madge.|Portable-Animation|L
D5AD9373-06D04614-8F27D3C7-220E9E03|Undead Dance Pack|Gather your friends and dance like the living dead.|Portable-Animation|L
D6B41731-1B5E40E8-A5AC9881-7C714A15|GST - K-Pop Dance Pack (Male)|This dance pack includes three K-Pop style dances Hocus-Pocus, Lipgloss and Run, Run, Run.|Portable-Animation|L
D7284FF2-17384213-BEE9B552-BCCDA06B|Comedy Dances|This pack contains 3 irresistibly funny dance moves inspired by comedy movies the Warp Dance, the Head Bobbing and the Stupid Run. All moves are both for male and female avatars.|Portable-Animation|L
D7880427-BE6D48B7-833332D5-84B6675C|00s dance moves|Equip this collection of 3 dances to party like in the noughties the Heel-Toe move, the Pop, lock and drop it move, and Krumping. This dance can be performed by both male and female avatars.|Portable-Animation|L
D86AE9B6-B2644EBA-9C159099-EFC79928|Glitchy Animation Pack (for Male)|Glitchy Animation Pack (for Male) This pack includes the following animations Pose Chat Laugh Beckon Walk Perform some everyday actions with added glitchy effect.|Portable-Animation|L
D8A25401-D7274F55-9D0CD768-B7AB210C|Drop Science Pose Pack (for Female)|Drop Science Pose Pack (for Female) This pack includes the following poses Chill All That Flava Break It Down Drop some Science.|Portable-Animation|L
D8DF46C8-03434055-8E9C1E68-305979D3|GST - Relaxed Poses Pack (for Male)|GST - Relaxed Poses Pack (for Male) This pack includes the following poses Polite Elbow Lean Knees to Chest Front Lie Down Recline Relax and chat with your friends in these comfortable, chilled out poses.|Portable-Animation|L
DA163C81-D96D4B92-BD4A4B55-466F2154|Aerial Swimming|Go on, you know you want to.|Portable-Animation|L
DA76A35E-572345E7-892CFF2D-0841C83A|Bollywood dance|Equip this item to execute a choreography inspired by Bollywood movies. This dance can be performed by both male and female avatars.|Portable-Animation|L
DAD335C1-CAEC48D3-94225D73-59BB5D35|GST - Kung Fu Dance Pack (Male)|This dance pack includes three awesome Kung Fu style dances.|Portable-Animation|L
DC0C6BAF-1236465D-BD3B63FE-2E02D430|Smooth Moves Dance Pack 1 (Female)|With these new smooth moves from nDreams, you can show off your sultry side with style.|Portable-Animation|L
DF3EE24E-20564A82-8EFEB843-C3AFC7A5|Get it Started. Party Anim Pack (for Male)|Get it Started. Party Anim Pack (for Male) This pack includes the following moves Befuddled Knockin Knees Easy, Tiger. Get it Started. Party long into the night with this fun, quirky animations.|Portable-Animation|L
DF797C4F-856148D7-87BE8245-64171066|The Hot Dance Pack Aspire (Male)|Show off the hottest moves in all of PlayStation Home with these new motion-captured dances from nDreams.|Portable-Animation|L
E01C4CCA-16FF45DF-B3AFB34E-7E56A460|GST- Hero Pose Collection (Male Defense)|Pose Collection To Color The Main Character. 4 Gestures GST (Gestures) Is A Portable Item.|Portable-Animation|L
E02C68DF-42944D09-9DB932A1-02AD86A3|New. K-Pop Dance Pack 1 (Female)|Get ready to Jump and Pop with this new K-Pop inspired dance pack from nDreams.|Portable-Animation|L
