id|name|desc|category|thumbnail
E070F983-B2014A7D-8EE51309-9891CDDF|AVAN - Fool Throttle Fortune Teller Dance Pack (for Female)|This pack includes the following dances - Traditional, Theatrical, Mesmerise, and Celebration. After a hard day telling fortunes, dancing is a fantastic way to unwind.|Portable-Animation|L
E1702A20-70484369-9A7B8D5C-25C6EEBF|Tricking Animation Pack (for Male)|Tricking Animation Pack (for Male) This pack includes the following animations Butterfly Twist Back Flips Tornado Areal Get Tricky.|Portable-Animation|L
E179B8D2-3F9F4B4D-84C6525C-AD55DA58|Werewolf EMT|Run with the pack with these hair-raising werewolf-themed animations.|Portable-Animation|L
E23F1732-AE2B4D54-9006D42E-A294D49D|Anime Ninja Animation Pack (for Male)|Anime Ninja Animation Pack (for Male) This pack includes the following animations Triple Spin Teleport Slash. Kip-up Starfish Kip-up Why spend years training with monks in the mountains when you can enable this pack and show off your Ninja skills.|Portable-Animation|L
E2FC2D26-AEA6493B-A66CC38C-FFC6C5B4|The Hot Dance Pack Aspire (Female)|Show off the hottest moves in all of PlayStation Home with these new motion-captured dances from nDreams.|Portable-Animation|L
E353C209-8C0841C9-9AA55345-DC5FA0C2|Castle Greywold Dance Pack 1 (Female)|Show off your medieval moves with this new dance pack from nDreams.|Portable-Animation|L
E35579C7-5D8B454B-B4E19797-42D5D9EC|GST - Floor Poses - Pack 1 (Male)|This gesture pack includes 5 floor poses.|Portable-Animation|L
E36311C6-2E7C49E6-85099573-48EB22A6|Awards Show Dance|This is how you dance at an Awards Show.|Portable-Animation|L
E3E84B2B-17F54227-B269BA93-8143B071|GST - nDreams Gestures - Love (Female)|Show those special to you exactly how you feel with the Love Gestures Pack. Includes Flirty Kiss, Hair Flick, Serenade, Love Heart and Swoon.|Portable-Animation|L
E41CAF58-A5E84BD6-A556F655-934CBDB5|The Hot Dance Pack Envy (Male)|Show off the hottest moves in all of PlayStation Home with these new motion-captured dances from nDreams.|Portable-Animation|L
E44FC479-87C94888-AFB5BE19-8BE606DF|Under The Weather Animation Pack (for Male)|Under The Weather Animation Pack (for Male) This pack includes the following animations Faint Headache Retch Stomach Ache Trip Get well soon.|Portable-Animation|L
E4C3A0B6-8BC54996-8BF82641-C0D5A57B|GST - Show Off Gestures Pack (Male)|Anything your friends can do you can do better with the Show Off Gesture Pack. Show off with a couple of idle poses and then bust out a Handstand or a one handed push up. For the real show off in you how about the no handed push up? This item is a portable item.|Portable-Animation|L
E4D980A6-8D8145A2-A9EE32CB-ADAC7A09|Street Moves Animation Pack 2 (Male)|You wanted the ability to pull off more dance moves in PlayStation Home and now you can. This animation pack contains moves taken from the Street Moves Character Collection DJ Spanner, Embarrasing Dad and B-Boy.|Portable-Animation|L
E6B231A7-717B42D9-BD6EBE6E-5EB22695|Epic Moves 2 - Dance Pack 4 (Female)|The Epic Dance Moves are back. Pull even more epic moves in PlayStation Home with this new dance pack from nDreams. Includes moves such as The Diver, The Solo Waltz and The Head Bop|Portable-Animation|L
E7A609BD-C80446CB-B8B3D508-394EA24E|Monarch of Pop Dance Pack (Female)|Show off your best moves in PlayStation Home with this new pop icon dance pack from nDreams. Contains the Monarch of Pop dance moves.|Portable-Animation|L
E7E51233-063A44E3-ABE6A9E7-EB0E434F|Smooth Moves Dance Pack 1 (Male)|With these new smooth moves from nDreams, you can show off your sultry side with style.|Portable-Animation|L
E80015F1-597B4C15-BA6CF5E5-3338D7F5|The Hot Dance Pack Slick (Female)|Show off the hottest moves in all of PlayStation Home with these new motion-captured dances from nDreams.|Portable-Animation|L
E8524C9F-6C704C28-B8DEC69D-0504AA8C|Work Out Animation Pack|Get in shape with these work outs. How many push ups can you do?|Portable-Animation|L
EA00DEA3-FDCB4B31-98DF1F47-F6B0D959|Get it Started. Party Anim Pack (for Female)|Get it Started. Party Anim Pack (for Female) This pack includes the following moves Befuddled Knockin Knees Easy, Tiger. Get it Started. Party long into the night with this fun, quirky animations.|Portable-Animation|L
EA906601-CF8E4799-B59EE0A4-0F14F69C|Sword Fighting Animation Pack (for Male)|Defend your honor - and that of your loved ones - with this swashbuckling animation pack.|Portable-Animation|L
EA975544-E02A4F7C-B76C777D-BF1F2271|Rock, Paper, Scissors gestures|With this collection of 3 gestures, you can play the game of Rock, paper, scissors anywhere in PlayStation Home with your friends.|Portable-Animation|L
EB9DD86C-49AE43CC-860B171E-87B6A574|Locomotion - Bon Festival Dance|When used, the avatar starts doing the Bon festival dance. Locomotion Speed *Locomotion is a portable item.|Portable-Animation|L
EBA56AEF-E9154457-842F3B54-347775FD|The Hot Dance Pack Passion (Female)|Show off the hottest moves in all of PlayStation Home with these new motion-captured dances from nDreams.|Portable-Animation|L
ECEF452D-B8E9444F-99AE8304-5019CC58|Smooth Moves Dance Pack 3 (Male)|With these new smooth moves from nDreams, you can show off your sultry side with style.|Portable-Animation|L
EDA20DBB-1B4141BC-8290604C-889036F4|The Hot Dance Pack Desire (Female)|Show off the hottest moves in all of PlayStation Home with these new motion-captured dances from nDreams.|Portable-Animation|L
EDF15626-F2394DAA-ADA083F4-F1A1D592|Foal Epic Gig Dance Pack (for Female)|This pack includes the following moves Mellow, Fist Pump, Raise the Roof, Seaweed, Sway and Clap Clap. Whether its a mellow affair or a performance to raise the roof, party like its the best gig of your life.|Portable-Animation|L
EE7FF203-1B774588-BE959D1E-4DE1EFF1|Jungle Dance Pack (for Female)|Jungle Dance Pack (for Female) This pack includes the following animations Praise Celebration Elation Power Blend in with the local jungle tribespeople with these wild animations.|Portable-Animation|L
EFBF9E16-ED324AB2-AF9E1071-975389CB|Disco Fever|This pack contains the worlds most famous disco routine seen in a musical movie. This animation is both for male and female avatars.|Portable-Animation|L
F01567E0-454446A2-B3F596A5-A836AA2D|AVAN - Air Band Animation Pack (for Male)|AVAN - Air Band Animation Pack (for Male) This pack includes the following animations Vocalist Saxophonist Guitarist Drummer Get together with your friends and perform the greatest air concert of all time.|Portable-Animation|L
F02A2B91-06434F36-A95E54DA-E7483864|The Secret Party Garden Dance Pack 2 (Female)|Dance the night away with this new dance pack from nDreams.|Portable-Animation|L
F04F15BF-D3CA4A3B-90F7DFE6-BA7D874F|Epic Moves 2 - Dance Pack 3 (Female)|The Epic Dance Moves are back. Pull even more epic moves in PlayStation Home with this new dance pack from nDreams. Includes moves such as The Kick, The Mowed Lawn and Shuffle Feet.|Portable-Animation|L
F07AEB26-2BA748A9-A906185F-15E78515|AVAN - Bright Lights Pop Dances Music Icon (for Female)|This pack includes the following dances Pop Pirouette, High Kick, and Big Finish. Your friends will impress with some smooth moves. Includes a bonus custom walk anim thats sure to give a new perspective on the world.|Portable-Animation|L
F0B2A558-2B7B46EB-A2EC2202-90D51E85|nDreams Gestures - Pack 1 (Female)|Time to show off your true emotions in PlayStation Home with this pack of five unique gestures. Gestures include air guitar, hip thrust, elegant bow, taunt and jazz hands.|Portable-Animation|L
F14EA845-EC164ED8-A184CB91-138B6A64|The Boutique Apartment Dance Pack 2 (Male)|Dance around PlayStation Home in style with this new dance pack from nDreams.|Portable-Animation|L
F23FC59A-4DB54735-A5EB3011-99E8AEB2|AVAN - Anime Dance Pack (for Male)|Lockwood Anime Dance Pack (for Male) This pack includes the following dances Huzzah. Pussycat Punch the Sky Nya-na-na-na Nya Nya Slinky Side Shuffle Under the Sea Be the star of your very own anime pop video Lockwood has just the right dances to make it happen.|Portable-Animation|L
F3328CE1-FA9F4089-934267E6-E3CBB0C3|Dastardly Plan Poses Pack (for Female)|Dastardly Plan Poses Pack (for Female) This pack includes the following animations Stroking Chin Rubbing Hands Head Scratch Eureka. No Plan Hatch a dastardly plan, or a hopeless one, with this unique animation pack.|Portable-Animation|L
F3934F82-EE894AA3-96D81A77-9E82D639|Paradise Health Club Yoga Poses 4 (Male)|Re-energise your soul with these new yoga poses from nDreams.|Portable-Animation|S
F41F0586-E1C34681-B678D110-9B270B73|Iron Fusion Flow Motion Animation Pack (for Female)|Iron Fusion Flow Motion Animation Pack (for Female) This pack includes the following animations Praying Mantis Bullet Dodge Slow Kick Somersault Defy time and gravity in future epic battles with this slow motion fight pack from Iron Fusion.|Portable-Animation|L
F45CC323-EE8C43F6-9E6D1DFB-CDE5D3E2|Street Skills Breakdance Pack 1 (Male)|Show off your dancing skills with these awesome technical moves from nDreams.|Portable-Animation|L
F47C7907-89C64314-88580759-F35156E6|Smooth Moves Dance Pack 2 (Female)|With these new smooth moves from nDreams, you can show off your sultry side with style.|Portable-Animation|L
F5891986-32514B73-B553A073-AE239970|Vampire EMT|Embrace the darkness with these mesmerizing vampire-themed animations.|Portable-Animation|L
F5A2EFFE-A2E64D97-A1418BB0-2EEA1023|AVAN - Anime Dance Pack (for Female)|Lockwood Anime Dance Pack (for Female) This pack includes the following dances Huzzah. Pussycat Punch the Sky Nya-na-na-na Nya Nya Slinky Side Shuffle Under the Sea Be the star of your very own anime pop video Lockwood has just the right dances to make it happen.|Portable-Animation|L
F6C0B981-802F42A8-920707AD-2D89D3AD|New. K-Pop Dance Pack 2 (Male)|Join the K-Pop Generation with this new dance pack from nDreams.|Portable-Animation|L
F77D611E-8AA14C0E-9C023EE3-3B1C93AB|David Guetta Heart|David Guetta Heart|Portable-Animation|L
FA76B7EA-35064402-B2ECC3E4-04CA4B25|Castle Greywold Dance Pack 1 (Male)|Show off your medieval moves with this new dance pack from nDreams.|Portable-Animation|L
FBEB8122-B32F44D2-8FE90FAE-59D34281|Animanga 3D Dance Pack 1|Shake your hips with these dance moves.. {Includes 6 animations.}|Portable-Animation|L
FCD1977C-EA7E4F63-BA7DE167-067B2DBA|GST - Floor Poses - Pack 1 (Female)|This gesture pack includes 5 floor poses.|Portable-Animation|L
FD8F9131-1E2B4D1F-83A395CB-6156D435|Paradise Health Club Yoga Poses 2 (Female)|Re-energise your soul with these new yoga poses from nDreams.|Portable-Animation|L
FE126228-5B984AA8-8099CBD5-1AC2F4CC|Bollywood Movie Dance|A famous dance from a Bollywood movie.|Portable-Animation|L
FE38B480-BBC746AE-84EE723F-090523AB|Techtonik Dance Pack (for Male)|Techtonik Dance Pack (for Male) This pack includes the following animations Achilles Heel Breton Bounce Au Revoir. Cest Chaud Danse Macabre Bust out the latest street moves to impress your crew.|Portable-Animation|L
FE4F64FF-495548B9-BE076EC1-97FC5F27|Shuffling Animation Pack (for Female)|Shuffling Animation Pack (for Female) This pack includes the following animations T-cross Kick Step Spin Cycle Shuffle Back Every day youre shuffling, with this modern urban dance pack.|Portable-Animation|L
FF162EF5-21674587-9BEA836C-5962BDAC|Drey Supermodel Pose Pack 3 (for Female)|Drey Supermodel Pose Pack 3 (for Female) This pack includes the following animations Attitude Melancholic Romantic Enchanting Dreamer Model behaviour returns to Drey. Find your light.|Portable-Animation|L
