id|name|desc|category|thumbnail
E7E13496-E0DC405B-A0692347-E0E3D665|LKWD Venue|The perfect location for all your social events, the Venue includes Interaction points allowing you and your friends to utilise unique animations In depth customization options including optional features like the Stage and the Runway A voting minigame Your own personal LKWD Store An integrated Lockwood Gift Machine Be the ultimate host with the LKWD Venue.|System-ResourcePack|L
E8414353-0AFB4A66-8C82F8B0-044D7331|Bare|Bare Style Pack|System-ResourcePack|L
E892093C-70BE47EF-B1EF71D0-FF015186|Fishing|Which Is A Test Of A Fishing Game|System-ResourcePack|L
E9B9BFFF-079847B5-9E0DE032-524A8A2A|MotorStorm Pacific Rift|MotorStorm Pacific Rift|System-GameLaunching|S
EA306D4A-54604EBA-A695A5B4-E98A7246|Avatar Interaction Resource Pack|A resource pack for the avatar interaction portable|System-ResourcePack|L
EB17FBC1-1AB848CA-B3F2CF16-44AB271F|AMP Resource Pack - Activity - Thanksgiving - Dodgems|This contains all the resources needed for Acorn Meadows Park Dodgems.|System-ResourcePack|L
EB597CE1-F6614CAF-B382D551-584285C8|Shin Mikuni Musou Online Corridor|A Public Space Featuring A Dragon Fountain Inspired By The Architecture Of The Three Kingdoms Period.|System-Worldmap|L
EB6ECA9F-389B4140-96F12563-BE7264F8|FrontendResource||System-Core|L
EBC672B4-BD9A4566-8E33849F-357D3BDC|The SingStar Rooms|Get your groove on to the hottest tracks in The SingStar Rooms. Listen to great music and get funky on the interactive dance floor.|System-Worldmap|L
EC184E22-ED374F77-9BB418A2-5C0BAF37|Burn Zombie Burn|Welcome to the Burn Zombie Burn graveyard laugh at our zombies, watch our trailer.|System-Worldmap|L
EC8FD5D7-F2584501-B6D301E4-234FDC0F|Base Park MiniGame|Base Class for all park interactive minigames|System-ResourcePack|L
ECF1FBD6-4A76458E-AFAFCF87-7C0E5123|Abandoned Docks|On the outskirts of the electrifying world of inFAMOUS sits the Abandoned Docks of Empire City. Here you can practice your skills in the Reaper Shock game, spread your message by tagging the Graffiti Wall, and even hear from the developers, on the Blog Site.|System-Worldmap|S
EDAEE79E-C80A4A8D-AC055F18-DFC46FA4|bird_rare_pack||System-ResourcePack|P
EE56908F-C4A84ACC-8FE57DC0-9C033F19|Everyones Picture Glittering Sands Beach|Lets Take A Picture Together. On The Beach|System-ResourcePack|P
EF22AF37-34A5483D-97706E3D-6B9BCB7A|HOME THEATRE|Keep up with the latest new releases. Watch game and movie trailers on ten exclusive screens in the Home Theatre.|System-Worldmap|S
EFE5814C-B1EC4D33-A5409578-24FD6BE2|Burn Zombie Burn|Welcome to the Burn Zombie Burn graveyard laugh at our zombies, watch our trailer.|System-Worldmap|L
F0AD0096-DC894F80-9287FACE-F1B94339|Registration Pack|Registration Pack|System-ResourcePack|L
F14C0D58-A3934173-99C50269-84DCB78C|Home Platform Group Startup Object V2|This object controls the start flow for all users.|System-Core|L
F1E4DF73-95FE4667-BB82ED8C-37C6A8E6|mintoro resourcepack|Lets Take A Picture Together. Sandy Beach Resourcepack|System-ResourcePack|P
F32CB79D-3D734BBE-8574DC8C-62B98FB3|BOWLING ALLEY|Have some fun and challenge other people at the exciting games on offer in the Bowling Alley.|System-Worldmap|L
F42E46AE-8A5B4033-8C8A6CBB-116BFE17|WWE SmackDown vs. RAW 2011|Activate WWE SmackDown vs. RAW 2011|System-GameLaunching|L
F4C4D44F-9EB54AC8-A7D7DC58-85CCE284|LOST PLANET 2 Game Launching Object|LOST PLANET 2 Game Launching Object.|System-GameLaunching|L
F567C842-255A4088-8BB672DD-5E7B18E9|Minna de SPELUNKER|Lets Go Spelunking. A Variety Of Stages Including Glaciers, Volcanoes, And Pyramids Sprawling Underground Await You. There Are Also Plenty Of Contents For Everyone To Enjoy, Such As A Multi Play Mode For Playing With Other Spelunkers Around The Territory, An Online Ranking In Which Your Exploration Records Decide Your Rank, And More.|System-GameLaunching|L
F7DB9765-36954B3F-B622B413-8B69303C|SIREN|SIRENs Most Terrifying Stage, Saiga Clinic, Has Come To The PlayStation Home World. Can You Survive?|System-Worldmap|L
FA6C3D46-BCD9472D-96D950FA-917BECC0|Killer Plants from Outer Space Level 8|Killer Plants from Outer Space Level 8|System-ResourcePack|L
FB72BDFA-E4974014-BBAB53CD-D6991E1F|Warhawk|Socialize, Strategize, Game Launch|System-Worldmap|S
FBFDE627-78C24182-998B3D04-48CFE66C|Tutorial|The tutorial shell|System-Core|L
FC998BAF-D91148B0-B55B4931-2577F5A2|devil_aqua_pack||System-ResourcePack|L
FD20F827-873E40C2-BE146A7A-7D5B506E|Oedo-version Lets Take Pictures Together.|Oedo Version Lets Take Pictures Together.|System-ResourcePack|P
