folderName|niceName|niceDesc|category|maker|hdkVersion|PremiumOrReward|fileCount|PreferredThumbnail|SceneID|TxxxVersion|Author|Comment|type|sha1|flags|uuidcount|uuids|size|timestamp|Keywords|config|desc|ChannelID|product_id_SCEE|product_id_SCEA|product_id_SCEAsia|product_id_SCEJ
9D53DE94-AF5F459F-A173D835-B1780E5B|The Secret Party Garden  Furniture Bundle|Make the party your own with this relaxing furniture bundle from nDreams. This bundle includes  The Secret Party Garden  Decorative Cushion (Patterned) The Secret Party Garden  Decorative Cushion (Mosaic) The Secret Party Garden  Decorative Cushion (Fuschia) The Secret Party Garden  Decorative Cushion (Natural) The Secret Party Garden  Beanbag (Patterned) The Secret Party Garden  Beanbag (Furry) The Secret Party Garden  Hammock (Striped) The Secret Party Garden  Hammock (Natural) Upon purchase, all items will be added to their corresponding categories.|Bundle-Furniture|nDreams Ltd.|1.86.0.17.PUB|P||L||T031|CarlaR||||||3202253A-85B74EDA-A46880FD-BE1ADC08,825AF791-67204478-983692C8-ECBC93AB,A989E4AE-24474908-9CA01304-BBA21073,B3122D62-DE2743F7-B479C42D-4DEFC58C,BFF90ECC-B0544CB6-A946A5B0-27B55DC9,D8BDE299-91A24B7D-9E67D781-706DAE9C,E398EA28-0ECF49DB-89E28FB0-8FF5608D,FCD4A8D7-C4F3483E-979BA25E-48826EAE|||||||EP4114-NPER00011_00-THESECRETP002056|UT5001-NPUR00022_00-0002420000000000||
9D6FAC1D-A7DD43A1-A9D70E46-82663D06|Swimming Float, Mat-shaped Set (Green)|2-piece set of mat-shaped swimming floats for floating in the ocean. This set includes the following items  - Swimming Float, Mat-shaped (Single Size, Green) (Decoration) - Swimming Float, Mat-shaped (Double Size, Green) (Decoration) * Upon purchase, each item will be added to the applicable category.|Bundle-Furniture|Granzella Inc.|1.70.0.93.PUB|P||L||T031|hide||||||7DFBA465-77C84E6E-9FB42438-4E58ED1C,86AB5D0B-E8F94DBC-94DDE896-0CB0BB4A|||||||EP5017-NPER00046_00-SWIMMINGFL001693|||
9D735805-6A764EEE-9C6C89FB-7E739F32|Personal Computer (White Set)|Personal Computer (White Set). This Set Contains The Following Items  * Keyboard (White) (Ornament) * Desktop Computer (White) (Ornament) * Mouse (White) (Ornament) * Monitor (White) (Ornament) When Purchased, Each Item Is Added To The Appropriate Category.|Bundle-Furniture|O-Two inc.|1.60.0.450.BETA|P||L||T032|Yoshinori Utsumi||||||5130605A-989D4599-9903B140-A2853EEC||||||||||
9E071B49-E134495B-93330FC6-4325EAFC|DIYR - Super Bundle #2|A great collection of objects to create an awesome DIY race track. This bundle includes  DIYR - Twister Lamp DIYR - Platform Lamp DIYR - Coffee Table DIYR - Bookshelves DIYR - Ramp Table DIYR - Wall Track DIYR - Half Pipe Go get the DIY Racer mini-game and turn your apartments into a race track.|Bundle-Furniture|Codeglue B.V.|1.70.0.93.PUB|P||L||T033|Tom Rutjens||||||1AE46AEC-3ADE481D-8F162D83-987764F9,1BCB5A9C-FE2B43CE-B9DC683E-55DFD5FD,46BCAF31-91FA47B4-95D1040D-6CAE072D,5D5CA8C9-B1E04049-A680BFA0-3CD298EF,9C39FE88-B274474F-80D62E04-0135B671,9DE9FAA2-DAE348BA-90E634EB-372D1211,A1731A1C-52F448CD-BD1C7079-BE352E1B|||||||EP4297-NPER00033_00-DIYRSUPERB000245|UT5007-NPUR00080_00-0014280000000000|HT4007-NPHR00016_00-0002830000000000|JT4007-NPJR50340_00-AA60170000000000
9E2E5A5E-37494356-AFC52A15-48E9B77E|Rattan Furniture Bundle|Make your life more relaxing like you are in some resort This bundle includes the following items  Round Rattan Chair Round Rattan Couch Round Rattan Table Upon purchase, the items will be placed into their respective categories.|Bundle-Furniture|Sony Computer Entertainment|1.60.0.451.PUB|P||L||T032|Sony Computer Entertainment|||||||||||||||HP9000-NPHQ00010_00-0009740000000000|
9E62EF42-42D0471D-A1B8117E-4D1FFCAF|Blueprint  Hedge Maze Bundle|Build your very own maze. This bundle comes with the following items that allows you to create your very own maze  * Blueprint  Hedge Maze - Regular Piece * Blueprint  Hedge Maze - Large Piece * Blueprint  Hedge Maze - Corner All of the above items will become available in their relevant categories once this bundle has been purchased. These items are recommended for Blueprint  Home but can be used in any personal space.|Bundle-Furniture|nDreams Ltd.|1.70.0.93.PUB|P||L||T032|Dan||||||60672AEE-599946EA-A71F6170-566239F9,819970E7-1B35426E-8D5C0E3B-7157805D,90177BE1-52904467-AC14E880-C7A375FE|||||||EP4114-NPER00011_00-BLUEPRINTH000842|UT5001-NPUR00020_00-NDBLUEPRNTHOME12|HT4002-NPHR00014_00-0005910000000000|JT4002-NPJR50260_00-AA60300000000000
9E7FED59-41384586-B18A2687-CE305F60|Curry and Rice 3-piece Set|A 3-piece set including curry and rice (regular large portions) and pork cutlet curry. This set includes the following items  - Curry and Rice, Regular Portion (Ornaments) - Curry and Rice, Large Portion (Ornaments) - Pork Cutlet Curry (Ornaments) * Upon purchase, each item will be added to the applicable category.|Bundle-Furniture|Granzella Inc.|1.75.0.85.PUB|P||L||T031|hide||||||8123F0A7-F98F4DD7-8F8684DE-81D5C65A,81ACA88F-9AA844B6-997F5F1B-134120D2|||||||EP5017-NPER00064_00-CURRYANDRI001016|||
9EB095F4-8D494A0A-AFF88419-7E717BC6|Floating Bag Mat-type Set (pink)|Two-piece Set Of Mat-type Floating Bags For Floating In The Ocean. This Set Includes The Following Items Floating Bag Mat-type (for One Person, Pink) Decoration Floating Bag Mat-type (for Two People, Pink) Decoration When Purchased, Each Item Will Be Added To The Corresponding Category.|Bundle-Furniture|Granzella Inc.|1.70.0.93.PUB|P||L||T031|hide||||||||||||||||JP0025-NPJR50380_00-AA61080000000000
9EEE65E4-EC4E4119-82CA7E7C-2E3CD15A|School Desk and Chair Set|A 9-piece set that includes variations of a teacher s desk, school desk, and school chair. This set includes the following items  - Teacher s Desk (Tables) - School Desk (Tables) - School Chair (Chairs) - School Desk and Handbag (Tables) - 2 School Desks, Spaced (Tables) - 2 School Desks, No Space (Tables) - 4 School Desks, Spaced (Tables) - 4 School Desks, No Space (Tables) - Stacked School Desk and Chair (Ornaments) * Upon purchase, each item will be added to the applicable category.|Bundle-Furniture|Granzella Inc.|1.80.0.53.PUB|P||L||T031|sigiyama||||||5C974AD1-160D4CF6-807E4945-381D9379,5DFA904E-5CC34504-92039300-C5B3ADCF,669ABB26-FA134323-B2CE237D-3C43A2B7,67A647F3-C8094E6A-9A47F81F-A7740015,680207BE-6592417E-A298C6AB-7837D361,6BB40A57-0AB34BEF-84382B48-ADE4CA19,70496809-442D425E-842F4CC8-A7BE2A03,73CAF4FA-C957490F-96101DE5-E6497B0C|||||||EP5017-NPER00064_00-SCHOOLDESK001309|||
9F2E6828-7F91435D-8A2C6306-20496A61|Las Vegas Suite Ultimate Furniture Pack|This ultimate furniture pack comes with all Las Vegas Suite furniture items including 2 active item beds, 4 active item gym items, 5 chairs, 1 footstool, 2 sofas, 8 tables, 4 rugs, 2 lamps, and 4 ornaments.|Bundle-Furniture|Sony Computer Entertainment|1.60.0.451.PUB|P||L||T033|shangqiuchen||||||001A2BC2-EABB4D0C-8B278FB5-5743F8DE,0A7A5C74-EC144614-8A15C873-0B6629B9,16277384-838342D1-B2A9DBA6-DE9A5CFF,28DF7E23-3A274B82-ADBD5085-803BFA54,48A44719-9F4748B2-B2B8C968-91CC5AC2,56F2F1C2-191F4AE0-81CD4A46-1C16B62B,5805C19D-510F46FA-9B0DAE78-845A2A07,76CA0B3C-5DE14966-A28167E2-8A996C01,7A401F5F-DC434DCD-B057FD3D-6D27CD57,7E08E2F6-C0A549F6-912BF2F3-9068D249,801437BC-36324187-87683B89-08E1C843,906F3224-0E394871-B3E65403-37BDF830,98F6D1C4-85EE42DE-982757E2-434D963A,A41AF6BE-727C45BF-95DB2135-FBDEAFBB,A62C5F66-47E24246-8CE0B6EA-34364293,B503BD62-EA534885-BD15FFCF-64F30DAF,BB4D8F5C-467C423E-883C1742-B6EBDFC8,BD926320-FAF7420C-A9E8F073-A63FE7A9,C0F31D7D-897A4584-B340DD7C-D4759A14,DB86C9A8-5C054640-90D2A551-FF83D25C,FD89C1F3-8FAC45D6-84300495-5FADBAC6||||||||UP9000-NPUQ00020_00-LSVGSSTULTFRNPK1||
9F59BABF-ACD9493E-B50A09FE-B5428782|Weapon Racks Bundle|Includes the weapons racks, bundled together and offered at a discount.|Bundle-Furniture|Sony Computer Entertainment|1.3.0.125.BETA1|P||L||T031|ppurdy||||||||||||||UP9000-NPUQ00010_00-WEAPONRACKSBUNDL||
9F810B4E-21CB4EE6-9E46A16F-BEB17E66|LKWD Venue Customization Pack - Squirrel|Unlocks further customisation options within the LKWD Venue Apartment. Important  LKWD Venue Customisation Packs can only be used in conjuction with the LKWD Venue Apartment.|Bundle-Furniture|Lockwood|1.70.0.93.PUB|L||L||T032|Lockwood||||||||||||||||
A007DA54-B3434BA5-BAE25993-F5CF265D|Breakfast 6-piece Set|A 6-piece set including simple dishes, snacks, and drinks. This set includes the following items  - Hot Dog Ornament - Eggs Benedict Ornament - Donuts Ornament - Apple Pie Ornament - Cola Ornament - Orange Juice Ornament * Upon purchase, each item will be added to the applicable category.|Bundle-Furniture|Granzella Inc.|1.82.0.17.PUB|P||L||T031|sigiyama|||||||||||||EP5017-NPER00064_00-BREAKFAST6001978|||
A0370FE3-D8FB4040-A9DE29D0-36D2F10F|Cleaning Supplies Set|A 5-piece set including 3 cleaning supply locker items, a broom, and a bucket. This set includes the following items  - Closed Cleaning Supply Locker (Ornaments) - Open Cleaning Supply Locker (Ornaments) - Open Cleaning Supply Locker, Large (Ornaments) - Bristled Broom (Ornaments) - Bucket and Dust Cloth (Ornaments) * Upon purchase, each item will be added to the applicable category.|Bundle-Furniture|Granzella Inc.|1.80.0.53.PUB|P||L||T031|sigiyama||||||78CD7A1F-19EB48D5-B96D4C62-F615EF0D,82B7D61F-E40545A2-872EB64B-2BC2CA9D,82FB15F8-EC7D4B51-AD16E188-77FE98C6,8C24FC5D-65F64053-81167FB1-0F9AA12D,90D15006-213F4EAE-B1878E5F-E86E6DF2|||||||EP5017-NPER00064_00-CLEANINGSU001310|||
A0C053C1-A16E4C42-8D48CD48-A2EA5BB5|Dinner 7-piece Set|A 7-piece professional dinner course set with a seafood theme. This set includes the following items  - Clam Chowder in Bread Bowl Ornament - Dungeness Crab Garlic Stir-fry Ornament - Seafood Salad Ornament - Beefsteak Ornament - Shrimp Salad Ornament - Cioppino Ornament - Crab Cake Ornament * Upon purchase, each item will be added to the applicable category.|Bundle-Furniture|Granzella Inc.|1.82.0.17.PUB|P||L||T031|sigiyama|||||||||||||EP5017-NPER00064_00-DINNER7PIE001979|||
A0DB8800-B5604F1D-A6216390-2CB11EB7|Laptop Set 2|Set 2 Full Of Stylish Laptops This Set Includes The Following Items Laptop Black Model (Decoration) Laptop Blue Model (Decoration) Laptop Green Model (Decoration) Laptop Pink Model (Decoration) Each Item Will Be Added To The Corresponding Category When Purchased.|Bundle-Furniture|O-Two inc.|1.60.0.450.BETA|P||L||T031|Yoshinori Utsumi||||||7ABF2C32-CC60489B-8BEAEF80-A5CEE73E||||||||||JP0085-NPJR50370_00-AA60570000000000
A10520D0-EC7840CB-B1113C89-0C0881E0|Air Conditioner Set|Set Item Of Both Interior And Exterior Equipments. This Set Contains The Following Items  Air Conditioner (wall Hanging) Compressor Unit (ornament) Items Are Added To Each Category After Purchase.|Bundle-Furniture|O-Two inc.|1.80.0.53.PUB|P||L||T031|Yoshinori Utsumi||||||19AF4DE2-A54541F0-996CF8FE-DEE42091||||||||UT5028-NPUR00240_00-0004190000000000||
A10DEF21-AE0C40A4-82AA05B8-32093E52|Paris Classical Room Ornament Set 2|It s the classical ornament bundle #2. Includes Opera Glasses, Wedgewood Teapot and Teacup, Silver sugar bowl and spoon, and a Plate with a stand.|Bundle-Furniture||1.3.2.27.PUB|P||L||T031|jcopeland||||||01FE00D6-DDE54B74-A445F7AA-4BD448CD,AFEF40EB-9E0E4174-91C55781-722835EB,C6F7ACF0-55DE44AE-9CEC7818-0154F8F0,C9637889-163943F2-92D6D23F-0E2573A8,11A11785-28AA4533-AFA1C49F-FCA30DE1||||||||UP9000-NPUQ00010_00-1JBPARISCLASOR2S||
A1A6769B-F41143C4-A1F8F893-A699D8B8|Name In Lights  Superstar Letter Bundle|Ever wanted your name in Lights. Impress your friends and feel like a Superstar with this amazing Bundle. This set includes the following items  * Name in Lights  Superstar Letter A (Ornament) * Name in Lights  Superstar Letter B (Ornament) * Name in Lights  Superstar Letter C (Ornament) * Name in Lights  Superstar Letter D (Ornament) * Name in Lights  Superstar Letter E (Ornament) * Name in Lights  Superstar Letter F (Ornament) * Name in Lights  Superstar Letter G (Ornament) * Name in Lights  Superstar Letter H (Ornament) * Name in Lights  Superstar Letter I (Ornament) * Name in Lights  Superstar Letter J (Ornament) * Name in Lights  Superstar Letter K (Ornament) * Name in Lights  Superstar Letter L (Ornament) * Name in Lights  Superstar Letter M (Ornament) * Name in Lights  Superstar Letter N (Ornament) * Name in Lights  Superstar Letter O (Ornament) * Name in Lights  Superstar Letter P (Ornament) * Name in Lights  Superstar Letter Q (Ornament) * Name in Lights  Superstar Letter R (Ornament) * Name in Lights  Superstar Letter S (Ornament) * Name in Lights  Superstar Letter T (Ornament) * Name in Lights  Superstar Letter U (Ornament) * Name in Lights  Superstar Letter V (Ornament) * Name in Lights  Superstar Letter W (Ornament) * Name in Lights  Superstar Letter X (Ornament) * Name in Lights  Superstar Letter Y (Ornament) * Name in Lights  Superstar Letter Z (Ornament) Upon purchase, all items will be added to their corresponding categories.|Bundle-Furniture|nDreams Ltd.|1.52.0.2.PUB|P||L||T031|danm||||||03BBD8C7-5E9C4F84-9E0AF9D7-BED91379,08CE48BB-531347A6-B457C343-B1B13A5B,0A83344A-6ED04AFB-A3A89567-3A149723,1CA16455-4F334503-A68ACF30-80A59EB9,2227E764-CED14885-BFCCB83C-E3D054FA,250D3C09-433043FC-BB89FAB3-FC1F588B,2F5EA1D7-3A074035-B7F3CE65-76E2C453,44C47865-71284F61-A0B4E501-220D6624,55C7BFF3-988D4E3C-87118030-7A1D1C53,633F31FD-5E1342B1-84B9125F-F2C01B00,6BC48EB8-D9904323-9CB52957-56573FD3,70DBD208-C84342CF-9F92CF45-7F0DC726,73DD3769-2E4149ED-967B2538-EE454444,80DD09ED-FA6349D6-BE8F4311-994BD2A6,84E75957-33AB443F-A17A6A67-7A96080C,A80E1055-61A14F04-9AA6C981-EBF168C8,B0CFAE82-846F4284-9EDB5B90-0C362E2E,B3C29370-69F24ECF-A54166F3-0BA71D8D,B8C337D0-F3594653-84889976-253A761D,BC2BBEAB-4CEE46AB-B576935F-0C40F226,C4C0C781-1BD74832-9B092171-523361E5,C590A1D5-9D2B4C0A-9B003DEE-E85CE3F6,C66740AF-C5524B73-B5C61584-B562F024,D1289C4E-78A5460B-8779C744-809E669E,D627CEBF-FF2E4B34-BF04EF6C-D4285FAF,D70C344E-23E64280-9E316161-F68B795C|||||||EP4114-NPER00011_00-NAMEINLIGH000287|UT5001-NPUR00020_00-NDNAMEINLITBNDL1|HT4002-NPHR00014_00-0003030000000000|JT4002-NPJR50260_00-AA90060000000000
A2140600-9A20424E-973526F3-EFA5F5CB|The Japanese Shelf Accumulated Black Set|A Simple But Good Quality Shelf. It Seems To Be Suitable For Displaying Figures. This Set Includes The Following Items For Furniture Stackable Jet-Black Japanese Shelf, Large (decorative) Stackable Jet-Black Japanese Shelf, Small (decorative) When Purchased, Each Item Will Be Added To The Appropriate Category.|Bundle-Furniture|Will Co.,Ltd.|1.66.0.144.PUB|P||L||T031|ishikawa||||||A4F6A919-203E4242-8E54A0C9-E1721B5F,F78ADB3B-13404644-A505C40D-88FBBAF1||||||||||JP0043-NPJR50420_00-AA60260000000000
A2493431-20344915-9006BB48-1CC7AA05|Delirious Squid Victoriana Gothic Furniture Value Expansion Pack - Magick|Delirious Squid Victoriana Gothic Furniture Value Expansion Pack - Magick This pack includes the following  Vampire Slaying Kit - Magick Dragon with Aragonite Statue Victoriana Gothic Bathtub - Magick Victoriana Gothic Drawers - Magick Victoriana Gothic Ornamental Birdcage - Magick Victoriana Gothic Dining Table - Magick Victoriana Gothic Confessional Chair - Magick Victoriana Gothic Dragon Head Shelf - Magick Victoriana Gothic Roaring Fireplace - Magick Albus the Taxidermy Raven Victoriana Gothic Gargoyle Table - Magick Victoriana Gothic Ledger and Keys - Magick Victoriana Gothic Ouija Board - Magick Victoriana Gothic Lamp - Magick Victoriana Gothic Sofa - Magick Specimens in Formaldehyde - Magick Red Chalk Summoning Circle Victoriana Gothic Standing Lamp - Magick Black is back, from the dead. Those misunderstood souls amongst us will appreciate this second dark collection from Delirious Squid.|Bundle-Furniture|Lockwood|1.80.0.53.PUB|P||L||T031|Lockwood||||||035A6A10-D3184398-BB2BDDCC-2B471286,0876B886-04A140FF-876E426D-3C768A51,0A965E15-40B144CB-95DA0DC8-D099D441,101C7803-74314C1D-A61B3D4C-813882A0,2A48ACA5-C8F14A7D-A7F5E00B-B36297C7,30467448-B6FC46A4-81450F78-DC3DF302,3C85EC41-18A34931-8A0F0A20-401D0908,5311C148-F3634992-8E822967-E619E2B2,554F2886-7B404E9F-8DFB1C19-9DF41217,657A14F9-50FB4B5B-B4C041FB-2FCD8FC3,69322727-79AA470B-B38B09BC-78689D91,6A8B6234-6FBE4947-9D2105D1-31C23475,7030C8E4-44BD417F-8FF2F76E-1BAC719A,81626DC7-E5DE4B9E-B07EA3A0-89596BD5,899C2979-66AE4F3E-9C815399-9783015D,B2085FD8-F1DB4175-87DC6EEE-BF7B8007,E0781A4D-A73A48B3-A771AFFD-1C71B7FD,EBF63210-2279497F-802F479F-F817BC2F,FD7F4767-402648DA-90D463F4-B43E8109|||||||EP4127-NPER00050_00-DELIRIOUSS001818|UT5000-NPUR00012_00-LKWDDELIRISOPPAK||
A2541A8C-CDF948A7-A45E8FAE-E54C89D1|Idea - Modular Sofa - Bundle - Black|This bundle is for the complete black sofa and comes with all six objects. 1. Double Seat 2. Left End Seat 3. Right End Seat 4. Corner Seat 5. Single Seat 6. Footstool|Bundle-Furniture|VEEMEE|1.70.0.93.PUB|P||L||T032|james||||||7EB9FB87-57FD4164-B0D729CD-C5FFA558|||||||EP4065-NPER00003_00-IDEAMODULA000815|UT5002-NPUR00030_00-TOVS2COUCHBUNDL2|HT4005-NPHR00020_00-0004540000000000|
A263DD1D-6C3948C4-9EF9BF98-173A3137|Personal Chef Bundle|Create a banquet with this Personal Chef Bundle. This bundle contains  (1) Personal Chef - French (2) Personal Chef - BBQ Upon purchase, the items will be placed into their respective categories. Active items provide more functionality than normal items. You may only place limited numbers of the active items in your apartment or clubhouse at any time.|Bundle-Furniture|VEEMEE|1.80.0.53.PUB|P||L||T032|debbie||||||BEE3F58B-096C4E7D-BBD3D080-783B12EE,F67157F8-A6C446D0-B7DFE0C9-DA670F43|||||||EP4065-NPER00071_00-PERSONALCH000109|UT5002-NPUR00030_00-0042040000000000|HT4005-NPHR00020_00-0013840000000000|
A2FA24D8-9FB04115-AADD8581-701F0F70|Rococo-Style Table 2-piece Set|A 2-piece set of Rococo-style table and chair. This set includes the following items  - Rococo-Style Table (Table) - Rococo-Style Chair (Chair) * Upon purchase, each item will be added to the applicable category.|Bundle-Furniture|Granzella Inc.|1.70.0.93.PUB|P||L||T031|hide||||||8A25DFB7-67A14E1C-A231A245-5B0F181A,E4BD5E9E-59564B30-B0CB91E1-6724FB80|||||||EP5017-NPER00046_00-ROCOCOSTYL002212|||
A4D9BAAA-15824DEE-B1AB8697-4B3E8C48|Ultimate Slice Furniture Set|Ultimate Slice Furniture Set This pack includes the following  Slice Cube Table - Charm Slice Curve Sofa - Charm Slice Cylinder Table - Charm Slice Rectangular Sofa - Charm Slice Cube Table - Flapjack Slice Curve Sofa - Flapjack Slice Cylinder Table - Flapjack Slice Rectangular Sofa - Flapjack Slice Cube Table - Truffle Slice Curve Sofa - Truffle Slice Cylinder Table - Truffle Slice Rectangular Sofa - Truffle Construct the perfect seating arrangement with Slice modular furniture from Cucumber.|Bundle-Furniture|Lockwood|1.55.0.155.BETA2|P||L||T032|Lockwood||||||14AFE1C3-2F5E48B9-904F4035-E2A2812C,1920D480-EE1F4D6F-9A88C6AF-8A076F6D,63FB99E8-FC564575-BF281D90-A61616E5,66CF8795-23DC4127-891F84C0-407BC3A6,9784AF5F-C5CD4DEA-8C15CEE8-0D07E8FB,98506D46-4A1240A0-923FDEB1-943CDA91,BE573841-5DED4E8E-B7301CC0-E5001C93,C72A2E71-FA7B4AFC-A2338626-8C671960,C78B44DA-764340F5-9926F379-700BCC82,E54CEF10-99264123-BF9ACB8C-43966AF0,F148BC1A-44A54AF0-BF47F37F-FCEA33E1,F4424409-6F5F417C-B54D819B-70846769|||||||EP4127-NPER00014_00-ULTIMATESL001682|UT5000-NPUR00010_00-LKWDFEBSLICESETM|HT4001-NPHR00012_00-0016360000000000|
A4E05E88-84BD499D-A716EC43-8505BCFC|Paris Classical Furniture Set|It s the ultimate Classic Furniture bundle. All the pieces of the Clasical Bedroom Set, Dining Room Set and Living Room Set are included in this single bundle and offered at a discount.|Bundle-Furniture|Sony Computer Entertainment|1.41.0.37.PUB|P||L||T033|s002377||||||B0BF92E7-7CC14FFB-A5BA8AF2-EB96447E|||||||EP9000-NPEQ00005_00-PARISCLASS001695||HP9000-NPHQ00010_00-0001800000000000|
A51F62EB-6C654976-BC94C05C-F05B008D|Kotatsu 5-piece Set|This 5-piece Set Includes A Kotatsu, 3 Types Of Kotatsu Tops, And A Basket Of Oranges, Essential For Japanese Winter. This Set Includes The Following Items Kotatsu (table) Kotatsu Top (wood Grain) (decorative Item) Kotatsu Top (green) (decorative Item) Kotatsu Top (mahjong) (decorative Item) Mikan No Kagozuri (decorative Item) Each Item Will Be Added To The Corresponding Category When Purchased.|Bundle-Furniture|Granzella Inc.|1.60.0.450.BETA|P||L||T032|hide||||||75FD7C08-28D84066-AECF46F6-EF53816B,9644CE15-D36C4368-A546153E-E665CD5C,C2217E51-BF344D67-BAF06E0F-AB52F8B6,C4A4BA1E-B91949D1-8A82404F-F65F6C9B||||||||||JP0025-NPJR50380_00-AA60680000000000
A5425B8D-672A441F-B561C1F2-D1DDD796|Anime Furniture Value Pack #1|A matching outfit is so last decade. It s all about matching furniture. Includes 9 items  Aerodynamic Chair, Camera Robot, Data Stream Table, Desk Picture Frame, Futuristic Room Lamp, Futuristic Slide Out Couch, Futuristic Tendril Lamp, Projection TV, and Red Crate.|Bundle-Furniture|Sony Computer Entertainment|1.41.0.37.PUB|P||L||T034|mvan||||||07709EE1-C1864B0D-9727F070-8364BE62,07C86CAA-BB4C490E-84AE543A-62252B6F,0C42CF45-04C14156-A1B59B87-7A86216D,1A15344A-01494970-B87B6589-1D7E0CEC,28B46CB6-0236493D-B042229A-9FB62C94,53D2ECCA-E6454E1E-A1194B02-2271445F,66313692-BAAD4537-898768BF-F34367AC,9E19AC8F-918E4D76-A54E14F2-D3A52CAF,A20A20E3-9EA04437-B384D650-BD0F2E7C,A3232DF9-483847EF-8E65FB17-58C79B99,A5441330-59E34827-A7A14A74-5959E27C,BD623498-77CB4604-BD328543-5368A083,C7D912AB-821E4B1F-88EC8571-03A4A137|||||||EP9000-NPEQ00005_00-ANIMEFURNI001787|||
A5D740FB-42AE4084-937AFE6A-3B539159|Dining Furniture Set (Green)|A 2-piece set with chairs and a table perfect for a dining room. This set includes the following items  - Fabric Dining Chair (Green) Chairs - Square Wooden Dining Table (Brown) Tables * Upon purchase, each item will be added to the applicable category.|Bundle-Furniture|Granzella Inc.|1.82.0.17.PUB|P||L||T031|shimizu|||||||||||||EP5017-NPER00064_00-DININGFURN002018|||
A63802F1-CDB4477E-B5004568-1BC51CB5|Built-in Kitchen 5-piece Set (Wood)|A 5-piece wooden built-in kitchen that gives a sense of warmth. This set includes the following items  - Built-in Kitchen (Wood, Cupboard) (Ornaments) - Built-in Kitchen (Wood, Utensil Drawers) (Ornaments) - Built-in Kitchen (Wood, Stove) (Ornaments) - Built-in Kitchen (Wood, Sink) (Ornaments) - Built-in Kitchen (Wood, Shelf) (Ornaments) * Upon purchase, each item will be added to the applicable category.|Bundle-Furniture|Granzella Inc.|1.70.0.93.PUB|P||L||T031|hide||||||68C45FA9-43294959-B2B7B896-71848E59,6B1CB9BB-649B470E-9D3F058F-FDE1067F,6C329A69-07514A10-BD062F82-F8F8E4EC,7077A287-0A224303-BA39BD6A-5C32476A,709913E4-BA144A90-9547716C-1A874336|||||||EP5017-NPER00046_00-BUILTINKIT002234|||
A65F80FF-1AB44404-9DDD35A2-A1FAE2DA|Sofa Set White|Sofa Set White This Set Includes The Following Items. Double Sofa White (sofa) Long Sofa White (sofa) Ottoman White (footstool) Each Item Will Be Added To The Corresponding Category When Purchased.|Bundle-Furniture|O-Two inc.|1.75.0.85.PUB|P||L||T031|Yoshinori Utsumi||||||3AFF42CF-D2844D8B-8E5F36FB-2592606C,6DF65ACE-E11944B5-94F15CDD-F1B874B0||||||||||JP0085-NPJR50370_00-AA61290000000000
A6738579-9DD04EB6-8380FC04-6CD2AC6C|Dolly s Diner Furniture Pack|Dolly s Diner Furniture Pack This pack includes the following  Dolly s Diner Curved Counter Dolly s Diner Straight Counter Dolly s Diner Booth Seat Dolly s Diner Condiment Set and Menu Dolly s Diner Stool Dolly s Diner Chair Dolly s Diner Table Create that classic All-American Diner look in your apartment, with the Dolly s Diner Furnishings Range from Cucumber.|Bundle-Furniture|Lockwood|1.50.0.238.BETA|P||L||T033|Lockwood||||||391DA929-9ED44231-871D5199-CA09FFE7,3E0AE7C6-5E9B42F6-82EB5920-310F8E5F,50A68627-A7AB4F4B-85A81FA0-36EDC610,A5268D65-E0C048EF-884F48B5-48731918,C3F0D3DE-DB5042ED-8281286F-2991CAAA,DCBA2529-9FD84D75-A15B8681-246CB9B7,E25E453C-E7AC457D-A47AC870-B932A0A1|||||||EP4127-NPER00014_00-DOLLYSDINE000825|UT5000-NPUR00010_00-OUTSOJUNDOLLYPAC|HT4001-NPHR00012_00-0008080000000000|JT4001-NPJR50210_00-AB60680000000000
A68FFE5D-CECF44FA-A55770BF-CB60C70E|CAS - Complete Tactical Furniture Bundle|Outfit your home base with the full line of D2O s technologically advanced items for your CAS units. This package includes the CAS Rocket Launcher, Mini-gun, Diagnostic Computer Bank, Charging Station, Scaffolding, Workbench, Rocket Rack, Flying Wings, Ammo Crate, and Fuel Tank.|Bundle-Furniture|Sony Computer Entertainment America|1.50.0.238.BETA|P||L||T032|Stephen||||||055267E7-BABE486A-8A43C19A-3F9CB18E,05C57C20-0DDC45CD-856F430D-8370E11F,3B35C326-735145EA-84F8D688-916B8EAE,4D464A51-025A4BD8-AD2626E4-A4D10B89,648B3992-AA254DCC-826DB492-C64C0EAB,847355CB-C4A24E81-84D5239A-4FE4C57B,93C05AEA-D7A04BFC-984F48EC-8764DEA5,94F8CFC8-DC3A47A9-9CA42A52-213A2355,9FB0214F-94194D65-A62BEC5B-49C93AD8,E4214A52-861B4491-B34C62A4-04280AC6||||||||UP9000-NPUQ00020_00-CASTACFURNBUNDLE||
A767D60A-65064C24-AC4551E5-391B2269|Dining Furniture Set (Red)|A 2-piece set with chairs and a table perfect for a dining room. This set includes the following items  - Fabric Dining Chair (Red) Chairs - Square Wooden Dining Table (white) Tables * Upon purchase, each item will be added to the applicable category.|Bundle-Furniture|Granzella Inc.|1.82.0.17.PUB|P||L||T031|shimizu|||||||||||||EP5017-NPER00064_00-DININGFURN002019|||
A7C1B3B4-B7014AC7-8280B166-C3E833F0|Dining Furniture Set (Dark Brown)|A 2-piece set with chairs and a table perfect for a dining room. This set includes the following items  - Fabric Dining Chair (Dark brown) Chairs - Square Wooden Dining Table (Dark brown) Tables * Upon purchase, each item will be added to the applicable category.|Bundle-Furniture|Granzella Inc.|1.82.0.17.PUB|P||L||T031|shimizu|||||||||||||EP5017-NPER00064_00-DININGFURN002020|||
A7CECF43-F9D7462C-8D6B9343-C2A85283|The Jam Jar - Courtyard Bundle|Including  3 x potted plants, 1 x round planter, 1 x bench, 1 x telephone box.|Bundle-Furniture|JAM Games Ltd|1.80.0.53.PUB|P||L||T031|Mike||||||02B35D5B-9D5D45D4-AFAFF041-43757356,40244435-FCBD4758-AC86B7B9-D4B78ED8|||||||EP4375-NPER00055_00-THEJAMJARC000295|UT5021-NPUR00200_00-0004290000000000||
