folderName|niceName|niceDesc|category|maker|hdkVersion|PremiumOrReward|fileCount|PreferredThumbnail|SceneID|TxxxVersion|Author|Comment|type|sha1|flags|uuidcount|uuids|size|timestamp|Keywords|config|desc|ChannelID|product_id_SCEE|product_id_SCEA|product_id_SCEAsia|product_id_SCEJ
4BA2FC54-C5224C92-AF1ED9C1-F2CF206A|Wintersweet and Winter Plum Ikebana 2-piece Set| A 2-piece set that includes wintersweet and winter plum arranged in bamboo and ceramic vases. This set includes the following items for private lounge customization  - Wintersweet and Winter Plum Arranged in Bamboo (Ornaments) - Wintersweet and Winter Plum Arranged in Ceramic (Ornaments) * Upon purchase, each item will be added to the applicable category in Private Lounge Customization . |Bundle-Furniture|Granzella Inc.|1.70.0.93.PUB|P||L||T031|hide||||||3ABB125C-3A5F4408-89234993-32D78418,3B0A1B41-B78F4196-A07CB6E8-0FFCEB19||||||||UT5012-NPUR00120_00-GZTEAHSWNTRX1590||
4BB63EE5-F2B4468F-9B36B40A-BE911FF4|Natural interior set|A 3 piece set perfect for the yearlong summer with 2 types of wooden chests and an interior light. This set includes the following items  - Wooden chest (Dark brown, 2 drawers) (Decoration) - Wooden chest (Natural, 3 drawers) (Decoration) - Table lamp (Bamboo) (Lighting device) * Upon purchase, each item will be added to the applicable category.|Bundle-Furniture|Granzella Inc.|1.75.0.85.PUB|P||L||T031|hide||||||13711D8C-B4B74ED9-8B1EE8B2-F6416563,13806029-BF544EA3-BEC98792-B0F2D985,D82DDF93-EE6F4D56-87DCA787-DFA1C6DD|||||||||HP0025-NPHR00021_00-0008550000000000|
4BE44EBF-BEB646E5-BFFA9680-E5FEC284|Tropical palm tree - 4 piece set|Put the 4 pieces of this set together to make a large palm tree. This set includes the following items  - Tropical palm tree - Piece I (Decoration) - Tropical palm tree - Piece II (Decoration) - Tropical palm tree - Piece III (Decoration) - Tropical palm tree - Piece IV (Decoration) * Upon purchase, each item will be added to the applicable category.|Bundle-Furniture|Granzella Inc.|1.75.0.85.PUB|P||L||T031|hide|||||||||||||||HP0025-NPHR00021_00-0008560000000000|
4C45377E-C1AF4976-B933302A-62D97A2D|Luxury Train Furniture Bundle (Black)|The perfect furniture bundle to go with the Luxury Train Apartment. Includes seven furniture items including  * Corner Sofa (Black) * Straight Sofa (Black) * Low Chair (Black) * Low Table (Black) * Large Counter Top (Black) * Small Counter Top (Black) * Bed (Black) Upon purchase, all items will be added to their corresponding categories.|Bundle-Furniture|nDreams Ltd.|1.82.0.17.PUB|P||L||T031|DanM||||||21A13BFC-89164941-B4599C4B-1FD548B1,3DC78644-1E2E4146-B73F8900-C86B4E61,5FBB15F0-D7CE48E5-B7B819BF-DD816F97,70058318-B55C4473-8AF5A3EB-113A41DA,96C48187-EB654A26-BA674D8B-C3916015,B8306E14-AFC646F0-989272D1-D594352A,EDF7A1B6-B6264A15-B7063DD8-C6FE604B|||||||EP4114-NPER00011_00-LUXURYTRAI001783|UT5001-NPUR00020_00-0047280000000000||
4D61EBB2-97644B42-8BED1BA4-58787590|x7 Bundle Volume 1|Get this exclusive bundle at great value, only available in x7. Includes  Animated Horse, Animated Hamster on Wheel, Animated Snake in Terrarium, Animated Rabbit, Active Item - Animated Cow, and Active Item - Animated Goat.|Bundle-Furniture|Sony Computer Entertainment|1.60.0.450.BETA|P||L||T032|apadua||||||4263F959-9D764CF6-9288F25F-DC92717A||||||||||
4DDB709A-514B444A-B14DDA0F-9ADA918F|Dark Green Grass Tile Set|A set of dark green grass tiles. This set includes the following items for customizing your personal space. Dark Green Grass Tile - Square (Ornaments) Dark Green Grass Tile - Wedge (Ornaments) Dark Green Grass Tile - Heart (Ornaments) Dark Green Grass Tile - Star (Ornaments) *Each item will be added to their relevant wardrobe and furniture category.|Bundle-Furniture|Toylogic Inc.|1.80.0.53.PUB|P||L||T031|Toylogic Inc.||||||1AD39CF3-5D8F4C97-9ED59309-1498354C|||||||EP5033-NPER00072_00-DARKGREENG000194|||
4DE222D2-0B504E14-8F1FBDCC-C3D0B83A|Dining Furniture Set (white)|A 2-piece set with chairs and a table perfect for a dining room. This set includes the following items  - Fabric Dining Chair (white) Chairs - Square Wooden Dining Table (Black) Tables * Upon purchase, each item will be added to the applicable category.|Bundle-Furniture|Granzella Inc.|1.82.0.17.PUB|P||L||T031|shimizu||||||00033179-83F9478E-914C756D-D38A72B2,040823D0-E7C94F4C-A03EF1D8-41A2C326||||||||UT5012-NPUR00121_00-0020040000000000||
4E8E9433-C6F14ED8-B51BB9D1-57D85044|nDreams Active Furniture Lucky Set - 2012 version| nDreams Active Furniture Lucky Set - 2012 version contains different 2 bundle item sets and 1single item (Total of 13 items) from nDreams and 2012 Special New Year T-shirt **IMPORTANT NOTICE** This nDreams Active Furniture Lucky Set - 2012 version may contain the items you have already purchased. If you purchased already the items which are included, same item will not appear in the inventory twice. Purchased Lucky Set are not refundable, transferable or exchangeable, and cannot be redeemed for cash or credit. |Bundle-Furniture|nDreams Ltd.|1.55.0.155.BETA2|P||L||T032||||||||||||||||HT4002-NPHR00014_00-0003810000000000|
4EBEB72A-27C84834-AB533356-5C6A0B4A|100 Vacation-Themed Items Super Bundle|Decorate your Home space with a souvenir from all of our popular vacation getaways. This 100 item vacation bundle includes unique items from our Tropical Escape, Santorini Greece, and Yacht  Santorini Collections. Valued at over $30, get this pack for only $4.99. As a bonus, get this pack for only $1 by owning any one of the following items  PlayStation Home Mansion First Floor, PlayStation Home Mansion Second Floor, PlayStation Home Mansion Infinity Pool, Gold Suit, Diamond Suit, Emerald, Ruby, and Sapphire Suit Bundle, Animated Diamond Furniture Collection, or the Ultimate Diamond Collection Bundle.|Bundle-Furniture|Sony Computer Entertainment|1.55.0.155.BETA2|P||L||T031|dpaulsen||||||||||||||||
4F36566C-2A1046ED-AA844EBA-018BFE01|Living Room Furniture Set (Green)|A 6-piece set of furniture perfect for a living room including a sofa with wooden armrests. This set includes the following items  - Wooden Sofa with Armrest, 3-seat (Green) Sofas - Wooden Sofa with Armrest, 2-seat (Green) Sofas - Wooden Chair with Armrest, 1-seat (Green) Chairs - Square Cushion (Green) Ornaments - Oval Wooden Coffee Table (Brown) Tables - Sideboard with Glass Door (Brown) Ornaments * Upon purchase, each item will be added to the applicable category.|Bundle-Furniture|Granzella Inc.|1.82.0.17.PUB|P||L||T032|shimizu||||||||||||||UT5012-NPUR00121_00-0020050000000000||
50D73D70-3BB64281-932F1140-B7E610EF|Cookware Set|Cookware Set. Cook Delicious Meals. This Set Includes The Following Items. Bowl (decorative) Frying Pan (decorative) One-handed Pot (decorative) Kettle (decorative) Cutting Board (decorative) Each Item Will Be Added To The Appropriate Category When Purchased.|Bundle-Furniture|O-Two inc.|1.65.0.139.BETA|P||L||T032|Yoshinori Utsumi||||||||||||||||JP0085-NPJR50370_00-AA60960000000000
50FFC3C6-88C046E9-A7D1C335-B5FBB672|The Japanese Shelf Accumulated Scarlet Set|A Simple But Good Quality Shelf. It Seems To Be Suitable For Displaying Figures. This Set Includes The Following Items For Furniture Stackable Scarlet Japanese Shelf Large (decorative) Stackable Scarlet Japanese Shelf Small (decorative) When Purchased, Each Item Will Be Added To The Appropriate Category.|Bundle-Furniture|Will Co.,Ltd.|1.66.0.144.PUB|P||L||T031|ishikawa||||||||||||||||JP0043-NPJR50420_00-AA60240000000000
518FEC02-E2034B81-B082461C-EA2A9DC1|5-Piece Interrogation Set|This 5-piece Set Includes A Desk, Chair, Desk Lamp, And Two Ashtrays For Use When Interrogating A Suspected Person. This Set Includes The Following Items. Table For Interrogation Chair For Interrogation Light Stand For Interrogation Ashtray (aluminum) (decorative Item) Ashtray With Cigarette Butt (stainless Steel) (decorative Item) When Purchased, Each Item Will Be Added To The Corresponding Category.|Bundle-Furniture|Granzella Inc.|1.55.0.155.BETA2|P||L||T031|hide||||||80BFAE62-8DDA47CE-B52E2241-3B3D0096||||||||||JP0025-NPJR50380_00-AA60660000000000
52589BC9-BF62405E-B3B2DD7A-DF8D2CE6|Living Room Furniture Set (Brown)|A 6-piece set of furniture perfect for a living room including a sofa with wooden armrests. This set includes the following items  - Wooden Sofa with Armrest, 3-seat (Brown) Sofas - Wooden Sofa with Armrest, 2-seat (Brown) Sofas - Wooden Chair with Armrest, 1-seat (Brown) Chairs - Square Cushion (Brown) Ornaments - Oval Wooden Coffee Table (white) Tables - Sideboard with Glass Door (white) Ornaments * Upon purchase, each item will be added to the applicable category.|Bundle-Furniture|Granzella Inc.|1.82.0.17.PUB|P||L||T032|shimizu||||||||||||||UT5012-NPUR00121_00-0020060000000000||
5280359F-45564233-8CC4E545-77ADAB91|Swimming Float, Mat-shaped Set (Yellow)|2-piece set of mat-shaped swimming floats for floating in the ocean. This set includes the following items  - Swimming Float, Mat-shaped (Single Size, Yellow) (Ornaments) - Swimming Float, Mat-shaped (Double Size, Yellow) (Ornaments) * Upon purchase, each item will be added to the applicable category.|Bundle-Furniture|Granzella Inc.|1.70.0.93.PUB|P||L||T032|hide||||||1B15ACB5-D956469D-811820F4-5A5E2DEA,1C7E2FF7-88064B5F-A791FF9F-ABBB692E,1EA20812-CE374047-B1D9A25F-53EC1016,2349E397-59BC49BD-B90C978F-5C88E7D8,284A1A3F-6B0E4E22-AEB24051-DBB58EE8,29A64B64-7C854939-87005E38-816117FB,2BACDB54-43B34B75-9ECBF512-ED54BE18||||||||UT5012-NPUR00120_00-GRNZXMASNYEX3742||
529CC6AD-21CD4241-BAF49581-8FE06CD2|Outdoor Ambient Lamp Set|These lamps are great for lighting up a walkway. Bundle includes 3 outdoor lamps.|Bundle-Furniture|Sony Computer Entertainment|1.41.0.37.PUB|P||L||T034|ksar||||||||||||||||
52EF2FDF-B77D46A9-B426A6DF-C416A5E0|Living Room Furniture Set (Red)|A 6-piece set of furniture perfect for a living room including a sofa with wooden armrests. This set includes the following items  - Wooden Sofa with Armrest, 3-seat (Red) Sofas - Wooden Sofa with Armrest, 2-seat (Red) Sofas - Wooden Chair with Armrest, 1-seat (Red) Chairs - Square Cushion (Red) Ornaments - Oval Wooden Coffee Table (Dark Brown) Tables - Sideboard with Glass Door (Dark Brown) Ornaments * Upon purchase, each item will be added to the applicable category.|Bundle-Furniture|Granzella Inc.|1.82.0.17.PUB|P||L||T033|shimizu||||||||||||||UT5012-NPUR00121_00-0020070000000000||
52F74572-641B4BF0-BE45BD6C-17098201|PixelJunk Monsters Giant Pack|Giants, towers, trees, oh my. Unleash the Giant within by giving your room that Monsters feel with this 7 item bundle today. PixelJunk Monsters Miniature Character (Giant) PixelJunk Monsters Miniature Tower (Trap Tower) PixelJunk Monsters Floor Rug (Type A) PixelJunk Monsters Floor Rug (Type C) PixelJunk Monsters Miniature Tree (Spring) PixelJunk Monsters Miniature Tree (Summer) PixelJunk Monsters Round Tree (Spring)|Bundle-Furniture|Q-Games|1.52.0.2.PUB|P||L||T032|K Yoshida||||||0B66209E-9DA34B4C-95A7FF3E-3090AF83,4A2035B2-5C6D4F79-A651EBB5-8E111BBE,5892EDA1-55264C0A-AA16CAFC-95055F2B,8AD14D6F-F8C44699-B4B4C431-6BE175DC,ADACC0B4-979546DC-8BF1DA45-E478A61E,E8151EB5-9C2E4526-AFD5A653-6F1031D0,EDE6AB0B-0A1A4827-A08B3661-F499FB49,EDF7CB08-1B2B4446-B7B364AC-1BCAB74A|||||||EP9000-NPEQ00013_00-PIXELJUNKM000084|UP9000-NPUQ00011_00-QGAMESMNSTRBNDL3|HP0743-NPHR00008_00-0000890000000000|JP0743-NPJR50120_00-AA60230000000000
53CF3500-AF724290-9BC8FF26-38EB96F9|x7 Bundle Volume 67|Exclusive x7 Value Bundle. Includes  -Black Sofa -Racing Dining Table - Dark Wood -White Lounge Sofa -Pink Rug -Black Lamp -Wood Bench with Cushions -Yellow Pot -White and Blue Beach Bag|Bundle-Furniture|Sony Computer Entertainment|1.70.0.93.PUB|P||L||T031|JLee||||||79A23DCA-9A3F481B-B71B8D2A-CE666455||||||||||
53DF0C4A-9FAF42F9-9710B337-147E971C|Mega Kitchen Bundle|including Cerkez Kitchen, Avedic Kitchen and Truzzi Kitchen (3 x Corner Unit, 3 x Hob Unit, 3 x Oven Housing, 3 x Sink Unit, 3 x Standard Unit)|Bundle-Furniture|JAM Games Ltd|1.82.0.17.PUB|P||L||T031|Mike||||||||||||||||
53EF71DC-BEF94474-97973B3D-731B35D4|Doctor Who - Wave Two Ultimate Bundle|This bundle comes with the following items  1) Doctor Who - Drone Dalek (Red) companion 2) Doctor Who - Supreme Dalek (White) companion 3) Doctor Who - Eternal Dalek (Yellow) companion 4) Doctor Who - Strategist Dalek (Blue) companion 5) Doctor Who - Scientist Dalek (Orange) companion 6) Doctor Who - Drone Dalek (Red) Furniture 7) Doctor Who - Scientist Dalek (Orange) Furniture 8) Doctor Who - Strategist Dalek (Blue) Furniture 9) Doctor Who - Eternal Dalek (Yellow) Furniture 10) Doctor Who - Supreme Dalek (White) Furniture 11) Doctor Who - Dalek Emperor Furniture 12) Doctor Who - Cyberman companion 13) Doctor Who - Cyberman Furniture 14) Doctor Who - K-9 companion 15) Doctor Who - K-9 Furniture BBC logo BBC 1996. Doctor Who logo BBC 2013. Dalek image BBC Terry Nation 1963. Cyberman image BBC Kit Pedler Gerry Davis 1966. K-9 image BBC Bob Baker Dave Martin 1977. Licensed by BBC Worldwide Limited.|Bundle-Furniture|BBC Worldwide Limited|1.80.0.53.PUB|P||L||T033|jsorensen||||||03379C94-8BB84280-85934FA2-CA78FB97,30D13DA1-BEE24F99-AD613D02-87C00654,36B8DD09-A59C425D-917744C8-3B88AC8A,49A18105-FAAF47C0-85963A95-1FBDAC44,500778F0-579C439C-BB561657-7A5CA198,89A7B400-3048492A-9FF9DCB2-BD0185A5,8C34B7A5-B98B4729-B22C1954-B47F94BB,F8FFB8DC-8A414D7A-8471F33F-E83D241E|||||||EP2066-NPER00063_00-DOCTORWHOW000036|UP2066-NPUR30340_00-0001330000000000||
540F9DE4-045B4378-8467F6A5-274ADD67|Two Daffodil Ikebana Set|Two Sets Of Daffodils, One In A Bamboo Bowl And One In A Ceramic Bowl. This Set Includes The Following Items For Customizing Your Private Lounge Daffodils In Bamboo Vase Decoration Daffodils In Pottery Decoration When Purchased, Each Item Will Be Added To The Appropriate Category In The Customize Private Lounge Section.|Bundle-Furniture|Granzella Inc.|1.70.0.93.PUB|P||L||T031|hide||||||1FE4C81F-34E44555-B25DEBB6-145CC0AA||||||||||JP0025-NPJR50380_00-AA61200000000000
541FFE4E-1F2246FD-B8C934B3-A0F79565|Living Room Furniture Set (Black)|A 6-piece set of furniture perfect for a living room including a sofa with wooden armrests. This set includes the following items  - Wooden Sofa with Armrest, 3-seat (Black) Sofas - Wooden Sofa with Armrest, 2-seat (Black) Sofas - Wooden Chair with Armrest, 1-seat (Black) Chairs - Square Cushion (Black) Ornaments - Oval Wooden Coffee Table (Black) Tables - Sideboard with Glass Door (Black) Ornaments * Upon purchase, each item will be added to the applicable category.|Bundle-Furniture|Granzella Inc.|1.82.0.17.PUB|P||L||T032|shimizu||||||||||||||UT5012-NPUR00121_00-0020080000000000||
54477667-8EB04FEC-84CC460B-98C3B808|Swimming Float, Mat-shaped Set (Green)|2-piece set of mat-shaped swimming floats for floating in the ocean. This set includes the following items  - Swimming Float, Mat-shaped (Single Size, Green) (Ornaments) - Swimming Float, Mat-shaped (Double Size, Green) (Ornaments) * Upon purchase, each item will be added to the applicable category.|Bundle-Furniture|Granzella Inc.|1.70.0.93.PUB|P||L||T032|hide||||||2349E397-59BC49BD-B90C978F-5C88E7D8,2BACDB54-43B34B75-9ECBF512-ED54BE18||||||||UT5012-NPUR00120_00-GRNZXMASNYEX3743||
5449F841-F3184AEF-BE2E3DA3-5A22844C|Idea - Modular Sofa - Bundle - Pink|This bundle is for the complete pink sofa and comes with all six objects. 1. Double Seat 2. Left End Seat 3. Right End Seat 4. Corner Seat 5. Single Seat 6. Footstool|Bundle-Furniture|VEEMEE|1.70.0.93.PUB|P||L||T032|james||||||7EB9FB87-57FD4164-B0D729CD-C5FFA558|||||||EP4065-NPER00003_00-IDEAMODULA000812|UT5002-NPUR00030_00-TOVS2COUCHBUNDL4|HT4005-NPHR00020_00-0004500000000000|
548DBDF5-0159489A-AF55495D-B1E0A08A|x7 Bundle Volume 39|Get this exclusive bundle at great value, only available in x7. Includes  Chimera Statue, Liger Statue, Lion Statue, T-Rex Statue, Black Lamp, Black Sofa, Earth Globe and Wood Bench with Cushions.|Bundle-Furniture|Sony Computer Entertainment|1.65.0.139.BETA|P||L||T032|apadua||||||||||||||||
549531ED-A2D84ED0-A8BB93AD-8EA49228|Lucky Set 1 - 2011 version (Furniture)| Would you like to have a summer house for your own apartment. (Lucky Set 1 contains different 6 items including 2011 special New Year T-shirt.) **IMPORTANT NOTICE** This Lucky Set may contain the items you have already purchased. Only the item which is not yet purchased is added to the corresponding categories under Redecorate and same purchased item will not appear twice. Purchased Lucky Set are not refundable, transferable or exchangeable, and cannot be redeemed for cash or credit. This Lucky Set 2011 contains different variety of items from Lucky Set 2010. |Bundle-Furniture|Sony Computer Entertainment|1.41.0.37.PUB|P||L||T033|Sony Computer Entertainment|||||||||||||||HP9000-NPHQ00009_00-0000910000000000|
54D939A8-ED0C4E9A-9C125658-09C02CF9|Lock-a-doodle Value Pack|Lock-a-doodle Value Pack This pack includes the following  Lock-a-doodle Studio Lock-a-doodle Studio (Clubhouse) Lock-a-doodle Lock-a-doodle Display Easel Lock-a-doodle Giant Furniture Pack Lock-a-doodle Doodle Pack - Jewel of the Skies Lock-a-doodle Doodle Pack - Sodium Lock-a-doodle Doodle Pack - Spring Time Lockwood Token Pack - 480 Lock-a-doodle is a fun social drawing game. Create Doodles for your friends to guess, accept random challenges from other players or unlock Doodle Mode and doodle to your heart s content. The more Lock-a-doodle Doodle Packs you own, the more stickers, colors and shapes at your disposal for creating incredible works of art. Each Doodle Pack contains new colors, stickers, words and shapes. Please note  Doodle Packs can only be used in conjunction with the Lock-a-doodle mini-game or Active Object, or Lock-a-doodle Gift Edition.|Bundle-Furniture|Lockwood|1.70.0.93.PUB|P||L||T031|Lockwood||||||1016B4BC-A0C44558-90E24029-8190457D||||||||UT5000-NPUR00012_00-LKWDLOCKADEMHPAK|HT4001-NPHR00012_00-0026470000000000|
5575ABBF-9F474619-9EB031F1-7E082F42|x7 Bundle Volume 38|Get this exclusive bundle at great value, only available in x7. Includes  Spiderweb, Red Loveseat, Red Sofa, Enchanted Cauldron, Pink Rug, White Lounge Chair, White Table Bar and Yellow Pot.|Bundle-Furniture|Sony Computer Entertainment|1.65.0.139.BETA|P||L||T032|apadua||||||||||||||||
55835A91-408F484F-87F92681-88D7A265|House Langfrey Furniture Bundle|Show your allegiances with this furniture bundle, and decorate your apartment with the Crowned Serpent of House Langfrey. This bundle includes  House Langfrey Throne House Langfrey Wingback House Langfrey Chair House Langfrey Dining Table House Langfrey Hanging Banner House Langfrey Standing Banner Upon purchase, all items will be added to their corresponding categories.|Bundle-Furniture|nDreams Ltd.|1.86.0.17.PUB|P||L||T031|KristianF|||||||||||||EP4114-NPER00011_00-HOUSELANGF001957|UT5001-NPUR00022_00-0001450000000000||
5672A0F7-0FB849D0-83BBD7AE-922811CF|All Monkey Island Items Bundle|Massive bundle includes LeChuck s Pirate Ship plus all Monkey Island furniture and clothing items. In total this bundle includes 1 Personal Space, 16 Male Clothing items, 12 Female Clothing items, and 42 Furniture items.|Bundle-Furniture|LucasArts|1.3.5.120.PUB|P||L||T031|Jeff Remmer||||||CE61AC47-4C7048E8-BF6C7D71-2C93A713,D59E2C57-50AE4767-ACDD0243-B35A6F04|||||||EP1010-NPER00024_00-ALLMONKEYI000147|UP1010-NPUR30060_00-LECMIMEGABUNDLE1||
57049EF2-6C014D5E-96EE174D-88B03A7C|Garden Set (Pine)|Set To Create Garden That Gives A Scent Of Pine. This Set Includes The Following Items. Small Pine (decorative Item) Grass Growth (decorative Item) Grass (Middle) (rug) Grass (Side) (rug) Grass (Corner) (rug) Items Are Added To Each Category After Purchase.|Bundle-Furniture|O-Two inc.|1.70.0.93.PUB|P||L||T035|Yoshinori Utsumi||||||647BCF4A-D34F484D-A03A75EB-18642A5A|||||||EP4392-NPER00061_00-GARDENSETP000144|UT5028-NPUR00240_00-OTWOPKVXNJLBX145||JP0085-NPJR50370_00-AA60710000000000
575CAE96-26C5495D-A8A43CC5-CF5E6FE1|Two-piece Lisianthus Flower Arrangement Set|Lisianthus Flowers, One Arranged In A Bamboo Bowl And One In A Ceramic Bowl. This Set Includes The Following Items Lisianthus In Bamboo Vase Decoration Lisianthus In Pottery Decoration When Purchased, Each Item Will Be Added To The Appropriate Category.|Bundle-Furniture|Granzella Inc.|1.65.0.139.BETA|P||L||T031|hide||||||||||||||||
5865D328-184C44E1-AFAF9E43-C1B4C87F|Personal Dining Experience - Table Bundle|Entertain your friends in the privacy of your own personal space with the VEEMEE Personal Dining Experience table bundle. This bundle contains the following items  Personal Dining Experience - 2 Person Table Personal Dining Experience - 4 Person Table Personal Dining Experience - 6 Person Table Personal Dining Experience - 10 Person Table|Bundle-Furniture|VEEMEE|1.80.0.53.PUB|P||L||T031|euan||||||3724B911-0CA140A4-AB743756-E97EEDAE,75481BEF-E4D04E2C-A9A9468E-A42A52F2,8A123F7A-55154F87-97CE3B30-18DC89F4,B2887727-618F46CF-8821F7FF-0A5327A8|||||||EP4065-NPER00003_00-PERSONALDI002156|UT5002-NPUR00030_00-0039930000000000|HT4005-NPHR00020_00-0011110000000000|
58B8A1F9-75E24C29-8245E2B5-4BD4E129|Ornamental Doll, Prop Set|A 35-piece set of ornamental dolls and props. * Upon purchase, each item will be added to the applicable category.|Bundle-Furniture|Granzella Inc.|1.70.0.93.PUB|P||L||T031|hide||||||320069D9-D3ED4B96-A286535B-9F2B5894,3C25110A-4C7E4F89-82AF3AED-35766E53,4031873D-EF504422-93A695F6-E331BFB5,4F668E06-93014F78-BFC71D0B-C3E63506,5493B600-BBE84D56-90C60061-B51A9789,54B9CA31-F011425E-BBA1EBDB-71CE5D9A||||||||UT5012-NPUR00120_00-GRANZELLAXXX5083||
58E0737D-50FA4CEA-9644E21F-3A2199FC|Built-in Kitchen 5-piece Set (Wood)|A 5-piece wooden built-in kitchen that gives a sense of warmth. This set includes the following items  - Built-in Kitchen (Wood, Cupboard) (Ornaments) - Built-in Kitchen (Wood, Utensil Drawers) (Ornaments) - Built-in Kitchen (Wood, Stove) (Ornaments) - Built-in Kitchen (Wood, Sink) (Ornaments) - Built-in Kitchen (Wood, Shelf) (Ornaments) * Upon purchase, each item will be added to the applicable category.|Bundle-Furniture|Granzella Inc.|1.70.0.93.PUB|P||L||T031|hide||||||02539132-AE114E0C-BA7F46F6-97E4999D,07382A1A-FE6E4BC7-B4689AE0-78994CAC,1192D82C-6F8B423E-BC025A7E-42D267F1,1223F856-98D24C6E-96C0DC1E-830C087D,1A08A84C-59BD46DA-8FC68A0B-EC45810A||||||||UT5012-NPUR00120_00-0048800000000000||
59B19003-D49D43A1-B9D57ED4-78254DC9|The Raven House Furniture Pack|A loyal banner-man of House Dumont should own all of the finely crafted furniture pertaining to that house. It s basic respect. Or you just like the color palette. Includes House Dumont Throne, House Dumont Ottoman, House Dumont Circular Coffee Table, House Dumont Rectangular Coffee Table, House Dumont Grand Vase, House Dumont Daybed, House Dumont King Bed, House Dumont Grand Chair, House Dumont Chair, House Dumont Loveseat, House Dumont Grand Dining Chair, House Dumont Dining Chair, House Dumont Wardrobe, and House Dumont Shield.|Bundle-Furniture|Heavy Water|1.66.0.144.PUB|P||L||T032|Stephen||||||06F32514-54A84284-9D20561A-AA7B78E1,0C8667D6-26E34187-B1943899-51CF30EA,1C6F4183-B08A449F-A5D5ECD1-13F757A1,1D3758EF-1A9A4AD3-A747BB88-9A468DAB,2E854AFD-E642410B-886A8504-7877E95C,38773797-D6714333-AD22F4AC-D0C05A66,5336A1F4-3DDD47ED-B09B405A-7187221F,7CA575DE-7B4D44F9-B10A3B09-E9FF80AC,B716F6BE-70CA4C5A-BBCF46DA-9220BDBD,BE94821A-27E549E7-823C1EEE-ADCB53E0,C055A344-906B4255-81B0CAE4-AAD3D700,E3E5ECC7-13D4466A-A0EB36C7-D8213985,FC5893B3-DA9541CD-BF5D4B08-C8FD084C,FCC1DDAE-09CB4958-B48D76C3-82422C71|||||||ET0002-NPER00035_00-THERAVENHO000325|UT5004-NPUR00050_00-HWAVLNRAVNHSEBND||
59BC4F22-D54D4296-862132B7-85A9688D|x7 Bundle Volume 59|Exclusive x7 Value Bundle. Includes  -Revolver-6 -PsT-50 Pistol -LRm-5960 Rifle -TxRm-20 Handgun -Anime Blaster -Anime Tech Pistol -Anime Sub Machine Gun|Bundle-Furniture|Sony Computer Entertainment|1.70.0.93.PUB|P||L||T031|JLee||||||||||||||||
5A1A5B74-C40F43F4-874D258F-C36F15C0|The Noble Houses Furniture Bundle|Show your allegiances with this furniture bundle, and decorate your apartment in the livery of the Noble Houses. This bundle includes  House Langfrey Throne House Langfrey Wingback House Langfrey Chair House Langfrey Dining Table House Langfrey Hanging Banner House Langfrey Standing Banner House Alliker Throne House Alliker Wingback House Alliker Chair House Alliker Dining Table House Alliker Hanging Banner House Alliker Standing Banner House Daederon Throne House Daederon Wingback House Daederon Chair House Daederon Dining Table House Daederon Hanging Banner House Daederon Standing Banner House Karus Throne House Karus Wingback House Karus Chair House Karus Dining Table House Karus Hanging Banner House Karus Standing Banner Upon purchase, all items will be added to their corresponding categories.|Bundle-Furniture|nDreams Ltd.|1.86.0.17.PUB|P||L||T031|KristianF||||||AF1A09F6-3E0C4004-AAEBBE78-C1DFA311|||||||EP4114-NPER00011_00-THENOBLEHO001956|UT5001-NPUR00022_00-0001440000000000||
5AF6EDF7-193F4B95-85194F71-CF21F80E|Coffee Shop Chair And Table Set|This 5-piece Set Includes A Table (square round), Chair, And Chair And Table (square round) Combination, Perfect For A Coffee Shop. This Set Includes The Following Items Coffee Table Square table Coffee Table Round table Coffee Chair chair Coffee Chair And Table Square chair Coffee Chair And Table Round chair When Purchased, Each Item Will Be Added To The Appropriate Category.|Bundle-Furniture|Granzella Inc.|1.75.0.85.PUB|P||L||T031|hide||||||5AD9F1A5-F92947B4-A46A1335-384D4554||||||||||JP0025-NPJR50380_00-AA61840000000000
