folderName|niceName|niceDesc|category|maker|hdkVersion|PremiumOrReward|fileCount|PreferredThumbnail|SceneID|TxxxVersion|Author|Comment|type|sha1|flags|uuidcount|uuids|size|timestamp|Keywords|config|desc|ChannelID|product_id_SCEE|product_id_SCEA|product_id_SCEAsia|product_id_SCEJ
D3E75DDD-66694B33-9CB58D3D-FC3EF299|Dynamite DX Fuel Additive x26|A highly unstable and powerful fuel additive for your Sodium2 racer that supplements your fuel to increase your top speed. This is a 26 use item that will be used automatically in a race if equipped.|Other-Technology|Sodium - Lockwood|1.55.0.155.BETA2|P||L||T032|Lockwood|||||||||||||EP4127-NPER00014_00-DYNAMITEDX000974|UT5000-NPUR00010_00-OUTSOSODIUM2FDY1|HT4001-NPHR00012_00-0009800000000000|JT4001-NPJR50210_00-AC60810000000000
DCEACB45-C32E4508-A6199B85-5B39BB7C|Turbulence DX Rocket Booster Pair x130|These are high power boosters with a slightly delayed onset. Get the timing right and you can kiss your old personal best goodbye.|Other-Technology|Sodium - Lockwood|1.50.0.238.BETA|P||L||T032|Lockwood|||||||||||||EP4127-NPER00014_00-TURBULENCE000963|UT5000-NPUR00010_00-OUTSOSODIUM2TUR2|HT4001-NPHR00012_00-0009690000000000|JT4001-NPJR50210_00-AC60700000000000
E11F6C2F-EBFD4805-825BEAE8-06878114|Hinomaru Racer - Sodium2 Racer Paint Scheme|Represent your own country, or just one you feel a strong affinity for, with this patriotic paint scheme.|Other-Technology|Sodium - Lockwood|1.55.0.155.BETA2|P||L||T033|Lockwood||||||A6005076-C5884DA3-93690313-167A6BC0|||||||EP4127-NPER00014_00-HINOMARURA001128|UT5000-NPUR00010_00-OUTSOSODIUM2SKHM|HT4001-NPHR00012_00-0011210000000000|JT4001-NPJR50210_00-AC61090000000000
EEDEE103-521A46BE-B92394D7-59724031|Turbulence DX Rocket Booster Pair x1300|These are high power boosters with a slightly delayed onset. Get the timing right and you can kiss your old personal best goodbye.|Other-Technology|Sodium - Lockwood|1.50.0.238.BETA|P||L||T032|Lockwood|||||||||||||EP4127-NPER00014_00-TURBULENCE000965|UT5000-NPUR00010_00-OUTSOSODIUM2TUR4|HT4001-NPHR00012_00-0009710000000000|JT4001-NPJR50210_00-AC60720000000000
F0B75557-D5E24F98-9AF93276-C40B2C26|Medium Pulse Alarm Suppressor|This disposable item moderately reduces the alarm state of any facility. This is a Conspiracy game item and is placed in your game character s inventory when purchased. It equips in a Gadget slot on raids. Quantity  5.|Other-Technology|Jet Set Games, Inc.|1.40.0.265.PUB|P||L||T033|||||||||||||||UT5005-NPUR00060_00-JSGMEDPLSALRMSUP||
F5254614-5C264087-931140A8-3F220C1F|Thor DX Engine|A Large and powerful engine to push your Sodium2 racer towards Mach 2. Don t forget to take account of the extra weight through the bends or a crash at that speed will leave nothing but a smear.|Other-Technology|Sodium - Lockwood|1.50.0.238.BETA|P||L||T036|Lockwood|||||||||||||EP4127-NPER00014_00-DREADNOUGH000321|UT5000-NPUR00010_00-OUTSOSODIUM2ENGG|HT4001-NPHR00012_00-0004330000000000|JT4001-NPJR50210_00-AC60420000000000
F5FDBE8A-342146BE-B6C24FED-9562DC2F|Hydrostatic DX Air Brakes|A brutally effective Air Brake system to get your Sodium2 racer through tighter corners at higher speeds. Remember to complement them with other increased acceleration components or your rivals will make up lost ground as you struggle to pull away.|Other-Technology|Sodium - Lockwood|1.50.0.238.BETA|P||L||T031|Lockwood|||||||||||||EP4127-NPER00014_00-HYDROSTATI000979|UT5000-NPUR00010_00-OUTSOSODIUM2ABHY|HT4001-NPHR00012_00-0009850000000000|JT4001-NPJR50210_00-AC60860000000000
