folderName|niceName|niceDesc|category|maker|hdkVersion|PremiumOrReward|fileCount|PreferredThumbnail|SceneID|TxxxVersion|Author|Comment|type|sha1|flags|uuidcount|uuids|size|timestamp|Keywords|config|desc|ChannelID|product_id_SCEE|product_id_SCEA|product_id_SCEAsia|product_id_SCEJ
00C4E166-D83A48EC-9A89767E-5F1F1410|MotorStorm Pacific Rift camp|Unwind after a day of brutal racing in your beachfront campsite.|Scene-Entitlement|Sony Computer Entertainment|1.3.2.16.BETA1|P||L|SCEE_MSPR_Apt_38C2_90B5|T032|Stephen_Routledge|||||||||||||EP9000-NPEQ00010_00-MOTORSTORM000033|UP9000-NPUQ00004_00-PACIFICRIFTBEACH|HP9000-NPHQ00006_00-0000430000000000|JP9000-NPJQ50010_00-AB40020000000000
02F15FC6-DE494F61-A2856059-3765740B|The Prairie Saloon|Mosey on down to the Saloon for a rootin tootin good time. Put on a performance on the stage, ride around the expansive grounds, or tend to your horse. Includes  Horse care game with 7 in-game rewards 4 Exclusive Saloon rewards This space is a Clubhouse.|Scene-Entitlement|Lockwood|1.80.0.53.PUB|P||L|Prairie_Saloon_Club_3754_A7A3|T032|JLee||||||F173BA13-4B674D64-948E720A-F3FFF5E9|||||||EP4127-NPER00050_00-THEPRAIRIE001099|UT5000-NPUR00012_00-LKWDTHEPRAIRIESA|HT4001-NPHR00036_00-0003060000000000|JT4001-NPJR50210_00-AA40070000000000
03DE7562-803A4BCC-A28ACD3C-8F3AB87D|Pharaoh s Tomb| Loosely translated from the hieroglyphs  Here lies Pharaoh Homenkhammun, about whom dancers rejoice and upon whom the Eye of Horus lingers. Loved by all, may he find further glory in the West. |Scene-Entitlement|Sony Computer Entertainment|1.52.0.2.PUB|P||L|SCEA_Pharoahs_Apt_2138_40E7|T034|ppurdy|||||||||||||EP9000-NPEQ00005_00-PHAROAHTOM002079|UP9000-NPUQ00010_00-1JBPHAROAHSTOMB1|HP9000-NPHQ00010_00-0004830000000000|
042A70AF-C4C641B7-AAB55602-1FE708AC|The Spunland Cottage|Take up residence in the Spunland Cottage, with scenic views of the purple skies and hills of Spunland. Includes a garden area with a grazing Flusho Spunner, suitable for relaxing in the afternoon. Explore the maze in the darker depths of the cottage when the house Lumino Spunner permits access. Trigger Sonic Spunners for your own combination of soundtrack, or invite your friends over for a Score Challenge and start the Spun Clock  who can catch the most Rabbits, collect the most Fruit and find the most Eggs in the spun time limit. Become a spun home owner today.|Scene-Entitlement|madmunki|1.86.0.17.PUB|P||L|Spunland_Playroom_C028_895A|T033|Dave|||||||||||||EP4393-NPER00062_00-SPUNLANDCO000079|UT5032-NPUR00280_00-0000770000000000||
046B3B88-640B45ED-A1A0AF17-9EEFC570|Musicality Apartment|A unique live music venue - up to four players can grab an instrument and jam compete against each other. Comes complete with the Dance music pack additional packs are available to purchase at the Musicality shop.|Scene-Entitlement|nDreams|1.3.2.16.BETA1|P||L|SCEE_Musicality_Apt_46B4_8AAE|T035|Stephen_Routledge|||||||||||||EP4114-NPER00011_00-MUSICALITY000006|UT5001-NPUR00020_00-NDMUSICALITYAPT1||
04E65407-CAC7407E-A862359E-8B4E176D|The Halloween Tour Bus Clubhouse|The time has come to hit the road and party. Take full advantage of the freedoms a virtual world provides, slip the bus into cruise control and join the party at full speed. Just remember what goes on tour, stays on tour.|Scene-Entitlement|JAM Games Ltd|1.86.0.17.PUB|P||L|HalloweenTourbusClub_C2DD_6CE|T031|Mike|||||||||||||EP4375-NPER00055_00-THEHALLOWE001047|UT5021-NPUR00200_00-0011300000000000||
051F2E74-69BF4FDD-B637F49D-EFD679B9|Discotheque Clubhouse|Dance the night away in this stylish discotheque. Featuring animated disco balls, spotlights and lasers, this vast underground night-club even contains a rythm-action dance mini-game, with a high-score leaderboard. Scoring 100,000 points will give you an exclusive reward... Whether you prefer to challenge your friends at the mini-game, party on the animated illuminated dance floor, sit on the stools at the bar, or relax on the comfy armchairs, this is the perfect place to invite your friends.|Scene-Entitlement|Atom Republic|1.80.0.53.PUB|P||L|Disco_Clubhouse_1269_DCD2|T032|mtyoung|||||||||||||EP4377-NPER00057_00-DISCOTHEQU000142|||
053159ED-F78E43D3-B58BEEDE-CC3A6831|Obsidian Officer s Quarters|Earth Fleet has constructed a new residency wing of the Novus Prime space station for high-ranking Obsidian pilots. Each apartment includes a Zero-Gravity Simulation System for the owner and guests.|Scene-Entitlement|Hellfire Games, Inc.|1.83.0.11.PUB|A||L|obsidian_officer_apt_b69f_9b19|T031|jposey||||||||||||||||
0537BA1A-F8934743-BFB06EEF-5819D61E|Men in Black Headquarters|Get an all-access pass when you own the Men In Black Headquarters as your own Private Space. Enjoy being the boss of the most top-secret organization established to monitor alien activity on Earth. Hang out with Frank the Pug in the MIB Offices, shop in the armory and relax in the break room. So suit up and get ready for the explosive return of Agents Kay and Jay in Men in Black III and the epic new video game Men in Black  Alien Crisis .|Scene-Entitlement|Sony Computer Entertainment|1.65.0.139.BETA|P||L|MIB_Headquarter_Apt_4280_6EBB|T032|jlee|||||||||||||EP0644-NPER00008_00-MENINBLACK000515|US0002-NPUR00001_00-MIBHEADQRTRSAPRT||
054FAFA9-D5DF4164-ADE3FC96-4F6C2A75|The Nightclub  Clubhouse|The Nightclub is the perfect venue for a fantastic night out. Dance to pumping music tracks on the dance floor, sip on drinks in the lounge area, or activate the foam cannon for an extra crazy night. Please note, in order to access this Clubhouse you will need to have purchased the Clubhouse slot from either the Estates Store or the Clubs menu (available in Options).|Scene-Entitlement|nDreams Ltd.|1.80.0.53.PUB|P||L|Nightclub_Clubhouse_CC06_8EE2|T033|bene||||||F58044D5-3C2C41F2-BC6F0B3A-839564F1|||||||EP4114-NPER00011_00-THENIGHTCL001510|UT5001-NPUR00020_00-0044740000000000|HT4002-NPHR00014_00-0012760000000000|JT4002-NPJR50260_00-AA40160000000000
0716BAC9-CBE74C2B-95E69620-0B42F835|A Dark Wizard s Mansion|Who knows what Dark magic has been performed within these walls. This centuries-old stately home is the perfect residence for the aspiring Dark witch or wizard. Please be aware that only Pottermore furniture can be placed in Pottermore personal apartments and that all chat functions have been disabled. Pottermore furniture can be purchased from the Pottermore shop. #PMExtraCommerce |Scene-Entitlement||1.82.0.17.PUB|P||L|Dark_Wizard_Apt_17D8_4177|T037|GBBrislSi|||||||||||||EP9000-NPEQ00021_00-ADARKWIZAR000297|UP9000-NPUQ00016_00-0002950000000000|HP9000-NPHQ00013_00-0002960000000000|
07357F60-FC504982-9E946020-1702D76A|Glittering Sands Secluded Retreat|Spend your holiday on a luxurious private beach. The clear blue sea, the white sandy beach, and the cottage on the ocean are all yours. With a friend, or with that special someone. Your holiday has just begun.|Scene-Entitlement|Granzella Inc.|1.75.0.85.PUB|P||L|Seaside_Apt_Asia_77E4_E0FB|T031|Administrator|||||||||||||||HP0025-NPHR00021_00-0008040000000000|
08A50448-25C6408F-93B42144-556321E7|The Spunland Cottage|Take up residence in the Spunland Cottage, with scenic views of the purple skies and hills of Spunland.|Scene-Entitlement|MadMunki|1.70.0.93.PUB|P||L|Spunland_Playroom_C028_895A|T031|astone|||||||||||||EP4393-NPER00062_00-SPUNLANDCO000079|||
099A248E-806944C7-887FB154-064F33D3|Xi  Continuum - Vertigo Apartment|This fantastical outdoor apartment, situated on the side of a skyscraper overlooking the Continuum, defies belief. This apartment grows in size as you play through Xi  Continuum, resulting in a massive and amazing home.|Scene-Entitlement|nDreams|1.70.0.93.PUB|P||L|Xi2_Axiom_Apt_8638_8203|T033|astone|||||||||||||EP4114-NPER00011_00-XICONTINUU000897|UT5001-NPUR00020_00-NDXIVRTGAPTXX670|HT4002-NPHR00033_00-0000570000000000|
09E3FE8D-5AEC4942-8AEE85EF-B4C3B3C9|Country Chic - Tour Bus|The time has come to hit the road and party. Take full advantage of the freedoms a virtual world provides, slip the bus into cruise control and join the party at full speed. Just remember what goes on tour, stays on tour.|Scene-Entitlement|JAM Games Ltd|1.86.0.17.PUB|P||L|CountryChicApt_65C0_4174|T031|Mike||||||1A16E6C0-4E98429B-9CA2BA4A-C4664A04,5483A97B-3B7344D0-AD002C0A-9923D8C8,EC2EB33F-76CC4057-8A3D8422-E213FB26|||||||EP4375-NPER00055_00-COUNTRYCHI000751|UT5021-NPUR00200_00-0008340000000000||
0A64C871-7C434211-98163DE4-7D8712B5|Discotheque|Dance the night away in this stylish discotheque. Featuring animated disco balls, spotlights and lasers, this vast underground night-club even contains a rythm-action dance mini-game, with a high-score leaderboard. Getting a high score will give you an exclusive reward... Whether you prefer to challenge your friends at the mini-game, party on the animated illuminated dance floor, sit on the stools at the bar, or relax on the comfy armchairs, this is the perfect place to invite your friends.|Scene-Entitlement|Atom Republic|1.70.0.93.PUB|P||L|Disco_Apartment_F7EE_FDF0|T032|JLee||||||||||||||UT5025-NPUR00220_00-0012310000000000||
0AA250D3-05B24899-B256646A-D78D9E8E|Audi Technology Apartment|The Audi Technology Apartment is your reward for configuring and racing your perfect car in the Audi Technology Experience. Inside the apartment you can relax, entertain your friends, or simply admire the view of the city below.|Scene-Entitlement|AUDI AG|1.70.0.93.PUB|L||L|Audi_Connect_Apt_C2D4_2F8B|T031|astone||||||||||||||||
0ABB6079-08A1450F-9BBFC56B-B89AC16A|Secret Peacekeeping Base, Yuma Caf |At a glance it appears to be a tasteful coffee shop, but behind a door in the rear is a secret base for heroes that utilise the most advanced science to battle evil. Well then, let s defend our tranquil planet Earth from the clutches of evil.|Scene-Entitlement|Granzella Inc.|1.80.0.53.PUB|P||L|Gzsdn_Lounge_PS_EU_90B7_372D|T031|mtyoung|||||||||||||EP5017-NPER00064_00-SECRETPEAC000795|||
0CB218BC-DDC44348-BBF97B0B-9DF1090E|My Private Hideaway|Washed ashore on a solitary island in the south seas. The blazing sun, the quiet ocean, the refreshing breeze, crap. I built a house on top of a cliff and even forgot to go home. You are now able to go to the|Scene-Entitlement|Granzella Inc.|1.60.0.451.PUB|P||P|Lagoon_Lounge_PSAsia_8378_DB55|T033|Granzella Inc.|||||||||||||||HP0025-NPHR00021_00-0004390000000000|
0D9584EC-0FC64A01-A7134965-E39748BF|The War Room Clubhouse|The War Room - perfect for clan meetings, socialising and plotting world domination. You and your fellow warmongerers can have your face and commands displayed on large screens throughout this high tech facility.|Scene-Entitlement|nDreams Ltd.|1.55.0.155.BETA2|P||L|Bunker_Clubhouse_A015_56D9|T032|jlee|||||||||||||EP4114-NPER00011_00-THEWARROOM000358|UT5001-NPUR00020_00-NDWARROOMCLUB001|HT4002-NPHR00014_00-0003570000000000|
0E54B445-040D401C-AF083E48-8139E4D4|Japanese Teahouse|A remote mountain location, with abundant vegetation and water. A small teahouse stands past the gate, beyond the garden stepping stones.The confined teahouse built according to the principles of wabi and sabi allows one to draw near to visitors. Spend a brief moment in silence.|Scene-Entitlement|Granzella Inc.|1.60.0.450.BETA|P||L|Tea_Lounge_Apt_SCEE_8D42_E7EF|T031|mtyoung||||||7ED28064-E2514485-9CAD9B39-F219E3A0|||||||EP5017-NPER00046_00-JAPANESETE001048|||
0E5D3D72-B67D421A-A626C84B-5237A634|Moonlight Room| When the sun sets, darkness reigns the night and only the magic of the moon lights up the streets. At that precise moment, the Moonlight Room comes to life. Its dark tones and silver trims are full with beauty, class and distinction. This is a shelter for lovers of the night. |Scene-Entitlement|KOVOK LTD|1.86.0.17.PUB|P||L|MoonlightRoom_8516_1D6F|T032|Joan||||||924DBF93-CD754AB5-AF07C845-B6FA2997|||||||EP4468-NPER00076_00-MOONLIGHTR000965|UT5035-NPUR00320_00-0008530000000000||
0F3C9BF0-FA9C4B3B-A3071A0A-411B0DC7|LOOT s Space Apartment|Enjoy the luxury of the future with this three-story apartment with loft. Experience the expansive views of Earth, space and the LOOT Space Station. Watch jellyfish swim in the two-story aquarium located in the center of the apartment. Relax in the aquatic meditation environment located on the bottom level. This wonderful personal space is also equipped with your own Space Apartment Remote Access (S.A.R.A.). With S.A.R.A. s help you can  View up to 5 different Twitter feeds on a news ticker Choose out of 8 screen locations to view your LOOT EOD Search for photos on FlickR and display them on any or all of the 16 photo screens available throughout the space. Each photo screen even lets you set-up slideshows. S.A.R.A. s also lets you control your environment with retractable ceiling, automated blinds and dynamic lighting options. In space, you couldn t ask for a better friend.|Scene-Entitlement|LOOT |1.52.0.2.PUB|P||L|Space_Apt_AB15_897A|T031|ppurdy||||||||||||||US0002-NPUR00001_00-LOOTSPACEAPT0001||
0F51150B-D31C4F40-96B20FEF-AC82FEBD|Acorn Meadows Park Apartment - 1st Birthday.|Join us in in celebrating Acorn Meadows Park s 1st Birthday. Your own little private slice of Acorn Meadows Park, this lakeside garden apartment provides the perfect place to relax and take time away from the main Park without leaving the Acorn Meadows environment. Awarded in the 1st Birthday Acorn Meadows Park after completing all 22 Birthday Challanges.|Scene-Entitlement|VEEMEE|1.86.0.17.PUB|L||L|AM_Birthday_Apt_830A_D57F|T032|euan||||||||||||||||
102DFC5F-2B8C4DCF-BD51BA1B-EA9BE2E5|Acorn Meadows Park Apartment - Winter|Your own little private slice of Acorn Meadows Park, this lakeside garden apartment provides the perfect place to relax and take time away from the main Park without leaving the Acorn Meadows environment.|Scene-Entitlement|VEEMEE|1.86.0.17.PUB|P||L|VeeMee_Park_Apt_3_C6C5_B72F|T031|euan||||||19BDD570-32124127-8C882B05-6448EEC0,1F355D59-92674BA9-8B69A0D7-0FA22DDE,EB6D29F1-44234956-A91D6386-88CE43BA|||||||EP4065-NPER00071_00-ACORNMEADO001307|UT5002-NPUR00030_00-0053930000000000||
1095EC78-EE204E80-A07EE02D-D2664E88|TORO s House| A model of the 8-mat room TORO lived in in Japanese MAINICHI ISSYO . Has a kitchen and bathroom. |Scene-Entitlement|Sony Computer Entertainment|1.3.6.22.PUB|P||L|J_SCEJ_Toro_Personal_B176_4996|T033|Sony Computer Entertainment|||||||||||||||HP9000-NPHQ00007_00-0001510000000000|JP9002-NPJQ50180_00-AA40010000000000
110C12A4-3B924418-82BC3C59-F90B14C2|The Sports Bar|Spend time with your friends in this Sports-themed Bar, complete with Darts game. Exclusive to the VEEMEE 3D Printer.|Scene-Entitlement|VEEMEE|1.80.0.53.PUB|L||L|VEEMEE_SportsPub_Apt_207E_18D8|T033|euan||||||||||||||||
11A90C45-2C6F4968-B102B468-72D4614B|Loco Island|This personal space is your very own tropical island inhabited by LocoRoco characters. The tropical retreat is full of exciting activities. Collect berries that fall from the trees, and communicate with islanders to expand the facilities. Enjoy the Swing, Slide, Jukebox, and games for two players. And the more time you spend on Loco Island, the more vibrant and exciting the paradise becomes. Treat yourself to this fun-filled personal space.|Scene-Entitlement|Sony Computer Entertainmnet|1.3.2.27.PUB|P||L|SCEJ_LocoRoco_Apt03_6529_7DEC|T033|Sony Computer Entertainmnet|||||||||||||EP9000-NPEQ00016_00-LOCOISLAND000008|||
11BFD9EE-F0DD4BAC-A114B216-106678CE|Gothic Cathedral|This ancient abandoned cathedral on the cliff is a sanctuary and a place you call home. From the majestic room, moonlit courtyard, to the massive candlelit hall, you can be the ruler of the night.|Scene-Entitlement|Konami|1.65.0.139.BETA|P||L|Gothic_Cathedral_Apt_9221_E8B5|T032|staylor||||||||||||||UP0101-NPUR30230_00-KDEGOTHAPARTMNT1||
11F3AD9E-72174F8B-91705D78-D39048BE|The Jam Jar Clubhouse|The Jam Jar was established in the 1940 s as THE place to go. Discover the opulence and grandeur of this by gone era in a building rescued and restored to its rightful glory. Whether you decide to return it to it s full boutique status, use it s exquisite detail as a backdrop for a gallery or as the venue of the latest fashion event, The Jam Jar will still prove to be THE place to be seen.|Scene-Entitlement|JAM Games Ltd|1.80.0.53.PUB|P||L|Jam_Jar_Clubhouse_350F_9E36|T031|sroche||||||5483A97B-3B7344D0-AD002C0A-9923D8C8|||||||EP4375-NPER00055_00-THEJAMJARC000307|UT5021-NPUR00200_00-0004400000000000||
12DD1398-68EB4301-9A7FE3BF-BC551325|Abbey Hill Cottage|In a picturesque setting beside the river, stands the timeless Abbey Hill Cottage. Dating back to the 17th century, this period house was home to the Lord Ronald Phillipson distant cousin to the inventor of the watering can. The cottage now nestles in serenity, amongst stunning scenery, enveloped by a breathtaking countryside scene.|Scene-Entitlement|Lockwood|1.80.0.53.PUB|P||L|AbbeyHillCottage_Apt_A513_5000|T031|Lockwood||||||4A931915-2CBB4B08-911A1C21-5EF2FDF4,3CFD2A7A-8F314651-A0D77191-0AE3004A,CDA9993F-8B25466D-8E5F36F7-1FFA294E|||||||EP4127-NPER00050_00-ABBEYHILLC001533|UT5000-NPUR00012_00-LKWDABBEYHILLSEO||
12E77FEB-354F4FFE-AB0684EF-6303485F| City of Flowers Penthouse Window to the World |Make this apartment penthouse in downtown Paris yours, between the Eiffel Tower and the Arc de Triomphe. Your life in the city of flowers, Paris, begins here.|Scene-Entitlement|Granzella Inc.|1.60.0.450.BETA|P||L|Paris_Lounge_PS_EU_E03A_C580|T031|mtyoung|||||||||||||EP5017-NPER00046_00-CITYOFFLOW002345|||
130CC37C-8FBA4D64-A629246F-CF54C524|Nostalgic School Days|Make the first floor of a school building yours, including two classrooms, a shop, and a hallway. The layout of desks, chairs, and other items is up to you. Make your own unique classroom and enjoy school life along with your friends. Be careful not to stay at school until late at night. You never know what might happen...|Scene-Entitlement|Sony Computer Entertainment|1.70.0.93.PUB|P||L|GzSchl_Lounge_PS_US_7422_6A9|T031|JLee||||||||||||||UT5012-NPUR00121_00-0012940000000000||
13CA27D2-243C4F63-BCE0193A-88AAA80A|Nightlife Lounge Apartment|Spend a night out on the town in your very own Nightlife Lounge. Inside, you can wine and dine your guests as they walk down the fashion runway inside. Get cozy and have a drink in the lounge area. Then spend the rest of the night on the lighted dance floor fist pumping to the DJ on the second floor. Are you ready to party.|Scene-Entitlement|Sony Computer Entertainment|1.66.0.144.PUB|P||L|Las_Vegas_Apt_3138_A19F|T036|staylor||||||F8164201-98D848A5-9AFE56A1-8E92A00E|||||||EP9000-NPEQ00005_00-NIGHTLIFEL002535|UP9000-NPUQ00020_00-NGHTLFLNGAPART01|HP9000-NPHQ00010_00-0009540000000000|
16609817-77F646D8-878789D7-135196C6|Japanese Apartment|A traditional Japanese apartment. Serene and tranquil.|Scene-Entitlement|Sony Computer Entertainment|1.3.5|P||L|SCEE_Japanese_Apt_5562_FB9A|T031|pritpal_panesar||||||67EED0EA-45E6475C-BE8B03D2-8A1A11AD|||||||EP9000-NPEQ00001_00-TRADITIONA000564|UP9000-NPUQ00010_00-CP15JAPANESEAPT1|HP9000-NPHQ00001_00-0008190000000000|JP9002-NPJQ50000_00-0040040000000000
1662E4E3-4C2846BC-9EF46DE8-A86169B5|Abbey Hill Cottage - Winter Retreat|When winter descends, Abbey Hill takes on a new form of beauty. Revel in the stark white charm of the riverside cottage in the festive season. Escape from the cold in the fireside or explore the gardens to earn the 7 daily rewards on offer. If you re feeling really adventurous, why not go for a skate on the frozen surface of the river.|Scene-Entitlement|Lockwood|1.80.0.53.PUB|P||L|AbbeyHillWinter_Apt_D50D_EFE6|T031|Lockwood||||||08CD680D-0AF3466F-9DB332E8-0A9570BA,67D35D9E-A5CE4A8E-987CDA24-19698A63|||||||EP4127-NPER00050_00-ABBEYHILLC001614|UT5000-NPUR00012_00-LKWDABBEYHILWINT||
186BE0D9-22DE4333-A7395829-E9CB3B6A|Red Bull House of Skate|FOR SALE  Red Bull s 10,000 sq ft House of Skate including scenic views of the Hollywood Hills, steamy hot tub and a playable skate game. Flip, grind, and ollie your way through this modern skate haven while earning medals and street cred. Make it your own.|Scene-Entitlement|Red Bull|1.55.0.155.BETA2|P||L|Red_Bull_Apartment_780E_57F8|T032|PPurdy||||||02543AF9-7DF84AAF-81E16F0A-B4C1D39D,84CE3499-A7AE4F47-BB1F23F7-F2F18789|||||||EP5019-NPER00047_00-RYANSHECKL000042|UT5013-NPUR00130_00-RBRSSK8APARTMENT||
18824AB2-6D524781-9E478811-3C9E7200|The Dream Yacht|Have The Lifestyle You Always Dreamed Of With The Dream Yacht From Figment. Three Decks Of Opulent Living, Two Hot Tubs And More Than 20 Collectable Rewards, Plus An Exclusive Commerce Point Only Available Through The Dream Yacht. Live The Dream.|Scene-Entitlement|Lockwood|1.55.0.155.BETA2|P||L|SCEJ_Million_Yacht_2709_32BC|T031|Lockwood||||||||||||||||JT4001-NPJR50210_00-AA40010000000000
18F0F0C6-38D24084-BE4DA40F-1EC02165|Luxury Train Apartment|Sometimes you can t spend all day in your apartment as you have to head to important meetings and social events. Take a trip through a scenic environment whilst relaxing with your friends as the world outside passes you by.|Scene-Entitlement|nDreams Ltd.|1.82.0.17.PUB|P||L|Train_Apt_17ED_B69A|T031|DanM||||||604EF031-F3F2467C-AFC7E5D2-77FFFA4A,C00621E5-313C4CD0-9B2227E2-0664A027|||||||EP4114-NPER00011_00-LUXURYTRAI001782|UT5001-NPUR00020_00-0047550000000000||
1917DB58-A04D42B5-85D08416-CDD2E416|Seasons-themed Room|A Personal Space To Enjoy The Changing Seasons.|Scene-Entitlement|O-Two inc.|1.75.0.85.PUB|P||L|OTwo_peakvox_labs_4_F66E_C44C|T031|O-Two inc.||||||||||||||||JP0085-NPJR50370_00-AA40020000000000
191F955B-4BD24508-90A8A889-DAFF792C|A House in Hogsmeade|The only all-wizarding village in Britain, Hogsmeade is situated close to Hogwarts. The Hogwarts Express travels to and from the village s station. Please be aware that only Pottermore furniture can be placed in Pottermore personal apartments and that all chat functions have been disabled. Pottermore furniture can be purchased from the Pottermore shop. #PMExtraCommerce |Scene-Entitlement|Sony Computer Entertainment|1.75.0.85.PUB|P||L|Hogsmeade_Apt_74FF_CA4C|T039|GBRoutlSt|||||||||||||EP9000-NPEQ00021_00-AHOUSEINHO000291|UP9000-NPUQ00016_00-0002680000000000|HP9000-NPHQ00013_00-0002910000000000|
1A30EAA8-AEAA4233-928A66FD-CBE32880|Demonic Cutteridge Estate|The abysmal darkness will imprison your soul for eternity.|Scene-Entitlement|Juggernaut Games|1.65.0.139.BETA|L||L|DemonicCutteridgeApt_1DD6_3D40|T031|JLee||||||||||||||||
1A485810-8150433B-A0D6BFC6-F4B01942|The London Pub|[Only for those above 18 years old. Please verify that you are 18 years of age or older to purchase.] Located in London, England, the pub comes with its own fantastic darts game and high score tables, working drink pumps and a bunch of hidden surprises and rewards. Cheers.|Scene-Entitlement|VEEMEE|1.55.0.155.BETA2|P||L|SCEE_Pub_Apartment_7433_C6E6|T032|schaney|||||||||||||||HT4005-NPHR00020_00-0000180000000000|JT4015-NPJR50400_00-AA40010000000000
1B2C4D74-C86949D3-BCC4A238-B0514542|The Complex 2  Clubhouse|This clubhouse, brought to you by nDreams, is based on the Complex 2 apartment. This luxurious cliff-side complex comes with all additional rooms and rewards already unlocked.|Scene-Entitlement|nDreams Ltd.|1.80.0.53.PUB|P||L|Cliff_Top_Clubhouse_705E_BD45|T031|bene||||||604EF031-F3F2467C-AFC7E5D2-77FFFA4A|||||||EP4114-NPER00011_00-THECOMPLEX001656|UT5001-NPUR00020_00-0045900000000000||
1C74781B-CABB4D85-B8244868-FED66129|Meekum Industries Skylab|Meekum Industries Skylab|Scene-Entitlement|Sony Computer Entertainment|1.82.0.17.PUB|A||L|Sci_Fi_Apt_A08E_30B2|T037|gbcarteri||||||||||||||||
1CC3FC83-AD55454C-B2A32C67-5D55B95D|Hollywood Hills House Nighttime Estate (with Home Theater)|Gaze upon glistening Los Angeles as Hollywood Hills royalty, in your private mansion above the LA skyline. Features include  Built-in Entertainment On Demand theatre system A swimming feature for the infinity pool. THIS is the spot to entertain your closest friends and clients. Purchase of this estate comes bundled with the LOOT Active Camera and Active Light, so you can film your parties and upload them to YouTube. PLEASE READ  Due to contractual and rights agreements, all content may not be available in all countries. Content availability is dependent on the geolocation of the device. CRACKLE content is only available in US, CA, UK, and AU. RADIOIO is only available in US and CA. Only one LOOT TV or LOOT Radio can be active at a time.|Scene-Entitlement| LOOT |1.70.0.93.PUB|P||L|Hllywd_Night_Apt_11B4_F050|T033|JLee|||||||||||||EP0644-NPER00008_00-HOLLYWOODH000747|US0002-NPUR00001_00-0001290000000000|HT4003-NPHR00027_00-0000520000000000|
1D021442-7BD7468F-BA141BF9-66FDF589|Infinite Oasis Ranch Clubhouse|The perfect place for a mid-summer retreat, the Infinite Oasis Ranch has it all. From lively cacti and ageless palm trees to panoramic views of the surrounding mountain ridge, this space packs it all. The Infinite Oasis Ranch space is a clubhouse where everyone is invited to join.|Scene-Entitlement|Sony Computer Entertainment|1.75.0.85.PUB|P||L|Modern_Ranch_Club_19EE_C1B2|T033|jlee||||||F9AE8A05-9DA945BA-AE5CFB15-8EAD4A6A|||||||EP9000-NPEQ00005_00-INFINITEOA002478|UP9000-NPUQ00020_00-INFOASRNCHCLBHS1|HP9000-NPHQ00010_00-0008900000000000|
1E99D78A-109444AD-95763330-D304BB9C|Darla s Den|This is our gift to you just for visiting The Midway. Admire your prowess on the prize runway, win access to the steamy hot tub, earn your entry into the Big Bang game, purchase a personal arcade shooter, and ultimately entertain Darla in the disco.|Scene-Entitlement|Mass Media|1.41.0.37.PUB|A||L|Midway_Apartment_4D5E_F216|T034|ppurdy||||||||||||||||
